somministrazioni,regione,siglaCategoria,identificativo,categoria,codice_regione,data,vaccino,punto,classeEta,siglaRegione,NUTS2
4,Friuli-Venezia Giulia,TML_CAT_OSS,27/12/2020_PF/BT_FVG_ND_Sede Regionale Protezione Civile_20-29,1 - Operatori Sanitari e Sociosanitari,06,2020-12-27,PF/BT,ND_Sede Regionale Protezione Civile,20-29,FVG,ITH4
16,Friuli-Venezia Giulia,TML_CAT_OSS,27/12/2020_PF/BT_FVG_ND_Sede Regionale Protezione Civile_30-39,1 - Operatori Sanitari e Sociosanitari,06,2020-12-27,PF/BT,ND_Sede Regionale Protezione Civile,30-39,FVG,ITH4
50,Friuli-Venezia Giulia,TML_CAT_OSS,27/12/2020_PF/BT_FVG_ND_Sede Regionale Protezione Civile_40-49,1 - Operatori Sanitari e Sociosanitari,06,2020-12-27,PF/BT,ND_Sede Regionale Protezione Civile,40-49,FVG,ITH4
100,Friuli-Venezia Giulia,TML_CAT_OSS,27/12/2020_PF/BT_FVG_ND_Sede Regionale Protezione Civile_50-59,1 - Operatori Sanitari e Sociosanitari,06,2020-12-27,PF/BT,ND_Sede Regionale Protezione Civile,50-59,FVG,ITH4
85,Friuli-Venezia Giulia,TML_CAT_OSS,27/12/2020_PF/BT_FVG_ND_Sede Regionale Protezione Civile_60-69,1 - Operatori Sanitari e Sociosanitari,06,2020-12-27,PF/BT,ND_Sede Regionale Protezione Civile,60-69,FVG,ITH4
5,Friuli-Venezia Giulia,TML_CAT_OSS,27/12/2020_PF/BT_FVG_ND_Sede Regionale Protezione Civile_70-79,1 - Operatori Sanitari e Sociosanitari,06,2020-12-27,PF/BT,ND_Sede Regionale Protezione Civile,70-79,FVG,ITH4
1,Friuli-Venezia Giulia,TML_CAT_PERSONALE,27/12/2020_PF/BT_FVG_ND_Sede Regionale Protezione Civile_20-29,2 - Personale non Sanitario,06,2020-12-27,PF/BT,ND_Sede Regionale Protezione Civile,20-29,FVG,ITH4
2,Friuli-Venezia Giulia,TML_CAT_PERSONALE,27/12/2020_PF/BT_FVG_ND_Sede Regionale Protezione Civile_50-59,2 - Personale non Sanitario,06,2020-12-27,PF/BT,ND_Sede Regionale Protezione Civile,50-59,FVG,ITH4
14,Friuli-Venezia Giulia,TML_CAT_OSS,30/12/2020_PF/BT_FVG_117510_Ospedale Pordenone_20-29,1 - Operatori Sanitari e Sociosanitari,06,2020-12-30,PF/BT,117510_Ospedale Pordenone,20-29,FVG,ITH4
7,Friuli-Venezia Giulia,TML_CAT_OSS,30/12/2020_PF/BT_FVG_12M810_Ospedale Monfalcone_20-29,1 - Operatori Sanitari e Sociosanitari,06,2020-12-30,PF/BT,12M810_Ospedale Monfalcone,20-29,FVG,ITH4
9,Friuli-Venezia Giulia,TML_CAT_OSS,30/12/2020_PF/BT_FVG_14VP13_Ospedale Udine_20-29,1 - Operatori Sanitari e Sociosanitari,06,2020-12-30,PF/BT,14VP13_Ospedale Udine,20-29,FVG,ITH4
11,Friuli-Venezia Giulia,TML_CAT_OSS,30/12/2020_PF/BT_FVG_201010_Ospedale Cattinara_20-29,1 - Operatori Sanitari e Sociosanitari,06,2020-12-30,PF/BT,201010_Ospedale Cattinara,20-29,FVG,ITH4
1,Friuli-Venezia Giulia,TML_CAT_OSS,30/12/2020_PF/BT_FVG_220101_H Tolmezzo_20-29,1 - Operatori Sanitari e Sociosanitari,06,2020-12-30,PF/BT,220101_H Tolmezzo,20-29,FVG,ITH4
32,Friuli-Venezia Giulia,TML_CAT_OSS,30/12/2020_PF/BT_FVG_117510_Ospedale Pordenone_30-39,1 - Operatori Sanitari e Sociosanitari,06,2020-12-30,PF/BT,117510_Ospedale Pordenone,30-39,FVG,ITH4
25,Friuli-Venezia Giulia,TML_CAT_OSS,30/12/2020_PF/BT_FVG_12M810_Ospedale Monfalcone_30-39,1 - Operatori Sanitari e Sociosanitari,06,2020-12-30,PF/BT,12M810_Ospedale Monfalcone,30-39,FVG,ITH4
34,Friuli-Venezia Giulia,TML_CAT_OSS,30/12/2020_PF/BT_FVG_14VP13_Ospedale Udine_30-39,1 - Operatori Sanitari e Sociosanitari,06,2020-12-30,PF/BT,14VP13_Ospedale Udine,30-39,FVG,ITH4
20,Friuli-Venezia Giulia,TML_CAT_OSS,30/12/2020_PF/BT_FVG_201010_Ospedale Cattinara_30-39,1 - Operatori Sanitari e Sociosanitari,06,2020-12-30,PF/BT,201010_Ospedale Cattinara,30-39,FVG,ITH4
10,Friuli-Venezia Giulia,TML_CAT_OSS,30/12/2020_PF/BT_FVG_220101_H Tolmezzo_30-39,1 - Operatori Sanitari e Sociosanitari,06,2020-12-30,PF/BT,220101_H Tolmezzo,30-39,FVG,ITH4
60,Friuli-Venezia Giulia,TML_CAT_OSS,30/12/2020_PF/BT_FVG_117510_Ospedale Pordenone_40-49,1 - Operatori Sanitari e Sociosanitari,06,2020-12-30,PF/BT,117510_Ospedale Pordenone,40-49,FVG,ITH4
23,Friuli-Venezia Giulia,TML_CAT_OSS,30/12/2020_PF/BT_FVG_12M810_Ospedale Monfalcone_40-49,1 - Operatori Sanitari e Sociosanitari,06,2020-12-30,PF/BT,12M810_Ospedale Monfalcone,40-49,FVG,ITH4
38,Friuli-Venezia Giulia,TML_CAT_OSS,30/12/2020_PF/BT_FVG_14VP13_Ospedale Udine_40-49,1 - Operatori Sanitari e Sociosanitari,06,2020-12-30,PF/BT,14VP13_Ospedale Udine,40-49,FVG,ITH4
18,Friuli-Venezia Giulia,TML_CAT_OSS,30/12/2020_PF/BT_FVG_201010_Ospedale Cattinara_40-49,1 - Operatori Sanitari e Sociosanitari,06,2020-12-30,PF/BT,201010_Ospedale Cattinara,40-49,FVG,ITH4
15,Friuli-Venezia Giulia,TML_CAT_OSS,30/12/2020_PF/BT_FVG_220101_H Tolmezzo_40-49,1 - Operatori Sanitari e Sociosanitari,06,2020-12-30,PF/BT,220101_H Tolmezzo,40-49,FVG,ITH4
67,Friuli-Venezia Giulia,TML_CAT_OSS,30/12/2020_PF/BT_FVG_117510_Ospedale Pordenone_50-59,1 - Operatori Sanitari e Sociosanitari,06,2020-12-30,PF/BT,117510_Ospedale Pordenone,50-59,FVG,ITH4
23,Friuli-Venezia Giulia,TML_CAT_OSS,30/12/2020_PF/BT_FVG_12M810_Ospedale Monfalcone_50-59,1 - Operatori Sanitari e Sociosanitari,06,2020-12-30,PF/BT,12M810_Ospedale Monfalcone,50-59,FVG,ITH4
31,Friuli-Venezia Giulia,TML_CAT_OSS,30/12/2020_PF/BT_FVG_14VP13_Ospedale Udine_50-59,1 - Operatori Sanitari e Sociosanitari,06,2020-12-30,PF/BT,14VP13_Ospedale Udine,50-59,FVG,ITH4
23,Friuli-Venezia Giulia,TML_CAT_OSS,30/12/2020_PF/BT_FVG_201010_Ospedale Cattinara_50-59,1 - Operatori Sanitari e Sociosanitari,06,2020-12-30,PF/BT,201010_Ospedale Cattinara,50-59,FVG,ITH4
16,Friuli-Venezia Giulia,TML_CAT_OSS,30/12/2020_PF/BT_FVG_220101_H Tolmezzo_50-59,1 - Operatori Sanitari e Sociosanitari,06,2020-12-30,PF/BT,220101_H Tolmezzo,50-59,FVG,ITH4
24,Friuli-Venezia Giulia,TML_CAT_OSS,30/12/2020_PF/BT_FVG_117510_Ospedale Pordenone_60-69,1 - Operatori Sanitari e Sociosanitari,06,2020-12-30,PF/BT,117510_Ospedale Pordenone,60-69,FVG,ITH4
23,Friuli-Venezia Giulia,TML_CAT_OSS,30/12/2020_PF/BT_FVG_12M810_Ospedale Monfalcone_60-69,1 - Operatori Sanitari e Sociosanitari,06,2020-12-30,PF/BT,12M810_Ospedale Monfalcone,60-69,FVG,ITH4
17,Friuli-Venezia Giulia,TML_CAT_OSS,30/12/2020_PF/BT_FVG_14VP13_Ospedale Udine_60-69,1 - Operatori Sanitari e Sociosanitari,06,2020-12-30,PF/BT,14VP13_Ospedale Udine,60-69,FVG,ITH4
15,Friuli-Venezia Giulia,TML_CAT_OSS,30/12/2020_PF/BT_FVG_201010_Ospedale Cattinara_60-69,1 - Operatori Sanitari e Sociosanitari,06,2020-12-30,PF/BT,201010_Ospedale Cattinara,60-69,FVG,ITH4
9,Friuli-Venezia Giulia,TML_CAT_OSS,30/12/2020_PF/BT_FVG_220101_H Tolmezzo_60-69,1 - Operatori Sanitari e Sociosanitari,06,2020-12-30,PF/BT,220101_H Tolmezzo,60-69,FVG,ITH4
2,Friuli-Venezia Giulia,TML_CAT_OSS,30/12/2020_PF/BT_FVG_117510_Ospedale Pordenone_70-79,1 - Operatori Sanitari e Sociosanitari,06,2020-12-30,PF/BT,117510_Ospedale Pordenone,70-79,FVG,ITH4
1,Friuli-Venezia Giulia,TML_CAT_OSS,30/12/2020_PF/BT_FVG_12M810_Ospedale Monfalcone_70-79,1 - Operatori Sanitari e Sociosanitari,06,2020-12-30,PF/BT,12M810_Ospedale Monfalcone,70-79,FVG,ITH4
3,Friuli-Venezia Giulia,TML_CAT_OSS,30/12/2020_PF/BT_FVG_14VP13_Ospedale Udine_70-79,1 - Operatori Sanitari e Sociosanitari,06,2020-12-30,PF/BT,14VP13_Ospedale Udine,70-79,FVG,ITH4
6,Friuli-Venezia Giulia,TML_CAT_OSS,30/12/2020_PF/BT_FVG_201010_Ospedale Cattinara_70-79,1 - Operatori Sanitari e Sociosanitari,06,2020-12-30,PF/BT,201010_Ospedale Cattinara,70-79,FVG,ITH4
3,Friuli-Venezia Giulia,TML_CAT_OSS,30/12/2020_PF/BT_FVG_220101_H Tolmezzo_70-79,1 - Operatori Sanitari e Sociosanitari,06,2020-12-30,PF/BT,220101_H Tolmezzo,70-79,FVG,ITH4
2,Friuli-Venezia Giulia,TML_CAT_OSS,30/12/2020_PF/BT_FVG_12M810_Ospedale Monfalcone_80-89,1 - Operatori Sanitari e Sociosanitari,06,2020-12-30,PF/BT,12M810_Ospedale Monfalcone,80-89,FVG,ITH4
1,Friuli-Venezia Giulia,TML_CAT_ALTRO,30/12/2020_PF/BT_FVG_117510_Ospedale Pordenone_20-29,2 - Personale non Sanitario,06,2020-12-30,PF/BT,117510_Ospedale Pordenone,20-29,FVG,ITH4
2,Friuli-Venezia Giulia,TML_CAT_PERSONALE,30/12/2020_PF/BT_FVG_201010_Ospedale Cattinara_20-29,2 - Personale non Sanitario,06,2020-12-30,PF/BT,201010_Ospedale Cattinara,20-29,FVG,ITH4
6,Friuli-Venezia Giulia,TML_CAT_ALTRO,30/12/2020_PF/BT_FVG_201010_Ospedale Cattinara_20-29,2 - Personale non Sanitario,06,2020-12-30,PF/BT,201010_Ospedale Cattinara,20-29,FVG,ITH4
1,Friuli-Venezia Giulia,TML_CAT_ALTRO,30/12/2020_PF/BT_FVG_220101_H Tolmezzo_20-29,2 - Personale non Sanitario,06,2020-12-30,PF/BT,220101_H Tolmezzo,20-29,FVG,ITH4
1,Friuli-Venezia Giulia,TML_CAT_PERSONALE,30/12/2020_PF/BT_FVG_117510_Ospedale Pordenone_30-39,2 - Personale non Sanitario,06,2020-12-30,PF/BT,117510_Ospedale Pordenone,30-39,FVG,ITH4
1,Friuli-Venezia Giulia,TML_CAT_ALTRO,30/12/2020_PF/BT_FVG_12M810_Ospedale Monfalcone_30-39,2 - Personale non Sanitario,06,2020-12-30,PF/BT,12M810_Ospedale Monfalcone,30-39,FVG,ITH4
2,Friuli-Venezia Giulia,TML_CAT_PERSONALE,30/12/2020_PF/BT_FVG_12M810_Ospedale Monfalcone_30-39,2 - Personale non Sanitario,06,2020-12-30,PF/BT,12M810_Ospedale Monfalcone,30-39,FVG,ITH4
1,Friuli-Venezia Giulia,TML_CAT_PERSONALE,30/12/2020_PF/BT_FVG_14VP13_Ospedale Udine_30-39,2 - Personale non Sanitario,06,2020-12-30,PF/BT,14VP13_Ospedale Udine,30-39,FVG,ITH4
4,Friuli-Venezia Giulia,TML_CAT_ALTRO,30/12/2020_PF/BT_FVG_14VP13_Ospedale Udine_30-39,2 - Personale non Sanitario,06,2020-12-30,PF/BT,14VP13_Ospedale Udine,30-39,FVG,ITH4
1,Friuli-Venezia Giulia,TML_CAT_PERSONALE,30/12/2020_PF/BT_FVG_201010_Ospedale Cattinara_30-39,2 - Personale non Sanitario,06,2020-12-30,PF/BT,201010_Ospedale Cattinara,30-39,FVG,ITH4
5,Friuli-Venezia Giulia,TML_CAT_ALTRO,30/12/2020_PF/BT_FVG_201010_Ospedale Cattinara_30-39,2 - Personale non Sanitario,06,2020-12-30,PF/BT,201010_Ospedale Cattinara,30-39,FVG,ITH4
2,Friuli-Venezia Giulia,TML_CAT_PERSONALE,30/12/2020_PF/BT_FVG_117510_Ospedale Pordenone_40-49,2 - Personale non Sanitario,06,2020-12-30,PF/BT,117510_Ospedale Pordenone,40-49,FVG,ITH4
3,Friuli-Venezia Giulia,TML_CAT_PERSONALE,30/12/2020_PF/BT_FVG_12M810_Ospedale Monfalcone_40-49,2 - Personale non Sanitario,06,2020-12-30,PF/BT,12M810_Ospedale Monfalcone,40-49,FVG,ITH4
2,Friuli-Venezia Giulia,TML_CAT_PERSONALE,30/12/2020_PF/BT_FVG_14VP13_Ospedale Udine_40-49,2 - Personale non Sanitario,06,2020-12-30,PF/BT,14VP13_Ospedale Udine,40-49,FVG,ITH4
3,Friuli-Venezia Giulia,TML_CAT_PERSONALE,30/12/2020_PF/BT_FVG_220101_H Tolmezzo_40-49,2 - Personale non Sanitario,06,2020-12-30,PF/BT,220101_H Tolmezzo,40-49,FVG,ITH4
1,Friuli-Venezia Giulia,TML_CAT_ALTRO,30/12/2020_PF/BT_FVG_117510_Ospedale Pordenone_50-59,2 - Personale non Sanitario,06,2020-12-30,PF/BT,117510_Ospedale Pordenone,50-59,FVG,ITH4
2,Friuli-Venezia Giulia,TML_CAT_PERSONALE,30/12/2020_PF/BT_FVG_117510_Ospedale Pordenone_50-59,2 - Personale non Sanitario,06,2020-12-30,PF/BT,117510_Ospedale Pordenone,50-59,FVG,ITH4
2,Friuli-Venezia Giulia,TML_CAT_PERSONALE,30/12/2020_PF/BT_FVG_12M810_Ospedale Monfalcone_50-59,2 - Personale non Sanitario,06,2020-12-30,PF/BT,12M810_Ospedale Monfalcone,50-59,FVG,ITH4
3,Friuli-Venezia Giulia,TML_CAT_PERSONALE,30/12/2020_PF/BT_FVG_14VP13_Ospedale Udine_50-59,2 - Personale non Sanitario,06,2020-12-30,PF/BT,14VP13_Ospedale Udine,50-59,FVG,ITH4
1,Friuli-Venezia Giulia,TML_CAT_PERSONALE,30/12/2020_PF/BT_FVG_201010_Ospedale Cattinara_50-59,2 - Personale non Sanitario,06,2020-12-30,PF/BT,201010_Ospedale Cattinara,50-59,FVG,ITH4
2,Friuli-Venezia Giulia,TML_CAT_PERSONALE,30/12/2020_PF/BT_FVG_12M810_Ospedale Monfalcone_60-69,2 - Personale non Sanitario,06,2020-12-30,PF/BT,12M810_Ospedale Monfalcone,60-69,FVG,ITH4
1,Friuli-Venezia Giulia,TML_CAT_PERSONALE,30/12/2020_PF/BT_FVG_14VP13_Ospedale Udine_60-69,2 - Personale non Sanitario,06,2020-12-30,PF/BT,14VP13_Ospedale Udine,60-69,FVG,ITH4
1,Friuli-Venezia Giulia,TML_CAT_PERSONALE,30/12/2020_PF/BT_FVG_220101_H Tolmezzo_60-69,2 - Personale non Sanitario,06,2020-12-30,PF/BT,220101_H Tolmezzo,60-69,FVG,ITH4
27,Friuli-Venezia Giulia,TML_CAT_OSS,31/12/2020_PF/BT_FVG_117510_SANTA MARIA DEGLI ANGELI_20-29,1 - Operatori Sanitari e Sociosanitari,06,2020-12-31,PF/BT,117510_SANTA MARIA DEGLI ANGELI,20-29,FVG,ITH4
13,Friuli-Venezia Giulia,TML_CAT_OSS,31/12/2020_PF/BT_FVG_12M810_MONFALCONE_20-29,1 - Operatori Sanitari e Sociosanitari,06,2020-12-31,PF/BT,12M810_MONFALCONE,20-29,FVG,ITH4
9,Friuli-Venezia Giulia,TML_CAT_OSS,31/12/2020_PF/BT_FVG_14VP13_SANTA MARIA DELLA MISERICORDIA_20-29,1 - Operatori Sanitari e Sociosanitari,06,2020-12-31,PF/BT,14VP13_SANTA MARIA DELLA MISERICORDIA,20-29,FVG,ITH4
17,Friuli-Venezia Giulia,TML_CAT_OSS,31/12/2020_PF/BT_FVG_201010_CATTINARA_20-29,1 - Operatori Sanitari e Sociosanitari,06,2020-12-31,PF/BT,201010_CATTINARA,20-29,FVG,ITH4
21,Friuli-Venezia Giulia,TML_CAT_OSS,31/12/2020_PF/BT_FVG_220101_TOLMEZZO_20-29,1 - Operatori Sanitari e Sociosanitari,06,2020-12-31,PF/BT,220101_TOLMEZZO,20-29,FVG,ITH4
25,Friuli-Venezia Giulia,TML_CAT_OSS,31/12/2020_PF/BT_FVG_117510_SANTA MARIA DEGLI ANGELI_30-39,1 - Operatori Sanitari e Sociosanitari,06,2020-12-31,PF/BT,117510_SANTA MARIA DEGLI ANGELI,30-39,FVG,ITH4
34,Friuli-Venezia Giulia,TML_CAT_OSS,31/12/2020_PF/BT_FVG_12M810_MONFALCONE_30-39,1 - Operatori Sanitari e Sociosanitari,06,2020-12-31,PF/BT,12M810_MONFALCONE,30-39,FVG,ITH4
53,Friuli-Venezia Giulia,TML_CAT_OSS,31/12/2020_PF/BT_FVG_14VP13_SANTA MARIA DELLA MISERICORDIA_30-39,1 - Operatori Sanitari e Sociosanitari,06,2020-12-31,PF/BT,14VP13_SANTA MARIA DELLA MISERICORDIA,30-39,FVG,ITH4
52,Friuli-Venezia Giulia,TML_CAT_OSS,31/12/2020_PF/BT_FVG_201010_CATTINARA_30-39,1 - Operatori Sanitari e Sociosanitari,06,2020-12-31,PF/BT,201010_CATTINARA,30-39,FVG,ITH4
37,Friuli-Venezia Giulia,TML_CAT_OSS,31/12/2020_PF/BT_FVG_220101_TOLMEZZO_30-39,1 - Operatori Sanitari e Sociosanitari,06,2020-12-31,PF/BT,220101_TOLMEZZO,30-39,FVG,ITH4
52,Friuli-Venezia Giulia,TML_CAT_OSS,31/12/2020_PF/BT_FVG_117510_SANTA MARIA DEGLI ANGELI_40-49,1 - Operatori Sanitari e Sociosanitari,06,2020-12-31,PF/BT,117510_SANTA MARIA DEGLI ANGELI,40-49,FVG,ITH4
51,Friuli-Venezia Giulia,TML_CAT_OSS,31/12/2020_PF/BT_FVG_12M810_MONFALCONE_40-49,1 - Operatori Sanitari e Sociosanitari,06,2020-12-31,PF/BT,12M810_MONFALCONE,40-49,FVG,ITH4
29,Friuli-Venezia Giulia,TML_CAT_OSS,31/12/2020_PF/BT_FVG_14VP13_SANTA MARIA DELLA MISERICORDIA_40-49,1 - Operatori Sanitari e Sociosanitari,06,2020-12-31,PF/BT,14VP13_SANTA MARIA DELLA MISERICORDIA,40-49,FVG,ITH4
49,Friuli-Venezia Giulia,TML_CAT_OSS,31/12/2020_PF/BT_FVG_201010_CATTINARA_40-49,1 - Operatori Sanitari e Sociosanitari,06,2020-12-31,PF/BT,201010_CATTINARA,40-49,FVG,ITH4
56,Friuli-Venezia Giulia,TML_CAT_OSS,31/12/2020_PF/BT_FVG_220101_TOLMEZZO_40-49,1 - Operatori Sanitari e Sociosanitari,06,2020-12-31,PF/BT,220101_TOLMEZZO,40-49,FVG,ITH4
59,Friuli-Venezia Giulia,TML_CAT_OSS,31/12/2020_PF/BT_FVG_117510_SANTA MARIA DEGLI ANGELI_50-59,1 - Operatori Sanitari e Sociosanitari,06,2020-12-31,PF/BT,117510_SANTA MARIA DEGLI ANGELI,50-59,FVG,ITH4
67,Friuli-Venezia Giulia,TML_CAT_OSS,31/12/2020_PF/BT_FVG_12M810_MONFALCONE_50-59,1 - Operatori Sanitari e Sociosanitari,06,2020-12-31,PF/BT,12M810_MONFALCONE,50-59,FVG,ITH4
21,Friuli-Venezia Giulia,TML_CAT_OSS,31/12/2020_PF/BT_FVG_14VP13_SANTA MARIA DELLA MISERICORDIA_50-59,1 - Operatori Sanitari e Sociosanitari,06,2020-12-31,PF/BT,14VP13_SANTA MARIA DELLA MISERICORDIA,50-59,FVG,ITH4
51,Friuli-Venezia Giulia,TML_CAT_OSS,31/12/2020_PF/BT_FVG_201010_CATTINARA_50-59,1 - Operatori Sanitari e Sociosanitari,06,2020-12-31,PF/BT,201010_CATTINARA,50-59,FVG,ITH4
82,Friuli-Venezia Giulia,TML_CAT_OSS,31/12/2020_PF/BT_FVG_220101_TOLMEZZO_50-59,1 - Operatori Sanitari e Sociosanitari,06,2020-12-31,PF/BT,220101_TOLMEZZO,50-59,FVG,ITH4
34,Friuli-Venezia Giulia,TML_CAT_OSS,31/12/2020_PF/BT_FVG_117510_SANTA MARIA DEGLI ANGELI_60-69,1 - Operatori Sanitari e Sociosanitari,06,2020-12-31,PF/BT,117510_SANTA MARIA DEGLI ANGELI,60-69,FVG,ITH4
41,Friuli-Venezia Giulia,TML_CAT_OSS,31/12/2020_PF/BT_FVG_12M810_MONFALCONE_60-69,1 - Operatori Sanitari e Sociosanitari,06,2020-12-31,PF/BT,12M810_MONFALCONE,60-69,FVG,ITH4
17,Friuli-Venezia Giulia,TML_CAT_OSS,31/12/2020_PF/BT_FVG_14VP13_SANTA MARIA DELLA MISERICORDIA_60-69,1 - Operatori Sanitari e Sociosanitari,06,2020-12-31,PF/BT,14VP13_SANTA MARIA DELLA MISERICORDIA,60-69,FVG,ITH4
24,Friuli-Venezia Giulia,TML_CAT_OSS,31/12/2020_PF/BT_FVG_201010_CATTINARA_60-69,1 - Operatori Sanitari e Sociosanitari,06,2020-12-31,PF/BT,201010_CATTINARA,60-69,FVG,ITH4
25,Friuli-Venezia Giulia,TML_CAT_OSS,31/12/2020_PF/BT_FVG_220101_TOLMEZZO_60-69,1 - Operatori Sanitari e Sociosanitari,06,2020-12-31,PF/BT,220101_TOLMEZZO,60-69,FVG,ITH4
2,Friuli-Venezia Giulia,TML_CAT_OSS,31/12/2020_PF/BT_FVG_117510_SANTA MARIA DEGLI ANGELI_70-79,1 - Operatori Sanitari e Sociosanitari,06,2020-12-31,PF/BT,117510_SANTA MARIA DEGLI ANGELI,70-79,FVG,ITH4
5,Friuli-Venezia Giulia,TML_CAT_OSS,31/12/2020_PF/BT_FVG_12M810_MONFALCONE_70-79,1 - Operatori Sanitari e Sociosanitari,06,2020-12-31,PF/BT,12M810_MONFALCONE,70-79,FVG,ITH4
1,Friuli-Venezia Giulia,TML_CAT_OSS,31/12/2020_PF/BT_FVG_14VP13_SANTA MARIA DELLA MISERICORDIA_70-79,1 - Operatori Sanitari e Sociosanitari,06,2020-12-31,PF/BT,14VP13_SANTA MARIA DELLA MISERICORDIA,70-79,FVG,ITH4
6,Friuli-Venezia Giulia,TML_CAT_OSS,31/12/2020_PF/BT_FVG_201010_CATTINARA_70-79,1 - Operatori Sanitari e Sociosanitari,06,2020-12-31,PF/BT,201010_CATTINARA,70-79,FVG,ITH4
2,Friuli-Venezia Giulia,TML_CAT_OSS,31/12/2020_PF/BT_FVG_220101_TOLMEZZO_70-79,1 - Operatori Sanitari e Sociosanitari,06,2020-12-31,PF/BT,220101_TOLMEZZO,70-79,FVG,ITH4
1,Friuli-Venezia Giulia,TML_CAT_OSS,31/12/2020_PF/BT_FVG_12M810_MONFALCONE_80-89,1 - Operatori Sanitari e Sociosanitari,06,2020-12-31,PF/BT,12M810_MONFALCONE,80-89,FVG,ITH4
1,Friuli-Venezia Giulia,TML_CAT_OSS,31/12/2020_PF/BT_FVG_201010_CATTINARA_90+,1 - Operatori Sanitari e Sociosanitari,06,2020-12-31,PF/BT,201010_CATTINARA,90+,FVG,ITH4
2,Friuli-Venezia Giulia,TML_CAT_PERSONALE,31/12/2020_PF/BT_FVG_117510_SANTA MARIA DEGLI ANGELI_20-29,2 - Personale non Sanitario,06,2020-12-31,PF/BT,117510_SANTA MARIA DEGLI ANGELI,20-29,FVG,ITH4
3,Friuli-Venezia Giulia,TML_CAT_ALTRO,31/12/2020_PF/BT_FVG_12M810_MONFALCONE_20-29,2 - Personale non Sanitario,06,2020-12-31,PF/BT,12M810_MONFALCONE,20-29,FVG,ITH4
6,Friuli-Venezia Giulia,TML_CAT_ALTRO,31/12/2020_PF/BT_FVG_14VP13_SANTA MARIA DELLA MISERICORDIA_20-29,2 - Personale non Sanitario,06,2020-12-31,PF/BT,14VP13_SANTA MARIA DELLA MISERICORDIA,20-29,FVG,ITH4
19,Friuli-Venezia Giulia,TML_CAT_ALTRO,31/12/2020_PF/BT_FVG_201010_CATTINARA_20-29,2 - Personale non Sanitario,06,2020-12-31,PF/BT,201010_CATTINARA,20-29,FVG,ITH4
1,Friuli-Venezia Giulia,TML_CAT_ALTRO,31/12/2020_PF/BT_FVG_220101_TOLMEZZO_20-29,2 - Personale non Sanitario,06,2020-12-31,PF/BT,220101_TOLMEZZO,20-29,FVG,ITH4
3,Friuli-Venezia Giulia,TML_CAT_PERSONALE,31/12/2020_PF/BT_FVG_220101_TOLMEZZO_20-29,2 - Personale non Sanitario,06,2020-12-31,PF/BT,220101_TOLMEZZO,20-29,FVG,ITH4
1,Friuli-Venezia Giulia,TML_CAT_PERSONALE,31/12/2020_PF/BT_FVG_117510_SANTA MARIA DEGLI ANGELI_30-39,2 - Personale non Sanitario,06,2020-12-31,PF/BT,117510_SANTA MARIA DEGLI ANGELI,30-39,FVG,ITH4
1,Friuli-Venezia Giulia,TML_CAT_ALTRO,31/12/2020_PF/BT_FVG_12M810_MONFALCONE_30-39,2 - Personale non Sanitario,06,2020-12-31,PF/BT,12M810_MONFALCONE,30-39,FVG,ITH4
1,Friuli-Venezia Giulia,TML_CAT_PERSONALE,31/12/2020_PF/BT_FVG_12M810_MONFALCONE_30-39,2 - Personale non Sanitario,06,2020-12-31,PF/BT,12M810_MONFALCONE,30-39,FVG,ITH4
1,Friuli-Venezia Giulia,TML_CAT_PERSONALE,31/12/2020_PF/BT_FVG_14VP13_SANTA MARIA DELLA MISERICORDIA_30-39,2 - Personale non Sanitario,06,2020-12-31,PF/BT,14VP13_SANTA MARIA DELLA MISERICORDIA,30-39,FVG,ITH4
6,Friuli-Venezia Giulia,TML_CAT_ALTRO,31/12/2020_PF/BT_FVG_14VP13_SANTA MARIA DELLA MISERICORDIA_30-39,2 - Personale non Sanitario,06,2020-12-31,PF/BT,14VP13_SANTA MARIA DELLA MISERICORDIA,30-39,FVG,ITH4
1,Friuli-Venezia Giulia,TML_CAT_PERSONALE,31/12/2020_PF/BT_FVG_201010_CATTINARA_30-39,2 - Personale non Sanitario,06,2020-12-31,PF/BT,201010_CATTINARA,30-39,FVG,ITH4
6,Friuli-Venezia Giulia,TML_CAT_ALTRO,31/12/2020_PF/BT_FVG_201010_CATTINARA_30-39,2 - Personale non Sanitario,06,2020-12-31,PF/BT,201010_CATTINARA,30-39,FVG,ITH4
1,Friuli-Venezia Giulia,TML_CAT_ALTRO,31/12/2020_PF/BT_FVG_220101_TOLMEZZO_30-39,2 - Personale non Sanitario,06,2020-12-31,PF/BT,220101_TOLMEZZO,30-39,FVG,ITH4
1,Friuli-Venezia Giulia,TML_CAT_PERSONALE,31/12/2020_PF/BT_FVG_220101_TOLMEZZO_30-39,2 - Personale non Sanitario,06,2020-12-31,PF/BT,220101_TOLMEZZO,30-39,FVG,ITH4
3,Friuli-Venezia Giulia,TML_CAT_PERSONALE,31/12/2020_PF/BT_FVG_117510_SANTA MARIA DEGLI ANGELI_40-49,2 - Personale non Sanitario,06,2020-12-31,PF/BT,117510_SANTA MARIA DEGLI ANGELI,40-49,FVG,ITH4
3,Friuli-Venezia Giulia,TML_CAT_PERSONALE,31/12/2020_PF/BT_FVG_12M810_MONFALCONE_40-49,2 - Personale non Sanitario,06,2020-12-31,PF/BT,12M810_MONFALCONE,40-49,FVG,ITH4
1,Friuli-Venezia Giulia,TML_CAT_PERSONALE,31/12/2020_PF/BT_FVG_14VP13_SANTA MARIA DELLA MISERICORDIA_40-49,2 - Personale non Sanitario,06,2020-12-31,PF/BT,14VP13_SANTA MARIA DELLA MISERICORDIA,40-49,FVG,ITH4
1,Friuli-Venezia Giulia,TML_CAT_ALTRO,31/12/2020_PF/BT_FVG_201010_CATTINARA_40-49,2 - Personale non Sanitario,06,2020-12-31,PF/BT,201010_CATTINARA,40-49,FVG,ITH4
3,Friuli-Venezia Giulia,TML_CAT_PERSONALE,31/12/2020_PF/BT_FVG_201010_CATTINARA_40-49,2 - Personale non Sanitario,06,2020-12-31,PF/BT,201010_CATTINARA,40-49,FVG,ITH4
4,Friuli-Venezia Giulia,TML_CAT_PERSONALE,31/12/2020_PF/BT_FVG_220101_TOLMEZZO_40-49,2 - Personale non Sanitario,06,2020-12-31,PF/BT,220101_TOLMEZZO,40-49,FVG,ITH4
2,Friuli-Venezia Giulia,TML_CAT_PERSONALE,31/12/2020_PF/BT_FVG_117510_SANTA MARIA DEGLI ANGELI_50-59,2 - Personale non Sanitario,06,2020-12-31,PF/BT,117510_SANTA MARIA DEGLI ANGELI,50-59,FVG,ITH4
2,Friuli-Venezia Giulia,TML_CAT_PERSONALE,31/12/2020_PF/BT_FVG_12M810_MONFALCONE_50-59,2 - Personale non Sanitario,06,2020-12-31,PF/BT,12M810_MONFALCONE,50-59,FVG,ITH4
2,Friuli-Venezia Giulia,TML_CAT_PERSONALE,31/12/2020_PF/BT_FVG_201010_CATTINARA_50-59,2 - Personale non Sanitario,06,2020-12-31,PF/BT,201010_CATTINARA,50-59,FVG,ITH4
7,Friuli-Venezia Giulia,TML_CAT_PERSONALE,31/12/2020_PF/BT_FVG_220101_TOLMEZZO_50-59,2 - Personale non Sanitario,06,2020-12-31,PF/BT,220101_TOLMEZZO,50-59,FVG,ITH4
3,Friuli-Venezia Giulia,TML_CAT_PERSONALE,31/12/2020_PF/BT_FVG_12M810_MONFALCONE_60-69,2 - Personale non Sanitario,06,2020-12-31,PF/BT,12M810_MONFALCONE,60-69,FVG,ITH4
1,Friuli-Venezia Giulia,TML_CAT_PERSONALE,31/12/2020_PF/BT_FVG_201010_CATTINARA_60-69,2 - Personale non Sanitario,06,2020-12-31,PF/BT,201010_CATTINARA,60-69,FVG,ITH4
1,Friuli-Venezia Giulia,TML_CAT_PERSONALE,31/12/2020_PF/BT_FVG_117510_SANTA MARIA DEGLI ANGELI_70-79,2 - Personale non Sanitario,06,2020-12-31,PF/BT,117510_SANTA MARIA DEGLI ANGELI,70-79,FVG,ITH4
27,Friuli-Venezia Giulia,TML_CAT_OSS,02/01/2021_PF/BT_FVG_117510_SANTA MARIA DEGLI ANGELI_20-29,1 - Operatori Sanitari e Sociosanitari,06,2021-01-02,PF/BT,117510_SANTA MARIA DEGLI ANGELI,20-29,FVG,ITH4
41,Friuli-Venezia Giulia,TML_CAT_OSS,02/01/2021_PF/BT_FVG_12M810_MONFALCONE_20-29,1 - Operatori Sanitari e Sociosanitari,06,2021-01-02,PF/BT,12M810_MONFALCONE,20-29,FVG,ITH4
27,Friuli-Venezia Giulia,TML_CAT_OSS,02/01/2021_PF/BT_FVG_14VP13_SANTA MARIA DELLA MISERICORDIA_20-29,1 - Operatori Sanitari e Sociosanitari,06,2021-01-02,PF/BT,14VP13_SANTA MARIA DELLA MISERICORDIA,20-29,FVG,ITH4
29,Friuli-Venezia Giulia,TML_CAT_OSS,02/01/2021_PF/BT_FVG_201010_CATTINARA_20-29,1 - Operatori Sanitari e Sociosanitari,06,2021-01-02,PF/BT,201010_CATTINARA,20-29,FVG,ITH4
54,Friuli-Venezia Giulia,TML_CAT_OSS,02/01/2021_PF/BT_FVG_117510_SANTA MARIA DEGLI ANGELI_30-39,1 - Operatori Sanitari e Sociosanitari,06,2021-01-02,PF/BT,117510_SANTA MARIA DEGLI ANGELI,30-39,FVG,ITH4
55,Friuli-Venezia Giulia,TML_CAT_OSS,02/01/2021_PF/BT_FVG_12M810_MONFALCONE_30-39,1 - Operatori Sanitari e Sociosanitari,06,2021-01-02,PF/BT,12M810_MONFALCONE,30-39,FVG,ITH4
51,Friuli-Venezia Giulia,TML_CAT_OSS,02/01/2021_PF/BT_FVG_14VP13_SANTA MARIA DELLA MISERICORDIA_30-39,1 - Operatori Sanitari e Sociosanitari,06,2021-01-02,PF/BT,14VP13_SANTA MARIA DELLA MISERICORDIA,30-39,FVG,ITH4
57,Friuli-Venezia Giulia,TML_CAT_OSS,02/01/2021_PF/BT_FVG_201010_CATTINARA_30-39,1 - Operatori Sanitari e Sociosanitari,06,2021-01-02,PF/BT,201010_CATTINARA,30-39,FVG,ITH4
51,Friuli-Venezia Giulia,TML_CAT_OSS,02/01/2021_PF/BT_FVG_117510_SANTA MARIA DEGLI ANGELI_40-49,1 - Operatori Sanitari e Sociosanitari,06,2021-01-02,PF/BT,117510_SANTA MARIA DEGLI ANGELI,40-49,FVG,ITH4
78,Friuli-Venezia Giulia,TML_CAT_OSS,02/01/2021_PF/BT_FVG_12M810_MONFALCONE_40-49,1 - Operatori Sanitari e Sociosanitari,06,2021-01-02,PF/BT,12M810_MONFALCONE,40-49,FVG,ITH4
56,Friuli-Venezia Giulia,TML_CAT_OSS,02/01/2021_PF/BT_FVG_14VP13_SANTA MARIA DELLA MISERICORDIA_40-49,1 - Operatori Sanitari e Sociosanitari,06,2021-01-02,PF/BT,14VP13_SANTA MARIA DELLA MISERICORDIA,40-49,FVG,ITH4
96,Friuli-Venezia Giulia,TML_CAT_OSS,02/01/2021_PF/BT_FVG_201010_CATTINARA_40-49,1 - Operatori Sanitari e Sociosanitari,06,2021-01-02,PF/BT,201010_CATTINARA,40-49,FVG,ITH4
54,Friuli-Venezia Giulia,TML_CAT_OSS,02/01/2021_PF/BT_FVG_117510_SANTA MARIA DEGLI ANGELI_50-59,1 - Operatori Sanitari e Sociosanitari,06,2021-01-02,PF/BT,117510_SANTA MARIA DEGLI ANGELI,50-59,FVG,ITH4
114,Friuli-Venezia Giulia,TML_CAT_OSS,02/01/2021_PF/BT_FVG_12M810_MONFALCONE_50-59,1 - Operatori Sanitari e Sociosanitari,06,2021-01-02,PF/BT,12M810_MONFALCONE,50-59,FVG,ITH4
50,Friuli-Venezia Giulia,TML_CAT_OSS,02/01/2021_PF/BT_FVG_14VP13_SANTA MARIA DELLA MISERICORDIA_50-59,1 - Operatori Sanitari e Sociosanitari,06,2021-01-02,PF/BT,14VP13_SANTA MARIA DELLA MISERICORDIA,50-59,FVG,ITH4
75,Friuli-Venezia Giulia,TML_CAT_OSS,02/01/2021_PF/BT_FVG_201010_CATTINARA_50-59,1 - Operatori Sanitari e Sociosanitari,06,2021-01-02,PF/BT,201010_CATTINARA,50-59,FVG,ITH4
34,Friuli-Venezia Giulia,TML_CAT_OSS,02/01/2021_PF/BT_FVG_117510_SANTA MARIA DEGLI ANGELI_60-69,1 - Operatori Sanitari e Sociosanitari,06,2021-01-02,PF/BT,117510_SANTA MARIA DEGLI ANGELI,60-69,FVG,ITH4
53,Friuli-Venezia Giulia,TML_CAT_OSS,02/01/2021_PF/BT_FVG_12M810_MONFALCONE_60-69,1 - Operatori Sanitari e Sociosanitari,06,2021-01-02,PF/BT,12M810_MONFALCONE,60-69,FVG,ITH4
29,Friuli-Venezia Giulia,TML_CAT_OSS,02/01/2021_PF/BT_FVG_14VP13_SANTA MARIA DELLA MISERICORDIA_60-69,1 - Operatori Sanitari e Sociosanitari,06,2021-01-02,PF/BT,14VP13_SANTA MARIA DELLA MISERICORDIA,60-69,FVG,ITH4
51,Friuli-Venezia Giulia,TML_CAT_OSS,02/01/2021_PF/BT_FVG_201010_CATTINARA_60-69,1 - Operatori Sanitari e Sociosanitari,06,2021-01-02,PF/BT,201010_CATTINARA,60-69,FVG,ITH4
9,Friuli-Venezia Giulia,TML_CAT_OSS,02/01/2021_PF/BT_FVG_117510_SANTA MARIA DEGLI ANGELI_70-79,1 - Operatori Sanitari e Sociosanitari,06,2021-01-02,PF/BT,117510_SANTA MARIA DEGLI ANGELI,70-79,FVG,ITH4
8,Friuli-Venezia Giulia,TML_CAT_OSS,02/01/2021_PF/BT_FVG_12M810_MONFALCONE_70-79,1 - Operatori Sanitari e Sociosanitari,06,2021-01-02,PF/BT,12M810_MONFALCONE,70-79,FVG,ITH4
5,Friuli-Venezia Giulia,TML_CAT_OSS,02/01/2021_PF/BT_FVG_14VP13_SANTA MARIA DELLA MISERICORDIA_70-79,1 - Operatori Sanitari e Sociosanitari,06,2021-01-02,PF/BT,14VP13_SANTA MARIA DELLA MISERICORDIA,70-79,FVG,ITH4
5,Friuli-Venezia Giulia,TML_CAT_OSS,02/01/2021_PF/BT_FVG_201010_CATTINARA_70-79,1 - Operatori Sanitari e Sociosanitari,06,2021-01-02,PF/BT,201010_CATTINARA,70-79,FVG,ITH4
1,Friuli-Venezia Giulia,TML_CAT_OSS,02/01/2021_PF/BT_FVG_12M810_MONFALCONE_80-89,1 - Operatori Sanitari e Sociosanitari,06,2021-01-02,PF/BT,12M810_MONFALCONE,80-89,FVG,ITH4
1,Friuli-Venezia Giulia,TML_CAT_PERSONALE,02/01/2021_PF/BT_FVG_117510_SANTA MARIA DEGLI ANGELI_20-29,2 - Personale non Sanitario,06,2021-01-02,PF/BT,117510_SANTA MARIA DEGLI ANGELI,20-29,FVG,ITH4
6,Friuli-Venezia Giulia,TML_CAT_ALTRO,02/01/2021_PF/BT_FVG_117510_SANTA MARIA DEGLI ANGELI_20-29,2 - Personale non Sanitario,06,2021-01-02,PF/BT,117510_SANTA MARIA DEGLI ANGELI,20-29,FVG,ITH4
6,Friuli-Venezia Giulia,TML_CAT_ALTRO,02/01/2021_PF/BT_FVG_12M810_MONFALCONE_20-29,2 - Personale non Sanitario,06,2021-01-02,PF/BT,12M810_MONFALCONE,20-29,FVG,ITH4
8,Friuli-Venezia Giulia,TML_CAT_ALTRO,02/01/2021_PF/BT_FVG_14VP13_SANTA MARIA DELLA MISERICORDIA_20-29,2 - Personale non Sanitario,06,2021-01-02,PF/BT,14VP13_SANTA MARIA DELLA MISERICORDIA,20-29,FVG,ITH4
2,Friuli-Venezia Giulia,TML_CAT_PERSONALE,02/01/2021_PF/BT_FVG_201010_CATTINARA_20-29,2 - Personale non Sanitario,06,2021-01-02,PF/BT,201010_CATTINARA,20-29,FVG,ITH4
13,Friuli-Venezia Giulia,TML_CAT_ALTRO,02/01/2021_PF/BT_FVG_201010_CATTINARA_20-29,2 - Personale non Sanitario,06,2021-01-02,PF/BT,201010_CATTINARA,20-29,FVG,ITH4
2,Friuli-Venezia Giulia,TML_CAT_PERSONALE,02/01/2021_PF/BT_FVG_117510_SANTA MARIA DEGLI ANGELI_30-39,2 - Personale non Sanitario,06,2021-01-02,PF/BT,117510_SANTA MARIA DEGLI ANGELI,30-39,FVG,ITH4
1,Friuli-Venezia Giulia,TML_CAT_ALTRO,02/01/2021_PF/BT_FVG_12M810_MONFALCONE_30-39,2 - Personale non Sanitario,06,2021-01-02,PF/BT,12M810_MONFALCONE,30-39,FVG,ITH4
7,Friuli-Venezia Giulia,TML_CAT_PERSONALE,02/01/2021_PF/BT_FVG_12M810_MONFALCONE_30-39,2 - Personale non Sanitario,06,2021-01-02,PF/BT,12M810_MONFALCONE,30-39,FVG,ITH4
1,Friuli-Venezia Giulia,TML_CAT_ALTRO,02/01/2021_PF/BT_FVG_14VP13_SANTA MARIA DELLA MISERICORDIA_30-39,2 - Personale non Sanitario,06,2021-01-02,PF/BT,14VP13_SANTA MARIA DELLA MISERICORDIA,30-39,FVG,ITH4
2,Friuli-Venezia Giulia,TML_CAT_PERSONALE,02/01/2021_PF/BT_FVG_14VP13_SANTA MARIA DELLA MISERICORDIA_30-39,2 - Personale non Sanitario,06,2021-01-02,PF/BT,14VP13_SANTA MARIA DELLA MISERICORDIA,30-39,FVG,ITH4
3,Friuli-Venezia Giulia,TML_CAT_PERSONALE,02/01/2021_PF/BT_FVG_201010_CATTINARA_30-39,2 - Personale non Sanitario,06,2021-01-02,PF/BT,201010_CATTINARA,30-39,FVG,ITH4
5,Friuli-Venezia Giulia,TML_CAT_ALTRO,02/01/2021_PF/BT_FVG_201010_CATTINARA_30-39,2 - Personale non Sanitario,06,2021-01-02,PF/BT,201010_CATTINARA,30-39,FVG,ITH4
4,Friuli-Venezia Giulia,TML_CAT_PERSONALE,02/01/2021_PF/BT_FVG_117510_SANTA MARIA DEGLI ANGELI_40-49,2 - Personale non Sanitario,06,2021-01-02,PF/BT,117510_SANTA MARIA DEGLI ANGELI,40-49,FVG,ITH4
1,Friuli-Venezia Giulia,TML_CAT_PERSONALE,02/01/2021_PF/BT_FVG_12M810_MONFALCONE_40-49,2 - Personale non Sanitario,06,2021-01-02,PF/BT,12M810_MONFALCONE,40-49,FVG,ITH4
4,Friuli-Venezia Giulia,TML_CAT_PERSONALE,02/01/2021_PF/BT_FVG_14VP13_SANTA MARIA DELLA MISERICORDIA_40-49,2 - Personale non Sanitario,06,2021-01-02,PF/BT,14VP13_SANTA MARIA DELLA MISERICORDIA,40-49,FVG,ITH4
4,Friuli-Venezia Giulia,TML_CAT_PERSONALE,02/01/2021_PF/BT_FVG_201010_CATTINARA_40-49,2 - Personale non Sanitario,06,2021-01-02,PF/BT,201010_CATTINARA,40-49,FVG,ITH4
5,Friuli-Venezia Giulia,TML_CAT_PERSONALE,02/01/2021_PF/BT_FVG_117510_SANTA MARIA DEGLI ANGELI_50-59,2 - Personale non Sanitario,06,2021-01-02,PF/BT,117510_SANTA MARIA DEGLI ANGELI,50-59,FVG,ITH4
9,Friuli-Venezia Giulia,TML_CAT_PERSONALE,02/01/2021_PF/BT_FVG_12M810_MONFALCONE_50-59,2 - Personale non Sanitario,06,2021-01-02,PF/BT,12M810_MONFALCONE,50-59,FVG,ITH4
5,Friuli-Venezia Giulia,TML_CAT_PERSONALE,02/01/2021_PF/BT_FVG_14VP13_SANTA MARIA DELLA MISERICORDIA_50-59,2 - Personale non Sanitario,06,2021-01-02,PF/BT,14VP13_SANTA MARIA DELLA MISERICORDIA,50-59,FVG,ITH4
10,Friuli-Venezia Giulia,TML_CAT_PERSONALE,02/01/2021_PF/BT_FVG_201010_CATTINARA_50-59,2 - Personale non Sanitario,06,2021-01-02,PF/BT,201010_CATTINARA,50-59,FVG,ITH4
5,Friuli-Venezia Giulia,TML_CAT_PERSONALE,02/01/2021_PF/BT_FVG_117510_SANTA MARIA DEGLI ANGELI_60-69,2 - Personale non Sanitario,06,2021-01-02,PF/BT,117510_SANTA MARIA DEGLI ANGELI,60-69,FVG,ITH4
1,Friuli-Venezia Giulia,TML_CAT_PERSONALE,02/01/2021_PF/BT_FVG_12M810_MONFALCONE_60-69,2 - Personale non Sanitario,06,2021-01-02,PF/BT,12M810_MONFALCONE,60-69,FVG,ITH4
1,Friuli-Venezia Giulia,TML_CAT_PERSONALE,02/01/2021_PF/BT_FVG_14VP13_SANTA MARIA DELLA MISERICORDIA_60-69,2 - Personale non Sanitario,06,2021-01-02,PF/BT,14VP13_SANTA MARIA DELLA MISERICORDIA,60-69,FVG,ITH4
1,Friuli-Venezia Giulia,TML_CAT_PERSONALE,02/01/2021_PF/BT_FVG_12M810_MONFALCONE_70-79,2 - Personale non Sanitario,06,2021-01-02,PF/BT,12M810_MONFALCONE,70-79,FVG,ITH4
38,Friuli-Venezia Giulia,TML_CAT_OSS,03/01/2021_PF/BT_FVG_201010_CATTINARA_20-29,1 - Operatori Sanitari e Sociosanitari,06,2021-01-03,PF/BT,201010_CATTINARA,20-29,FVG,ITH4
45,Friuli-Venezia Giulia,TML_CAT_OSS,03/01/2021_PF/BT_FVG_201010_CATTINARA_30-39,1 - Operatori Sanitari e Sociosanitari,06,2021-01-03,PF/BT,201010_CATTINARA,30-39,FVG,ITH4
58,Friuli-Venezia Giulia,TML_CAT_OSS,03/01/2021_PF/BT_FVG_201010_CATTINARA_40-49,1 - Operatori Sanitari e Sociosanitari,06,2021-01-03,PF/BT,201010_CATTINARA,40-49,FVG,ITH4
55,Friuli-Venezia Giulia,TML_CAT_OSS,03/01/2021_PF/BT_FVG_201010_CATTINARA_50-59,1 - Operatori Sanitari e Sociosanitari,06,2021-01-03,PF/BT,201010_CATTINARA,50-59,FVG,ITH4
31,Friuli-Venezia Giulia,TML_CAT_OSS,03/01/2021_PF/BT_FVG_201010_CATTINARA_60-69,1 - Operatori Sanitari e Sociosanitari,06,2021-01-03,PF/BT,201010_CATTINARA,60-69,FVG,ITH4
11,Friuli-Venezia Giulia,TML_CAT_OSS,03/01/2021_PF/BT_FVG_201010_CATTINARA_70-79,1 - Operatori Sanitari e Sociosanitari,06,2021-01-03,PF/BT,201010_CATTINARA,70-79,FVG,ITH4
1,Friuli-Venezia Giulia,TML_CAT_ALTRO,03/01/2021_PF/BT_FVG_201010_CATTINARA_16-19,2 - Personale non Sanitario,06,2021-01-03,PF/BT,201010_CATTINARA,16-19,FVG,ITH4
5,Friuli-Venezia Giulia,TML_CAT_PERSONALE,03/01/2021_PF/BT_FVG_201010_CATTINARA_20-29,2 - Personale non Sanitario,06,2021-01-03,PF/BT,201010_CATTINARA,20-29,FVG,ITH4
1,Friuli-Venezia Giulia,TML_CAT_PERSONALE,03/01/2021_PF/BT_FVG_201010_CATTINARA_30-39,2 - Personale non Sanitario,06,2021-01-03,PF/BT,201010_CATTINARA,30-39,FVG,ITH4
10,Friuli-Venezia Giulia,TML_CAT_ALTRO,03/01/2021_PF/BT_FVG_201010_CATTINARA_30-39,2 - Personale non Sanitario,06,2021-01-03,PF/BT,201010_CATTINARA,30-39,FVG,ITH4
1,Friuli-Venezia Giulia,TML_CAT_ALTRO,03/01/2021_PF/BT_FVG_201010_CATTINARA_40-49,2 - Personale non Sanitario,06,2021-01-03,PF/BT,201010_CATTINARA,40-49,FVG,ITH4
6,Friuli-Venezia Giulia,TML_CAT_PERSONALE,03/01/2021_PF/BT_FVG_201010_CATTINARA_40-49,2 - Personale non Sanitario,06,2021-01-03,PF/BT,201010_CATTINARA,40-49,FVG,ITH4
9,Friuli-Venezia Giulia,TML_CAT_PERSONALE,03/01/2021_PF/BT_FVG_201010_CATTINARA_50-59,2 - Personale non Sanitario,06,2021-01-03,PF/BT,201010_CATTINARA,50-59,FVG,ITH4
3,Friuli-Venezia Giulia,TML_CAT_PERSONALE,03/01/2021_PF/BT_FVG_201010_CATTINARA_60-69,2 - Personale non Sanitario,06,2021-01-03,PF/BT,201010_CATTINARA,60-69,FVG,ITH4
2,Friuli-Venezia Giulia,TML_CAT_PERSONALE,03/01/2021_PF/BT_FVG_201010_CATTINARA_70-79,2 - Personale non Sanitario,06,2021-01-03,PF/BT,201010_CATTINARA,70-79,FVG,ITH4
1,Friuli-Venezia Giulia,TML_CAT_RSA_OSPITI,03/01/2021_PF/BT_FVG_201010_CATTINARA_90+,3 - Ospiti Strutture Residenziali,06,2021-01-03,PF/BT,201010_CATTINARA,90+,FVG,ITH4
39,Friuli-Venezia Giulia,TML_CAT_OSS,04/01/2021_PF/BT_FVG_117510_SANTA MARIA DEGLI ANGELI_20-29,1 - Operatori Sanitari e Sociosanitari,06,2021-01-04,PF/BT,117510_SANTA MARIA DEGLI ANGELI,20-29,FVG,ITH4
36,Friuli-Venezia Giulia,TML_CAT_OSS,04/01/2021_PF/BT_FVG_12M810_MONFALCONE_20-29,1 - Operatori Sanitari e Sociosanitari,06,2021-01-04,PF/BT,12M810_MONFALCONE,20-29,FVG,ITH4
36,Friuli-Venezia Giulia,TML_CAT_OSS,04/01/2021_PF/BT_FVG_14VP13_SANTA MARIA DELLA MISERICORDIA_20-29,1 - Operatori Sanitari e Sociosanitari,06,2021-01-04,PF/BT,14VP13_SANTA MARIA DELLA MISERICORDIA,20-29,FVG,ITH4
40,Friuli-Venezia Giulia,TML_CAT_OSS,04/01/2021_PF/BT_FVG_201010_CATTINARA_20-29,1 - Operatori Sanitari e Sociosanitari,06,2021-01-04,PF/BT,201010_CATTINARA,20-29,FVG,ITH4
16,Friuli-Venezia Giulia,TML_CAT_OSS,04/01/2021_PF/BT_FVG_220101_TOLMEZZO_20-29,1 - Operatori Sanitari e Sociosanitari,06,2021-01-04,PF/BT,220101_TOLMEZZO,20-29,FVG,ITH4
75,Friuli-Venezia Giulia,TML_CAT_OSS,04/01/2021_PF/BT_FVG_117510_SANTA MARIA DEGLI ANGELI_30-39,1 - Operatori Sanitari e Sociosanitari,06,2021-01-04,PF/BT,117510_SANTA MARIA DEGLI ANGELI,30-39,FVG,ITH4
29,Friuli-Venezia Giulia,TML_CAT_OSS,04/01/2021_PF/BT_FVG_12M810_MONFALCONE_30-39,1 - Operatori Sanitari e Sociosanitari,06,2021-01-04,PF/BT,12M810_MONFALCONE,30-39,FVG,ITH4
44,Friuli-Venezia Giulia,TML_CAT_OSS,04/01/2021_PF/BT_FVG_14VP13_SANTA MARIA DELLA MISERICORDIA_30-39,1 - Operatori Sanitari e Sociosanitari,06,2021-01-04,PF/BT,14VP13_SANTA MARIA DELLA MISERICORDIA,30-39,FVG,ITH4
68,Friuli-Venezia Giulia,TML_CAT_OSS,04/01/2021_PF/BT_FVG_201010_CATTINARA_30-39,1 - Operatori Sanitari e Sociosanitari,06,2021-01-04,PF/BT,201010_CATTINARA,30-39,FVG,ITH4
36,Friuli-Venezia Giulia,TML_CAT_OSS,04/01/2021_PF/BT_FVG_220101_TOLMEZZO_30-39,1 - Operatori Sanitari e Sociosanitari,06,2021-01-04,PF/BT,220101_TOLMEZZO,30-39,FVG,ITH4
73,Friuli-Venezia Giulia,TML_CAT_OSS,04/01/2021_PF/BT_FVG_117510_SANTA MARIA DEGLI ANGELI_40-49,1 - Operatori Sanitari e Sociosanitari,06,2021-01-04,PF/BT,117510_SANTA MARIA DEGLI ANGELI,40-49,FVG,ITH4
45,Friuli-Venezia Giulia,TML_CAT_OSS,04/01/2021_PF/BT_FVG_12M810_MONFALCONE_40-49,1 - Operatori Sanitari e Sociosanitari,06,2021-01-04,PF/BT,12M810_MONFALCONE,40-49,FVG,ITH4
64,Friuli-Venezia Giulia,TML_CAT_OSS,04/01/2021_PF/BT_FVG_14VP13_SANTA MARIA DELLA MISERICORDIA_40-49,1 - Operatori Sanitari e Sociosanitari,06,2021-01-04,PF/BT,14VP13_SANTA MARIA DELLA MISERICORDIA,40-49,FVG,ITH4
76,Friuli-Venezia Giulia,TML_CAT_OSS,04/01/2021_PF/BT_FVG_201010_CATTINARA_40-49,1 - Operatori Sanitari e Sociosanitari,06,2021-01-04,PF/BT,201010_CATTINARA,40-49,FVG,ITH4
50,Friuli-Venezia Giulia,TML_CAT_OSS,04/01/2021_PF/BT_FVG_220101_TOLMEZZO_40-49,1 - Operatori Sanitari e Sociosanitari,06,2021-01-04,PF/BT,220101_TOLMEZZO,40-49,FVG,ITH4
78,Friuli-Venezia Giulia,TML_CAT_OSS,04/01/2021_PF/BT_FVG_117510_SANTA MARIA DEGLI ANGELI_50-59,1 - Operatori Sanitari e Sociosanitari,06,2021-01-04,PF/BT,117510_SANTA MARIA DEGLI ANGELI,50-59,FVG,ITH4
39,Friuli-Venezia Giulia,TML_CAT_OSS,04/01/2021_PF/BT_FVG_12M810_MONFALCONE_50-59,1 - Operatori Sanitari e Sociosanitari,06,2021-01-04,PF/BT,12M810_MONFALCONE,50-59,FVG,ITH4
53,Friuli-Venezia Giulia,TML_CAT_OSS,04/01/2021_PF/BT_FVG_14VP13_SANTA MARIA DELLA MISERICORDIA_50-59,1 - Operatori Sanitari e Sociosanitari,06,2021-01-04,PF/BT,14VP13_SANTA MARIA DELLA MISERICORDIA,50-59,FVG,ITH4
119,Friuli-Venezia Giulia,TML_CAT_OSS,04/01/2021_PF/BT_FVG_201010_CATTINARA_50-59,1 - Operatori Sanitari e Sociosanitari,06,2021-01-04,PF/BT,201010_CATTINARA,50-59,FVG,ITH4
72,Friuli-Venezia Giulia,TML_CAT_OSS,04/01/2021_PF/BT_FVG_220101_TOLMEZZO_50-59,1 - Operatori Sanitari e Sociosanitari,06,2021-01-04,PF/BT,220101_TOLMEZZO,50-59,FVG,ITH4
47,Friuli-Venezia Giulia,TML_CAT_OSS,04/01/2021_PF/BT_FVG_117510_SANTA MARIA DEGLI ANGELI_60-69,1 - Operatori Sanitari e Sociosanitari,06,2021-01-04,PF/BT,117510_SANTA MARIA DEGLI ANGELI,60-69,FVG,ITH4
34,Friuli-Venezia Giulia,TML_CAT_OSS,04/01/2021_PF/BT_FVG_12M810_MONFALCONE_60-69,1 - Operatori Sanitari e Sociosanitari,06,2021-01-04,PF/BT,12M810_MONFALCONE,60-69,FVG,ITH4
16,Friuli-Venezia Giulia,TML_CAT_OSS,04/01/2021_PF/BT_FVG_14VP13_SANTA MARIA DELLA MISERICORDIA_60-69,1 - Operatori Sanitari e Sociosanitari,06,2021-01-04,PF/BT,14VP13_SANTA MARIA DELLA MISERICORDIA,60-69,FVG,ITH4
61,Friuli-Venezia Giulia,TML_CAT_OSS,04/01/2021_PF/BT_FVG_201010_CATTINARA_60-69,1 - Operatori Sanitari e Sociosanitari,06,2021-01-04,PF/BT,201010_CATTINARA,60-69,FVG,ITH4
32,Friuli-Venezia Giulia,TML_CAT_OSS,04/01/2021_PF/BT_FVG_220101_TOLMEZZO_60-69,1 - Operatori Sanitari e Sociosanitari,06,2021-01-04,PF/BT,220101_TOLMEZZO,60-69,FVG,ITH4
11,Friuli-Venezia Giulia,TML_CAT_OSS,04/01/2021_PF/BT_FVG_117510_SANTA MARIA DEGLI ANGELI_70-79,1 - Operatori Sanitari e Sociosanitari,06,2021-01-04,PF/BT,117510_SANTA MARIA DEGLI ANGELI,70-79,FVG,ITH4
4,Friuli-Venezia Giulia,TML_CAT_OSS,04/01/2021_PF/BT_FVG_12M810_MONFALCONE_70-79,1 - Operatori Sanitari e Sociosanitari,06,2021-01-04,PF/BT,12M810_MONFALCONE,70-79,FVG,ITH4
7,Friuli-Venezia Giulia,TML_CAT_OSS,04/01/2021_PF/BT_FVG_14VP13_SANTA MARIA DELLA MISERICORDIA_70-79,1 - Operatori Sanitari e Sociosanitari,06,2021-01-04,PF/BT,14VP13_SANTA MARIA DELLA MISERICORDIA,70-79,FVG,ITH4
10,Friuli-Venezia Giulia,TML_CAT_OSS,04/01/2021_PF/BT_FVG_201010_CATTINARA_70-79,1 - Operatori Sanitari e Sociosanitari,06,2021-01-04,PF/BT,201010_CATTINARA,70-79,FVG,ITH4
2,Friuli-Venezia Giulia,TML_CAT_OSS,04/01/2021_PF/BT_FVG_220101_TOLMEZZO_70-79,1 - Operatori Sanitari e Sociosanitari,06,2021-01-04,PF/BT,220101_TOLMEZZO,70-79,FVG,ITH4
2,Friuli-Venezia Giulia,TML_CAT_OSS,04/01/2021_PF/BT_FVG_14VP13_SANTA MARIA DELLA MISERICORDIA_80-89,1 - Operatori Sanitari e Sociosanitari,06,2021-01-04,PF/BT,14VP13_SANTA MARIA DELLA MISERICORDIA,80-89,FVG,ITH4
1,Friuli-Venezia Giulia,TML_CAT_OSS,04/01/2021_PF/BT_FVG_220101_TOLMEZZO_80-89,1 - Operatori Sanitari e Sociosanitari,06,2021-01-04,PF/BT,220101_TOLMEZZO,80-89,FVG,ITH4
1,Friuli-Venezia Giulia,TML_CAT_ALTRO,04/01/2021_PF/BT_FVG_201010_CATTINARA_16-19,2 - Personale non Sanitario,06,2021-01-04,PF/BT,201010_CATTINARA,16-19,FVG,ITH4
2,Friuli-Venezia Giulia,TML_CAT_ALTRO,04/01/2021_PF/BT_FVG_117510_SANTA MARIA DEGLI ANGELI_20-29,2 - Personale non Sanitario,06,2021-01-04,PF/BT,117510_SANTA MARIA DEGLI ANGELI,20-29,FVG,ITH4
3,Friuli-Venezia Giulia,TML_CAT_PERSONALE,04/01/2021_PF/BT_FVG_117510_SANTA MARIA DEGLI ANGELI_20-29,2 - Personale non Sanitario,06,2021-01-04,PF/BT,117510_SANTA MARIA DEGLI ANGELI,20-29,FVG,ITH4
5,Friuli-Venezia Giulia,TML_CAT_PERSONALE,04/01/2021_PF/BT_FVG_12M810_MONFALCONE_20-29,2 - Personale non Sanitario,06,2021-01-04,PF/BT,12M810_MONFALCONE,20-29,FVG,ITH4
15,Friuli-Venezia Giulia,TML_CAT_ALTRO,04/01/2021_PF/BT_FVG_12M810_MONFALCONE_20-29,2 - Personale non Sanitario,06,2021-01-04,PF/BT,12M810_MONFALCONE,20-29,FVG,ITH4
1,Friuli-Venezia Giulia,TML_CAT_PERSONALE,04/01/2021_PF/BT_FVG_14VP13_SANTA MARIA DELLA MISERICORDIA_20-29,2 - Personale non Sanitario,06,2021-01-04,PF/BT,14VP13_SANTA MARIA DELLA MISERICORDIA,20-29,FVG,ITH4
9,Friuli-Venezia Giulia,TML_CAT_ALTRO,04/01/2021_PF/BT_FVG_14VP13_SANTA MARIA DELLA MISERICORDIA_20-29,2 - Personale non Sanitario,06,2021-01-04,PF/BT,14VP13_SANTA MARIA DELLA MISERICORDIA,20-29,FVG,ITH4
4,Friuli-Venezia Giulia,TML_CAT_PERSONALE,04/01/2021_PF/BT_FVG_201010_CATTINARA_20-29,2 - Personale non Sanitario,06,2021-01-04,PF/BT,201010_CATTINARA,20-29,FVG,ITH4
2,Friuli-Venezia Giulia,TML_CAT_PERSONALE,04/01/2021_PF/BT_FVG_220101_TOLMEZZO_20-29,2 - Personale non Sanitario,06,2021-01-04,PF/BT,220101_TOLMEZZO,20-29,FVG,ITH4
5,Friuli-Venezia Giulia,TML_CAT_ALTRO,04/01/2021_PF/BT_FVG_220101_TOLMEZZO_20-29,2 - Personale non Sanitario,06,2021-01-04,PF/BT,220101_TOLMEZZO,20-29,FVG,ITH4
1,Friuli-Venezia Giulia,TML_CAT_ALTRO,04/01/2021_PF/BT_FVG_117510_SANTA MARIA DEGLI ANGELI_30-39,2 - Personale non Sanitario,06,2021-01-04,PF/BT,117510_SANTA MARIA DEGLI ANGELI,30-39,FVG,ITH4
4,Friuli-Venezia Giulia,TML_CAT_PERSONALE,04/01/2021_PF/BT_FVG_117510_SANTA MARIA DEGLI ANGELI_30-39,2 - Personale non Sanitario,06,2021-01-04,PF/BT,117510_SANTA MARIA DEGLI ANGELI,30-39,FVG,ITH4
2,Friuli-Venezia Giulia,TML_CAT_ALTRO,04/01/2021_PF/BT_FVG_12M810_MONFALCONE_30-39,2 - Personale non Sanitario,06,2021-01-04,PF/BT,12M810_MONFALCONE,30-39,FVG,ITH4
6,Friuli-Venezia Giulia,TML_CAT_PERSONALE,04/01/2021_PF/BT_FVG_12M810_MONFALCONE_30-39,2 - Personale non Sanitario,06,2021-01-04,PF/BT,12M810_MONFALCONE,30-39,FVG,ITH4
2,Friuli-Venezia Giulia,TML_CAT_PERSONALE,04/01/2021_PF/BT_FVG_14VP13_SANTA MARIA DELLA MISERICORDIA_30-39,2 - Personale non Sanitario,06,2021-01-04,PF/BT,14VP13_SANTA MARIA DELLA MISERICORDIA,30-39,FVG,ITH4
3,Friuli-Venezia Giulia,TML_CAT_PERSONALE,04/01/2021_PF/BT_FVG_201010_CATTINARA_30-39,2 - Personale non Sanitario,06,2021-01-04,PF/BT,201010_CATTINARA,30-39,FVG,ITH4
10,Friuli-Venezia Giulia,TML_CAT_ALTRO,04/01/2021_PF/BT_FVG_201010_CATTINARA_30-39,2 - Personale non Sanitario,06,2021-01-04,PF/BT,201010_CATTINARA,30-39,FVG,ITH4
1,Friuli-Venezia Giulia,TML_CAT_ALTRO,04/01/2021_PF/BT_FVG_220101_TOLMEZZO_30-39,2 - Personale non Sanitario,06,2021-01-04,PF/BT,220101_TOLMEZZO,30-39,FVG,ITH4
3,Friuli-Venezia Giulia,TML_CAT_PERSONALE,04/01/2021_PF/BT_FVG_220101_TOLMEZZO_30-39,2 - Personale non Sanitario,06,2021-01-04,PF/BT,220101_TOLMEZZO,30-39,FVG,ITH4
4,Friuli-Venezia Giulia,TML_CAT_PERSONALE,04/01/2021_PF/BT_FVG_117510_SANTA MARIA DEGLI ANGELI_40-49,2 - Personale non Sanitario,06,2021-01-04,PF/BT,117510_SANTA MARIA DEGLI ANGELI,40-49,FVG,ITH4
11,Friuli-Venezia Giulia,TML_CAT_PERSONALE,04/01/2021_PF/BT_FVG_12M810_MONFALCONE_40-49,2 - Personale non Sanitario,06,2021-01-04,PF/BT,12M810_MONFALCONE,40-49,FVG,ITH4
1,Friuli-Venezia Giulia,TML_CAT_PERSONALE,04/01/2021_PF/BT_FVG_14VP13_SANTA MARIA DELLA MISERICORDIA_40-49,2 - Personale non Sanitario,06,2021-01-04,PF/BT,14VP13_SANTA MARIA DELLA MISERICORDIA,40-49,FVG,ITH4
1,Friuli-Venezia Giulia,TML_CAT_ALTRO,04/01/2021_PF/BT_FVG_201010_CATTINARA_40-49,2 - Personale non Sanitario,06,2021-01-04,PF/BT,201010_CATTINARA,40-49,FVG,ITH4
12,Friuli-Venezia Giulia,TML_CAT_PERSONALE,04/01/2021_PF/BT_FVG_201010_CATTINARA_40-49,2 - Personale non Sanitario,06,2021-01-04,PF/BT,201010_CATTINARA,40-49,FVG,ITH4
1,Friuli-Venezia Giulia,TML_CAT_ALTRO,04/01/2021_PF/BT_FVG_220101_TOLMEZZO_40-49,2 - Personale non Sanitario,06,2021-01-04,PF/BT,220101_TOLMEZZO,40-49,FVG,ITH4
5,Friuli-Venezia Giulia,TML_CAT_PERSONALE,04/01/2021_PF/BT_FVG_220101_TOLMEZZO_40-49,2 - Personale non Sanitario,06,2021-01-04,PF/BT,220101_TOLMEZZO,40-49,FVG,ITH4
4,Friuli-Venezia Giulia,TML_CAT_PERSONALE,04/01/2021_PF/BT_FVG_117510_SANTA MARIA DEGLI ANGELI_50-59,2 - Personale non Sanitario,06,2021-01-04,PF/BT,117510_SANTA MARIA DEGLI ANGELI,50-59,FVG,ITH4
7,Friuli-Venezia Giulia,TML_CAT_PERSONALE,04/01/2021_PF/BT_FVG_12M810_MONFALCONE_50-59,2 - Personale non Sanitario,06,2021-01-04,PF/BT,12M810_MONFALCONE,50-59,FVG,ITH4
2,Friuli-Venezia Giulia,TML_CAT_PERSONALE,04/01/2021_PF/BT_FVG_14VP13_SANTA MARIA DELLA MISERICORDIA_50-59,2 - Personale non Sanitario,06,2021-01-04,PF/BT,14VP13_SANTA MARIA DELLA MISERICORDIA,50-59,FVG,ITH4
11,Friuli-Venezia Giulia,TML_CAT_PERSONALE,04/01/2021_PF/BT_FVG_201010_CATTINARA_50-59,2 - Personale non Sanitario,06,2021-01-04,PF/BT,201010_CATTINARA,50-59,FVG,ITH4
10,Friuli-Venezia Giulia,TML_CAT_PERSONALE,04/01/2021_PF/BT_FVG_220101_TOLMEZZO_50-59,2 - Personale non Sanitario,06,2021-01-04,PF/BT,220101_TOLMEZZO,50-59,FVG,ITH4
1,Friuli-Venezia Giulia,TML_CAT_PERSONALE,04/01/2021_PF/BT_FVG_117510_SANTA MARIA DEGLI ANGELI_60-69,2 - Personale non Sanitario,06,2021-01-04,PF/BT,117510_SANTA MARIA DEGLI ANGELI,60-69,FVG,ITH4
5,Friuli-Venezia Giulia,TML_CAT_PERSONALE,04/01/2021_PF/BT_FVG_12M810_MONFALCONE_60-69,2 - Personale non Sanitario,06,2021-01-04,PF/BT,12M810_MONFALCONE,60-69,FVG,ITH4
2,Friuli-Venezia Giulia,TML_CAT_PERSONALE,04/01/2021_PF/BT_FVG_14VP13_SANTA MARIA DELLA MISERICORDIA_60-69,2 - Personale non Sanitario,06,2021-01-04,PF/BT,14VP13_SANTA MARIA DELLA MISERICORDIA,60-69,FVG,ITH4
3,Friuli-Venezia Giulia,TML_CAT_PERSONALE,04/01/2021_PF/BT_FVG_201010_CATTINARA_60-69,2 - Personale non Sanitario,06,2021-01-04,PF/BT,201010_CATTINARA,60-69,FVG,ITH4
3,Friuli-Venezia Giulia,TML_CAT_PERSONALE,04/01/2021_PF/BT_FVG_220101_TOLMEZZO_60-69,2 - Personale non Sanitario,06,2021-01-04,PF/BT,220101_TOLMEZZO,60-69,FVG,ITH4
2,Friuli-Venezia Giulia,TML_CAT_PERSONALE,04/01/2021_PF/BT_FVG_12M810_MONFALCONE_70-79,2 - Personale non Sanitario,06,2021-01-04,PF/BT,12M810_MONFALCONE,70-79,FVG,ITH4
2,Friuli-Venezia Giulia,TML_CAT_PERSONALE,04/01/2021_PF/BT_FVG_201010_CATTINARA_80-89,2 - Personale non Sanitario,06,2021-01-04,PF/BT,201010_CATTINARA,80-89,FVG,ITH4
34,Friuli-Venezia Giulia,TML_CAT_OSS,05/01/2021_PF/BT_FVG_117510_SANTA MARIA DEGLI ANGELI_20-29,1 - Operatori Sanitari e Sociosanitari,06,2021-01-05,PF/BT,117510_SANTA MARIA DEGLI ANGELI,20-29,FVG,ITH4
18,Friuli-Venezia Giulia,TML_CAT_OSS,05/01/2021_PF/BT_FVG_14VP13_SANTA MARIA DELLA MISERICORDIA_20-29,1 - Operatori Sanitari e Sociosanitari,06,2021-01-05,PF/BT,14VP13_SANTA MARIA DELLA MISERICORDIA,20-29,FVG,ITH4
72,Friuli-Venezia Giulia,TML_CAT_OSS,05/01/2021_PF/BT_FVG_201010_CATTINARA_20-29,1 - Operatori Sanitari e Sociosanitari,06,2021-01-05,PF/BT,201010_CATTINARA,20-29,FVG,ITH4
31,Friuli-Venezia Giulia,TML_CAT_OSS,05/01/2021_PF/BT_FVG_220101_TOLMEZZO_20-29,1 - Operatori Sanitari e Sociosanitari,06,2021-01-05,PF/BT,220101_TOLMEZZO,20-29,FVG,ITH4
58,Friuli-Venezia Giulia,TML_CAT_OSS,05/01/2021_PF/BT_FVG_117510_SANTA MARIA DEGLI ANGELI_30-39,1 - Operatori Sanitari e Sociosanitari,06,2021-01-05,PF/BT,117510_SANTA MARIA DEGLI ANGELI,30-39,FVG,ITH4
46,Friuli-Venezia Giulia,TML_CAT_OSS,05/01/2021_PF/BT_FVG_14VP13_SANTA MARIA DELLA MISERICORDIA_30-39,1 - Operatori Sanitari e Sociosanitari,06,2021-01-05,PF/BT,14VP13_SANTA MARIA DELLA MISERICORDIA,30-39,FVG,ITH4
94,Friuli-Venezia Giulia,TML_CAT_OSS,05/01/2021_PF/BT_FVG_201010_CATTINARA_30-39,1 - Operatori Sanitari e Sociosanitari,06,2021-01-05,PF/BT,201010_CATTINARA,30-39,FVG,ITH4
40,Friuli-Venezia Giulia,TML_CAT_OSS,05/01/2021_PF/BT_FVG_220101_TOLMEZZO_30-39,1 - Operatori Sanitari e Sociosanitari,06,2021-01-05,PF/BT,220101_TOLMEZZO,30-39,FVG,ITH4
92,Friuli-Venezia Giulia,TML_CAT_OSS,05/01/2021_PF/BT_FVG_117510_SANTA MARIA DEGLI ANGELI_40-49,1 - Operatori Sanitari e Sociosanitari,06,2021-01-05,PF/BT,117510_SANTA MARIA DEGLI ANGELI,40-49,FVG,ITH4
55,Friuli-Venezia Giulia,TML_CAT_OSS,05/01/2021_PF/BT_FVG_14VP13_SANTA MARIA DELLA MISERICORDIA_40-49,1 - Operatori Sanitari e Sociosanitari,06,2021-01-05,PF/BT,14VP13_SANTA MARIA DELLA MISERICORDIA,40-49,FVG,ITH4
105,Friuli-Venezia Giulia,TML_CAT_OSS,05/01/2021_PF/BT_FVG_201010_CATTINARA_40-49,1 - Operatori Sanitari e Sociosanitari,06,2021-01-05,PF/BT,201010_CATTINARA,40-49,FVG,ITH4
59,Friuli-Venezia Giulia,TML_CAT_OSS,05/01/2021_PF/BT_FVG_220101_TOLMEZZO_40-49,1 - Operatori Sanitari e Sociosanitari,06,2021-01-05,PF/BT,220101_TOLMEZZO,40-49,FVG,ITH4
92,Friuli-Venezia Giulia,TML_CAT_OSS,05/01/2021_PF/BT_FVG_117510_SANTA MARIA DEGLI ANGELI_50-59,1 - Operatori Sanitari e Sociosanitari,06,2021-01-05,PF/BT,117510_SANTA MARIA DEGLI ANGELI,50-59,FVG,ITH4
50,Friuli-Venezia Giulia,TML_CAT_OSS,05/01/2021_PF/BT_FVG_14VP13_SANTA MARIA DELLA MISERICORDIA_50-59,1 - Operatori Sanitari e Sociosanitari,06,2021-01-05,PF/BT,14VP13_SANTA MARIA DELLA MISERICORDIA,50-59,FVG,ITH4
136,Friuli-Venezia Giulia,TML_CAT_OSS,05/01/2021_PF/BT_FVG_201010_CATTINARA_50-59,1 - Operatori Sanitari e Sociosanitari,06,2021-01-05,PF/BT,201010_CATTINARA,50-59,FVG,ITH4
62,Friuli-Venezia Giulia,TML_CAT_OSS,05/01/2021_PF/BT_FVG_220101_TOLMEZZO_50-59,1 - Operatori Sanitari e Sociosanitari,06,2021-01-05,PF/BT,220101_TOLMEZZO,50-59,FVG,ITH4
68,Friuli-Venezia Giulia,TML_CAT_OSS,05/01/2021_PF/BT_FVG_117510_SANTA MARIA DEGLI ANGELI_60-69,1 - Operatori Sanitari e Sociosanitari,06,2021-01-05,PF/BT,117510_SANTA MARIA DEGLI ANGELI,60-69,FVG,ITH4
34,Friuli-Venezia Giulia,TML_CAT_OSS,05/01/2021_PF/BT_FVG_14VP13_SANTA MARIA DELLA MISERICORDIA_60-69,1 - Operatori Sanitari e Sociosanitari,06,2021-01-05,PF/BT,14VP13_SANTA MARIA DELLA MISERICORDIA,60-69,FVG,ITH4
52,Friuli-Venezia Giulia,TML_CAT_OSS,05/01/2021_PF/BT_FVG_201010_CATTINARA_60-69,1 - Operatori Sanitari e Sociosanitari,06,2021-01-05,PF/BT,201010_CATTINARA,60-69,FVG,ITH4
37,Friuli-Venezia Giulia,TML_CAT_OSS,05/01/2021_PF/BT_FVG_220101_TOLMEZZO_60-69,1 - Operatori Sanitari e Sociosanitari,06,2021-01-05,PF/BT,220101_TOLMEZZO,60-69,FVG,ITH4
4,Friuli-Venezia Giulia,TML_CAT_OSS,05/01/2021_PF/BT_FVG_117510_SANTA MARIA DEGLI ANGELI_70-79,1 - Operatori Sanitari e Sociosanitari,06,2021-01-05,PF/BT,117510_SANTA MARIA DEGLI ANGELI,70-79,FVG,ITH4
9,Friuli-Venezia Giulia,TML_CAT_OSS,05/01/2021_PF/BT_FVG_14VP13_SANTA MARIA DELLA MISERICORDIA_70-79,1 - Operatori Sanitari e Sociosanitari,06,2021-01-05,PF/BT,14VP13_SANTA MARIA DELLA MISERICORDIA,70-79,FVG,ITH4
23,Friuli-Venezia Giulia,TML_CAT_OSS,05/01/2021_PF/BT_FVG_201010_CATTINARA_70-79,1 - Operatori Sanitari e Sociosanitari,06,2021-01-05,PF/BT,201010_CATTINARA,70-79,FVG,ITH4
7,Friuli-Venezia Giulia,TML_CAT_OSS,05/01/2021_PF/BT_FVG_220101_TOLMEZZO_70-79,1 - Operatori Sanitari e Sociosanitari,06,2021-01-05,PF/BT,220101_TOLMEZZO,70-79,FVG,ITH4
2,Friuli-Venezia Giulia,TML_CAT_OSS,05/01/2021_PF/BT_FVG_201010_CATTINARA_80-89,1 - Operatori Sanitari e Sociosanitari,06,2021-01-05,PF/BT,201010_CATTINARA,80-89,FVG,ITH4
1,Friuli-Venezia Giulia,TML_CAT_OSS,05/01/2021_PF/BT_FVG_220101_TOLMEZZO_80-89,1 - Operatori Sanitari e Sociosanitari,06,2021-01-05,PF/BT,220101_TOLMEZZO,80-89,FVG,ITH4
3,Friuli-Venezia Giulia,TML_CAT_PERSONALE,05/01/2021_PF/BT_FVG_117510_SANTA MARIA DEGLI ANGELI_20-29,2 - Personale non Sanitario,06,2021-01-05,PF/BT,117510_SANTA MARIA DEGLI ANGELI,20-29,FVG,ITH4
6,Friuli-Venezia Giulia,TML_CAT_ALTRO,05/01/2021_PF/BT_FVG_117510_SANTA MARIA DEGLI ANGELI_20-29,2 - Personale non Sanitario,06,2021-01-05,PF/BT,117510_SANTA MARIA DEGLI ANGELI,20-29,FVG,ITH4
6,Friuli-Venezia Giulia,TML_CAT_ALTRO,05/01/2021_PF/BT_FVG_14VP13_SANTA MARIA DELLA MISERICORDIA_20-29,2 - Personale non Sanitario,06,2021-01-05,PF/BT,14VP13_SANTA MARIA DELLA MISERICORDIA,20-29,FVG,ITH4
6,Friuli-Venezia Giulia,TML_CAT_PERSONALE,05/01/2021_PF/BT_FVG_201010_CATTINARA_20-29,2 - Personale non Sanitario,06,2021-01-05,PF/BT,201010_CATTINARA,20-29,FVG,ITH4
45,Friuli-Venezia Giulia,TML_CAT_ALTRO,05/01/2021_PF/BT_FVG_201010_CATTINARA_20-29,2 - Personale non Sanitario,06,2021-01-05,PF/BT,201010_CATTINARA,20-29,FVG,ITH4
1,Friuli-Venezia Giulia,TML_CAT_PERSONALE,05/01/2021_PF/BT_FVG_220101_TOLMEZZO_20-29,2 - Personale non Sanitario,06,2021-01-05,PF/BT,220101_TOLMEZZO,20-29,FVG,ITH4
2,Friuli-Venezia Giulia,TML_CAT_ALTRO,05/01/2021_PF/BT_FVG_220101_TOLMEZZO_20-29,2 - Personale non Sanitario,06,2021-01-05,PF/BT,220101_TOLMEZZO,20-29,FVG,ITH4
1,Friuli-Venezia Giulia,TML_CAT_ALTRO,05/01/2021_PF/BT_FVG_117510_SANTA MARIA DEGLI ANGELI_30-39,2 - Personale non Sanitario,06,2021-01-05,PF/BT,117510_SANTA MARIA DEGLI ANGELI,30-39,FVG,ITH4
3,Friuli-Venezia Giulia,TML_CAT_PERSONALE,05/01/2021_PF/BT_FVG_117510_SANTA MARIA DEGLI ANGELI_30-39,2 - Personale non Sanitario,06,2021-01-05,PF/BT,117510_SANTA MARIA DEGLI ANGELI,30-39,FVG,ITH4
2,Friuli-Venezia Giulia,TML_CAT_ALTRO,05/01/2021_PF/BT_FVG_14VP13_SANTA MARIA DELLA MISERICORDIA_30-39,2 - Personale non Sanitario,06,2021-01-05,PF/BT,14VP13_SANTA MARIA DELLA MISERICORDIA,30-39,FVG,ITH4
3,Friuli-Venezia Giulia,TML_CAT_PERSONALE,05/01/2021_PF/BT_FVG_14VP13_SANTA MARIA DELLA MISERICORDIA_30-39,2 - Personale non Sanitario,06,2021-01-05,PF/BT,14VP13_SANTA MARIA DELLA MISERICORDIA,30-39,FVG,ITH4
7,Friuli-Venezia Giulia,TML_CAT_ALTRO,05/01/2021_PF/BT_FVG_201010_CATTINARA_30-39,2 - Personale non Sanitario,06,2021-01-05,PF/BT,201010_CATTINARA,30-39,FVG,ITH4
7,Friuli-Venezia Giulia,TML_CAT_PERSONALE,05/01/2021_PF/BT_FVG_201010_CATTINARA_30-39,2 - Personale non Sanitario,06,2021-01-05,PF/BT,201010_CATTINARA,30-39,FVG,ITH4
1,Friuli-Venezia Giulia,TML_CAT_ALTRO,05/01/2021_PF/BT_FVG_220101_TOLMEZZO_30-39,2 - Personale non Sanitario,06,2021-01-05,PF/BT,220101_TOLMEZZO,30-39,FVG,ITH4
1,Friuli-Venezia Giulia,TML_CAT_PERSONALE,05/01/2021_PF/BT_FVG_220101_TOLMEZZO_30-39,2 - Personale non Sanitario,06,2021-01-05,PF/BT,220101_TOLMEZZO,30-39,FVG,ITH4
6,Friuli-Venezia Giulia,TML_CAT_PERSONALE,05/01/2021_PF/BT_FVG_117510_SANTA MARIA DEGLI ANGELI_40-49,2 - Personale non Sanitario,06,2021-01-05,PF/BT,117510_SANTA MARIA DEGLI ANGELI,40-49,FVG,ITH4
10,Friuli-Venezia Giulia,TML_CAT_PERSONALE,05/01/2021_PF/BT_FVG_14VP13_SANTA MARIA DELLA MISERICORDIA_40-49,2 - Personale non Sanitario,06,2021-01-05,PF/BT,14VP13_SANTA MARIA DELLA MISERICORDIA,40-49,FVG,ITH4
21,Friuli-Venezia Giulia,TML_CAT_PERSONALE,05/01/2021_PF/BT_FVG_201010_CATTINARA_40-49,2 - Personale non Sanitario,06,2021-01-05,PF/BT,201010_CATTINARA,40-49,FVG,ITH4
2,Friuli-Venezia Giulia,TML_CAT_PERSONALE,05/01/2021_PF/BT_FVG_220101_TOLMEZZO_40-49,2 - Personale non Sanitario,06,2021-01-05,PF/BT,220101_TOLMEZZO,40-49,FVG,ITH4
10,Friuli-Venezia Giulia,TML_CAT_PERSONALE,05/01/2021_PF/BT_FVG_117510_SANTA MARIA DEGLI ANGELI_50-59,2 - Personale non Sanitario,06,2021-01-05,PF/BT,117510_SANTA MARIA DEGLI ANGELI,50-59,FVG,ITH4
5,Friuli-Venezia Giulia,TML_CAT_PERSONALE,05/01/2021_PF/BT_FVG_14VP13_SANTA MARIA DELLA MISERICORDIA_50-59,2 - Personale non Sanitario,06,2021-01-05,PF/BT,14VP13_SANTA MARIA DELLA MISERICORDIA,50-59,FVG,ITH4
29,Friuli-Venezia Giulia,TML_CAT_PERSONALE,05/01/2021_PF/BT_FVG_201010_CATTINARA_50-59,2 - Personale non Sanitario,06,2021-01-05,PF/BT,201010_CATTINARA,50-59,FVG,ITH4
5,Friuli-Venezia Giulia,TML_CAT_PERSONALE,05/01/2021_PF/BT_FVG_220101_TOLMEZZO_50-59,2 - Personale non Sanitario,06,2021-01-05,PF/BT,220101_TOLMEZZO,50-59,FVG,ITH4
4,Friuli-Venezia Giulia,TML_CAT_PERSONALE,05/01/2021_PF/BT_FVG_117510_SANTA MARIA DEGLI ANGELI_60-69,2 - Personale non Sanitario,06,2021-01-05,PF/BT,117510_SANTA MARIA DEGLI ANGELI,60-69,FVG,ITH4
2,Friuli-Venezia Giulia,TML_CAT_PERSONALE,05/01/2021_PF/BT_FVG_14VP13_SANTA MARIA DELLA MISERICORDIA_60-69,2 - Personale non Sanitario,06,2021-01-05,PF/BT,14VP13_SANTA MARIA DELLA MISERICORDIA,60-69,FVG,ITH4
11,Friuli-Venezia Giulia,TML_CAT_PERSONALE,05/01/2021_PF/BT_FVG_201010_CATTINARA_60-69,2 - Personale non Sanitario,06,2021-01-05,PF/BT,201010_CATTINARA,60-69,FVG,ITH4
1,Friuli-Venezia Giulia,TML_CAT_PERSONALE,05/01/2021_PF/BT_FVG_220101_TOLMEZZO_60-69,2 - Personale non Sanitario,06,2021-01-05,PF/BT,220101_TOLMEZZO,60-69,FVG,ITH4
1,Friuli-Venezia Giulia,TML_CAT_PERSONALE,05/01/2021_PF/BT_FVG_201010_CATTINARA_70-79,2 - Personale non Sanitario,06,2021-01-05,PF/BT,201010_CATTINARA,70-79,FVG,ITH4
1,Friuli-Venezia Giulia,TML_CAT_PERSONALE,05/01/2021_PF/BT_FVG_220101_TOLMEZZO_70-79,2 - Personale non Sanitario,06,2021-01-05,PF/BT,220101_TOLMEZZO,70-79,FVG,ITH4
1,Friuli-Venezia Giulia,TML_CAT_PERSONALE,05/01/2021_PF/BT_FVG_220101_TOLMEZZO_80-89,2 - Personale non Sanitario,06,2021-01-05,PF/BT,220101_TOLMEZZO,80-89,FVG,ITH4
1,Friuli-Venezia Giulia,TML_CAT_RSA_OSPITI,05/01/2021_PF/BT_FVG_9A0041_CASA SERENA PORDENONE_40-49,3 - Ospiti Strutture Residenziali,06,2021-01-05,PF/BT,9A0041_CASA SERENA PORDENONE,40-49,FVG,ITH4
4,Friuli-Venezia Giulia,TML_CAT_RSA_OSPITI,05/01/2021_PF/BT_FVG_9A0041_CASA SERENA PORDENONE_50-59,3 - Ospiti Strutture Residenziali,06,2021-01-05,PF/BT,9A0041_CASA SERENA PORDENONE,50-59,FVG,ITH4
7,Friuli-Venezia Giulia,TML_CAT_RSA_OSPITI,05/01/2021_PF/BT_FVG_9A0041_CASA SERENA PORDENONE_60-69,3 - Ospiti Strutture Residenziali,06,2021-01-05,PF/BT,9A0041_CASA SERENA PORDENONE,60-69,FVG,ITH4
1,Friuli-Venezia Giulia,TML_CAT_RSA_OSPITI,05/01/2021_PF/BT_FVG_9C0040_FONDAZ. C. DI RIP. CORDENONS_60-69,3 - Ospiti Strutture Residenziali,06,2021-01-05,PF/BT,9C0040_FONDAZ. C. DI RIP. CORDENONS,60-69,FVG,ITH4
1,Friuli-Venezia Giulia,TML_CAT_RSA_OSPITI,05/01/2021_PF/BT_FVG_117510_SANTA MARIA DEGLI ANGELI_70-79,3 - Ospiti Strutture Residenziali,06,2021-01-05,PF/BT,117510_SANTA MARIA DEGLI ANGELI,70-79,FVG,ITH4
25,Friuli-Venezia Giulia,TML_CAT_RSA_OSPITI,05/01/2021_PF/BT_FVG_9A0041_CASA SERENA PORDENONE_70-79,3 - Ospiti Strutture Residenziali,06,2021-01-05,PF/BT,9A0041_CASA SERENA PORDENONE,70-79,FVG,ITH4
5,Friuli-Venezia Giulia,TML_CAT_RSA_OSPITI,05/01/2021_PF/BT_FVG_9C0040_FONDAZ. C. DI RIP. CORDENONS_70-79,3 - Ospiti Strutture Residenziali,06,2021-01-05,PF/BT,9C0040_FONDAZ. C. DI RIP. CORDENONS,70-79,FVG,ITH4
1,Friuli-Venezia Giulia,TML_CAT_RSA_OSPITI,05/01/2021_PF/BT_FVG_117510_SANTA MARIA DEGLI ANGELI_80-89,3 - Ospiti Strutture Residenziali,06,2021-01-05,PF/BT,117510_SANTA MARIA DEGLI ANGELI,80-89,FVG,ITH4
61,Friuli-Venezia Giulia,TML_CAT_RSA_OSPITI,05/01/2021_PF/BT_FVG_9A0041_CASA SERENA PORDENONE_80-89,3 - Ospiti Strutture Residenziali,06,2021-01-05,PF/BT,9A0041_CASA SERENA PORDENONE,80-89,FVG,ITH4
14,Friuli-Venezia Giulia,TML_CAT_RSA_OSPITI,05/01/2021_PF/BT_FVG_9C0040_FONDAZ. C. DI RIP. CORDENONS_80-89,3 - Ospiti Strutture Residenziali,06,2021-01-05,PF/BT,9C0040_FONDAZ. C. DI RIP. CORDENONS,80-89,FVG,ITH4
1,Friuli-Venezia Giulia,TML_CAT_RSA_OSPITI,05/01/2021_PF/BT_FVG_117510_SANTA MARIA DEGLI ANGELI_90+,3 - Ospiti Strutture Residenziali,06,2021-01-05,PF/BT,117510_SANTA MARIA DEGLI ANGELI,90+,FVG,ITH4
68,Friuli-Venezia Giulia,TML_CAT_RSA_OSPITI,05/01/2021_PF/BT_FVG_9A0041_CASA SERENA PORDENONE_90+,3 - Ospiti Strutture Residenziali,06,2021-01-05,PF/BT,9A0041_CASA SERENA PORDENONE,90+,FVG,ITH4
9,Friuli-Venezia Giulia,TML_CAT_RSA_OSPITI,05/01/2021_PF/BT_FVG_9C0040_FONDAZ. C. DI RIP. CORDENONS_90+,3 - Ospiti Strutture Residenziali,06,2021-01-05,PF/BT,9C0040_FONDAZ. C. DI RIP. CORDENONS,90+,FVG,ITH4
41,Friuli-Venezia Giulia,TML_CAT_OSS,06/01/2021_PF/BT_FVG_14VP13_SANTA MARIA DELLA MISERICORDIA_20-29,1 - Operatori Sanitari e Sociosanitari,06,2021-01-06,PF/BT,14VP13_SANTA MARIA DELLA MISERICORDIA,20-29,FVG,ITH4
31,Friuli-Venezia Giulia,TML_CAT_OSS,06/01/2021_PF/BT_FVG_201010_CATTINARA_20-29,1 - Operatori Sanitari e Sociosanitari,06,2021-01-06,PF/BT,201010_CATTINARA,20-29,FVG,ITH4
40,Friuli-Venezia Giulia,TML_CAT_OSS,06/01/2021_PF/BT_FVG_14VP13_SANTA MARIA DELLA MISERICORDIA_30-39,1 - Operatori Sanitari e Sociosanitari,06,2021-01-06,PF/BT,14VP13_SANTA MARIA DELLA MISERICORDIA,30-39,FVG,ITH4
45,Friuli-Venezia Giulia,TML_CAT_OSS,06/01/2021_PF/BT_FVG_201010_CATTINARA_30-39,1 - Operatori Sanitari e Sociosanitari,06,2021-01-06,PF/BT,201010_CATTINARA,30-39,FVG,ITH4
49,Friuli-Venezia Giulia,TML_CAT_OSS,06/01/2021_PF/BT_FVG_14VP13_SANTA MARIA DELLA MISERICORDIA_40-49,1 - Operatori Sanitari e Sociosanitari,06,2021-01-06,PF/BT,14VP13_SANTA MARIA DELLA MISERICORDIA,40-49,FVG,ITH4
44,Friuli-Venezia Giulia,TML_CAT_OSS,06/01/2021_PF/BT_FVG_201010_CATTINARA_40-49,1 - Operatori Sanitari e Sociosanitari,06,2021-01-06,PF/BT,201010_CATTINARA,40-49,FVG,ITH4
61,Friuli-Venezia Giulia,TML_CAT_OSS,06/01/2021_PF/BT_FVG_14VP13_SANTA MARIA DELLA MISERICORDIA_50-59,1 - Operatori Sanitari e Sociosanitari,06,2021-01-06,PF/BT,14VP13_SANTA MARIA DELLA MISERICORDIA,50-59,FVG,ITH4
40,Friuli-Venezia Giulia,TML_CAT_OSS,06/01/2021_PF/BT_FVG_201010_CATTINARA_50-59,1 - Operatori Sanitari e Sociosanitari,06,2021-01-06,PF/BT,201010_CATTINARA,50-59,FVG,ITH4
33,Friuli-Venezia Giulia,TML_CAT_OSS,06/01/2021_PF/BT_FVG_14VP13_SANTA MARIA DELLA MISERICORDIA_60-69,1 - Operatori Sanitari e Sociosanitari,06,2021-01-06,PF/BT,14VP13_SANTA MARIA DELLA MISERICORDIA,60-69,FVG,ITH4
33,Friuli-Venezia Giulia,TML_CAT_OSS,06/01/2021_PF/BT_FVG_201010_CATTINARA_60-69,1 - Operatori Sanitari e Sociosanitari,06,2021-01-06,PF/BT,201010_CATTINARA,60-69,FVG,ITH4
6,Friuli-Venezia Giulia,TML_CAT_OSS,06/01/2021_PF/BT_FVG_14VP13_SANTA MARIA DELLA MISERICORDIA_70-79,1 - Operatori Sanitari e Sociosanitari,06,2021-01-06,PF/BT,14VP13_SANTA MARIA DELLA MISERICORDIA,70-79,FVG,ITH4
18,Friuli-Venezia Giulia,TML_CAT_OSS,06/01/2021_PF/BT_FVG_201010_CATTINARA_70-79,1 - Operatori Sanitari e Sociosanitari,06,2021-01-06,PF/BT,201010_CATTINARA,70-79,FVG,ITH4
2,Friuli-Venezia Giulia,TML_CAT_OSS,06/01/2021_PF/BT_FVG_201010_CATTINARA_80-89,1 - Operatori Sanitari e Sociosanitari,06,2021-01-06,PF/BT,201010_CATTINARA,80-89,FVG,ITH4
1,Friuli-Venezia Giulia,TML_CAT_OSS,06/01/2021_PF/BT_FVG_201010_CATTINARA_90+,1 - Operatori Sanitari e Sociosanitari,06,2021-01-06,PF/BT,201010_CATTINARA,90+,FVG,ITH4
1,Friuli-Venezia Giulia,TML_CAT_ALTRO,06/01/2021_PF/BT_FVG_201010_CATTINARA_16-19,2 - Personale non Sanitario,06,2021-01-06,PF/BT,201010_CATTINARA,16-19,FVG,ITH4
6,Friuli-Venezia Giulia,TML_CAT_PERSONALE,06/01/2021_PF/BT_FVG_14VP13_SANTA MARIA DELLA MISERICORDIA_20-29,2 - Personale non Sanitario,06,2021-01-06,PF/BT,14VP13_SANTA MARIA DELLA MISERICORDIA,20-29,FVG,ITH4
14,Friuli-Venezia Giulia,TML_CAT_ALTRO,06/01/2021_PF/BT_FVG_14VP13_SANTA MARIA DELLA MISERICORDIA_20-29,2 - Personale non Sanitario,06,2021-01-06,PF/BT,14VP13_SANTA MARIA DELLA MISERICORDIA,20-29,FVG,ITH4
2,Friuli-Venezia Giulia,TML_CAT_PERSONALE,06/01/2021_PF/BT_FVG_201010_CATTINARA_20-29,2 - Personale non Sanitario,06,2021-01-06,PF/BT,201010_CATTINARA,20-29,FVG,ITH4
1,Friuli-Venezia Giulia,TML_CAT_ALTRO,06/01/2021_PF/BT_FVG_14VP13_SANTA MARIA DELLA MISERICORDIA_30-39,2 - Personale non Sanitario,06,2021-01-06,PF/BT,14VP13_SANTA MARIA DELLA MISERICORDIA,30-39,FVG,ITH4
16,Friuli-Venezia Giulia,TML_CAT_PERSONALE,06/01/2021_PF/BT_FVG_14VP13_SANTA MARIA DELLA MISERICORDIA_30-39,2 - Personale non Sanitario,06,2021-01-06,PF/BT,14VP13_SANTA MARIA DELLA MISERICORDIA,30-39,FVG,ITH4
4,Friuli-Venezia Giulia,TML_CAT_PERSONALE,06/01/2021_PF/BT_FVG_201010_CATTINARA_30-39,2 - Personale non Sanitario,06,2021-01-06,PF/BT,201010_CATTINARA,30-39,FVG,ITH4
8,Friuli-Venezia Giulia,TML_CAT_ALTRO,06/01/2021_PF/BT_FVG_201010_CATTINARA_30-39,2 - Personale non Sanitario,06,2021-01-06,PF/BT,201010_CATTINARA,30-39,FVG,ITH4
1,Friuli-Venezia Giulia,TML_CAT_ALTRO,06/01/2021_PF/BT_FVG_14VP13_SANTA MARIA DELLA MISERICORDIA_40-49,2 - Personale non Sanitario,06,2021-01-06,PF/BT,14VP13_SANTA MARIA DELLA MISERICORDIA,40-49,FVG,ITH4
47,Friuli-Venezia Giulia,TML_CAT_PERSONALE,06/01/2021_PF/BT_FVG_14VP13_SANTA MARIA DELLA MISERICORDIA_40-49,2 - Personale non Sanitario,06,2021-01-06,PF/BT,14VP13_SANTA MARIA DELLA MISERICORDIA,40-49,FVG,ITH4
2,Friuli-Venezia Giulia,TML_CAT_ALTRO,06/01/2021_PF/BT_FVG_201010_CATTINARA_40-49,2 - Personale non Sanitario,06,2021-01-06,PF/BT,201010_CATTINARA,40-49,FVG,ITH4
15,Friuli-Venezia Giulia,TML_CAT_PERSONALE,06/01/2021_PF/BT_FVG_201010_CATTINARA_40-49,2 - Personale non Sanitario,06,2021-01-06,PF/BT,201010_CATTINARA,40-49,FVG,ITH4
49,Friuli-Venezia Giulia,TML_CAT_PERSONALE,06/01/2021_PF/BT_FVG_14VP13_SANTA MARIA DELLA MISERICORDIA_50-59,2 - Personale non Sanitario,06,2021-01-06,PF/BT,14VP13_SANTA MARIA DELLA MISERICORDIA,50-59,FVG,ITH4
1,Friuli-Venezia Giulia,TML_CAT_ALTRO,06/01/2021_PF/BT_FVG_201010_CATTINARA_50-59,2 - Personale non Sanitario,06,2021-01-06,PF/BT,201010_CATTINARA,50-59,FVG,ITH4
25,Friuli-Venezia Giulia,TML_CAT_PERSONALE,06/01/2021_PF/BT_FVG_201010_CATTINARA_50-59,2 - Personale non Sanitario,06,2021-01-06,PF/BT,201010_CATTINARA,50-59,FVG,ITH4
11,Friuli-Venezia Giulia,TML_CAT_PERSONALE,06/01/2021_PF/BT_FVG_14VP13_SANTA MARIA DELLA MISERICORDIA_60-69,2 - Personale non Sanitario,06,2021-01-06,PF/BT,14VP13_SANTA MARIA DELLA MISERICORDIA,60-69,FVG,ITH4
14,Friuli-Venezia Giulia,TML_CAT_PERSONALE,06/01/2021_PF/BT_FVG_201010_CATTINARA_60-69,2 - Personale non Sanitario,06,2021-01-06,PF/BT,201010_CATTINARA,60-69,FVG,ITH4
2,Friuli-Venezia Giulia,TML_CAT_PERSONALE,06/01/2021_PF/BT_FVG_14VP13_SANTA MARIA DELLA MISERICORDIA_70-79,2 - Personale non Sanitario,06,2021-01-06,PF/BT,14VP13_SANTA MARIA DELLA MISERICORDIA,70-79,FVG,ITH4
3,Friuli-Venezia Giulia,TML_CAT_PERSONALE,06/01/2021_PF/BT_FVG_201010_CATTINARA_70-79,2 - Personale non Sanitario,06,2021-01-06,PF/BT,201010_CATTINARA,70-79,FVG,ITH4
1,Friuli-Venezia Giulia,TML_CAT_PERSONALE,06/01/2021_PF/BT_FVG_201010_CATTINARA_80-89,2 - Personale non Sanitario,06,2021-01-06,PF/BT,201010_CATTINARA,80-89,FVG,ITH4
32,Friuli-Venezia Giulia,TML_CAT_OSS,07/01/2021_PF/BT_FVG_117510_SANTA MARIA DEGLI ANGELI_20-29,1 - Operatori Sanitari e Sociosanitari,06,2021-01-07,PF/BT,117510_SANTA MARIA DEGLI ANGELI,20-29,FVG,ITH4
20,Friuli-Venezia Giulia,TML_CAT_OSS,07/01/2021_PF/BT_FVG_12M810_MONFALCONE_20-29,1 - Operatori Sanitari e Sociosanitari,06,2021-01-07,PF/BT,12M810_MONFALCONE,20-29,FVG,ITH4
56,Friuli-Venezia Giulia,TML_CAT_OSS,07/01/2021_PF/BT_FVG_14VP13_SANTA MARIA DELLA MISERICORDIA_20-29,1 - Operatori Sanitari e Sociosanitari,06,2021-01-07,PF/BT,14VP13_SANTA MARIA DELLA MISERICORDIA,20-29,FVG,ITH4
69,Friuli-Venezia Giulia,TML_CAT_OSS,07/01/2021_PF/BT_FVG_201010_CATTINARA_20-29,1 - Operatori Sanitari e Sociosanitari,06,2021-01-07,PF/BT,201010_CATTINARA,20-29,FVG,ITH4
19,Friuli-Venezia Giulia,TML_CAT_OSS,07/01/2021_PF/BT_FVG_220101_TOLMEZZO_20-29,1 - Operatori Sanitari e Sociosanitari,06,2021-01-07,PF/BT,220101_TOLMEZZO,20-29,FVG,ITH4
69,Friuli-Venezia Giulia,TML_CAT_OSS,07/01/2021_PF/BT_FVG_117510_SANTA MARIA DEGLI ANGELI_30-39,1 - Operatori Sanitari e Sociosanitari,06,2021-01-07,PF/BT,117510_SANTA MARIA DEGLI ANGELI,30-39,FVG,ITH4
23,Friuli-Venezia Giulia,TML_CAT_OSS,07/01/2021_PF/BT_FVG_12M810_MONFALCONE_30-39,1 - Operatori Sanitari e Sociosanitari,06,2021-01-07,PF/BT,12M810_MONFALCONE,30-39,FVG,ITH4
87,Friuli-Venezia Giulia,TML_CAT_OSS,07/01/2021_PF/BT_FVG_14VP13_SANTA MARIA DELLA MISERICORDIA_30-39,1 - Operatori Sanitari e Sociosanitari,06,2021-01-07,PF/BT,14VP13_SANTA MARIA DELLA MISERICORDIA,30-39,FVG,ITH4
110,Friuli-Venezia Giulia,TML_CAT_OSS,07/01/2021_PF/BT_FVG_201010_CATTINARA_30-39,1 - Operatori Sanitari e Sociosanitari,06,2021-01-07,PF/BT,201010_CATTINARA,30-39,FVG,ITH4
34,Friuli-Venezia Giulia,TML_CAT_OSS,07/01/2021_PF/BT_FVG_220101_TOLMEZZO_30-39,1 - Operatori Sanitari e Sociosanitari,06,2021-01-07,PF/BT,220101_TOLMEZZO,30-39,FVG,ITH4
75,Friuli-Venezia Giulia,TML_CAT_OSS,07/01/2021_PF/BT_FVG_117510_SANTA MARIA DEGLI ANGELI_40-49,1 - Operatori Sanitari e Sociosanitari,06,2021-01-07,PF/BT,117510_SANTA MARIA DEGLI ANGELI,40-49,FVG,ITH4
44,Friuli-Venezia Giulia,TML_CAT_OSS,07/01/2021_PF/BT_FVG_12M810_MONFALCONE_40-49,1 - Operatori Sanitari e Sociosanitari,06,2021-01-07,PF/BT,12M810_MONFALCONE,40-49,FVG,ITH4
132,Friuli-Venezia Giulia,TML_CAT_OSS,07/01/2021_PF/BT_FVG_14VP13_SANTA MARIA DELLA MISERICORDIA_40-49,1 - Operatori Sanitari e Sociosanitari,06,2021-01-07,PF/BT,14VP13_SANTA MARIA DELLA MISERICORDIA,40-49,FVG,ITH4
118,Friuli-Venezia Giulia,TML_CAT_OSS,07/01/2021_PF/BT_FVG_201010_CATTINARA_40-49,1 - Operatori Sanitari e Sociosanitari,06,2021-01-07,PF/BT,201010_CATTINARA,40-49,FVG,ITH4
49,Friuli-Venezia Giulia,TML_CAT_OSS,07/01/2021_PF/BT_FVG_220101_TOLMEZZO_40-49,1 - Operatori Sanitari e Sociosanitari,06,2021-01-07,PF/BT,220101_TOLMEZZO,40-49,FVG,ITH4
91,Friuli-Venezia Giulia,TML_CAT_OSS,07/01/2021_PF/BT_FVG_117510_SANTA MARIA DEGLI ANGELI_50-59,1 - Operatori Sanitari e Sociosanitari,06,2021-01-07,PF/BT,117510_SANTA MARIA DEGLI ANGELI,50-59,FVG,ITH4
73,Friuli-Venezia Giulia,TML_CAT_OSS,07/01/2021_PF/BT_FVG_12M810_MONFALCONE_50-59,1 - Operatori Sanitari e Sociosanitari,06,2021-01-07,PF/BT,12M810_MONFALCONE,50-59,FVG,ITH4
138,Friuli-Venezia Giulia,TML_CAT_OSS,07/01/2021_PF/BT_FVG_14VP13_SANTA MARIA DELLA MISERICORDIA_50-59,1 - Operatori Sanitari e Sociosanitari,06,2021-01-07,PF/BT,14VP13_SANTA MARIA DELLA MISERICORDIA,50-59,FVG,ITH4
117,Friuli-Venezia Giulia,TML_CAT_OSS,07/01/2021_PF/BT_FVG_201010_CATTINARA_50-59,1 - Operatori Sanitari e Sociosanitari,06,2021-01-07,PF/BT,201010_CATTINARA,50-59,FVG,ITH4
60,Friuli-Venezia Giulia,TML_CAT_OSS,07/01/2021_PF/BT_FVG_220101_TOLMEZZO_50-59,1 - Operatori Sanitari e Sociosanitari,06,2021-01-07,PF/BT,220101_TOLMEZZO,50-59,FVG,ITH4
41,Friuli-Venezia Giulia,TML_CAT_OSS,07/01/2021_PF/BT_FVG_117510_SANTA MARIA DEGLI ANGELI_60-69,1 - Operatori Sanitari e Sociosanitari,06,2021-01-07,PF/BT,117510_SANTA MARIA DEGLI ANGELI,60-69,FVG,ITH4
37,Friuli-Venezia Giulia,TML_CAT_OSS,07/01/2021_PF/BT_FVG_12M810_MONFALCONE_60-69,1 - Operatori Sanitari e Sociosanitari,06,2021-01-07,PF/BT,12M810_MONFALCONE,60-69,FVG,ITH4
66,Friuli-Venezia Giulia,TML_CAT_OSS,07/01/2021_PF/BT_FVG_14VP13_SANTA MARIA DELLA MISERICORDIA_60-69,1 - Operatori Sanitari e Sociosanitari,06,2021-01-07,PF/BT,14VP13_SANTA MARIA DELLA MISERICORDIA,60-69,FVG,ITH4
47,Friuli-Venezia Giulia,TML_CAT_OSS,07/01/2021_PF/BT_FVG_201010_CATTINARA_60-69,1 - Operatori Sanitari e Sociosanitari,06,2021-01-07,PF/BT,201010_CATTINARA,60-69,FVG,ITH4
24,Friuli-Venezia Giulia,TML_CAT_OSS,07/01/2021_PF/BT_FVG_220101_TOLMEZZO_60-69,1 - Operatori Sanitari e Sociosanitari,06,2021-01-07,PF/BT,220101_TOLMEZZO,60-69,FVG,ITH4
6,Friuli-Venezia Giulia,TML_CAT_OSS,07/01/2021_PF/BT_FVG_117510_SANTA MARIA DEGLI ANGELI_70-79,1 - Operatori Sanitari e Sociosanitari,06,2021-01-07,PF/BT,117510_SANTA MARIA DEGLI ANGELI,70-79,FVG,ITH4
5,Friuli-Venezia Giulia,TML_CAT_OSS,07/01/2021_PF/BT_FVG_12M810_MONFALCONE_70-79,1 - Operatori Sanitari e Sociosanitari,06,2021-01-07,PF/BT,12M810_MONFALCONE,70-79,FVG,ITH4
8,Friuli-Venezia Giulia,TML_CAT_OSS,07/01/2021_PF/BT_FVG_14VP13_SANTA MARIA DELLA MISERICORDIA_70-79,1 - Operatori Sanitari e Sociosanitari,06,2021-01-07,PF/BT,14VP13_SANTA MARIA DELLA MISERICORDIA,70-79,FVG,ITH4
8,Friuli-Venezia Giulia,TML_CAT_OSS,07/01/2021_PF/BT_FVG_201010_CATTINARA_70-79,1 - Operatori Sanitari e Sociosanitari,06,2021-01-07,PF/BT,201010_CATTINARA,70-79,FVG,ITH4
3,Friuli-Venezia Giulia,TML_CAT_OSS,07/01/2021_PF/BT_FVG_220101_TOLMEZZO_70-79,1 - Operatori Sanitari e Sociosanitari,06,2021-01-07,PF/BT,220101_TOLMEZZO,70-79,FVG,ITH4
1,Friuli-Venezia Giulia,TML_CAT_OSS,07/01/2021_PF/BT_FVG_117510_SANTA MARIA DEGLI ANGELI_80-89,1 - Operatori Sanitari e Sociosanitari,06,2021-01-07,PF/BT,117510_SANTA MARIA DEGLI ANGELI,80-89,FVG,ITH4
1,Friuli-Venezia Giulia,TML_CAT_OSS,07/01/2021_PF/BT_FVG_12M810_MONFALCONE_80-89,1 - Operatori Sanitari e Sociosanitari,06,2021-01-07,PF/BT,12M810_MONFALCONE,80-89,FVG,ITH4
2,Friuli-Venezia Giulia,TML_CAT_OSS,07/01/2021_PF/BT_FVG_14VP13_SANTA MARIA DELLA MISERICORDIA_80-89,1 - Operatori Sanitari e Sociosanitari,06,2021-01-07,PF/BT,14VP13_SANTA MARIA DELLA MISERICORDIA,80-89,FVG,ITH4
4,Friuli-Venezia Giulia,TML_CAT_OSS,07/01/2021_PF/BT_FVG_201010_CATTINARA_80-89,1 - Operatori Sanitari e Sociosanitari,06,2021-01-07,PF/BT,201010_CATTINARA,80-89,FVG,ITH4
2,Friuli-Venezia Giulia,TML_CAT_ALTRO,07/01/2021_PF/BT_FVG_12M810_MONFALCONE_16-19,2 - Personale non Sanitario,06,2021-01-07,PF/BT,12M810_MONFALCONE,16-19,FVG,ITH4
8,Friuli-Venezia Giulia,TML_CAT_ALTRO,07/01/2021_PF/BT_FVG_117510_SANTA MARIA DEGLI ANGELI_20-29,2 - Personale non Sanitario,06,2021-01-07,PF/BT,117510_SANTA MARIA DEGLI ANGELI,20-29,FVG,ITH4
1,Friuli-Venezia Giulia,TML_CAT_PERSONALE,07/01/2021_PF/BT_FVG_12M810_MONFALCONE_20-29,2 - Personale non Sanitario,06,2021-01-07,PF/BT,12M810_MONFALCONE,20-29,FVG,ITH4
4,Friuli-Venezia Giulia,TML_CAT_ALTRO,07/01/2021_PF/BT_FVG_12M810_MONFALCONE_20-29,2 - Personale non Sanitario,06,2021-01-07,PF/BT,12M810_MONFALCONE,20-29,FVG,ITH4
5,Friuli-Venezia Giulia,TML_CAT_PERSONALE,07/01/2021_PF/BT_FVG_14VP13_SANTA MARIA DELLA MISERICORDIA_20-29,2 - Personale non Sanitario,06,2021-01-07,PF/BT,14VP13_SANTA MARIA DELLA MISERICORDIA,20-29,FVG,ITH4
12,Friuli-Venezia Giulia,TML_CAT_ALTRO,07/01/2021_PF/BT_FVG_14VP13_SANTA MARIA DELLA MISERICORDIA_20-29,2 - Personale non Sanitario,06,2021-01-07,PF/BT,14VP13_SANTA MARIA DELLA MISERICORDIA,20-29,FVG,ITH4
7,Friuli-Venezia Giulia,TML_CAT_PERSONALE,07/01/2021_PF/BT_FVG_201010_CATTINARA_20-29,2 - Personale non Sanitario,06,2021-01-07,PF/BT,201010_CATTINARA,20-29,FVG,ITH4
38,Friuli-Venezia Giulia,TML_CAT_ALTRO,07/01/2021_PF/BT_FVG_201010_CATTINARA_20-29,2 - Personale non Sanitario,06,2021-01-07,PF/BT,201010_CATTINARA,20-29,FVG,ITH4
1,Friuli-Venezia Giulia,TML_CAT_PERSONALE,07/01/2021_PF/BT_FVG_220101_TOLMEZZO_20-29,2 - Personale non Sanitario,06,2021-01-07,PF/BT,220101_TOLMEZZO,20-29,FVG,ITH4
2,Friuli-Venezia Giulia,TML_CAT_ALTRO,07/01/2021_PF/BT_FVG_117510_SANTA MARIA DEGLI ANGELI_30-39,2 - Personale non Sanitario,06,2021-01-07,PF/BT,117510_SANTA MARIA DEGLI ANGELI,30-39,FVG,ITH4
5,Friuli-Venezia Giulia,TML_CAT_PERSONALE,07/01/2021_PF/BT_FVG_117510_SANTA MARIA DEGLI ANGELI_30-39,2 - Personale non Sanitario,06,2021-01-07,PF/BT,117510_SANTA MARIA DEGLI ANGELI,30-39,FVG,ITH4
2,Friuli-Venezia Giulia,TML_CAT_ALTRO,07/01/2021_PF/BT_FVG_12M810_MONFALCONE_30-39,2 - Personale non Sanitario,06,2021-01-07,PF/BT,12M810_MONFALCONE,30-39,FVG,ITH4
2,Friuli-Venezia Giulia,TML_CAT_PERSONALE,07/01/2021_PF/BT_FVG_12M810_MONFALCONE_30-39,2 - Personale non Sanitario,06,2021-01-07,PF/BT,12M810_MONFALCONE,30-39,FVG,ITH4
5,Friuli-Venezia Giulia,TML_CAT_PERSONALE,07/01/2021_PF/BT_FVG_14VP13_SANTA MARIA DELLA MISERICORDIA_30-39,2 - Personale non Sanitario,06,2021-01-07,PF/BT,14VP13_SANTA MARIA DELLA MISERICORDIA,30-39,FVG,ITH4
11,Friuli-Venezia Giulia,TML_CAT_ALTRO,07/01/2021_PF/BT_FVG_14VP13_SANTA MARIA DELLA MISERICORDIA_30-39,2 - Personale non Sanitario,06,2021-01-07,PF/BT,14VP13_SANTA MARIA DELLA MISERICORDIA,30-39,FVG,ITH4
7,Friuli-Venezia Giulia,TML_CAT_ALTRO,07/01/2021_PF/BT_FVG_201010_CATTINARA_30-39,2 - Personale non Sanitario,06,2021-01-07,PF/BT,201010_CATTINARA,30-39,FVG,ITH4
15,Friuli-Venezia Giulia,TML_CAT_PERSONALE,07/01/2021_PF/BT_FVG_201010_CATTINARA_30-39,2 - Personale non Sanitario,06,2021-01-07,PF/BT,201010_CATTINARA,30-39,FVG,ITH4
1,Friuli-Venezia Giulia,TML_CAT_ALTRO,07/01/2021_PF/BT_FVG_220101_TOLMEZZO_30-39,2 - Personale non Sanitario,06,2021-01-07,PF/BT,220101_TOLMEZZO,30-39,FVG,ITH4
3,Friuli-Venezia Giulia,TML_CAT_PERSONALE,07/01/2021_PF/BT_FVG_220101_TOLMEZZO_30-39,2 - Personale non Sanitario,06,2021-01-07,PF/BT,220101_TOLMEZZO,30-39,FVG,ITH4
14,Friuli-Venezia Giulia,TML_CAT_PERSONALE,07/01/2021_PF/BT_FVG_117510_SANTA MARIA DEGLI ANGELI_40-49,2 - Personale non Sanitario,06,2021-01-07,PF/BT,117510_SANTA MARIA DEGLI ANGELI,40-49,FVG,ITH4
9,Friuli-Venezia Giulia,TML_CAT_PERSONALE,07/01/2021_PF/BT_FVG_12M810_MONFALCONE_40-49,2 - Personale non Sanitario,06,2021-01-07,PF/BT,12M810_MONFALCONE,40-49,FVG,ITH4
2,Friuli-Venezia Giulia,TML_CAT_ALTRO,07/01/2021_PF/BT_FVG_14VP13_SANTA MARIA DELLA MISERICORDIA_40-49,2 - Personale non Sanitario,06,2021-01-07,PF/BT,14VP13_SANTA MARIA DELLA MISERICORDIA,40-49,FVG,ITH4
12,Friuli-Venezia Giulia,TML_CAT_PERSONALE,07/01/2021_PF/BT_FVG_14VP13_SANTA MARIA DELLA MISERICORDIA_40-49,2 - Personale non Sanitario,06,2021-01-07,PF/BT,14VP13_SANTA MARIA DELLA MISERICORDIA,40-49,FVG,ITH4
4,Friuli-Venezia Giulia,TML_CAT_ALTRO,07/01/2021_PF/BT_FVG_201010_CATTINARA_40-49,2 - Personale non Sanitario,06,2021-01-07,PF/BT,201010_CATTINARA,40-49,FVG,ITH4
19,Friuli-Venezia Giulia,TML_CAT_PERSONALE,07/01/2021_PF/BT_FVG_201010_CATTINARA_40-49,2 - Personale non Sanitario,06,2021-01-07,PF/BT,201010_CATTINARA,40-49,FVG,ITH4
2,Friuli-Venezia Giulia,TML_CAT_PERSONALE,07/01/2021_PF/BT_FVG_220101_TOLMEZZO_40-49,2 - Personale non Sanitario,06,2021-01-07,PF/BT,220101_TOLMEZZO,40-49,FVG,ITH4
17,Friuli-Venezia Giulia,TML_CAT_PERSONALE,07/01/2021_PF/BT_FVG_117510_SANTA MARIA DEGLI ANGELI_50-59,2 - Personale non Sanitario,06,2021-01-07,PF/BT,117510_SANTA MARIA DEGLI ANGELI,50-59,FVG,ITH4
9,Friuli-Venezia Giulia,TML_CAT_PERSONALE,07/01/2021_PF/BT_FVG_12M810_MONFALCONE_50-59,2 - Personale non Sanitario,06,2021-01-07,PF/BT,12M810_MONFALCONE,50-59,FVG,ITH4
24,Friuli-Venezia Giulia,TML_CAT_PERSONALE,07/01/2021_PF/BT_FVG_14VP13_SANTA MARIA DELLA MISERICORDIA_50-59,2 - Personale non Sanitario,06,2021-01-07,PF/BT,14VP13_SANTA MARIA DELLA MISERICORDIA,50-59,FVG,ITH4
23,Friuli-Venezia Giulia,TML_CAT_PERSONALE,07/01/2021_PF/BT_FVG_201010_CATTINARA_50-59,2 - Personale non Sanitario,06,2021-01-07,PF/BT,201010_CATTINARA,50-59,FVG,ITH4
10,Friuli-Venezia Giulia,TML_CAT_PERSONALE,07/01/2021_PF/BT_FVG_220101_TOLMEZZO_50-59,2 - Personale non Sanitario,06,2021-01-07,PF/BT,220101_TOLMEZZO,50-59,FVG,ITH4
11,Friuli-Venezia Giulia,TML_CAT_PERSONALE,07/01/2021_PF/BT_FVG_117510_SANTA MARIA DEGLI ANGELI_60-69,2 - Personale non Sanitario,06,2021-01-07,PF/BT,117510_SANTA MARIA DEGLI ANGELI,60-69,FVG,ITH4
7,Friuli-Venezia Giulia,TML_CAT_PERSONALE,07/01/2021_PF/BT_FVG_12M810_MONFALCONE_60-69,2 - Personale non Sanitario,06,2021-01-07,PF/BT,12M810_MONFALCONE,60-69,FVG,ITH4
6,Friuli-Venezia Giulia,TML_CAT_PERSONALE,07/01/2021_PF/BT_FVG_14VP13_SANTA MARIA DELLA MISERICORDIA_60-69,2 - Personale non Sanitario,06,2021-01-07,PF/BT,14VP13_SANTA MARIA DELLA MISERICORDIA,60-69,FVG,ITH4
5,Friuli-Venezia Giulia,TML_CAT_PERSONALE,07/01/2021_PF/BT_FVG_201010_CATTINARA_60-69,2 - Personale non Sanitario,06,2021-01-07,PF/BT,201010_CATTINARA,60-69,FVG,ITH4
4,Friuli-Venezia Giulia,TML_CAT_PERSONALE,07/01/2021_PF/BT_FVG_220101_TOLMEZZO_60-69,2 - Personale non Sanitario,06,2021-01-07,PF/BT,220101_TOLMEZZO,60-69,FVG,ITH4
3,Friuli-Venezia Giulia,TML_CAT_PERSONALE,07/01/2021_PF/BT_FVG_117510_SANTA MARIA DEGLI ANGELI_70-79,2 - Personale non Sanitario,06,2021-01-07,PF/BT,117510_SANTA MARIA DEGLI ANGELI,70-79,FVG,ITH4
1,Friuli-Venezia Giulia,TML_CAT_PERSONALE,07/01/2021_PF/BT_FVG_12M810_MONFALCONE_70-79,2 - Personale non Sanitario,06,2021-01-07,PF/BT,12M810_MONFALCONE,70-79,FVG,ITH4
1,Friuli-Venezia Giulia,TML_CAT_PERSONALE,07/01/2021_PF/BT_FVG_201010_CATTINARA_70-79,2 - Personale non Sanitario,06,2021-01-07,PF/BT,201010_CATTINARA,70-79,FVG,ITH4
1,Friuli-Venezia Giulia,TML_CAT_RSA_OSPITI,07/01/2021_PF/BT_FVG_9B0040_CASA PER ANZIANI UMBERTO I_30-39,3 - Ospiti Strutture Residenziali,06,2021-01-07,PF/BT,9B0040_CASA PER ANZIANI UMBERTO I,30-39,FVG,ITH4
2,Friuli-Venezia Giulia,TML_CAT_RSA_OSPITI,07/01/2021_PF/BT_FVG_9I0042_C. DI RIP. SAN VITO AL TAGL.TO_40-49,3 - Ospiti Strutture Residenziali,06,2021-01-07,PF/BT,9I0042_C. DI RIP. SAN VITO AL TAGL.TO,40-49,FVG,ITH4
2,Friuli-Venezia Giulia,TML_CAT_RSA_OSPITI,07/01/2021_PF/BT_FVG_9B0040_CASA PER ANZIANI UMBERTO I_50-59,3 - Ospiti Strutture Residenziali,06,2021-01-07,PF/BT,9B0040_CASA PER ANZIANI UMBERTO I,50-59,FVG,ITH4
4,Friuli-Venezia Giulia,TML_CAT_RSA_OSPITI,07/01/2021_PF/BT_FVG_9I0042_C. DI RIP. SAN VITO AL TAGL.TO_60-69,3 - Ospiti Strutture Residenziali,06,2021-01-07,PF/BT,9I0042_C. DI RIP. SAN VITO AL TAGL.TO,60-69,FVG,ITH4
2,Friuli-Venezia Giulia,TML_CAT_RSA_OSPITI,07/01/2021_PF/BT_FVG_9B0040_CASA PER ANZIANI UMBERTO I_70-79,3 - Ospiti Strutture Residenziali,06,2021-01-07,PF/BT,9B0040_CASA PER ANZIANI UMBERTO I,70-79,FVG,ITH4
16,Friuli-Venezia Giulia,TML_CAT_RSA_OSPITI,07/01/2021_PF/BT_FVG_9I0042_C. DI RIP. SAN VITO AL TAGL.TO_70-79,3 - Ospiti Strutture Residenziali,06,2021-01-07,PF/BT,9I0042_C. DI RIP. SAN VITO AL TAGL.TO,70-79,FVG,ITH4
1,Friuli-Venezia Giulia,TML_CAT_RSA_OSPITI,07/01/2021_PF/BT_FVG_117510_SANTA MARIA DEGLI ANGELI_80-89,3 - Ospiti Strutture Residenziali,06,2021-01-07,PF/BT,117510_SANTA MARIA DEGLI ANGELI,80-89,FVG,ITH4
15,Friuli-Venezia Giulia,TML_CAT_RSA_OSPITI,07/01/2021_PF/BT_FVG_9B0040_CASA PER ANZIANI UMBERTO I_80-89,3 - Ospiti Strutture Residenziali,06,2021-01-07,PF/BT,9B0040_CASA PER ANZIANI UMBERTO I,80-89,FVG,ITH4
23,Friuli-Venezia Giulia,TML_CAT_RSA_OSPITI,07/01/2021_PF/BT_FVG_9I0042_C. DI RIP. SAN VITO AL TAGL.TO_80-89,3 - Ospiti Strutture Residenziali,06,2021-01-07,PF/BT,9I0042_C. DI RIP. SAN VITO AL TAGL.TO,80-89,FVG,ITH4
14,Friuli-Venezia Giulia,TML_CAT_RSA_OSPITI,07/01/2021_PF/BT_FVG_9B0040_CASA PER ANZIANI UMBERTO I_90+,3 - Ospiti Strutture Residenziali,06,2021-01-07,PF/BT,9B0040_CASA PER ANZIANI UMBERTO I,90+,FVG,ITH4
29,Friuli-Venezia Giulia,TML_CAT_RSA_OSPITI,07/01/2021_PF/BT_FVG_9I0042_C. DI RIP. SAN VITO AL TAGL.TO_90+,3 - Ospiti Strutture Residenziali,06,2021-01-07,PF/BT,9I0042_C. DI RIP. SAN VITO AL TAGL.TO,90+,FVG,ITH4
1,Friuli-Venezia Giulia,TML_CAT_OSS,08/01/2021_PF/BT_FVG_201010_CATTINARA_16-19,1 - Operatori Sanitari e Sociosanitari,06,2021-01-08,PF/BT,201010_CATTINARA,16-19,FVG,ITH4
31,Friuli-Venezia Giulia,TML_CAT_OSS,08/01/2021_PF/BT_FVG_117510_SANTA MARIA DEGLI ANGELI_20-29,1 - Operatori Sanitari e Sociosanitari,06,2021-01-08,PF/BT,117510_SANTA MARIA DEGLI ANGELI,20-29,FVG,ITH4
15,Friuli-Venezia Giulia,TML_CAT_OSS,08/01/2021_PF/BT_FVG_12M810_MONFALCONE_20-29,1 - Operatori Sanitari e Sociosanitari,06,2021-01-08,PF/BT,12M810_MONFALCONE,20-29,FVG,ITH4
58,Friuli-Venezia Giulia,TML_CAT_OSS,08/01/2021_PF/BT_FVG_14VP13_SANTA MARIA DELLA MISERICORDIA_20-29,1 - Operatori Sanitari e Sociosanitari,06,2021-01-08,PF/BT,14VP13_SANTA MARIA DELLA MISERICORDIA,20-29,FVG,ITH4
65,Friuli-Venezia Giulia,TML_CAT_OSS,08/01/2021_PF/BT_FVG_201010_CATTINARA_20-29,1 - Operatori Sanitari e Sociosanitari,06,2021-01-08,PF/BT,201010_CATTINARA,20-29,FVG,ITH4
16,Friuli-Venezia Giulia,TML_CAT_OSS,08/01/2021_PF/BT_FVG_220101_TOLMEZZO_20-29,1 - Operatori Sanitari e Sociosanitari,06,2021-01-08,PF/BT,220101_TOLMEZZO,20-29,FVG,ITH4
1,Friuli-Venezia Giulia,TML_CAT_OSS,08/01/2021_PF/BT_FVG_94XA9W_A.S.P. 'FONDAZIONE E. MUNER DE GIUDICI' PRADAMANO_20-29,1 - Operatori Sanitari e Sociosanitari,06,2021-01-08,PF/BT,94XA9W_A.S.P. 'FONDAZIONE E. MUNER DE GIUDICI' PRADAMANO,20-29,FVG,ITH4
1,Friuli-Venezia Giulia,TML_CAT_OSS,08/01/2021_PF/BT_FVG_9N0040_C. DI RIP. SACILE_20-29,1 - Operatori Sanitari e Sociosanitari,06,2021-01-08,PF/BT,9N0040_C. DI RIP. SACILE,20-29,FVG,ITH4
1,Friuli-Venezia Giulia,TML_CAT_OSS,"08/01/2021_PF/BT_FVG_9X0040_CDR ""LA PANORAMICA"" PINZANO_20-29",1 - Operatori Sanitari e Sociosanitari,06,2021-01-08,PF/BT,"9X0040_CDR ""LA PANORAMICA"" PINZANO",20-29,FVG,ITH4
50,Friuli-Venezia Giulia,TML_CAT_OSS,08/01/2021_PF/BT_FVG_117510_SANTA MARIA DEGLI ANGELI_30-39,1 - Operatori Sanitari e Sociosanitari,06,2021-01-08,PF/BT,117510_SANTA MARIA DEGLI ANGELI,30-39,FVG,ITH4
31,Friuli-Venezia Giulia,TML_CAT_OSS,08/01/2021_PF/BT_FVG_12M810_MONFALCONE_30-39,1 - Operatori Sanitari e Sociosanitari,06,2021-01-08,PF/BT,12M810_MONFALCONE,30-39,FVG,ITH4
84,Friuli-Venezia Giulia,TML_CAT_OSS,08/01/2021_PF/BT_FVG_14VP13_SANTA MARIA DELLA MISERICORDIA_30-39,1 - Operatori Sanitari e Sociosanitari,06,2021-01-08,PF/BT,14VP13_SANTA MARIA DELLA MISERICORDIA,30-39,FVG,ITH4
86,Friuli-Venezia Giulia,TML_CAT_OSS,08/01/2021_PF/BT_FVG_201010_CATTINARA_30-39,1 - Operatori Sanitari e Sociosanitari,06,2021-01-08,PF/BT,201010_CATTINARA,30-39,FVG,ITH4
15,Friuli-Venezia Giulia,TML_CAT_OSS,08/01/2021_PF/BT_FVG_220101_TOLMEZZO_30-39,1 - Operatori Sanitari e Sociosanitari,06,2021-01-08,PF/BT,220101_TOLMEZZO,30-39,FVG,ITH4
1,Friuli-Venezia Giulia,TML_CAT_OSS,"08/01/2021_PF/BT_FVG_9X0040_CDR ""LA PANORAMICA"" PINZANO_30-39",1 - Operatori Sanitari e Sociosanitari,06,2021-01-08,PF/BT,"9X0040_CDR ""LA PANORAMICA"" PINZANO",30-39,FVG,ITH4
69,Friuli-Venezia Giulia,TML_CAT_OSS,08/01/2021_PF/BT_FVG_117510_SANTA MARIA DEGLI ANGELI_40-49,1 - Operatori Sanitari e Sociosanitari,06,2021-01-08,PF/BT,117510_SANTA MARIA DEGLI ANGELI,40-49,FVG,ITH4
34,Friuli-Venezia Giulia,TML_CAT_OSS,08/01/2021_PF/BT_FVG_12M810_MONFALCONE_40-49,1 - Operatori Sanitari e Sociosanitari,06,2021-01-08,PF/BT,12M810_MONFALCONE,40-49,FVG,ITH4
133,Friuli-Venezia Giulia,TML_CAT_OSS,08/01/2021_PF/BT_FVG_14VP13_SANTA MARIA DELLA MISERICORDIA_40-49,1 - Operatori Sanitari e Sociosanitari,06,2021-01-08,PF/BT,14VP13_SANTA MARIA DELLA MISERICORDIA,40-49,FVG,ITH4
101,Friuli-Venezia Giulia,TML_CAT_OSS,08/01/2021_PF/BT_FVG_201010_CATTINARA_40-49,1 - Operatori Sanitari e Sociosanitari,06,2021-01-08,PF/BT,201010_CATTINARA,40-49,FVG,ITH4
37,Friuli-Venezia Giulia,TML_CAT_OSS,08/01/2021_PF/BT_FVG_220101_TOLMEZZO_40-49,1 - Operatori Sanitari e Sociosanitari,06,2021-01-08,PF/BT,220101_TOLMEZZO,40-49,FVG,ITH4
1,Friuli-Venezia Giulia,TML_CAT_OSS,08/01/2021_PF/BT_FVG_94BC9F_C.DI R. COMUNE DI BUJA_40-49,1 - Operatori Sanitari e Sociosanitari,06,2021-01-08,PF/BT,94BC9F_C.DI R. COMUNE DI BUJA,40-49,FVG,ITH4
1,Friuli-Venezia Giulia,TML_CAT_OSS,08/01/2021_PF/BT_FVG_94XA9W_A.S.P. 'FONDAZIONE E. MUNER DE GIUDICI' PRADAMANO_40-49,1 - Operatori Sanitari e Sociosanitari,06,2021-01-08,PF/BT,94XA9W_A.S.P. 'FONDAZIONE E. MUNER DE GIUDICI' PRADAMANO,40-49,FVG,ITH4
2,Friuli-Venezia Giulia,TML_CAT_OSS,08/01/2021_PF/BT_FVG_9D0040_C. DI RIP. SPILIMBERGO_40-49,1 - Operatori Sanitari e Sociosanitari,06,2021-01-08,PF/BT,9D0040_C. DI RIP. SPILIMBERGO,40-49,FVG,ITH4
1,Friuli-Venezia Giulia,TML_CAT_OSS,"08/01/2021_PF/BT_FVG_9H0040_C.E. ""C. E A. CARNERA"" SEQUALS_40-49",1 - Operatori Sanitari e Sociosanitari,06,2021-01-08,PF/BT,"9H0040_C.E. ""C. E A. CARNERA"" SEQUALS",40-49,FVG,ITH4
1,Friuli-Venezia Giulia,TML_CAT_OSS,08/01/2021_PF/BT_FVG_9N0040_C. DI RIP. SACILE_40-49,1 - Operatori Sanitari e Sociosanitari,06,2021-01-08,PF/BT,9N0040_C. DI RIP. SACILE,40-49,FVG,ITH4
1,Friuli-Venezia Giulia,TML_CAT_OSS,"08/01/2021_PF/BT_FVG_9X0040_CDR ""LA PANORAMICA"" PINZANO_40-49",1 - Operatori Sanitari e Sociosanitari,06,2021-01-08,PF/BT,"9X0040_CDR ""LA PANORAMICA"" PINZANO",40-49,FVG,ITH4
86,Friuli-Venezia Giulia,TML_CAT_OSS,08/01/2021_PF/BT_FVG_117510_SANTA MARIA DEGLI ANGELI_50-59,1 - Operatori Sanitari e Sociosanitari,06,2021-01-08,PF/BT,117510_SANTA MARIA DEGLI ANGELI,50-59,FVG,ITH4
65,Friuli-Venezia Giulia,TML_CAT_OSS,08/01/2021_PF/BT_FVG_12M810_MONFALCONE_50-59,1 - Operatori Sanitari e Sociosanitari,06,2021-01-08,PF/BT,12M810_MONFALCONE,50-59,FVG,ITH4
131,Friuli-Venezia Giulia,TML_CAT_OSS,08/01/2021_PF/BT_FVG_14VP13_SANTA MARIA DELLA MISERICORDIA_50-59,1 - Operatori Sanitari e Sociosanitari,06,2021-01-08,PF/BT,14VP13_SANTA MARIA DELLA MISERICORDIA,50-59,FVG,ITH4
113,Friuli-Venezia Giulia,TML_CAT_OSS,08/01/2021_PF/BT_FVG_201010_CATTINARA_50-59,1 - Operatori Sanitari e Sociosanitari,06,2021-01-08,PF/BT,201010_CATTINARA,50-59,FVG,ITH4
41,Friuli-Venezia Giulia,TML_CAT_OSS,08/01/2021_PF/BT_FVG_220101_TOLMEZZO_50-59,1 - Operatori Sanitari e Sociosanitari,06,2021-01-08,PF/BT,220101_TOLMEZZO,50-59,FVG,ITH4
1,Friuli-Venezia Giulia,TML_CAT_OSS,08/01/2021_PF/BT_FVG_920002_CASA ALBERGO ANZIANI DOMENICO CORRADINI - RONCHI_50-59,1 - Operatori Sanitari e Sociosanitari,06,2021-01-08,PF/BT,920002_CASA ALBERGO ANZIANI DOMENICO CORRADINI - RONCHI,50-59,FVG,ITH4
1,Friuli-Venezia Giulia,TML_CAT_OSS,08/01/2021_PF/BT_FVG_9N0040_C. DI RIP. SACILE_50-59,1 - Operatori Sanitari e Sociosanitari,06,2021-01-08,PF/BT,9N0040_C. DI RIP. SACILE,50-59,FVG,ITH4
2,Friuli-Venezia Giulia,TML_CAT_OSS,"08/01/2021_PF/BT_FVG_9X0040_CDR ""LA PANORAMICA"" PINZANO_50-59",1 - Operatori Sanitari e Sociosanitari,06,2021-01-08,PF/BT,"9X0040_CDR ""LA PANORAMICA"" PINZANO",50-59,FVG,ITH4
57,Friuli-Venezia Giulia,TML_CAT_OSS,08/01/2021_PF/BT_FVG_117510_SANTA MARIA DEGLI ANGELI_60-69,1 - Operatori Sanitari e Sociosanitari,06,2021-01-08,PF/BT,117510_SANTA MARIA DEGLI ANGELI,60-69,FVG,ITH4
27,Friuli-Venezia Giulia,TML_CAT_OSS,08/01/2021_PF/BT_FVG_12M810_MONFALCONE_60-69,1 - Operatori Sanitari e Sociosanitari,06,2021-01-08,PF/BT,12M810_MONFALCONE,60-69,FVG,ITH4
68,Friuli-Venezia Giulia,TML_CAT_OSS,08/01/2021_PF/BT_FVG_14VP13_SANTA MARIA DELLA MISERICORDIA_60-69,1 - Operatori Sanitari e Sociosanitari,06,2021-01-08,PF/BT,14VP13_SANTA MARIA DELLA MISERICORDIA,60-69,FVG,ITH4
53,Friuli-Venezia Giulia,TML_CAT_OSS,08/01/2021_PF/BT_FVG_201010_CATTINARA_60-69,1 - Operatori Sanitari e Sociosanitari,06,2021-01-08,PF/BT,201010_CATTINARA,60-69,FVG,ITH4
18,Friuli-Venezia Giulia,TML_CAT_OSS,08/01/2021_PF/BT_FVG_220101_TOLMEZZO_60-69,1 - Operatori Sanitari e Sociosanitari,06,2021-01-08,PF/BT,220101_TOLMEZZO,60-69,FVG,ITH4
1,Friuli-Venezia Giulia,TML_CAT_OSS,08/01/2021_PF/BT_FVG_920002_CASA ALBERGO ANZIANI DOMENICO CORRADINI - RONCHI_60-69,1 - Operatori Sanitari e Sociosanitari,06,2021-01-08,PF/BT,920002_CASA ALBERGO ANZIANI DOMENICO CORRADINI - RONCHI,60-69,FVG,ITH4
1,Friuli-Venezia Giulia,TML_CAT_OSS,"08/01/2021_PF/BT_FVG_9H0040_C.E. ""C. E A. CARNERA"" SEQUALS_60-69",1 - Operatori Sanitari e Sociosanitari,06,2021-01-08,PF/BT,"9H0040_C.E. ""C. E A. CARNERA"" SEQUALS",60-69,FVG,ITH4
9,Friuli-Venezia Giulia,TML_CAT_OSS,08/01/2021_PF/BT_FVG_117510_SANTA MARIA DEGLI ANGELI_70-79,1 - Operatori Sanitari e Sociosanitari,06,2021-01-08,PF/BT,117510_SANTA MARIA DEGLI ANGELI,70-79,FVG,ITH4
7,Friuli-Venezia Giulia,TML_CAT_OSS,08/01/2021_PF/BT_FVG_12M810_MONFALCONE_70-79,1 - Operatori Sanitari e Sociosanitari,06,2021-01-08,PF/BT,12M810_MONFALCONE,70-79,FVG,ITH4
8,Friuli-Venezia Giulia,TML_CAT_OSS,08/01/2021_PF/BT_FVG_14VP13_SANTA MARIA DELLA MISERICORDIA_70-79,1 - Operatori Sanitari e Sociosanitari,06,2021-01-08,PF/BT,14VP13_SANTA MARIA DELLA MISERICORDIA,70-79,FVG,ITH4
18,Friuli-Venezia Giulia,TML_CAT_OSS,08/01/2021_PF/BT_FVG_201010_CATTINARA_70-79,1 - Operatori Sanitari e Sociosanitari,06,2021-01-08,PF/BT,201010_CATTINARA,70-79,FVG,ITH4
2,Friuli-Venezia Giulia,TML_CAT_OSS,08/01/2021_PF/BT_FVG_220101_TOLMEZZO_70-79,1 - Operatori Sanitari e Sociosanitari,06,2021-01-08,PF/BT,220101_TOLMEZZO,70-79,FVG,ITH4
2,Friuli-Venezia Giulia,TML_CAT_OSS,08/01/2021_PF/BT_FVG_117510_SANTA MARIA DEGLI ANGELI_80-89,1 - Operatori Sanitari e Sociosanitari,06,2021-01-08,PF/BT,117510_SANTA MARIA DEGLI ANGELI,80-89,FVG,ITH4
1,Friuli-Venezia Giulia,TML_CAT_OSS,08/01/2021_PF/BT_FVG_201010_CATTINARA_80-89,1 - Operatori Sanitari e Sociosanitari,06,2021-01-08,PF/BT,201010_CATTINARA,80-89,FVG,ITH4
1,Friuli-Venezia Giulia,TML_CAT_ALTRO,08/01/2021_PF/BT_FVG_117510_SANTA MARIA DEGLI ANGELI_16-19,2 - Personale non Sanitario,06,2021-01-08,PF/BT,117510_SANTA MARIA DEGLI ANGELI,16-19,FVG,ITH4
1,Friuli-Venezia Giulia,TML_CAT_PERSONALE,08/01/2021_PF/BT_FVG_117510_SANTA MARIA DEGLI ANGELI_20-29,2 - Personale non Sanitario,06,2021-01-08,PF/BT,117510_SANTA MARIA DEGLI ANGELI,20-29,FVG,ITH4
15,Friuli-Venezia Giulia,TML_CAT_ALTRO,08/01/2021_PF/BT_FVG_117510_SANTA MARIA DEGLI ANGELI_20-29,2 - Personale non Sanitario,06,2021-01-08,PF/BT,117510_SANTA MARIA DEGLI ANGELI,20-29,FVG,ITH4
4,Friuli-Venezia Giulia,TML_CAT_PERSONALE,08/01/2021_PF/BT_FVG_12M810_MONFALCONE_20-29,2 - Personale non Sanitario,06,2021-01-08,PF/BT,12M810_MONFALCONE,20-29,FVG,ITH4
22,Friuli-Venezia Giulia,TML_CAT_ALTRO,08/01/2021_PF/BT_FVG_12M810_MONFALCONE_20-29,2 - Personale non Sanitario,06,2021-01-08,PF/BT,12M810_MONFALCONE,20-29,FVG,ITH4
6,Friuli-Venezia Giulia,TML_CAT_PERSONALE,08/01/2021_PF/BT_FVG_14VP13_SANTA MARIA DELLA MISERICORDIA_20-29,2 - Personale non Sanitario,06,2021-01-08,PF/BT,14VP13_SANTA MARIA DELLA MISERICORDIA,20-29,FVG,ITH4
21,Friuli-Venezia Giulia,TML_CAT_ALTRO,08/01/2021_PF/BT_FVG_14VP13_SANTA MARIA DELLA MISERICORDIA_20-29,2 - Personale non Sanitario,06,2021-01-08,PF/BT,14VP13_SANTA MARIA DELLA MISERICORDIA,20-29,FVG,ITH4
6,Friuli-Venezia Giulia,TML_CAT_PERSONALE,08/01/2021_PF/BT_FVG_201010_CATTINARA_20-29,2 - Personale non Sanitario,06,2021-01-08,PF/BT,201010_CATTINARA,20-29,FVG,ITH4
34,Friuli-Venezia Giulia,TML_CAT_ALTRO,08/01/2021_PF/BT_FVG_201010_CATTINARA_20-29,2 - Personale non Sanitario,06,2021-01-08,PF/BT,201010_CATTINARA,20-29,FVG,ITH4
1,Friuli-Venezia Giulia,TML_CAT_PERSONALE,08/01/2021_PF/BT_FVG_220101_TOLMEZZO_20-29,2 - Personale non Sanitario,06,2021-01-08,PF/BT,220101_TOLMEZZO,20-29,FVG,ITH4
3,Friuli-Venezia Giulia,TML_CAT_ALTRO,08/01/2021_PF/BT_FVG_220101_TOLMEZZO_20-29,2 - Personale non Sanitario,06,2021-01-08,PF/BT,220101_TOLMEZZO,20-29,FVG,ITH4
1,Friuli-Venezia Giulia,TML_CAT_ALTRO,08/01/2021_PF/BT_FVG_117510_SANTA MARIA DEGLI ANGELI_30-39,2 - Personale non Sanitario,06,2021-01-08,PF/BT,117510_SANTA MARIA DEGLI ANGELI,30-39,FVG,ITH4
9,Friuli-Venezia Giulia,TML_CAT_PERSONALE,08/01/2021_PF/BT_FVG_117510_SANTA MARIA DEGLI ANGELI_30-39,2 - Personale non Sanitario,06,2021-01-08,PF/BT,117510_SANTA MARIA DEGLI ANGELI,30-39,FVG,ITH4
3,Friuli-Venezia Giulia,TML_CAT_ALTRO,08/01/2021_PF/BT_FVG_12M810_MONFALCONE_30-39,2 - Personale non Sanitario,06,2021-01-08,PF/BT,12M810_MONFALCONE,30-39,FVG,ITH4
6,Friuli-Venezia Giulia,TML_CAT_PERSONALE,08/01/2021_PF/BT_FVG_12M810_MONFALCONE_30-39,2 - Personale non Sanitario,06,2021-01-08,PF/BT,12M810_MONFALCONE,30-39,FVG,ITH4
6,Friuli-Venezia Giulia,TML_CAT_ALTRO,08/01/2021_PF/BT_FVG_14VP13_SANTA MARIA DELLA MISERICORDIA_30-39,2 - Personale non Sanitario,06,2021-01-08,PF/BT,14VP13_SANTA MARIA DELLA MISERICORDIA,30-39,FVG,ITH4
14,Friuli-Venezia Giulia,TML_CAT_PERSONALE,08/01/2021_PF/BT_FVG_14VP13_SANTA MARIA DELLA MISERICORDIA_30-39,2 - Personale non Sanitario,06,2021-01-08,PF/BT,14VP13_SANTA MARIA DELLA MISERICORDIA,30-39,FVG,ITH4
6,Friuli-Venezia Giulia,TML_CAT_ALTRO,08/01/2021_PF/BT_FVG_201010_CATTINARA_30-39,2 - Personale non Sanitario,06,2021-01-08,PF/BT,201010_CATTINARA,30-39,FVG,ITH4
10,Friuli-Venezia Giulia,TML_CAT_PERSONALE,08/01/2021_PF/BT_FVG_201010_CATTINARA_30-39,2 - Personale non Sanitario,06,2021-01-08,PF/BT,201010_CATTINARA,30-39,FVG,ITH4
1,Friuli-Venezia Giulia,TML_CAT_PERSONALE,08/01/2021_PF/BT_FVG_220101_TOLMEZZO_30-39,2 - Personale non Sanitario,06,2021-01-08,PF/BT,220101_TOLMEZZO,30-39,FVG,ITH4
2,Friuli-Venezia Giulia,TML_CAT_ALTRO,08/01/2021_PF/BT_FVG_220101_TOLMEZZO_30-39,2 - Personale non Sanitario,06,2021-01-08,PF/BT,220101_TOLMEZZO,30-39,FVG,ITH4
14,Friuli-Venezia Giulia,TML_CAT_PERSONALE,08/01/2021_PF/BT_FVG_117510_SANTA MARIA DEGLI ANGELI_40-49,2 - Personale non Sanitario,06,2021-01-08,PF/BT,117510_SANTA MARIA DEGLI ANGELI,40-49,FVG,ITH4
3,Friuli-Venezia Giulia,TML_CAT_ALTRO,08/01/2021_PF/BT_FVG_12M810_MONFALCONE_40-49,2 - Personale non Sanitario,06,2021-01-08,PF/BT,12M810_MONFALCONE,40-49,FVG,ITH4
6,Friuli-Venezia Giulia,TML_CAT_PERSONALE,08/01/2021_PF/BT_FVG_12M810_MONFALCONE_40-49,2 - Personale non Sanitario,06,2021-01-08,PF/BT,12M810_MONFALCONE,40-49,FVG,ITH4
22,Friuli-Venezia Giulia,TML_CAT_PERSONALE,08/01/2021_PF/BT_FVG_14VP13_SANTA MARIA DELLA MISERICORDIA_40-49,2 - Personale non Sanitario,06,2021-01-08,PF/BT,14VP13_SANTA MARIA DELLA MISERICORDIA,40-49,FVG,ITH4
15,Friuli-Venezia Giulia,TML_CAT_PERSONALE,08/01/2021_PF/BT_FVG_201010_CATTINARA_40-49,2 - Personale non Sanitario,06,2021-01-08,PF/BT,201010_CATTINARA,40-49,FVG,ITH4
2,Friuli-Venezia Giulia,TML_CAT_ALTRO,08/01/2021_PF/BT_FVG_220101_TOLMEZZO_40-49,2 - Personale non Sanitario,06,2021-01-08,PF/BT,220101_TOLMEZZO,40-49,FVG,ITH4
6,Friuli-Venezia Giulia,TML_CAT_PERSONALE,08/01/2021_PF/BT_FVG_220101_TOLMEZZO_40-49,2 - Personale non Sanitario,06,2021-01-08,PF/BT,220101_TOLMEZZO,40-49,FVG,ITH4
1,Friuli-Venezia Giulia,TML_CAT_PERSONALE,08/01/2021_PF/BT_FVG_920002_CASA ALBERGO ANZIANI DOMENICO CORRADINI - RONCHI_40-49,2 - Personale non Sanitario,06,2021-01-08,PF/BT,920002_CASA ALBERGO ANZIANI DOMENICO CORRADINI - RONCHI,40-49,FVG,ITH4
22,Friuli-Venezia Giulia,TML_CAT_PERSONALE,08/01/2021_PF/BT_FVG_117510_SANTA MARIA DEGLI ANGELI_50-59,2 - Personale non Sanitario,06,2021-01-08,PF/BT,117510_SANTA MARIA DEGLI ANGELI,50-59,FVG,ITH4
8,Friuli-Venezia Giulia,TML_CAT_PERSONALE,08/01/2021_PF/BT_FVG_12M810_MONFALCONE_50-59,2 - Personale non Sanitario,06,2021-01-08,PF/BT,12M810_MONFALCONE,50-59,FVG,ITH4
16,Friuli-Venezia Giulia,TML_CAT_PERSONALE,08/01/2021_PF/BT_FVG_14VP13_SANTA MARIA DELLA MISERICORDIA_50-59,2 - Personale non Sanitario,06,2021-01-08,PF/BT,14VP13_SANTA MARIA DELLA MISERICORDIA,50-59,FVG,ITH4
1,Friuli-Venezia Giulia,TML_CAT_ALTRO,08/01/2021_PF/BT_FVG_201010_CATTINARA_50-59,2 - Personale non Sanitario,06,2021-01-08,PF/BT,201010_CATTINARA,50-59,FVG,ITH4
29,Friuli-Venezia Giulia,TML_CAT_PERSONALE,08/01/2021_PF/BT_FVG_201010_CATTINARA_50-59,2 - Personale non Sanitario,06,2021-01-08,PF/BT,201010_CATTINARA,50-59,FVG,ITH4
6,Friuli-Venezia Giulia,TML_CAT_PERSONALE,08/01/2021_PF/BT_FVG_220101_TOLMEZZO_50-59,2 - Personale non Sanitario,06,2021-01-08,PF/BT,220101_TOLMEZZO,50-59,FVG,ITH4
7,Friuli-Venezia Giulia,TML_CAT_ALTRO,08/01/2021_PF/BT_FVG_220101_TOLMEZZO_50-59,2 - Personale non Sanitario,06,2021-01-08,PF/BT,220101_TOLMEZZO,50-59,FVG,ITH4
11,Friuli-Venezia Giulia,TML_CAT_PERSONALE,08/01/2021_PF/BT_FVG_117510_SANTA MARIA DEGLI ANGELI_60-69,2 - Personale non Sanitario,06,2021-01-08,PF/BT,117510_SANTA MARIA DEGLI ANGELI,60-69,FVG,ITH4
5,Friuli-Venezia Giulia,TML_CAT_PERSONALE,08/01/2021_PF/BT_FVG_12M810_MONFALCONE_60-69,2 - Personale non Sanitario,06,2021-01-08,PF/BT,12M810_MONFALCONE,60-69,FVG,ITH4
8,Friuli-Venezia Giulia,TML_CAT_PERSONALE,08/01/2021_PF/BT_FVG_14VP13_SANTA MARIA DELLA MISERICORDIA_60-69,2 - Personale non Sanitario,06,2021-01-08,PF/BT,14VP13_SANTA MARIA DELLA MISERICORDIA,60-69,FVG,ITH4
5,Friuli-Venezia Giulia,TML_CAT_PERSONALE,08/01/2021_PF/BT_FVG_201010_CATTINARA_60-69,2 - Personale non Sanitario,06,2021-01-08,PF/BT,201010_CATTINARA,60-69,FVG,ITH4
2,Friuli-Venezia Giulia,TML_CAT_ALTRO,08/01/2021_PF/BT_FVG_220101_TOLMEZZO_60-69,2 - Personale non Sanitario,06,2021-01-08,PF/BT,220101_TOLMEZZO,60-69,FVG,ITH4
4,Friuli-Venezia Giulia,TML_CAT_PERSONALE,08/01/2021_PF/BT_FVG_117510_SANTA MARIA DEGLI ANGELI_70-79,2 - Personale non Sanitario,06,2021-01-08,PF/BT,117510_SANTA MARIA DEGLI ANGELI,70-79,FVG,ITH4
2,Friuli-Venezia Giulia,TML_CAT_PERSONALE,08/01/2021_PF/BT_FVG_12M810_MONFALCONE_70-79,2 - Personale non Sanitario,06,2021-01-08,PF/BT,12M810_MONFALCONE,70-79,FVG,ITH4
1,Friuli-Venezia Giulia,TML_CAT_PERSONALE,08/01/2021_PF/BT_FVG_14VP13_SANTA MARIA DELLA MISERICORDIA_70-79,2 - Personale non Sanitario,06,2021-01-08,PF/BT,14VP13_SANTA MARIA DELLA MISERICORDIA,70-79,FVG,ITH4
2,Friuli-Venezia Giulia,TML_CAT_PERSONALE,08/01/2021_PF/BT_FVG_201010_CATTINARA_70-79,2 - Personale non Sanitario,06,2021-01-08,PF/BT,201010_CATTINARA,70-79,FVG,ITH4
1,Friuli-Venezia Giulia,TML_CAT_PERSONALE,08/01/2021_PF/BT_FVG_14VP13_SANTA MARIA DELLA MISERICORDIA_90+,2 - Personale non Sanitario,06,2021-01-08,PF/BT,14VP13_SANTA MARIA DELLA MISERICORDIA,90+,FVG,ITH4
1,Friuli-Venezia Giulia,TML_CAT_RSA_OSPITI,08/01/2021_PF/BT_FVG_201010_CATTINARA_20-29,3 - Ospiti Strutture Residenziali,06,2021-01-08,PF/BT,201010_CATTINARA,20-29,FVG,ITH4
