somministrazioni,regione,siglaCategoria,identificativo,categoria,codice_regione,data,vaccino,punto,classeEta,siglaRegione,NUTS2
2,Molise,TML_CAT_OSS,27/12/2020_PF/BT_MOL_140 001_P.O. ANTONIO CARDARELLI_20-29,1 - Operatori Sanitari e Sociosanitari,14,2020-12-27,PF/BT,140 001_P.O. ANTONIO CARDARELLI,20-29,MOL,ITF2
2,Molise,TML_CAT_OSS,"27/12/2020_PF/BT_MOL_201_Casa di riposo ""Cannavina"" - Ripalimosani_20-29",1 - Operatori Sanitari e Sociosanitari,14,2020-12-27,PF/BT,"201_Casa di riposo ""Cannavina"" - Ripalimosani",20-29,MOL,ITF2
8,Molise,TML_CAT_OSS,27/12/2020_PF/BT_MOL_140 001_P.O. ANTONIO CARDARELLI_30-39,1 - Operatori Sanitari e Sociosanitari,14,2020-12-27,PF/BT,140 001_P.O. ANTONIO CARDARELLI,30-39,MOL,ITF2
7,Molise,TML_CAT_OSS,27/12/2020_PF/BT_MOL_140 001_P.O. ANTONIO CARDARELLI_40-49,1 - Operatori Sanitari e Sociosanitari,14,2020-12-27,PF/BT,140 001_P.O. ANTONIO CARDARELLI,40-49,MOL,ITF2
10,Molise,TML_CAT_OSS,27/12/2020_PF/BT_MOL_140 001_P.O. ANTONIO CARDARELLI_50-59,1 - Operatori Sanitari e Sociosanitari,14,2020-12-27,PF/BT,140 001_P.O. ANTONIO CARDARELLI,50-59,MOL,ITF2
3,Molise,TML_CAT_OSS,27/12/2020_PF/BT_MOL_140 001_P.O. ANTONIO CARDARELLI_60-69,1 - Operatori Sanitari e Sociosanitari,14,2020-12-27,PF/BT,140 001_P.O. ANTONIO CARDARELLI,60-69,MOL,ITF2
1,Molise,TML_CAT_ALTRO,"27/12/2020_PF/BT_MOL_201_Casa di riposo ""Cannavina"" - Ripalimosani_30-39",2 - Personale non Sanitario,14,2020-12-27,PF/BT,"201_Casa di riposo ""Cannavina"" - Ripalimosani",30-39,MOL,ITF2
1,Molise,TML_CAT_RSA_OSPITI,"27/12/2020_PF/BT_MOL_201_Casa di riposo ""Cannavina"" - Ripalimosani_60-69",3 - Ospiti Strutture Residenziali,14,2020-12-27,PF/BT,"201_Casa di riposo ""Cannavina"" - Ripalimosani",60-69,MOL,ITF2
4,Molise,TML_CAT_RSA_OSPITI,"27/12/2020_PF/BT_MOL_201_Casa di riposo ""Cannavina"" - Ripalimosani_70-79",3 - Ospiti Strutture Residenziali,14,2020-12-27,PF/BT,"201_Casa di riposo ""Cannavina"" - Ripalimosani",70-79,MOL,ITF2
6,Molise,TML_CAT_RSA_OSPITI,"27/12/2020_PF/BT_MOL_201_Casa di riposo ""Cannavina"" - Ripalimosani_80-89",3 - Ospiti Strutture Residenziali,14,2020-12-27,PF/BT,"201_Casa di riposo ""Cannavina"" - Ripalimosani",80-89,MOL,ITF2
6,Molise,TML_CAT_RSA_OSPITI,"27/12/2020_PF/BT_MOL_201_Casa di riposo ""Cannavina"" - Ripalimosani_90+",3 - Ospiti Strutture Residenziali,14,2020-12-27,PF/BT,"201_Casa di riposo ""Cannavina"" - Ripalimosani",90+,MOL,ITF2
10,Molise,TML_CAT_OSS,04/01/2021_PF/BT_MOL_14000100_P.O. A.CARDARELLI-CAMPOBASSO_20-29,1 - Operatori Sanitari e Sociosanitari,14,2021-01-04,PF/BT,14000100_P.O. A.CARDARELLI-CAMPOBASSO,20-29,MOL,ITF2
5,Molise,TML_CAT_OSS,04/01/2021_PF/BT_MOL_14000200_P.O. SAN TIMOTEO - TERMOLI_20-29,1 - Operatori Sanitari e Sociosanitari,14,2021-01-04,PF/BT,14000200_P.O. SAN TIMOTEO - TERMOLI,20-29,MOL,ITF2
3,Molise,TML_CAT_OSS,04/01/2021_PF/BT_MOL_14000301_P.O.ISERNIA_20-29,1 - Operatori Sanitari e Sociosanitari,14,2021-01-04,PF/BT,14000301_P.O.ISERNIA,20-29,MOL,ITF2
23,Molise,TML_CAT_OSS,04/01/2021_PF/BT_MOL_14000100_P.O. A.CARDARELLI-CAMPOBASSO_30-39,1 - Operatori Sanitari e Sociosanitari,14,2021-01-04,PF/BT,14000100_P.O. A.CARDARELLI-CAMPOBASSO,30-39,MOL,ITF2
12,Molise,TML_CAT_OSS,04/01/2021_PF/BT_MOL_14000200_P.O. SAN TIMOTEO - TERMOLI_30-39,1 - Operatori Sanitari e Sociosanitari,14,2021-01-04,PF/BT,14000200_P.O. SAN TIMOTEO - TERMOLI,30-39,MOL,ITF2
10,Molise,TML_CAT_OSS,04/01/2021_PF/BT_MOL_14000301_P.O.ISERNIA_30-39,1 - Operatori Sanitari e Sociosanitari,14,2021-01-04,PF/BT,14000301_P.O.ISERNIA,30-39,MOL,ITF2
23,Molise,TML_CAT_OSS,04/01/2021_PF/BT_MOL_14000100_P.O. A.CARDARELLI-CAMPOBASSO_40-49,1 - Operatori Sanitari e Sociosanitari,14,2021-01-04,PF/BT,14000100_P.O. A.CARDARELLI-CAMPOBASSO,40-49,MOL,ITF2
32,Molise,TML_CAT_OSS,04/01/2021_PF/BT_MOL_14000200_P.O. SAN TIMOTEO - TERMOLI_40-49,1 - Operatori Sanitari e Sociosanitari,14,2021-01-04,PF/BT,14000200_P.O. SAN TIMOTEO - TERMOLI,40-49,MOL,ITF2
31,Molise,TML_CAT_OSS,04/01/2021_PF/BT_MOL_14000301_P.O.ISERNIA_40-49,1 - Operatori Sanitari e Sociosanitari,14,2021-01-04,PF/BT,14000301_P.O.ISERNIA,40-49,MOL,ITF2
25,Molise,TML_CAT_OSS,04/01/2021_PF/BT_MOL_14000100_P.O. A.CARDARELLI-CAMPOBASSO_50-59,1 - Operatori Sanitari e Sociosanitari,14,2021-01-04,PF/BT,14000100_P.O. A.CARDARELLI-CAMPOBASSO,50-59,MOL,ITF2
46,Molise,TML_CAT_OSS,04/01/2021_PF/BT_MOL_14000200_P.O. SAN TIMOTEO - TERMOLI_50-59,1 - Operatori Sanitari e Sociosanitari,14,2021-01-04,PF/BT,14000200_P.O. SAN TIMOTEO - TERMOLI,50-59,MOL,ITF2
21,Molise,TML_CAT_OSS,04/01/2021_PF/BT_MOL_14000301_P.O.ISERNIA_50-59,1 - Operatori Sanitari e Sociosanitari,14,2021-01-04,PF/BT,14000301_P.O.ISERNIA,50-59,MOL,ITF2
16,Molise,TML_CAT_OSS,04/01/2021_PF/BT_MOL_14000100_P.O. A.CARDARELLI-CAMPOBASSO_60-69,1 - Operatori Sanitari e Sociosanitari,14,2021-01-04,PF/BT,14000100_P.O. A.CARDARELLI-CAMPOBASSO,60-69,MOL,ITF2
22,Molise,TML_CAT_OSS,04/01/2021_PF/BT_MOL_14000200_P.O. SAN TIMOTEO - TERMOLI_60-69,1 - Operatori Sanitari e Sociosanitari,14,2021-01-04,PF/BT,14000200_P.O. SAN TIMOTEO - TERMOLI,60-69,MOL,ITF2
12,Molise,TML_CAT_OSS,04/01/2021_PF/BT_MOL_14000301_P.O.ISERNIA_60-69,1 - Operatori Sanitari e Sociosanitari,14,2021-01-04,PF/BT,14000301_P.O.ISERNIA,60-69,MOL,ITF2
1,Molise,TML_CAT_OSS,04/01/2021_PF/BT_MOL_14000100_P.O. A.CARDARELLI-CAMPOBASSO_70-79,1 - Operatori Sanitari e Sociosanitari,14,2021-01-04,PF/BT,14000100_P.O. A.CARDARELLI-CAMPOBASSO,70-79,MOL,ITF2
1,Molise,TML_CAT_ALTRO,04/01/2021_PF/BT_MOL_14000100_P.O. A.CARDARELLI-CAMPOBASSO_30-39,2 - Personale non Sanitario,14,2021-01-04,PF/BT,14000100_P.O. A.CARDARELLI-CAMPOBASSO,30-39,MOL,ITF2
1,Molise,TML_CAT_ALTRO,04/01/2021_PF/BT_MOL_14000301_P.O.ISERNIA_30-39,2 - Personale non Sanitario,14,2021-01-04,PF/BT,14000301_P.O.ISERNIA,30-39,MOL,ITF2
1,Molise,TML_CAT_PERSONALE,04/01/2021_PF/BT_MOL_14000301_P.O.ISERNIA_40-49,2 - Personale non Sanitario,14,2021-01-04,PF/BT,14000301_P.O.ISERNIA,40-49,MOL,ITF2
3,Molise,TML_CAT_ALTRO,04/01/2021_PF/BT_MOL_14000301_P.O.ISERNIA_40-49,2 - Personale non Sanitario,14,2021-01-04,PF/BT,14000301_P.O.ISERNIA,40-49,MOL,ITF2
4,Molise,TML_CAT_ALTRO,04/01/2021_PF/BT_MOL_14000200_P.O. SAN TIMOTEO - TERMOLI_50-59,2 - Personale non Sanitario,14,2021-01-04,PF/BT,14000200_P.O. SAN TIMOTEO - TERMOLI,50-59,MOL,ITF2
4,Molise,TML_CAT_ALTRO,04/01/2021_PF/BT_MOL_14000301_P.O.ISERNIA_50-59,2 - Personale non Sanitario,14,2021-01-04,PF/BT,14000301_P.O.ISERNIA,50-59,MOL,ITF2
1,Molise,TML_CAT_ALTRO,04/01/2021_PF/BT_MOL_14000200_P.O. SAN TIMOTEO - TERMOLI_60-69,2 - Personale non Sanitario,14,2021-01-04,PF/BT,14000200_P.O. SAN TIMOTEO - TERMOLI,60-69,MOL,ITF2
1,Molise,TML_CAT_PERSONALE,04/01/2021_PF/BT_MOL_14000301_P.O.ISERNIA_60-69,2 - Personale non Sanitario,14,2021-01-04,PF/BT,14000301_P.O.ISERNIA,60-69,MOL,ITF2
11,Molise,TML_CAT_OSS,05/01/2021_PF/BT_MOL_14000100_P.O. A.CARDARELLI-CAMPOBASSO_20-29,1 - Operatori Sanitari e Sociosanitari,14,2021-01-05,PF/BT,14000100_P.O. A.CARDARELLI-CAMPOBASSO,20-29,MOL,ITF2
6,Molise,TML_CAT_OSS,05/01/2021_PF/BT_MOL_14000200_P.O. SAN TIMOTEO - TERMOLI_20-29,1 - Operatori Sanitari e Sociosanitari,14,2021-01-05,PF/BT,14000200_P.O. SAN TIMOTEO - TERMOLI,20-29,MOL,ITF2
32,Molise,TML_CAT_OSS,05/01/2021_PF/BT_MOL_14000100_P.O. A.CARDARELLI-CAMPOBASSO_30-39,1 - Operatori Sanitari e Sociosanitari,14,2021-01-05,PF/BT,14000100_P.O. A.CARDARELLI-CAMPOBASSO,30-39,MOL,ITF2
21,Molise,TML_CAT_OSS,05/01/2021_PF/BT_MOL_14000200_P.O. SAN TIMOTEO - TERMOLI_30-39,1 - Operatori Sanitari e Sociosanitari,14,2021-01-05,PF/BT,14000200_P.O. SAN TIMOTEO - TERMOLI,30-39,MOL,ITF2
4,Molise,TML_CAT_OSS,05/01/2021_PF/BT_MOL_14000301_P.O.ISERNIA_30-39,1 - Operatori Sanitari e Sociosanitari,14,2021-01-05,PF/BT,14000301_P.O.ISERNIA,30-39,MOL,ITF2
47,Molise,TML_CAT_OSS,05/01/2021_PF/BT_MOL_14000100_P.O. A.CARDARELLI-CAMPOBASSO_40-49,1 - Operatori Sanitari e Sociosanitari,14,2021-01-05,PF/BT,14000100_P.O. A.CARDARELLI-CAMPOBASSO,40-49,MOL,ITF2
41,Molise,TML_CAT_OSS,05/01/2021_PF/BT_MOL_14000200_P.O. SAN TIMOTEO - TERMOLI_40-49,1 - Operatori Sanitari e Sociosanitari,14,2021-01-05,PF/BT,14000200_P.O. SAN TIMOTEO - TERMOLI,40-49,MOL,ITF2
16,Molise,TML_CAT_OSS,05/01/2021_PF/BT_MOL_14000301_P.O.ISERNIA_40-49,1 - Operatori Sanitari e Sociosanitari,14,2021-01-05,PF/BT,14000301_P.O.ISERNIA,40-49,MOL,ITF2
58,Molise,TML_CAT_OSS,05/01/2021_PF/BT_MOL_14000100_P.O. A.CARDARELLI-CAMPOBASSO_50-59,1 - Operatori Sanitari e Sociosanitari,14,2021-01-05,PF/BT,14000100_P.O. A.CARDARELLI-CAMPOBASSO,50-59,MOL,ITF2
69,Molise,TML_CAT_OSS,05/01/2021_PF/BT_MOL_14000200_P.O. SAN TIMOTEO - TERMOLI_50-59,1 - Operatori Sanitari e Sociosanitari,14,2021-01-05,PF/BT,14000200_P.O. SAN TIMOTEO - TERMOLI,50-59,MOL,ITF2
34,Molise,TML_CAT_OSS,05/01/2021_PF/BT_MOL_14000301_P.O.ISERNIA_50-59,1 - Operatori Sanitari e Sociosanitari,14,2021-01-05,PF/BT,14000301_P.O.ISERNIA,50-59,MOL,ITF2
38,Molise,TML_CAT_OSS,05/01/2021_PF/BT_MOL_14000100_P.O. A.CARDARELLI-CAMPOBASSO_60-69,1 - Operatori Sanitari e Sociosanitari,14,2021-01-05,PF/BT,14000100_P.O. A.CARDARELLI-CAMPOBASSO,60-69,MOL,ITF2
34,Molise,TML_CAT_OSS,05/01/2021_PF/BT_MOL_14000200_P.O. SAN TIMOTEO - TERMOLI_60-69,1 - Operatori Sanitari e Sociosanitari,14,2021-01-05,PF/BT,14000200_P.O. SAN TIMOTEO - TERMOLI,60-69,MOL,ITF2
28,Molise,TML_CAT_OSS,05/01/2021_PF/BT_MOL_14000301_P.O.ISERNIA_60-69,1 - Operatori Sanitari e Sociosanitari,14,2021-01-05,PF/BT,14000301_P.O.ISERNIA,60-69,MOL,ITF2
1,Molise,TML_CAT_OSS,05/01/2021_PF/BT_MOL_14000200_P.O. SAN TIMOTEO - TERMOLI_70-79,1 - Operatori Sanitari e Sociosanitari,14,2021-01-05,PF/BT,14000200_P.O. SAN TIMOTEO - TERMOLI,70-79,MOL,ITF2
4,Molise,TML_CAT_ALTRO,05/01/2021_PF/BT_MOL_14000301_P.O.ISERNIA_40-49,2 - Personale non Sanitario,14,2021-01-05,PF/BT,14000301_P.O.ISERNIA,40-49,MOL,ITF2
1,Molise,TML_CAT_ALTRO,05/01/2021_PF/BT_MOL_14000100_P.O. A.CARDARELLI-CAMPOBASSO_50-59,2 - Personale non Sanitario,14,2021-01-05,PF/BT,14000100_P.O. A.CARDARELLI-CAMPOBASSO,50-59,MOL,ITF2
2,Molise,TML_CAT_ALTRO,05/01/2021_PF/BT_MOL_14000301_P.O.ISERNIA_50-59,2 - Personale non Sanitario,14,2021-01-05,PF/BT,14000301_P.O.ISERNIA,50-59,MOL,ITF2
1,Molise,TML_CAT_ALTRO,05/01/2021_PF/BT_MOL_14000301_P.O.ISERNIA_60-69,2 - Personale non Sanitario,14,2021-01-05,PF/BT,14000301_P.O.ISERNIA,60-69,MOL,ITF2
19,Molise,TML_CAT_OSS,06/01/2021_PF/BT_MOL_14000100_P.O. A.CARDARELLI-CAMPOBASSO_20-29,1 - Operatori Sanitari e Sociosanitari,14,2021-01-06,PF/BT,14000100_P.O. A.CARDARELLI-CAMPOBASSO,20-29,MOL,ITF2
10,Molise,TML_CAT_OSS,06/01/2021_PF/BT_MOL_14000200_P.O. SAN TIMOTEO - TERMOLI_20-29,1 - Operatori Sanitari e Sociosanitari,14,2021-01-06,PF/BT,14000200_P.O. SAN TIMOTEO - TERMOLI,20-29,MOL,ITF2
2,Molise,TML_CAT_OSS,06/01/2021_PF/BT_MOL_14000301_P.O.ISERNIA_20-29,1 - Operatori Sanitari e Sociosanitari,14,2021-01-06,PF/BT,14000301_P.O.ISERNIA,20-29,MOL,ITF2
38,Molise,TML_CAT_OSS,06/01/2021_PF/BT_MOL_14000100_P.O. A.CARDARELLI-CAMPOBASSO_30-39,1 - Operatori Sanitari e Sociosanitari,14,2021-01-06,PF/BT,14000100_P.O. A.CARDARELLI-CAMPOBASSO,30-39,MOL,ITF2
28,Molise,TML_CAT_OSS,06/01/2021_PF/BT_MOL_14000200_P.O. SAN TIMOTEO - TERMOLI_30-39,1 - Operatori Sanitari e Sociosanitari,14,2021-01-06,PF/BT,14000200_P.O. SAN TIMOTEO - TERMOLI,30-39,MOL,ITF2
9,Molise,TML_CAT_OSS,06/01/2021_PF/BT_MOL_14000301_P.O.ISERNIA_30-39,1 - Operatori Sanitari e Sociosanitari,14,2021-01-06,PF/BT,14000301_P.O.ISERNIA,30-39,MOL,ITF2
1,Molise,TML_CAT_OSS,06/01/2021_PF/BT_MOL_140201_CASA DI RIPOSO LA RESIDENZA DE SAGGI MONTERODUNI (IS)_30-39,1 - Operatori Sanitari e Sociosanitari,14,2021-01-06,PF/BT,140201_CASA DI RIPOSO LA RESIDENZA DE SAGGI MONTERODUNI (IS),30-39,MOL,ITF2
46,Molise,TML_CAT_OSS,06/01/2021_PF/BT_MOL_14000100_P.O. A.CARDARELLI-CAMPOBASSO_40-49,1 - Operatori Sanitari e Sociosanitari,14,2021-01-06,PF/BT,14000100_P.O. A.CARDARELLI-CAMPOBASSO,40-49,MOL,ITF2
24,Molise,TML_CAT_OSS,06/01/2021_PF/BT_MOL_14000200_P.O. SAN TIMOTEO - TERMOLI_40-49,1 - Operatori Sanitari e Sociosanitari,14,2021-01-06,PF/BT,14000200_P.O. SAN TIMOTEO - TERMOLI,40-49,MOL,ITF2
22,Molise,TML_CAT_OSS,06/01/2021_PF/BT_MOL_14000301_P.O.ISERNIA_40-49,1 - Operatori Sanitari e Sociosanitari,14,2021-01-06,PF/BT,14000301_P.O.ISERNIA,40-49,MOL,ITF2
2,Molise,TML_CAT_OSS,06/01/2021_PF/BT_MOL_140201_CASA DI RIPOSO LA RESIDENZA DE SAGGI MONTERODUNI (IS)_40-49,1 - Operatori Sanitari e Sociosanitari,14,2021-01-06,PF/BT,140201_CASA DI RIPOSO LA RESIDENZA DE SAGGI MONTERODUNI (IS),40-49,MOL,ITF2
56,Molise,TML_CAT_OSS,06/01/2021_PF/BT_MOL_14000100_P.O. A.CARDARELLI-CAMPOBASSO_50-59,1 - Operatori Sanitari e Sociosanitari,14,2021-01-06,PF/BT,14000100_P.O. A.CARDARELLI-CAMPOBASSO,50-59,MOL,ITF2
53,Molise,TML_CAT_OSS,06/01/2021_PF/BT_MOL_14000200_P.O. SAN TIMOTEO - TERMOLI_50-59,1 - Operatori Sanitari e Sociosanitari,14,2021-01-06,PF/BT,14000200_P.O. SAN TIMOTEO - TERMOLI,50-59,MOL,ITF2
24,Molise,TML_CAT_OSS,06/01/2021_PF/BT_MOL_14000301_P.O.ISERNIA_50-59,1 - Operatori Sanitari e Sociosanitari,14,2021-01-06,PF/BT,14000301_P.O.ISERNIA,50-59,MOL,ITF2
3,Molise,TML_CAT_OSS,06/01/2021_PF/BT_MOL_140201_CASA DI RIPOSO DON CARLO PISTILLI CB_50-59,1 - Operatori Sanitari e Sociosanitari,14,2021-01-06,PF/BT,140201_CASA DI RIPOSO DON CARLO PISTILLI CB,50-59,MOL,ITF2
1,Molise,TML_CAT_OSS,06/01/2021_PF/BT_MOL_140201_CASA DI RIPOSO LA RESIDENZA DE SAGGI MONTERODUNI (IS)_50-59,1 - Operatori Sanitari e Sociosanitari,14,2021-01-06,PF/BT,140201_CASA DI RIPOSO LA RESIDENZA DE SAGGI MONTERODUNI (IS),50-59,MOL,ITF2
41,Molise,TML_CAT_OSS,06/01/2021_PF/BT_MOL_14000100_P.O. A.CARDARELLI-CAMPOBASSO_60-69,1 - Operatori Sanitari e Sociosanitari,14,2021-01-06,PF/BT,14000100_P.O. A.CARDARELLI-CAMPOBASSO,60-69,MOL,ITF2
32,Molise,TML_CAT_OSS,06/01/2021_PF/BT_MOL_14000200_P.O. SAN TIMOTEO - TERMOLI_60-69,1 - Operatori Sanitari e Sociosanitari,14,2021-01-06,PF/BT,14000200_P.O. SAN TIMOTEO - TERMOLI,60-69,MOL,ITF2
28,Molise,TML_CAT_OSS,06/01/2021_PF/BT_MOL_14000301_P.O.ISERNIA_60-69,1 - Operatori Sanitari e Sociosanitari,14,2021-01-06,PF/BT,14000301_P.O.ISERNIA,60-69,MOL,ITF2
2,Molise,TML_CAT_OSS,06/01/2021_PF/BT_MOL_140201_CASA DI RIPOSO DON CARLO PISTILLI CB_60-69,1 - Operatori Sanitari e Sociosanitari,14,2021-01-06,PF/BT,140201_CASA DI RIPOSO DON CARLO PISTILLI CB,60-69,MOL,ITF2
2,Molise,TML_CAT_OSS,06/01/2021_PF/BT_MOL_14000200_P.O. SAN TIMOTEO - TERMOLI_70-79,1 - Operatori Sanitari e Sociosanitari,14,2021-01-06,PF/BT,14000200_P.O. SAN TIMOTEO - TERMOLI,70-79,MOL,ITF2
1,Molise,TML_CAT_PERSONALE,06/01/2021_PF/BT_MOL_14000100_P.O. A.CARDARELLI-CAMPOBASSO_16-19,2 - Personale non Sanitario,14,2021-01-06,PF/BT,14000100_P.O. A.CARDARELLI-CAMPOBASSO,16-19,MOL,ITF2
2,Molise,TML_CAT_PERSONALE,06/01/2021_PF/BT_MOL_14000100_P.O. A.CARDARELLI-CAMPOBASSO_20-29,2 - Personale non Sanitario,14,2021-01-06,PF/BT,14000100_P.O. A.CARDARELLI-CAMPOBASSO,20-29,MOL,ITF2
1,Molise,TML_CAT_PERSONALE,06/01/2021_PF/BT_MOL_140201_CASA DI RIPOSO LA RESIDENZA DE SAGGI MONTERODUNI (IS)_20-29,2 - Personale non Sanitario,14,2021-01-06,PF/BT,140201_CASA DI RIPOSO LA RESIDENZA DE SAGGI MONTERODUNI (IS),20-29,MOL,ITF2
1,Molise,TML_CAT_PERSONALE,06/01/2021_PF/BT_MOL_14000100_P.O. A.CARDARELLI-CAMPOBASSO_30-39,2 - Personale non Sanitario,14,2021-01-06,PF/BT,14000100_P.O. A.CARDARELLI-CAMPOBASSO,30-39,MOL,ITF2
1,Molise,TML_CAT_ALTRO,06/01/2021_PF/BT_MOL_14000200_P.O. SAN TIMOTEO - TERMOLI_30-39,2 - Personale non Sanitario,14,2021-01-06,PF/BT,14000200_P.O. SAN TIMOTEO - TERMOLI,30-39,MOL,ITF2
1,Molise,TML_CAT_ALTRO,06/01/2021_PF/BT_MOL_14000301_P.O.ISERNIA_30-39,2 - Personale non Sanitario,14,2021-01-06,PF/BT,14000301_P.O.ISERNIA,30-39,MOL,ITF2
1,Molise,TML_CAT_PERSONALE,06/01/2021_PF/BT_MOL_140201_CASA DI RIPOSO VILLA SANTA MARIA MONTENERO DI BISACCIA (CB)_30-39,2 - Personale non Sanitario,14,2021-01-06,PF/BT,140201_CASA DI RIPOSO VILLA SANTA MARIA MONTENERO DI BISACCIA (CB),30-39,MOL,ITF2
1,Molise,TML_CAT_PERSONALE,06/01/2021_PF/BT_MOL_14000100_P.O. A.CARDARELLI-CAMPOBASSO_40-49,2 - Personale non Sanitario,14,2021-01-06,PF/BT,14000100_P.O. A.CARDARELLI-CAMPOBASSO,40-49,MOL,ITF2
1,Molise,TML_CAT_ALTRO,06/01/2021_PF/BT_MOL_14000200_P.O. SAN TIMOTEO - TERMOLI_40-49,2 - Personale non Sanitario,14,2021-01-06,PF/BT,14000200_P.O. SAN TIMOTEO - TERMOLI,40-49,MOL,ITF2
2,Molise,TML_CAT_PERSONALE,06/01/2021_PF/BT_MOL_14000200_P.O. SAN TIMOTEO - TERMOLI_40-49,2 - Personale non Sanitario,14,2021-01-06,PF/BT,14000200_P.O. SAN TIMOTEO - TERMOLI,40-49,MOL,ITF2
1,Molise,TML_CAT_PERSONALE,06/01/2021_PF/BT_MOL_14000301_P.O.ISERNIA_40-49,2 - Personale non Sanitario,14,2021-01-06,PF/BT,14000301_P.O.ISERNIA,40-49,MOL,ITF2
1,Molise,TML_CAT_ALTRO,06/01/2021_PF/BT_MOL_14000100_P.O. A.CARDARELLI-CAMPOBASSO_50-59,2 - Personale non Sanitario,14,2021-01-06,PF/BT,14000100_P.O. A.CARDARELLI-CAMPOBASSO,50-59,MOL,ITF2
2,Molise,TML_CAT_PERSONALE,06/01/2021_PF/BT_MOL_14000100_P.O. A.CARDARELLI-CAMPOBASSO_50-59,2 - Personale non Sanitario,14,2021-01-06,PF/BT,14000100_P.O. A.CARDARELLI-CAMPOBASSO,50-59,MOL,ITF2
5,Molise,TML_CAT_PERSONALE,06/01/2021_PF/BT_MOL_14000200_P.O. SAN TIMOTEO - TERMOLI_50-59,2 - Personale non Sanitario,14,2021-01-06,PF/BT,14000200_P.O. SAN TIMOTEO - TERMOLI,50-59,MOL,ITF2
2,Molise,TML_CAT_ALTRO,06/01/2021_PF/BT_MOL_14000301_P.O.ISERNIA_50-59,2 - Personale non Sanitario,14,2021-01-06,PF/BT,14000301_P.O.ISERNIA,50-59,MOL,ITF2
2,Molise,TML_CAT_PERSONALE,06/01/2021_PF/BT_MOL_140201_CASA DI RIPOSO DON CARLO PISTILLI CB_50-59,2 - Personale non Sanitario,14,2021-01-06,PF/BT,140201_CASA DI RIPOSO DON CARLO PISTILLI CB,50-59,MOL,ITF2
4,Molise,TML_CAT_PERSONALE,06/01/2021_PF/BT_MOL_140201_CASA DI RIPOSO LA RESIDENZA DE SAGGI MONTERODUNI (IS)_50-59,2 - Personale non Sanitario,14,2021-01-06,PF/BT,140201_CASA DI RIPOSO LA RESIDENZA DE SAGGI MONTERODUNI (IS),50-59,MOL,ITF2
1,Molise,TML_CAT_PERSONALE,06/01/2021_PF/BT_MOL_140201_CASA DI RIPOSO VILLA SANTA MARIA MONTENERO DI BISACCIA (CB)_50-59,2 - Personale non Sanitario,14,2021-01-06,PF/BT,140201_CASA DI RIPOSO VILLA SANTA MARIA MONTENERO DI BISACCIA (CB),50-59,MOL,ITF2
1,Molise,TML_CAT_PERSONALE,06/01/2021_PF/BT_MOL_14000100_P.O. A.CARDARELLI-CAMPOBASSO_60-69,2 - Personale non Sanitario,14,2021-01-06,PF/BT,14000100_P.O. A.CARDARELLI-CAMPOBASSO,60-69,MOL,ITF2
1,Molise,TML_CAT_PERSONALE,06/01/2021_PF/BT_MOL_14000200_P.O. SAN TIMOTEO - TERMOLI_60-69,2 - Personale non Sanitario,14,2021-01-06,PF/BT,14000200_P.O. SAN TIMOTEO - TERMOLI,60-69,MOL,ITF2
2,Molise,TML_CAT_PERSONALE,06/01/2021_PF/BT_MOL_140201_CASA DI RIPOSO VILLA SANTA MARIA MONTENERO DI BISACCIA (CB)_60-69,2 - Personale non Sanitario,14,2021-01-06,PF/BT,140201_CASA DI RIPOSO VILLA SANTA MARIA MONTENERO DI BISACCIA (CB),60-69,MOL,ITF2
1,Molise,TML_CAT_PERSONALE,06/01/2021_PF/BT_MOL_14000200_P.O. SAN TIMOTEO - TERMOLI_70-79,2 - Personale non Sanitario,14,2021-01-06,PF/BT,14000200_P.O. SAN TIMOTEO - TERMOLI,70-79,MOL,ITF2
2,Molise,TML_CAT_ALTRO,06/01/2021_PF/BT_MOL_140201_CASA DI RIPOSO VILLA SANTA MARIA MONTENERO DI BISACCIA (CB)_70-79,2 - Personale non Sanitario,14,2021-01-06,PF/BT,140201_CASA DI RIPOSO VILLA SANTA MARIA MONTENERO DI BISACCIA (CB),70-79,MOL,ITF2
1,Molise,TML_CAT_PERSONALE,06/01/2021_PF/BT_MOL_14000200_P.O. SAN TIMOTEO - TERMOLI_80-89,2 - Personale non Sanitario,14,2021-01-06,PF/BT,14000200_P.O. SAN TIMOTEO - TERMOLI,80-89,MOL,ITF2
1,Molise,TML_CAT_ALTRO,06/01/2021_PF/BT_MOL_140201_CASA DI RIPOSO DON CARLO PISTILLI CB_80-89,2 - Personale non Sanitario,14,2021-01-06,PF/BT,140201_CASA DI RIPOSO DON CARLO PISTILLI CB,80-89,MOL,ITF2
2,Molise,TML_CAT_PERSONALE,06/01/2021_PF/BT_MOL_140201_CASA DI RIPOSO VILLA SANTA MARIA MONTENERO DI BISACCIA (CB)_80-89,2 - Personale non Sanitario,14,2021-01-06,PF/BT,140201_CASA DI RIPOSO VILLA SANTA MARIA MONTENERO DI BISACCIA (CB),80-89,MOL,ITF2
10,Molise,TML_CAT_ALTRO,06/01/2021_PF/BT_MOL_140201_CASA DI RIPOSO VILLA SANTA MARIA MONTENERO DI BISACCIA (CB)_80-89,2 - Personale non Sanitario,14,2021-01-06,PF/BT,140201_CASA DI RIPOSO VILLA SANTA MARIA MONTENERO DI BISACCIA (CB),80-89,MOL,ITF2
5,Molise,TML_CAT_ALTRO,06/01/2021_PF/BT_MOL_140201_CASA DI RIPOSO VILLA SANTA MARIA MONTENERO DI BISACCIA (CB)_90+,2 - Personale non Sanitario,14,2021-01-06,PF/BT,140201_CASA DI RIPOSO VILLA SANTA MARIA MONTENERO DI BISACCIA (CB),90+,MOL,ITF2
3,Molise,TML_CAT_RSA_OSPITI,06/01/2021_PF/BT_MOL_140201_CASA DI RIPOSO LA RESIDENZA DE SAGGI MONTERODUNI (IS)_60-69,3 - Ospiti Strutture Residenziali,14,2021-01-06,PF/BT,140201_CASA DI RIPOSO LA RESIDENZA DE SAGGI MONTERODUNI (IS),60-69,MOL,ITF2
5,Molise,TML_CAT_RSA_OSPITI,06/01/2021_PF/BT_MOL_140201_CASA DI RIPOSO DON CARLO PISTILLI CB_70-79,3 - Ospiti Strutture Residenziali,14,2021-01-06,PF/BT,140201_CASA DI RIPOSO DON CARLO PISTILLI CB,70-79,MOL,ITF2
7,Molise,TML_CAT_RSA_OSPITI,06/01/2021_PF/BT_MOL_140201_CASA DI RIPOSO LA RESIDENZA DE SAGGI MONTERODUNI (IS)_70-79,3 - Ospiti Strutture Residenziali,14,2021-01-06,PF/BT,140201_CASA DI RIPOSO LA RESIDENZA DE SAGGI MONTERODUNI (IS),70-79,MOL,ITF2
7,Molise,TML_CAT_RSA_OSPITI,06/01/2021_PF/BT_MOL_140201_CASA DI RIPOSO VILLA SANTA MARIA MONTENERO DI BISACCIA (CB)_70-79,3 - Ospiti Strutture Residenziali,14,2021-01-06,PF/BT,140201_CASA DI RIPOSO VILLA SANTA MARIA MONTENERO DI BISACCIA (CB),70-79,MOL,ITF2
30,Molise,TML_CAT_RSA_OSPITI,06/01/2021_PF/BT_MOL_140201_CASA DI RIPOSO DON CARLO PISTILLI CB_80-89,3 - Ospiti Strutture Residenziali,14,2021-01-06,PF/BT,140201_CASA DI RIPOSO DON CARLO PISTILLI CB,80-89,MOL,ITF2
15,Molise,TML_CAT_RSA_OSPITI,06/01/2021_PF/BT_MOL_140201_CASA DI RIPOSO LA RESIDENZA DE SAGGI MONTERODUNI (IS)_80-89,3 - Ospiti Strutture Residenziali,14,2021-01-06,PF/BT,140201_CASA DI RIPOSO LA RESIDENZA DE SAGGI MONTERODUNI (IS),80-89,MOL,ITF2
30,Molise,TML_CAT_RSA_OSPITI,06/01/2021_PF/BT_MOL_140201_CASA DI RIPOSO VILLA SANTA MARIA MONTENERO DI BISACCIA (CB)_80-89,3 - Ospiti Strutture Residenziali,14,2021-01-06,PF/BT,140201_CASA DI RIPOSO VILLA SANTA MARIA MONTENERO DI BISACCIA (CB),80-89,MOL,ITF2
36,Molise,TML_CAT_RSA_OSPITI,06/01/2021_PF/BT_MOL_140201_CASA DI RIPOSO DON CARLO PISTILLI CB_90+,3 - Ospiti Strutture Residenziali,14,2021-01-06,PF/BT,140201_CASA DI RIPOSO DON CARLO PISTILLI CB,90+,MOL,ITF2
15,Molise,TML_CAT_RSA_OSPITI,06/01/2021_PF/BT_MOL_140201_CASA DI RIPOSO LA RESIDENZA DE SAGGI MONTERODUNI (IS)_90+,3 - Ospiti Strutture Residenziali,14,2021-01-06,PF/BT,140201_CASA DI RIPOSO LA RESIDENZA DE SAGGI MONTERODUNI (IS),90+,MOL,ITF2
33,Molise,TML_CAT_RSA_OSPITI,06/01/2021_PF/BT_MOL_140201_CASA DI RIPOSO VILLA SANTA MARIA MONTENERO DI BISACCIA (CB)_90+,3 - Ospiti Strutture Residenziali,14,2021-01-06,PF/BT,140201_CASA DI RIPOSO VILLA SANTA MARIA MONTENERO DI BISACCIA (CB),90+,MOL,ITF2
8,Molise,TML_CAT_OSS,07/01/2021_PF/BT_MOL_14000100_P.O. A.CARDARELLI-CAMPOBASSO_20-29,1 - Operatori Sanitari e Sociosanitari,14,2021-01-07,PF/BT,14000100_P.O. A.CARDARELLI-CAMPOBASSO,20-29,MOL,ITF2
2,Molise,TML_CAT_OSS,07/01/2021_PF/BT_MOL_14000200_P.O TIMOTEO- TERMOLI_20-29,1 - Operatori Sanitari e Sociosanitari,14,2021-01-07,PF/BT,14000200_P.O TIMOTEO- TERMOLI,20-29,MOL,ITF2
7,Molise,TML_CAT_OSS,07/01/2021_PF/BT_MOL_14000301_P.O. ISERNIA_20-29,1 - Operatori Sanitari e Sociosanitari,14,2021-01-07,PF/BT,14000301_P.O. ISERNIA,20-29,MOL,ITF2
1,Molise,TML_CAT_OSS,07/01/2021_PF/BT_MOL_140201_Casa Di Riposo Villa Anna_20-29,1 - Operatori Sanitari e Sociosanitari,14,2021-01-07,PF/BT,140201_Casa Di Riposo Villa Anna,20-29,MOL,ITF2
1,Molise,TML_CAT_OSS,07/01/2021_PF/BT_MOL_140201_Villa Le Ginestre Casa Di Riposo Per Anziani_20-29,1 - Operatori Sanitari e Sociosanitari,14,2021-01-07,PF/BT,140201_Villa Le Ginestre Casa Di Riposo Per Anziani,20-29,MOL,ITF2
25,Molise,TML_CAT_OSS,07/01/2021_PF/BT_MOL_14000100_P.O. A.CARDARELLI-CAMPOBASSO_30-39,1 - Operatori Sanitari e Sociosanitari,14,2021-01-07,PF/BT,14000100_P.O. A.CARDARELLI-CAMPOBASSO,30-39,MOL,ITF2
8,Molise,TML_CAT_OSS,07/01/2021_PF/BT_MOL_14000200_P.O TIMOTEO- TERMOLI_30-39,1 - Operatori Sanitari e Sociosanitari,14,2021-01-07,PF/BT,14000200_P.O TIMOTEO- TERMOLI,30-39,MOL,ITF2
18,Molise,TML_CAT_OSS,07/01/2021_PF/BT_MOL_14000301_P.O. ISERNIA_30-39,1 - Operatori Sanitari e Sociosanitari,14,2021-01-07,PF/BT,14000301_P.O. ISERNIA,30-39,MOL,ITF2
32,Molise,TML_CAT_OSS,07/01/2021_PF/BT_MOL_14000100_P.O. A.CARDARELLI-CAMPOBASSO_40-49,1 - Operatori Sanitari e Sociosanitari,14,2021-01-07,PF/BT,14000100_P.O. A.CARDARELLI-CAMPOBASSO,40-49,MOL,ITF2
26,Molise,TML_CAT_OSS,07/01/2021_PF/BT_MOL_14000200_P.O TIMOTEO- TERMOLI_40-49,1 - Operatori Sanitari e Sociosanitari,14,2021-01-07,PF/BT,14000200_P.O TIMOTEO- TERMOLI,40-49,MOL,ITF2
20,Molise,TML_CAT_OSS,07/01/2021_PF/BT_MOL_14000301_P.O. ISERNIA_40-49,1 - Operatori Sanitari e Sociosanitari,14,2021-01-07,PF/BT,14000301_P.O. ISERNIA,40-49,MOL,ITF2
1,Molise,TML_CAT_OSS,07/01/2021_PF/BT_MOL_140201_Casa Di Riposo Villa Anna_40-49,1 - Operatori Sanitari e Sociosanitari,14,2021-01-07,PF/BT,140201_Casa Di Riposo Villa Anna,40-49,MOL,ITF2
1,Molise,TML_CAT_OSS,07/01/2021_PF/BT_MOL_140201_Villa Le Ginestre Casa Di Riposo Per Anziani_40-49,1 - Operatori Sanitari e Sociosanitari,14,2021-01-07,PF/BT,140201_Villa Le Ginestre Casa Di Riposo Per Anziani,40-49,MOL,ITF2
59,Molise,TML_CAT_OSS,07/01/2021_PF/BT_MOL_14000100_P.O. A.CARDARELLI-CAMPOBASSO_50-59,1 - Operatori Sanitari e Sociosanitari,14,2021-01-07,PF/BT,14000100_P.O. A.CARDARELLI-CAMPOBASSO,50-59,MOL,ITF2
49,Molise,TML_CAT_OSS,07/01/2021_PF/BT_MOL_14000200_P.O TIMOTEO- TERMOLI_50-59,1 - Operatori Sanitari e Sociosanitari,14,2021-01-07,PF/BT,14000200_P.O TIMOTEO- TERMOLI,50-59,MOL,ITF2
35,Molise,TML_CAT_OSS,07/01/2021_PF/BT_MOL_14000301_P.O. ISERNIA_50-59,1 - Operatori Sanitari e Sociosanitari,14,2021-01-07,PF/BT,14000301_P.O. ISERNIA,50-59,MOL,ITF2
2,Molise,TML_CAT_OSS,07/01/2021_PF/BT_MOL_140201_Casa Di Riposo Villa Anna_50-59,1 - Operatori Sanitari e Sociosanitari,14,2021-01-07,PF/BT,140201_Casa Di Riposo Villa Anna,50-59,MOL,ITF2
31,Molise,TML_CAT_OSS,07/01/2021_PF/BT_MOL_14000100_P.O. A.CARDARELLI-CAMPOBASSO_60-69,1 - Operatori Sanitari e Sociosanitari,14,2021-01-07,PF/BT,14000100_P.O. A.CARDARELLI-CAMPOBASSO,60-69,MOL,ITF2
38,Molise,TML_CAT_OSS,07/01/2021_PF/BT_MOL_14000200_P.O TIMOTEO- TERMOLI_60-69,1 - Operatori Sanitari e Sociosanitari,14,2021-01-07,PF/BT,14000200_P.O TIMOTEO- TERMOLI,60-69,MOL,ITF2
21,Molise,TML_CAT_OSS,07/01/2021_PF/BT_MOL_14000301_P.O. ISERNIA_60-69,1 - Operatori Sanitari e Sociosanitari,14,2021-01-07,PF/BT,14000301_P.O. ISERNIA,60-69,MOL,ITF2
1,Molise,TML_CAT_OSS,07/01/2021_PF/BT_MOL_14000100_P.O. A.CARDARELLI-CAMPOBASSO_70-79,1 - Operatori Sanitari e Sociosanitari,14,2021-01-07,PF/BT,14000100_P.O. A.CARDARELLI-CAMPOBASSO,70-79,MOL,ITF2
3,Molise,TML_CAT_PERSONALE,07/01/2021_PF/BT_MOL_14000100_P.O. A.CARDARELLI-CAMPOBASSO_20-29,2 - Personale non Sanitario,14,2021-01-07,PF/BT,14000100_P.O. A.CARDARELLI-CAMPOBASSO,20-29,MOL,ITF2
3,Molise,TML_CAT_PERSONALE,07/01/2021_PF/BT_MOL_14000200_P.O TIMOTEO- TERMOLI_20-29,2 - Personale non Sanitario,14,2021-01-07,PF/BT,14000200_P.O TIMOTEO- TERMOLI,20-29,MOL,ITF2
1,Molise,TML_CAT_PERSONALE,07/01/2021_PF/BT_MOL_14000301_P.O. ISERNIA_20-29,2 - Personale non Sanitario,14,2021-01-07,PF/BT,14000301_P.O. ISERNIA,20-29,MOL,ITF2
1,Molise,TML_CAT_ALTRO,07/01/2021_PF/BT_MOL_14000100_P.O. A.CARDARELLI-CAMPOBASSO_30-39,2 - Personale non Sanitario,14,2021-01-07,PF/BT,14000100_P.O. A.CARDARELLI-CAMPOBASSO,30-39,MOL,ITF2
4,Molise,TML_CAT_PERSONALE,07/01/2021_PF/BT_MOL_14000100_P.O. A.CARDARELLI-CAMPOBASSO_30-39,2 - Personale non Sanitario,14,2021-01-07,PF/BT,14000100_P.O. A.CARDARELLI-CAMPOBASSO,30-39,MOL,ITF2
1,Molise,TML_CAT_PERSONALE,07/01/2021_PF/BT_MOL_14000200_P.O TIMOTEO- TERMOLI_30-39,2 - Personale non Sanitario,14,2021-01-07,PF/BT,14000200_P.O TIMOTEO- TERMOLI,30-39,MOL,ITF2
4,Molise,TML_CAT_ALTRO,07/01/2021_PF/BT_MOL_14000200_P.O TIMOTEO- TERMOLI_30-39,2 - Personale non Sanitario,14,2021-01-07,PF/BT,14000200_P.O TIMOTEO- TERMOLI,30-39,MOL,ITF2
2,Molise,TML_CAT_PERSONALE,07/01/2021_PF/BT_MOL_14000100_P.O. A.CARDARELLI-CAMPOBASSO_40-49,2 - Personale non Sanitario,14,2021-01-07,PF/BT,14000100_P.O. A.CARDARELLI-CAMPOBASSO,40-49,MOL,ITF2
4,Molise,TML_CAT_ALTRO,07/01/2021_PF/BT_MOL_14000100_P.O. A.CARDARELLI-CAMPOBASSO_40-49,2 - Personale non Sanitario,14,2021-01-07,PF/BT,14000100_P.O. A.CARDARELLI-CAMPOBASSO,40-49,MOL,ITF2
1,Molise,TML_CAT_ALTRO,07/01/2021_PF/BT_MOL_14000200_P.O TIMOTEO- TERMOLI_40-49,2 - Personale non Sanitario,14,2021-01-07,PF/BT,14000200_P.O TIMOTEO- TERMOLI,40-49,MOL,ITF2
4,Molise,TML_CAT_PERSONALE,07/01/2021_PF/BT_MOL_14000200_P.O TIMOTEO- TERMOLI_40-49,2 - Personale non Sanitario,14,2021-01-07,PF/BT,14000200_P.O TIMOTEO- TERMOLI,40-49,MOL,ITF2
2,Molise,TML_CAT_ALTRO,07/01/2021_PF/BT_MOL_14000301_P.O. ISERNIA_40-49,2 - Personale non Sanitario,14,2021-01-07,PF/BT,14000301_P.O. ISERNIA,40-49,MOL,ITF2
1,Molise,TML_CAT_PERSONALE,07/01/2021_PF/BT_MOL_140201_Villa Le Ginestre Casa Di Riposo Per Anziani_40-49,2 - Personale non Sanitario,14,2021-01-07,PF/BT,140201_Villa Le Ginestre Casa Di Riposo Per Anziani,40-49,MOL,ITF2
6,Molise,TML_CAT_ALTRO,07/01/2021_PF/BT_MOL_14000100_P.O. A.CARDARELLI-CAMPOBASSO_50-59,2 - Personale non Sanitario,14,2021-01-07,PF/BT,14000100_P.O. A.CARDARELLI-CAMPOBASSO,50-59,MOL,ITF2
4,Molise,TML_CAT_ALTRO,07/01/2021_PF/BT_MOL_14000200_P.O TIMOTEO- TERMOLI_50-59,2 - Personale non Sanitario,14,2021-01-07,PF/BT,14000200_P.O TIMOTEO- TERMOLI,50-59,MOL,ITF2
5,Molise,TML_CAT_PERSONALE,07/01/2021_PF/BT_MOL_14000200_P.O TIMOTEO- TERMOLI_50-59,2 - Personale non Sanitario,14,2021-01-07,PF/BT,14000200_P.O TIMOTEO- TERMOLI,50-59,MOL,ITF2
2,Molise,TML_CAT_ALTRO,07/01/2021_PF/BT_MOL_14000301_P.O. ISERNIA_50-59,2 - Personale non Sanitario,14,2021-01-07,PF/BT,14000301_P.O. ISERNIA,50-59,MOL,ITF2
2,Molise,TML_CAT_PERSONALE,07/01/2021_PF/BT_MOL_14000301_P.O. ISERNIA_50-59,2 - Personale non Sanitario,14,2021-01-07,PF/BT,14000301_P.O. ISERNIA,50-59,MOL,ITF2
1,Molise,TML_CAT_ALTRO,07/01/2021_PF/BT_MOL_140201_Villa Le Ginestre Casa Di Riposo Per Anziani_50-59,2 - Personale non Sanitario,14,2021-01-07,PF/BT,140201_Villa Le Ginestre Casa Di Riposo Per Anziani,50-59,MOL,ITF2
1,Molise,TML_CAT_PERSONALE,07/01/2021_PF/BT_MOL_14000100_P.O. A.CARDARELLI-CAMPOBASSO_60-69,2 - Personale non Sanitario,14,2021-01-07,PF/BT,14000100_P.O. A.CARDARELLI-CAMPOBASSO,60-69,MOL,ITF2
3,Molise,TML_CAT_ALTRO,07/01/2021_PF/BT_MOL_14000100_P.O. A.CARDARELLI-CAMPOBASSO_60-69,2 - Personale non Sanitario,14,2021-01-07,PF/BT,14000100_P.O. A.CARDARELLI-CAMPOBASSO,60-69,MOL,ITF2
1,Molise,TML_CAT_ALTRO,07/01/2021_PF/BT_MOL_14000200_P.O TIMOTEO- TERMOLI_60-69,2 - Personale non Sanitario,14,2021-01-07,PF/BT,14000200_P.O TIMOTEO- TERMOLI,60-69,MOL,ITF2
1,Molise,TML_CAT_PERSONALE,07/01/2021_PF/BT_MOL_14000200_P.O TIMOTEO- TERMOLI_60-69,2 - Personale non Sanitario,14,2021-01-07,PF/BT,14000200_P.O TIMOTEO- TERMOLI,60-69,MOL,ITF2
1,Molise,TML_CAT_PERSONALE,07/01/2021_PF/BT_MOL_14000200_P.O TIMOTEO- TERMOLI_70-79,2 - Personale non Sanitario,14,2021-01-07,PF/BT,14000200_P.O TIMOTEO- TERMOLI,70-79,MOL,ITF2
3,Molise,TML_CAT_ALTRO,07/01/2021_PF/BT_MOL_140201_Villa Le Ginestre Casa Di Riposo Per Anziani_80-89,2 - Personale non Sanitario,14,2021-01-07,PF/BT,140201_Villa Le Ginestre Casa Di Riposo Per Anziani,80-89,MOL,ITF2
1,Molise,TML_CAT_ALTRO,07/01/2021_PF/BT_MOL_140201_Villa Le Ginestre Casa Di Riposo Per Anziani_90+,2 - Personale non Sanitario,14,2021-01-07,PF/BT,140201_Villa Le Ginestre Casa Di Riposo Per Anziani,90+,MOL,ITF2
1,Molise,TML_CAT_RSA_OSPITI,07/01/2021_PF/BT_MOL_000921_RSA FONDAZIONE OPERA SERENA_50-59,3 - Ospiti Strutture Residenziali,14,2021-01-07,PF/BT,000921_RSA FONDAZIONE OPERA SERENA,50-59,MOL,ITF2
5,Molise,TML_CAT_RSA_OSPITI,07/01/2021_PF/BT_MOL_000921_RSA FONDAZIONE OPERA SERENA_60-69,3 - Ospiti Strutture Residenziali,14,2021-01-07,PF/BT,000921_RSA FONDAZIONE OPERA SERENA,60-69,MOL,ITF2
1,Molise,TML_CAT_RSA_OSPITI,07/01/2021_PF/BT_MOL_140201_Casa Di Riposo Villa Anna_60-69,3 - Ospiti Strutture Residenziali,14,2021-01-07,PF/BT,140201_Casa Di Riposo Villa Anna,60-69,MOL,ITF2
2,Molise,TML_CAT_RSA_OSPITI,07/01/2021_PF/BT_MOL_140201_Villa Le Ginestre Casa Di Riposo Per Anziani_60-69,3 - Ospiti Strutture Residenziali,14,2021-01-07,PF/BT,140201_Villa Le Ginestre Casa Di Riposo Per Anziani,60-69,MOL,ITF2
7,Molise,TML_CAT_RSA_OSPITI,07/01/2021_PF/BT_MOL_000921_RSA FONDAZIONE OPERA SERENA_70-79,3 - Ospiti Strutture Residenziali,14,2021-01-07,PF/BT,000921_RSA FONDAZIONE OPERA SERENA,70-79,MOL,ITF2
2,Molise,TML_CAT_RSA_OSPITI,07/01/2021_PF/BT_MOL_140201_Casa Di Riposo Villa Anna_70-79,3 - Ospiti Strutture Residenziali,14,2021-01-07,PF/BT,140201_Casa Di Riposo Villa Anna,70-79,MOL,ITF2
12,Molise,TML_CAT_RSA_OSPITI,07/01/2021_PF/BT_MOL_140201_Villa Le Ginestre Casa Di Riposo Per Anziani_70-79,3 - Ospiti Strutture Residenziali,14,2021-01-07,PF/BT,140201_Villa Le Ginestre Casa Di Riposo Per Anziani,70-79,MOL,ITF2
28,Molise,TML_CAT_RSA_OSPITI,07/01/2021_PF/BT_MOL_000921_RSA FONDAZIONE OPERA SERENA_80-89,3 - Ospiti Strutture Residenziali,14,2021-01-07,PF/BT,000921_RSA FONDAZIONE OPERA SERENA,80-89,MOL,ITF2
13,Molise,TML_CAT_RSA_OSPITI,07/01/2021_PF/BT_MOL_140201_Casa Di Riposo Villa Anna_80-89,3 - Ospiti Strutture Residenziali,14,2021-01-07,PF/BT,140201_Casa Di Riposo Villa Anna,80-89,MOL,ITF2
16,Molise,TML_CAT_RSA_OSPITI,07/01/2021_PF/BT_MOL_140201_Villa Le Ginestre Casa Di Riposo Per Anziani_80-89,3 - Ospiti Strutture Residenziali,14,2021-01-07,PF/BT,140201_Villa Le Ginestre Casa Di Riposo Per Anziani,80-89,MOL,ITF2
27,Molise,TML_CAT_RSA_OSPITI,07/01/2021_PF/BT_MOL_000921_RSA FONDAZIONE OPERA SERENA_90+,3 - Ospiti Strutture Residenziali,14,2021-01-07,PF/BT,000921_RSA FONDAZIONE OPERA SERENA,90+,MOL,ITF2
16,Molise,TML_CAT_RSA_OSPITI,07/01/2021_PF/BT_MOL_140201_Casa Di Riposo Villa Anna_90+,3 - Ospiti Strutture Residenziali,14,2021-01-07,PF/BT,140201_Casa Di Riposo Villa Anna,90+,MOL,ITF2
16,Molise,TML_CAT_RSA_OSPITI,07/01/2021_PF/BT_MOL_140201_Villa Le Ginestre Casa Di Riposo Per Anziani_90+,3 - Ospiti Strutture Residenziali,14,2021-01-07,PF/BT,140201_Villa Le Ginestre Casa Di Riposo Per Anziani,90+,MOL,ITF2
2,Molise,TML_CAT_OSS,08/01/2021_PF/BT_MOL_14000100_P.O. A.CARDARELLI-CAMPOBASSO_20-29,1 - Operatori Sanitari e Sociosanitari,14,2021-01-08,PF/BT,14000100_P.O. A.CARDARELLI-CAMPOBASSO,20-29,MOL,ITF2
1,Molise,TML_CAT_OSS,08/01/2021_PF/BT_MOL_14000301_P.O. ISERNIA_20-29,1 - Operatori Sanitari e Sociosanitari,14,2021-01-08,PF/BT,14000301_P.O. ISERNIA,20-29,MOL,ITF2
19,Molise,TML_CAT_OSS,08/01/2021_PF/BT_MOL_14000100_P.O. A.CARDARELLI-CAMPOBASSO_30-39,1 - Operatori Sanitari e Sociosanitari,14,2021-01-08,PF/BT,14000100_P.O. A.CARDARELLI-CAMPOBASSO,30-39,MOL,ITF2
1,Molise,TML_CAT_OSS,08/01/2021_PF/BT_MOL_14000200_P.O TIMOTEO- TERMOLI_30-39,1 - Operatori Sanitari e Sociosanitari,14,2021-01-08,PF/BT,14000200_P.O TIMOTEO- TERMOLI,30-39,MOL,ITF2
22,Molise,TML_CAT_OSS,08/01/2021_PF/BT_MOL_14000100_P.O. A.CARDARELLI-CAMPOBASSO_40-49,1 - Operatori Sanitari e Sociosanitari,14,2021-01-08,PF/BT,14000100_P.O. A.CARDARELLI-CAMPOBASSO,40-49,MOL,ITF2
4,Molise,TML_CAT_OSS,08/01/2021_PF/BT_MOL_14000200_P.O TIMOTEO- TERMOLI_40-49,1 - Operatori Sanitari e Sociosanitari,14,2021-01-08,PF/BT,14000200_P.O TIMOTEO- TERMOLI,40-49,MOL,ITF2
17,Molise,TML_CAT_OSS,08/01/2021_PF/BT_MOL_14000301_P.O. ISERNIA_40-49,1 - Operatori Sanitari e Sociosanitari,14,2021-01-08,PF/BT,14000301_P.O. ISERNIA,40-49,MOL,ITF2
1,Molise,TML_CAT_OSS,08/01/2021_PF/BT_MOL_140201_Comunita Alloggio Temenos_40-49,1 - Operatori Sanitari e Sociosanitari,14,2021-01-08,PF/BT,140201_Comunita Alloggio Temenos,40-49,MOL,ITF2
1,Molise,TML_CAT_OSS,08/01/2021_PF/BT_MOL_922_FONDAZIONE PADRE PIO ONLUS R2 CASA MIA IS_40-49,1 - Operatori Sanitari e Sociosanitari,14,2021-01-08,PF/BT,922_FONDAZIONE PADRE PIO ONLUS R2 CASA MIA IS,40-49,MOL,ITF2
43,Molise,TML_CAT_OSS,08/01/2021_PF/BT_MOL_14000100_P.O. A.CARDARELLI-CAMPOBASSO_50-59,1 - Operatori Sanitari e Sociosanitari,14,2021-01-08,PF/BT,14000100_P.O. A.CARDARELLI-CAMPOBASSO,50-59,MOL,ITF2
10,Molise,TML_CAT_OSS,08/01/2021_PF/BT_MOL_14000200_P.O TIMOTEO- TERMOLI_50-59,1 - Operatori Sanitari e Sociosanitari,14,2021-01-08,PF/BT,14000200_P.O TIMOTEO- TERMOLI,50-59,MOL,ITF2
31,Molise,TML_CAT_OSS,08/01/2021_PF/BT_MOL_14000301_P.O. ISERNIA_50-59,1 - Operatori Sanitari e Sociosanitari,14,2021-01-08,PF/BT,14000301_P.O. ISERNIA,50-59,MOL,ITF2
1,Molise,TML_CAT_OSS,08/01/2021_PF/BT_MOL_140201_Comunita Alloggio Temenos_50-59,1 - Operatori Sanitari e Sociosanitari,14,2021-01-08,PF/BT,140201_Comunita Alloggio Temenos,50-59,MOL,ITF2
35,Molise,TML_CAT_OSS,08/01/2021_PF/BT_MOL_14000100_P.O. A.CARDARELLI-CAMPOBASSO_60-69,1 - Operatori Sanitari e Sociosanitari,14,2021-01-08,PF/BT,14000100_P.O. A.CARDARELLI-CAMPOBASSO,60-69,MOL,ITF2
13,Molise,TML_CAT_OSS,08/01/2021_PF/BT_MOL_14000200_P.O TIMOTEO- TERMOLI_60-69,1 - Operatori Sanitari e Sociosanitari,14,2021-01-08,PF/BT,14000200_P.O TIMOTEO- TERMOLI,60-69,MOL,ITF2
30,Molise,TML_CAT_OSS,08/01/2021_PF/BT_MOL_14000301_P.O. ISERNIA_60-69,1 - Operatori Sanitari e Sociosanitari,14,2021-01-08,PF/BT,14000301_P.O. ISERNIA,60-69,MOL,ITF2
1,Molise,TML_CAT_OSS,08/01/2021_PF/BT_MOL_922_FONDAZIONE PADRE PIO ONLUS R2 CASA MIA IS_60-69,1 - Operatori Sanitari e Sociosanitari,14,2021-01-08,PF/BT,922_FONDAZIONE PADRE PIO ONLUS R2 CASA MIA IS,60-69,MOL,ITF2
2,Molise,TML_CAT_OSS,08/01/2021_PF/BT_MOL_922_FONDAZIONE PADRE PIO ONLUS R2 CASA MIA IS_70-79,1 - Operatori Sanitari e Sociosanitari,14,2021-01-08,PF/BT,922_FONDAZIONE PADRE PIO ONLUS R2 CASA MIA IS,70-79,MOL,ITF2
1,Molise,TML_CAT_PERSONALE,08/01/2021_PF/BT_MOL_14000100_P.O. A.CARDARELLI-CAMPOBASSO_16-19,2 - Personale non Sanitario,14,2021-01-08,PF/BT,14000100_P.O. A.CARDARELLI-CAMPOBASSO,16-19,MOL,ITF2
1,Molise,TML_CAT_ALTRO,08/01/2021_PF/BT_MOL_14000100_P.O. A.CARDARELLI-CAMPOBASSO_20-29,2 - Personale non Sanitario,14,2021-01-08,PF/BT,14000100_P.O. A.CARDARELLI-CAMPOBASSO,20-29,MOL,ITF2
2,Molise,TML_CAT_PERSONALE,08/01/2021_PF/BT_MOL_14000100_P.O. A.CARDARELLI-CAMPOBASSO_20-29,2 - Personale non Sanitario,14,2021-01-08,PF/BT,14000100_P.O. A.CARDARELLI-CAMPOBASSO,20-29,MOL,ITF2
1,Molise,TML_CAT_PERSONALE,08/01/2021_PF/BT_MOL_14000200_P.O TIMOTEO- TERMOLI_20-29,2 - Personale non Sanitario,14,2021-01-08,PF/BT,14000200_P.O TIMOTEO- TERMOLI,20-29,MOL,ITF2
1,Molise,TML_CAT_PERSONALE,08/01/2021_PF/BT_MOL_140201_Casa Di Riposo Asilo Senile Argento Vivo_20-29,2 - Personale non Sanitario,14,2021-01-08,PF/BT,140201_Casa Di Riposo Asilo Senile Argento Vivo,20-29,MOL,ITF2
3,Molise,TML_CAT_ALTRO,08/01/2021_PF/BT_MOL_14000100_P.O. A.CARDARELLI-CAMPOBASSO_30-39,2 - Personale non Sanitario,14,2021-01-08,PF/BT,14000100_P.O. A.CARDARELLI-CAMPOBASSO,30-39,MOL,ITF2
1,Molise,TML_CAT_PERSONALE,08/01/2021_PF/BT_MOL_14000200_P.O TIMOTEO- TERMOLI_30-39,2 - Personale non Sanitario,14,2021-01-08,PF/BT,14000200_P.O TIMOTEO- TERMOLI,30-39,MOL,ITF2
1,Molise,TML_CAT_PERSONALE,08/01/2021_PF/BT_MOL_140201_Casa Di Riposo Asilo Senile Argento Vivo_30-39,2 - Personale non Sanitario,14,2021-01-08,PF/BT,140201_Casa Di Riposo Asilo Senile Argento Vivo,30-39,MOL,ITF2
1,Molise,TML_CAT_PERSONALE,08/01/2021_PF/BT_MOL_140201_Comunita Alloggio Temenos_30-39,2 - Personale non Sanitario,14,2021-01-08,PF/BT,140201_Comunita Alloggio Temenos,30-39,MOL,ITF2
1,Molise,TML_CAT_PERSONALE,08/01/2021_PF/BT_MOL_14000100_P.O. A.CARDARELLI-CAMPOBASSO_40-49,2 - Personale non Sanitario,14,2021-01-08,PF/BT,14000100_P.O. A.CARDARELLI-CAMPOBASSO,40-49,MOL,ITF2
15,Molise,TML_CAT_ALTRO,08/01/2021_PF/BT_MOL_14000100_P.O. A.CARDARELLI-CAMPOBASSO_40-49,2 - Personale non Sanitario,14,2021-01-08,PF/BT,14000100_P.O. A.CARDARELLI-CAMPOBASSO,40-49,MOL,ITF2
1,Molise,TML_CAT_PERSONALE,08/01/2021_PF/BT_MOL_14000200_P.O TIMOTEO- TERMOLI_40-49,2 - Personale non Sanitario,14,2021-01-08,PF/BT,14000200_P.O TIMOTEO- TERMOLI,40-49,MOL,ITF2
1,Molise,TML_CAT_PERSONALE,08/01/2021_PF/BT_MOL_140201_Casa Di Riposo Asilo Senile Argento Vivo_40-49,2 - Personale non Sanitario,14,2021-01-08,PF/BT,140201_Casa Di Riposo Asilo Senile Argento Vivo,40-49,MOL,ITF2
1,Molise,TML_CAT_PERSONALE,08/01/2021_PF/BT_MOL_14000100_P.O. A.CARDARELLI-CAMPOBASSO_50-59,2 - Personale non Sanitario,14,2021-01-08,PF/BT,14000100_P.O. A.CARDARELLI-CAMPOBASSO,50-59,MOL,ITF2
25,Molise,TML_CAT_ALTRO,08/01/2021_PF/BT_MOL_14000100_P.O. A.CARDARELLI-CAMPOBASSO_50-59,2 - Personale non Sanitario,14,2021-01-08,PF/BT,14000100_P.O. A.CARDARELLI-CAMPOBASSO,50-59,MOL,ITF2
3,Molise,TML_CAT_PERSONALE,08/01/2021_PF/BT_MOL_14000200_P.O TIMOTEO- TERMOLI_50-59,2 - Personale non Sanitario,14,2021-01-08,PF/BT,14000200_P.O TIMOTEO- TERMOLI,50-59,MOL,ITF2
2,Molise,TML_CAT_PERSONALE,08/01/2021_PF/BT_MOL_140201_Casa Di Riposo Asilo Senile Argento Vivo_50-59,2 - Personale non Sanitario,14,2021-01-08,PF/BT,140201_Casa Di Riposo Asilo Senile Argento Vivo,50-59,MOL,ITF2
11,Molise,TML_CAT_ALTRO,08/01/2021_PF/BT_MOL_14000100_P.O. A.CARDARELLI-CAMPOBASSO_60-69,2 - Personale non Sanitario,14,2021-01-08,PF/BT,14000100_P.O. A.CARDARELLI-CAMPOBASSO,60-69,MOL,ITF2
1,Molise,TML_CAT_ALTRO,08/01/2021_PF/BT_MOL_14000200_P.O TIMOTEO- TERMOLI_60-69,2 - Personale non Sanitario,14,2021-01-08,PF/BT,14000200_P.O TIMOTEO- TERMOLI,60-69,MOL,ITF2
1,Molise,TML_CAT_PERSONALE,08/01/2021_PF/BT_MOL_14000200_P.O TIMOTEO- TERMOLI_70-79,2 - Personale non Sanitario,14,2021-01-08,PF/BT,14000200_P.O TIMOTEO- TERMOLI,70-79,MOL,ITF2
1,Molise,TML_CAT_PERSONALE,08/01/2021_PF/BT_MOL_922_FONDAZIONE PADRE PIO ONLUS R2 CASA MIA IS_80-89,2 - Personale non Sanitario,14,2021-01-08,PF/BT,922_FONDAZIONE PADRE PIO ONLUS R2 CASA MIA IS,80-89,MOL,ITF2
1,Molise,TML_CAT_RSA_OSPITI,08/01/2021_PF/BT_MOL_140201_CASA FAMIGLIA SAN MARTINO IN PENSILIS_20-29,3 - Ospiti Strutture Residenziali,14,2021-01-08,PF/BT,140201_CASA FAMIGLIA SAN MARTINO IN PENSILIS,20-29,MOL,ITF2
2,Molise,TML_CAT_RSA_OSPITI,08/01/2021_PF/BT_MOL_140201_CASA FAMIGLIA SAN MARTINO IN PENSILIS_30-39,3 - Ospiti Strutture Residenziali,14,2021-01-08,PF/BT,140201_CASA FAMIGLIA SAN MARTINO IN PENSILIS,30-39,MOL,ITF2
1,Molise,TML_CAT_RSA_OSPITI,08/01/2021_PF/BT_MOL_140201_CASA FAMIGLIA SAN MARTINO IN PENSILIS_40-49,3 - Ospiti Strutture Residenziali,14,2021-01-08,PF/BT,140201_CASA FAMIGLIA SAN MARTINO IN PENSILIS,40-49,MOL,ITF2
1,Molise,TML_CAT_RSA_OSPITI,08/01/2021_PF/BT_MOL_140201_COMUNITA' ALLOGGIO - SANTA MARIA DELLE GRAZIE_40-49,3 - Ospiti Strutture Residenziali,14,2021-01-08,PF/BT,140201_COMUNITA' ALLOGGIO - SANTA MARIA DELLE GRAZIE,40-49,MOL,ITF2
2,Molise,TML_CAT_RSA_OSPITI,08/01/2021_PF/BT_MOL_140201_CASA FAMIGLIA SAN MARTINO IN PENSILIS_50-59,3 - Ospiti Strutture Residenziali,14,2021-01-08,PF/BT,140201_CASA FAMIGLIA SAN MARTINO IN PENSILIS,50-59,MOL,ITF2
2,Molise,TML_CAT_RSA_OSPITI,08/01/2021_PF/BT_MOL_140201_COMUNITA' ALLOGGIO - SANTA MARIA DELLE GRAZIE_50-59,3 - Ospiti Strutture Residenziali,14,2021-01-08,PF/BT,140201_COMUNITA' ALLOGGIO - SANTA MARIA DELLE GRAZIE,50-59,MOL,ITF2
4,Molise,TML_CAT_RSA_OSPITI,08/01/2021_PF/BT_MOL_140201_CASA FAMIGLIA SAN MARTINO IN PENSILIS_60-69,3 - Ospiti Strutture Residenziali,14,2021-01-08,PF/BT,140201_CASA FAMIGLIA SAN MARTINO IN PENSILIS,60-69,MOL,ITF2
2,Molise,TML_CAT_RSA_OSPITI,08/01/2021_PF/BT_MOL_140201_Casa Di Riposo Asilo Senile Argento Vivo_60-69,3 - Ospiti Strutture Residenziali,14,2021-01-08,PF/BT,140201_Casa Di Riposo Asilo Senile Argento Vivo,60-69,MOL,ITF2
2,Molise,TML_CAT_RSA_OSPITI,08/01/2021_PF/BT_MOL_140201_Comunita Alloggio Temenos_60-69,3 - Ospiti Strutture Residenziali,14,2021-01-08,PF/BT,140201_Comunita Alloggio Temenos,60-69,MOL,ITF2
3,Molise,TML_CAT_RSA_OSPITI,08/01/2021_PF/BT_MOL_140201_CASA FAMIGLIA SAN MARTINO IN PENSILIS_70-79,3 - Ospiti Strutture Residenziali,14,2021-01-08,PF/BT,140201_CASA FAMIGLIA SAN MARTINO IN PENSILIS,70-79,MOL,ITF2
1,Molise,TML_CAT_RSA_OSPITI,08/01/2021_PF/BT_MOL_140201_COMUNITA' ALLOGGIO - SANTA MARIA DELLE GRAZIE_70-79,3 - Ospiti Strutture Residenziali,14,2021-01-08,PF/BT,140201_COMUNITA' ALLOGGIO - SANTA MARIA DELLE GRAZIE,70-79,MOL,ITF2
2,Molise,TML_CAT_RSA_OSPITI,08/01/2021_PF/BT_MOL_140201_Casa Di Riposo Asilo Senile Argento Vivo_70-79,3 - Ospiti Strutture Residenziali,14,2021-01-08,PF/BT,140201_Casa Di Riposo Asilo Senile Argento Vivo,70-79,MOL,ITF2
1,Molise,TML_CAT_RSA_OSPITI,08/01/2021_PF/BT_MOL_922_FONDAZIONE PADRE PIO ONLUS R2 CASA MIA IS_70-79,3 - Ospiti Strutture Residenziali,14,2021-01-08,PF/BT,922_FONDAZIONE PADRE PIO ONLUS R2 CASA MIA IS,70-79,MOL,ITF2
14,Molise,TML_CAT_RSA_OSPITI,08/01/2021_PF/BT_MOL_140201_CASA FAMIGLIA SAN MARTINO IN PENSILIS_80-89,3 - Ospiti Strutture Residenziali,14,2021-01-08,PF/BT,140201_CASA FAMIGLIA SAN MARTINO IN PENSILIS,80-89,MOL,ITF2
5,Molise,TML_CAT_RSA_OSPITI,08/01/2021_PF/BT_MOL_140201_COMUNITA' ALLOGGIO - SANTA MARIA DELLE GRAZIE_80-89,3 - Ospiti Strutture Residenziali,14,2021-01-08,PF/BT,140201_COMUNITA' ALLOGGIO - SANTA MARIA DELLE GRAZIE,80-89,MOL,ITF2
13,Molise,TML_CAT_RSA_OSPITI,08/01/2021_PF/BT_MOL_140201_Casa Di Riposo Asilo Senile Argento Vivo_80-89,3 - Ospiti Strutture Residenziali,14,2021-01-08,PF/BT,140201_Casa Di Riposo Asilo Senile Argento Vivo,80-89,MOL,ITF2
4,Molise,TML_CAT_RSA_OSPITI,08/01/2021_PF/BT_MOL_140201_Comunita Alloggio Temenos_80-89,3 - Ospiti Strutture Residenziali,14,2021-01-08,PF/BT,140201_Comunita Alloggio Temenos,80-89,MOL,ITF2
1,Molise,TML_CAT_RSA_OSPITI,08/01/2021_PF/BT_MOL_140201_Villa Le Ginestre Casa Di Riposo Per Anziani_80-89,3 - Ospiti Strutture Residenziali,14,2021-01-08,PF/BT,140201_Villa Le Ginestre Casa Di Riposo Per Anziani,80-89,MOL,ITF2
13,Molise,TML_CAT_RSA_OSPITI,08/01/2021_PF/BT_MOL_922_FONDAZIONE PADRE PIO ONLUS R2 CASA MIA IS_80-89,3 - Ospiti Strutture Residenziali,14,2021-01-08,PF/BT,922_FONDAZIONE PADRE PIO ONLUS R2 CASA MIA IS,80-89,MOL,ITF2
4,Molise,TML_CAT_RSA_OSPITI,08/01/2021_PF/BT_MOL_140201_CASA FAMIGLIA SAN MARTINO IN PENSILIS_90+,3 - Ospiti Strutture Residenziali,14,2021-01-08,PF/BT,140201_CASA FAMIGLIA SAN MARTINO IN PENSILIS,90+,MOL,ITF2
3,Molise,TML_CAT_RSA_OSPITI,08/01/2021_PF/BT_MOL_140201_COMUNITA' ALLOGGIO - SANTA MARIA DELLE GRAZIE_90+,3 - Ospiti Strutture Residenziali,14,2021-01-08,PF/BT,140201_COMUNITA' ALLOGGIO - SANTA MARIA DELLE GRAZIE,90+,MOL,ITF2
14,Molise,TML_CAT_RSA_OSPITI,08/01/2021_PF/BT_MOL_140201_Casa Di Riposo Asilo Senile Argento Vivo_90+,3 - Ospiti Strutture Residenziali,14,2021-01-08,PF/BT,140201_Casa Di Riposo Asilo Senile Argento Vivo,90+,MOL,ITF2
3,Molise,TML_CAT_RSA_OSPITI,08/01/2021_PF/BT_MOL_140201_Comunita Alloggio Temenos_90+,3 - Ospiti Strutture Residenziali,14,2021-01-08,PF/BT,140201_Comunita Alloggio Temenos,90+,MOL,ITF2
22,Molise,TML_CAT_RSA_OSPITI,08/01/2021_PF/BT_MOL_922_FONDAZIONE PADRE PIO ONLUS R2 CASA MIA IS_90+,3 - Ospiti Strutture Residenziali,14,2021-01-08,PF/BT,922_FONDAZIONE PADRE PIO ONLUS R2 CASA MIA IS,90+,MOL,ITF2
1,Molise,TML_CAT_OSS,09/01/2021_PF/BT_MOL_14000100_P.O. A.CARDARELLI-CAMPOBASSO_20-29,1 - Operatori Sanitari e Sociosanitari,14,2021-01-09,PF/BT,14000100_P.O. A.CARDARELLI-CAMPOBASSO,20-29,MOL,ITF2
1,Molise,TML_CAT_OSS,09/01/2021_PF/BT_MOL_14000200_P.O TIMOTEO- TERMOLI_20-29,1 - Operatori Sanitari e Sociosanitari,14,2021-01-09,PF/BT,14000200_P.O TIMOTEO- TERMOLI,20-29,MOL,ITF2
2,Molise,TML_CAT_OSS,09/01/2021_PF/BT_MOL_14000301_P.O. ISERNIA_20-29,1 - Operatori Sanitari e Sociosanitari,14,2021-01-09,PF/BT,14000301_P.O. ISERNIA,20-29,MOL,ITF2
2,Molise,TML_CAT_OSS,09/01/2021_PF/BT_MOL_140201_Casa Di Riposo Punta Paradiso_20-29,1 - Operatori Sanitari e Sociosanitari,14,2021-01-09,PF/BT,140201_Casa Di Riposo Punta Paradiso,20-29,MOL,ITF2
1,Molise,TML_CAT_OSS,09/01/2021_PF/BT_MOL_140201_Villa Paradiso Delle Mainarde_20-29,1 - Operatori Sanitari e Sociosanitari,14,2021-01-09,PF/BT,140201_Villa Paradiso Delle Mainarde,20-29,MOL,ITF2
7,Molise,TML_CAT_OSS,09/01/2021_PF/BT_MOL_14000100_P.O. A.CARDARELLI-CAMPOBASSO_30-39,1 - Operatori Sanitari e Sociosanitari,14,2021-01-09,PF/BT,14000100_P.O. A.CARDARELLI-CAMPOBASSO,30-39,MOL,ITF2
2,Molise,TML_CAT_OSS,09/01/2021_PF/BT_MOL_14000200_P.O TIMOTEO- TERMOLI_30-39,1 - Operatori Sanitari e Sociosanitari,14,2021-01-09,PF/BT,14000200_P.O TIMOTEO- TERMOLI,30-39,MOL,ITF2
11,Molise,TML_CAT_OSS,09/01/2021_PF/BT_MOL_14000301_P.O. ISERNIA_30-39,1 - Operatori Sanitari e Sociosanitari,14,2021-01-09,PF/BT,14000301_P.O. ISERNIA,30-39,MOL,ITF2
2,Molise,TML_CAT_OSS,09/01/2021_PF/BT_MOL_140201_Casa Di Riposo Mater Dei_30-39,1 - Operatori Sanitari e Sociosanitari,14,2021-01-09,PF/BT,140201_Casa Di Riposo Mater Dei,30-39,MOL,ITF2
1,Molise,TML_CAT_OSS,09/01/2021_PF/BT_MOL_140201_Casa Di Riposo Punta Paradiso_30-39,1 - Operatori Sanitari e Sociosanitari,14,2021-01-09,PF/BT,140201_Casa Di Riposo Punta Paradiso,30-39,MOL,ITF2
1,Molise,TML_CAT_OSS,09/01/2021_PF/BT_MOL_140201_Villa Paradiso Delle Mainarde_30-39,1 - Operatori Sanitari e Sociosanitari,14,2021-01-09,PF/BT,140201_Villa Paradiso Delle Mainarde,30-39,MOL,ITF2
22,Molise,TML_CAT_OSS,09/01/2021_PF/BT_MOL_14000100_P.O. A.CARDARELLI-CAMPOBASSO_40-49,1 - Operatori Sanitari e Sociosanitari,14,2021-01-09,PF/BT,14000100_P.O. A.CARDARELLI-CAMPOBASSO,40-49,MOL,ITF2
1,Molise,TML_CAT_OSS,09/01/2021_PF/BT_MOL_14000200_P.O TIMOTEO- TERMOLI_40-49,1 - Operatori Sanitari e Sociosanitari,14,2021-01-09,PF/BT,14000200_P.O TIMOTEO- TERMOLI,40-49,MOL,ITF2
15,Molise,TML_CAT_OSS,09/01/2021_PF/BT_MOL_14000301_P.O. ISERNIA_40-49,1 - Operatori Sanitari e Sociosanitari,14,2021-01-09,PF/BT,14000301_P.O. ISERNIA,40-49,MOL,ITF2
2,Molise,TML_CAT_OSS,09/01/2021_PF/BT_MOL_140201_Casa Di Riposo Mater Dei_40-49,1 - Operatori Sanitari e Sociosanitari,14,2021-01-09,PF/BT,140201_Casa Di Riposo Mater Dei,40-49,MOL,ITF2
45,Molise,TML_CAT_OSS,09/01/2021_PF/BT_MOL_14000100_P.O. A.CARDARELLI-CAMPOBASSO_50-59,1 - Operatori Sanitari e Sociosanitari,14,2021-01-09,PF/BT,14000100_P.O. A.CARDARELLI-CAMPOBASSO,50-59,MOL,ITF2
7,Molise,TML_CAT_OSS,09/01/2021_PF/BT_MOL_14000200_P.O TIMOTEO- TERMOLI_50-59,1 - Operatori Sanitari e Sociosanitari,14,2021-01-09,PF/BT,14000200_P.O TIMOTEO- TERMOLI,50-59,MOL,ITF2
33,Molise,TML_CAT_OSS,09/01/2021_PF/BT_MOL_14000301_P.O. ISERNIA_50-59,1 - Operatori Sanitari e Sociosanitari,14,2021-01-09,PF/BT,14000301_P.O. ISERNIA,50-59,MOL,ITF2
1,Molise,TML_CAT_OSS,09/01/2021_PF/BT_MOL_140201_Casa Di Riposo Protetta Padre Minozzi_50-59,1 - Operatori Sanitari e Sociosanitari,14,2021-01-09,PF/BT,140201_Casa Di Riposo Protetta Padre Minozzi,50-59,MOL,ITF2
1,Molise,TML_CAT_OSS,09/01/2021_PF/BT_MOL_140201_Villa Paradiso Delle Mainarde_50-59,1 - Operatori Sanitari e Sociosanitari,14,2021-01-09,PF/BT,140201_Villa Paradiso Delle Mainarde,50-59,MOL,ITF2
19,Molise,TML_CAT_OSS,09/01/2021_PF/BT_MOL_14000100_P.O. A.CARDARELLI-CAMPOBASSO_60-69,1 - Operatori Sanitari e Sociosanitari,14,2021-01-09,PF/BT,14000100_P.O. A.CARDARELLI-CAMPOBASSO,60-69,MOL,ITF2
2,Molise,TML_CAT_OSS,09/01/2021_PF/BT_MOL_14000200_P.O TIMOTEO- TERMOLI_60-69,1 - Operatori Sanitari e Sociosanitari,14,2021-01-09,PF/BT,14000200_P.O TIMOTEO- TERMOLI,60-69,MOL,ITF2
16,Molise,TML_CAT_OSS,09/01/2021_PF/BT_MOL_14000301_P.O. ISERNIA_60-69,1 - Operatori Sanitari e Sociosanitari,14,2021-01-09,PF/BT,14000301_P.O. ISERNIA,60-69,MOL,ITF2
1,Molise,TML_CAT_OSS,09/01/2021_PF/BT_MOL_926_Gea Medica Srl_60-69,1 - Operatori Sanitari e Sociosanitari,14,2021-01-09,PF/BT,926_Gea Medica Srl,60-69,MOL,ITF2
1,Molise,TML_CAT_OSS,09/01/2021_PF/BT_MOL_926_Gea Medica Srl_80-89,1 - Operatori Sanitari e Sociosanitari,14,2021-01-09,PF/BT,926_Gea Medica Srl,80-89,MOL,ITF2
17,Molise,TML_CAT_OSS,09/01/2021_PF/BT_MOL_926_Gea Medica Srl_90+,1 - Operatori Sanitari e Sociosanitari,14,2021-01-09,PF/BT,926_Gea Medica Srl,90+,MOL,ITF2
2,Molise,TML_CAT_ALTRO,09/01/2021_PF/BT_MOL_14000100_P.O. A.CARDARELLI-CAMPOBASSO_20-29,2 - Personale non Sanitario,14,2021-01-09,PF/BT,14000100_P.O. A.CARDARELLI-CAMPOBASSO,20-29,MOL,ITF2
3,Molise,TML_CAT_PERSONALE,09/01/2021_PF/BT_MOL_14000301_P.O. ISERNIA_20-29,2 - Personale non Sanitario,14,2021-01-09,PF/BT,14000301_P.O. ISERNIA,20-29,MOL,ITF2
1,Molise,TML_CAT_PERSONALE,09/01/2021_PF/BT_MOL_14000200_P.O TIMOTEO- TERMOLI_30-39,2 - Personale non Sanitario,14,2021-01-09,PF/BT,14000200_P.O TIMOTEO- TERMOLI,30-39,MOL,ITF2
4,Molise,TML_CAT_PERSONALE,09/01/2021_PF/BT_MOL_14000301_P.O. ISERNIA_30-39,2 - Personale non Sanitario,14,2021-01-09,PF/BT,14000301_P.O. ISERNIA,30-39,MOL,ITF2
5,Molise,TML_CAT_ALTRO,09/01/2021_PF/BT_MOL_14000100_P.O. A.CARDARELLI-CAMPOBASSO_40-49,2 - Personale non Sanitario,14,2021-01-09,PF/BT,14000100_P.O. A.CARDARELLI-CAMPOBASSO,40-49,MOL,ITF2
1,Molise,TML_CAT_PERSONALE,09/01/2021_PF/BT_MOL_14000200_P.O TIMOTEO- TERMOLI_40-49,2 - Personale non Sanitario,14,2021-01-09,PF/BT,14000200_P.O TIMOTEO- TERMOLI,40-49,MOL,ITF2
4,Molise,TML_CAT_PERSONALE,09/01/2021_PF/BT_MOL_14000301_P.O. ISERNIA_40-49,2 - Personale non Sanitario,14,2021-01-09,PF/BT,14000301_P.O. ISERNIA,40-49,MOL,ITF2
13,Molise,TML_CAT_ALTRO,09/01/2021_PF/BT_MOL_14000100_P.O. A.CARDARELLI-CAMPOBASSO_50-59,2 - Personale non Sanitario,14,2021-01-09,PF/BT,14000100_P.O. A.CARDARELLI-CAMPOBASSO,50-59,MOL,ITF2
3,Molise,TML_CAT_PERSONALE,09/01/2021_PF/BT_MOL_14000200_P.O TIMOTEO- TERMOLI_50-59,2 - Personale non Sanitario,14,2021-01-09,PF/BT,14000200_P.O TIMOTEO- TERMOLI,50-59,MOL,ITF2
11,Molise,TML_CAT_PERSONALE,09/01/2021_PF/BT_MOL_14000301_P.O. ISERNIA_50-59,2 - Personale non Sanitario,14,2021-01-09,PF/BT,14000301_P.O. ISERNIA,50-59,MOL,ITF2
2,Molise,TML_CAT_PERSONALE,09/01/2021_PF/BT_MOL_14000100_P.O. A.CARDARELLI-CAMPOBASSO_60-69,2 - Personale non Sanitario,14,2021-01-09,PF/BT,14000100_P.O. A.CARDARELLI-CAMPOBASSO,60-69,MOL,ITF2
4,Molise,TML_CAT_ALTRO,09/01/2021_PF/BT_MOL_14000100_P.O. A.CARDARELLI-CAMPOBASSO_60-69,2 - Personale non Sanitario,14,2021-01-09,PF/BT,14000100_P.O. A.CARDARELLI-CAMPOBASSO,60-69,MOL,ITF2
3,Molise,TML_CAT_PERSONALE,09/01/2021_PF/BT_MOL_14000301_P.O. ISERNIA_60-69,2 - Personale non Sanitario,14,2021-01-09,PF/BT,14000301_P.O. ISERNIA,60-69,MOL,ITF2
1,Molise,TML_CAT_PERSONALE,09/01/2021_PF/BT_MOL_926_Gea Medica Srl_90+,2 - Personale non Sanitario,14,2021-01-09,PF/BT,926_Gea Medica Srl,90+,MOL,ITF2
1,Molise,TML_CAT_RSA_OSPITI,09/01/2021_PF/BT_MOL_926_Gea Medica Srl_30-39,3 - Ospiti Strutture Residenziali,14,2021-01-09,PF/BT,926_Gea Medica Srl,30-39,MOL,ITF2
1,Molise,TML_CAT_RSA_OSPITI,09/01/2021_PF/BT_MOL_140201_Casa Di Riposo Mater Dei_40-49,3 - Ospiti Strutture Residenziali,14,2021-01-09,PF/BT,140201_Casa Di Riposo Mater Dei,40-49,MOL,ITF2
3,Molise,TML_CAT_RSA_OSPITI,09/01/2021_PF/BT_MOL_140201_Casa Di Riposo Mater Dei_50-59,3 - Ospiti Strutture Residenziali,14,2021-01-09,PF/BT,140201_Casa Di Riposo Mater Dei,50-59,MOL,ITF2
1,Molise,TML_CAT_RSA_OSPITI,09/01/2021_PF/BT_MOL_140201_Casa Di Riposo Protetta Padre Minozzi_50-59,3 - Ospiti Strutture Residenziali,14,2021-01-09,PF/BT,140201_Casa Di Riposo Protetta Padre Minozzi,50-59,MOL,ITF2
2,Molise,TML_CAT_RSA_OSPITI,09/01/2021_PF/BT_MOL_926_Gea Medica Srl_50-59,3 - Ospiti Strutture Residenziali,14,2021-01-09,PF/BT,926_Gea Medica Srl,50-59,MOL,ITF2
3,Molise,TML_CAT_RSA_OSPITI,09/01/2021_PF/BT_MOL_140201_Casa Di Riposo Mater Dei_60-69,3 - Ospiti Strutture Residenziali,14,2021-01-09,PF/BT,140201_Casa Di Riposo Mater Dei,60-69,MOL,ITF2
5,Molise,TML_CAT_RSA_OSPITI,09/01/2021_PF/BT_MOL_140201_Casa Di Riposo Protetta Padre Minozzi_60-69,3 - Ospiti Strutture Residenziali,14,2021-01-09,PF/BT,140201_Casa Di Riposo Protetta Padre Minozzi,60-69,MOL,ITF2
3,Molise,TML_CAT_RSA_OSPITI,09/01/2021_PF/BT_MOL_926_Gea Medica Srl_60-69,3 - Ospiti Strutture Residenziali,14,2021-01-09,PF/BT,926_Gea Medica Srl,60-69,MOL,ITF2
5,Molise,TML_CAT_RSA_OSPITI,09/01/2021_PF/BT_MOL_140201_Casa Di Riposo Protetta Padre Minozzi_70-79,3 - Ospiti Strutture Residenziali,14,2021-01-09,PF/BT,140201_Casa Di Riposo Protetta Padre Minozzi,70-79,MOL,ITF2
1,Molise,TML_CAT_RSA_OSPITI,09/01/2021_PF/BT_MOL_140201_Casa Di Riposo Punta Paradiso_70-79,3 - Ospiti Strutture Residenziali,14,2021-01-09,PF/BT,140201_Casa Di Riposo Punta Paradiso,70-79,MOL,ITF2
2,Molise,TML_CAT_RSA_OSPITI,09/01/2021_PF/BT_MOL_926_Gea Medica Srl_70-79,3 - Ospiti Strutture Residenziali,14,2021-01-09,PF/BT,926_Gea Medica Srl,70-79,MOL,ITF2
9,Molise,TML_CAT_RSA_OSPITI,09/01/2021_PF/BT_MOL_140201_Casa Di Riposo Mater Dei_80-89,3 - Ospiti Strutture Residenziali,14,2021-01-09,PF/BT,140201_Casa Di Riposo Mater Dei,80-89,MOL,ITF2
20,Molise,TML_CAT_RSA_OSPITI,09/01/2021_PF/BT_MOL_140201_Casa Di Riposo Protetta Padre Minozzi_80-89,3 - Ospiti Strutture Residenziali,14,2021-01-09,PF/BT,140201_Casa Di Riposo Protetta Padre Minozzi,80-89,MOL,ITF2
1,Molise,TML_CAT_RSA_OSPITI,09/01/2021_PF/BT_MOL_140201_Casa Di Riposo Punta Paradiso_80-89,3 - Ospiti Strutture Residenziali,14,2021-01-09,PF/BT,140201_Casa Di Riposo Punta Paradiso,80-89,MOL,ITF2
3,Molise,TML_CAT_RSA_OSPITI,09/01/2021_PF/BT_MOL_140201_Villa Paradiso Delle Mainarde_80-89,3 - Ospiti Strutture Residenziali,14,2021-01-09,PF/BT,140201_Villa Paradiso Delle Mainarde,80-89,MOL,ITF2
13,Molise,TML_CAT_RSA_OSPITI,09/01/2021_PF/BT_MOL_926_Gea Medica Srl_80-89,3 - Ospiti Strutture Residenziali,14,2021-01-09,PF/BT,926_Gea Medica Srl,80-89,MOL,ITF2
9,Molise,TML_CAT_RSA_OSPITI,09/01/2021_PF/BT_MOL_140201_Casa Di Riposo Mater Dei_90+,3 - Ospiti Strutture Residenziali,14,2021-01-09,PF/BT,140201_Casa Di Riposo Mater Dei,90+,MOL,ITF2
16,Molise,TML_CAT_RSA_OSPITI,09/01/2021_PF/BT_MOL_140201_Casa Di Riposo Protetta Padre Minozzi_90+,3 - Ospiti Strutture Residenziali,14,2021-01-09,PF/BT,140201_Casa Di Riposo Protetta Padre Minozzi,90+,MOL,ITF2
61,Molise,TML_CAT_RSA_OSPITI,09/01/2021_PF/BT_MOL_140201_Casa Di Riposo Punta Paradiso_90+,3 - Ospiti Strutture Residenziali,14,2021-01-09,PF/BT,140201_Casa Di Riposo Punta Paradiso,90+,MOL,ITF2
6,Molise,TML_CAT_RSA_OSPITI,09/01/2021_PF/BT_MOL_140201_Villa Paradiso Delle Mainarde_90+,3 - Ospiti Strutture Residenziali,14,2021-01-09,PF/BT,140201_Villa Paradiso Delle Mainarde,90+,MOL,ITF2
13,Molise,TML_CAT_RSA_OSPITI,09/01/2021_PF/BT_MOL_926_Gea Medica Srl_90+,3 - Ospiti Strutture Residenziali,14,2021-01-09,PF/BT,926_Gea Medica Srl,90+,MOL,ITF2
1,Molise,TML_CAT_OSS,"10/01/2021_PF/BT_MOL_14000500_Casa Di Cura ""Villa Esther""_20-29",1 - Operatori Sanitari e Sociosanitari,14,2021-01-10,PF/BT,"14000500_Casa Di Cura ""Villa Esther""",20-29,MOL,ITF2
8,Molise,TML_CAT_OSS,"10/01/2021_PF/BT_MOL_14000500_Casa Di Cura ""Villa Esther""_30-39",1 - Operatori Sanitari e Sociosanitari,14,2021-01-10,PF/BT,"14000500_Casa Di Cura ""Villa Esther""",30-39,MOL,ITF2
2,Molise,TML_CAT_OSS,10/01/2021_PF/BT_MOL_140201_Casa Di Riposo Villa Immacolata_30-39,1 - Operatori Sanitari e Sociosanitari,14,2021-01-10,PF/BT,140201_Casa Di Riposo Villa Immacolata,30-39,MOL,ITF2
9,Molise,TML_CAT_OSS,"10/01/2021_PF/BT_MOL_14000500_Casa Di Cura ""Villa Esther""_40-49",1 - Operatori Sanitari e Sociosanitari,14,2021-01-10,PF/BT,"14000500_Casa Di Cura ""Villa Esther""",40-49,MOL,ITF2
13,Molise,TML_CAT_OSS,"10/01/2021_PF/BT_MOL_14000500_Casa Di Cura ""Villa Esther""_50-59",1 - Operatori Sanitari e Sociosanitari,14,2021-01-10,PF/BT,"14000500_Casa Di Cura ""Villa Esther""",50-59,MOL,ITF2
2,Molise,TML_CAT_OSS,10/01/2021_PF/BT_MOL_140201_Casa Di Riposo Villa Immacolata_50-59,1 - Operatori Sanitari e Sociosanitari,14,2021-01-10,PF/BT,140201_Casa Di Riposo Villa Immacolata,50-59,MOL,ITF2
1,Molise,TML_CAT_OSS,10/01/2021_PF/BT_MOL_14000400_Casa Di Cura Villa Maria_60-69,1 - Operatori Sanitari e Sociosanitari,14,2021-01-10,PF/BT,14000400_Casa Di Cura Villa Maria,60-69,MOL,ITF2
5,Molise,TML_CAT_OSS,"10/01/2021_PF/BT_MOL_14000500_Casa Di Cura ""Villa Esther""_60-69",1 - Operatori Sanitari e Sociosanitari,14,2021-01-10,PF/BT,"14000500_Casa Di Cura ""Villa Esther""",60-69,MOL,ITF2
1,Molise,TML_CAT_OSS,10/01/2021_PF/BT_MOL_140201_Casa Di Riposo Villa Immacolata_60-69,1 - Operatori Sanitari e Sociosanitari,14,2021-01-10,PF/BT,140201_Casa Di Riposo Villa Immacolata,60-69,MOL,ITF2
2,Molise,TML_CAT_OSS,"10/01/2021_PF/BT_MOL_14000500_Casa Di Cura ""Villa Esther""_70-79",1 - Operatori Sanitari e Sociosanitari,14,2021-01-10,PF/BT,"14000500_Casa Di Cura ""Villa Esther""",70-79,MOL,ITF2
38,Molise,TML_CAT_OSS,10/01/2021_PF/BT_MOL_14000400_Casa Di Cura Villa Maria_90+,1 - Operatori Sanitari e Sociosanitari,14,2021-01-10,PF/BT,14000400_Casa Di Cura Villa Maria,90+,MOL,ITF2
2,Molise,TML_CAT_PERSONALE,"10/01/2021_PF/BT_MOL_14000500_Casa Di Cura ""Villa Esther""_30-39",2 - Personale non Sanitario,14,2021-01-10,PF/BT,"14000500_Casa Di Cura ""Villa Esther""",30-39,MOL,ITF2
3,Molise,TML_CAT_PERSONALE,"10/01/2021_PF/BT_MOL_14000500_Casa Di Cura ""Villa Esther""_40-49",2 - Personale non Sanitario,14,2021-01-10,PF/BT,"14000500_Casa Di Cura ""Villa Esther""",40-49,MOL,ITF2
4,Molise,TML_CAT_PERSONALE,"10/01/2021_PF/BT_MOL_14000500_Casa Di Cura ""Villa Esther""_50-59",2 - Personale non Sanitario,14,2021-01-10,PF/BT,"14000500_Casa Di Cura ""Villa Esther""",50-59,MOL,ITF2
1,Molise,TML_CAT_PERSONALE,10/01/2021_PF/BT_MOL_14000400_Casa Di Cura Villa Maria_60-69,2 - Personale non Sanitario,14,2021-01-10,PF/BT,14000400_Casa Di Cura Villa Maria,60-69,MOL,ITF2
1,Molise,TML_CAT_PERSONALE,"10/01/2021_PF/BT_MOL_14000500_Casa Di Cura ""Villa Esther""_60-69",2 - Personale non Sanitario,14,2021-01-10,PF/BT,"14000500_Casa Di Cura ""Villa Esther""",60-69,MOL,ITF2
8,Molise,TML_CAT_PERSONALE,10/01/2021_PF/BT_MOL_14000400_Casa Di Cura Villa Maria_90+,2 - Personale non Sanitario,14,2021-01-10,PF/BT,14000400_Casa Di Cura Villa Maria,90+,MOL,ITF2
1,Molise,TML_CAT_RSA_OSPITI,10/01/2021_PF/BT_MOL_140201_Casa Di Riposo Villa Immacolata_40-49,3 - Ospiti Strutture Residenziali,14,2021-01-10,PF/BT,140201_Casa Di Riposo Villa Immacolata,40-49,MOL,ITF2
2,Molise,TML_CAT_RSA_OSPITI,"10/01/2021_PF/BT_MOL_140201_Istituto ""Sacro Cuore""_40-49",3 - Ospiti Strutture Residenziali,14,2021-01-10,PF/BT,"140201_Istituto ""Sacro Cuore""",40-49,MOL,ITF2
1,Molise,TML_CAT_RSA_OSPITI,10/01/2021_PF/BT_MOL_140201_COMUNITA' ALLOGGIO - SAN GIULIANO DI PUGLIA (ARCOBALENO)_50-59,3 - Ospiti Strutture Residenziali,14,2021-01-10,PF/BT,140201_COMUNITA' ALLOGGIO - SAN GIULIANO DI PUGLIA (ARCOBALENO),50-59,MOL,ITF2
2,Molise,TML_CAT_RSA_OSPITI,"10/01/2021_PF/BT_MOL_140201_Casa Di Riposo Hotel Sporting ""Villa Delle Rose""_50-59",3 - Ospiti Strutture Residenziali,14,2021-01-10,PF/BT,"140201_Casa Di Riposo Hotel Sporting ""Villa Delle Rose""",50-59,MOL,ITF2
3,Molise,TML_CAT_RSA_OSPITI,"10/01/2021_PF/BT_MOL_140201_Istituto ""Sacro Cuore""_50-59",3 - Ospiti Strutture Residenziali,14,2021-01-10,PF/BT,"140201_Istituto ""Sacro Cuore""",50-59,MOL,ITF2
1,Molise,TML_CAT_RSA_OSPITI,10/01/2021_PF/BT_MOL_140201_COMUNITA' ALLOGGIO - SAN GIULIANO DI PUGLIA (ARCOBALENO)_60-69,3 - Ospiti Strutture Residenziali,14,2021-01-10,PF/BT,140201_COMUNITA' ALLOGGIO - SAN GIULIANO DI PUGLIA (ARCOBALENO),60-69,MOL,ITF2
5,Molise,TML_CAT_RSA_OSPITI,"10/01/2021_PF/BT_MOL_140201_Casa Di Riposo Hotel Sporting ""Villa Delle Rose""_60-69",3 - Ospiti Strutture Residenziali,14,2021-01-10,PF/BT,"140201_Casa Di Riposo Hotel Sporting ""Villa Delle Rose""",60-69,MOL,ITF2
3,Molise,TML_CAT_RSA_OSPITI,10/01/2021_PF/BT_MOL_140201_Casa Di Riposo Villa Immacolata_60-69,3 - Ospiti Strutture Residenziali,14,2021-01-10,PF/BT,140201_Casa Di Riposo Villa Immacolata,60-69,MOL,ITF2
2,Molise,TML_CAT_RSA_OSPITI,"10/01/2021_PF/BT_MOL_140201_Istituto ""Sacro Cuore""_60-69",3 - Ospiti Strutture Residenziali,14,2021-01-10,PF/BT,"140201_Istituto ""Sacro Cuore""",60-69,MOL,ITF2
1,Molise,TML_CAT_RSA_OSPITI,10/01/2021_PF/BT_MOL_140201_COMUNITA' ALLOGGIO - SAN GIULIANO DI PUGLIA (ARCOBALENO)_70-79,3 - Ospiti Strutture Residenziali,14,2021-01-10,PF/BT,140201_COMUNITA' ALLOGGIO - SAN GIULIANO DI PUGLIA (ARCOBALENO),70-79,MOL,ITF2
7,Molise,TML_CAT_RSA_OSPITI,"10/01/2021_PF/BT_MOL_140201_Casa Di Riposo Hotel Sporting ""Villa Delle Rose""_70-79",3 - Ospiti Strutture Residenziali,14,2021-01-10,PF/BT,"140201_Casa Di Riposo Hotel Sporting ""Villa Delle Rose""",70-79,MOL,ITF2
6,Molise,TML_CAT_RSA_OSPITI,10/01/2021_PF/BT_MOL_140201_Casa Di Riposo Villa Immacolata_70-79,3 - Ospiti Strutture Residenziali,14,2021-01-10,PF/BT,140201_Casa Di Riposo Villa Immacolata,70-79,MOL,ITF2
7,Molise,TML_CAT_RSA_OSPITI,"10/01/2021_PF/BT_MOL_140201_Istituto ""Sacro Cuore""_70-79",3 - Ospiti Strutture Residenziali,14,2021-01-10,PF/BT,"140201_Istituto ""Sacro Cuore""",70-79,MOL,ITF2
8,Molise,TML_CAT_RSA_OSPITI,10/01/2021_PF/BT_MOL_140201_COMUNITA' ALLOGGIO - SAN GIULIANO DI PUGLIA (ARCOBALENO)_80-89,3 - Ospiti Strutture Residenziali,14,2021-01-10,PF/BT,140201_COMUNITA' ALLOGGIO - SAN GIULIANO DI PUGLIA (ARCOBALENO),80-89,MOL,ITF2
25,Molise,TML_CAT_RSA_OSPITI,"10/01/2021_PF/BT_MOL_140201_Casa Di Riposo Hotel Sporting ""Villa Delle Rose""_80-89",3 - Ospiti Strutture Residenziali,14,2021-01-10,PF/BT,"140201_Casa Di Riposo Hotel Sporting ""Villa Delle Rose""",80-89,MOL,ITF2
22,Molise,TML_CAT_RSA_OSPITI,10/01/2021_PF/BT_MOL_140201_Casa Di Riposo Villa Immacolata_80-89,3 - Ospiti Strutture Residenziali,14,2021-01-10,PF/BT,140201_Casa Di Riposo Villa Immacolata,80-89,MOL,ITF2
12,Molise,TML_CAT_RSA_OSPITI,"10/01/2021_PF/BT_MOL_140201_Istituto ""Sacro Cuore""_80-89",3 - Ospiti Strutture Residenziali,14,2021-01-10,PF/BT,"140201_Istituto ""Sacro Cuore""",80-89,MOL,ITF2
7,Molise,TML_CAT_RSA_OSPITI,10/01/2021_PF/BT_MOL_140201_COMUNITA' ALLOGGIO - SAN GIULIANO DI PUGLIA (ARCOBALENO)_90+,3 - Ospiti Strutture Residenziali,14,2021-01-10,PF/BT,140201_COMUNITA' ALLOGGIO - SAN GIULIANO DI PUGLIA (ARCOBALENO),90+,MOL,ITF2
21,Molise,TML_CAT_RSA_OSPITI,"10/01/2021_PF/BT_MOL_140201_Casa Di Riposo Hotel Sporting ""Villa Delle Rose""_90+",3 - Ospiti Strutture Residenziali,14,2021-01-10,PF/BT,"140201_Casa Di Riposo Hotel Sporting ""Villa Delle Rose""",90+,MOL,ITF2
17,Molise,TML_CAT_RSA_OSPITI,10/01/2021_PF/BT_MOL_140201_Casa Di Riposo Villa Immacolata_90+,3 - Ospiti Strutture Residenziali,14,2021-01-10,PF/BT,140201_Casa Di Riposo Villa Immacolata,90+,MOL,ITF2
15,Molise,TML_CAT_RSA_OSPITI,"10/01/2021_PF/BT_MOL_140201_Istituto ""Sacro Cuore""_90+",3 - Ospiti Strutture Residenziali,14,2021-01-10,PF/BT,"140201_Istituto ""Sacro Cuore""",90+,MOL,ITF2
3,Molise,TML_CAT_OSS,"11/01/2021_PF/BT_MOL_14000500_Casa Di Cura ""Villa Esther""_20-29",1 - Operatori Sanitari e Sociosanitari,14,2021-01-11,PF/BT,"14000500_Casa Di Cura ""Villa Esther""",20-29,MOL,ITF2
5,Molise,TML_CAT_OSS,11/01/2021_PF/BT_MOL_14000100_P.O. A.CARDARELLI-CAMPOBASSO_30-39,1 - Operatori Sanitari e Sociosanitari,14,2021-01-11,PF/BT,14000100_P.O. A.CARDARELLI-CAMPOBASSO,30-39,MOL,ITF2
1,Molise,TML_CAT_OSS,11/01/2021_PF/BT_MOL_14000200_P.O TIMOTEO- TERMOLI_30-39,1 - Operatori Sanitari e Sociosanitari,14,2021-01-11,PF/BT,14000200_P.O TIMOTEO- TERMOLI,30-39,MOL,ITF2
4,Molise,TML_CAT_OSS,11/01/2021_PF/BT_MOL_14000301_P.O. ISERNIA_30-39,1 - Operatori Sanitari e Sociosanitari,14,2021-01-11,PF/BT,14000301_P.O. ISERNIA,30-39,MOL,ITF2
9,Molise,TML_CAT_OSS,"11/01/2021_PF/BT_MOL_14000500_Casa Di Cura ""Villa Esther""_30-39",1 - Operatori Sanitari e Sociosanitari,14,2021-01-11,PF/BT,"14000500_Casa Di Cura ""Villa Esther""",30-39,MOL,ITF2
2,Molise,TML_CAT_OSS,"11/01/2021_PF/BT_MOL_140201_Casa Di Riposo ""Arnaldo De Lisio""_30-39",1 - Operatori Sanitari e Sociosanitari,14,2021-01-11,PF/BT,"140201_Casa Di Riposo ""Arnaldo De Lisio""",30-39,MOL,ITF2
1,Molise,TML_CAT_OSS,11/01/2021_PF/BT_MOL_140201_Casa San Bernardino - Agnone_30-39,1 - Operatori Sanitari e Sociosanitari,14,2021-01-11,PF/BT,140201_Casa San Bernardino - Agnone,30-39,MOL,ITF2
1,Molise,TML_CAT_OSS,11/01/2021_PF/BT_MOL_140201_Comunita Alloggio Nicolino De Rubertis_30-39,1 - Operatori Sanitari e Sociosanitari,14,2021-01-11,PF/BT,140201_Comunita Alloggio Nicolino De Rubertis,30-39,MOL,ITF2
8,Molise,TML_CAT_OSS,11/01/2021_PF/BT_MOL_14000100_P.O. A.CARDARELLI-CAMPOBASSO_40-49,1 - Operatori Sanitari e Sociosanitari,14,2021-01-11,PF/BT,14000100_P.O. A.CARDARELLI-CAMPOBASSO,40-49,MOL,ITF2
5,Molise,TML_CAT_OSS,11/01/2021_PF/BT_MOL_14000200_P.O TIMOTEO- TERMOLI_40-49,1 - Operatori Sanitari e Sociosanitari,14,2021-01-11,PF/BT,14000200_P.O TIMOTEO- TERMOLI,40-49,MOL,ITF2
9,Molise,TML_CAT_OSS,11/01/2021_PF/BT_MOL_14000301_P.O. ISERNIA_40-49,1 - Operatori Sanitari e Sociosanitari,14,2021-01-11,PF/BT,14000301_P.O. ISERNIA,40-49,MOL,ITF2
10,Molise,TML_CAT_OSS,"11/01/2021_PF/BT_MOL_14000500_Casa Di Cura ""Villa Esther""_40-49",1 - Operatori Sanitari e Sociosanitari,14,2021-01-11,PF/BT,"14000500_Casa Di Cura ""Villa Esther""",40-49,MOL,ITF2
1,Molise,TML_CAT_OSS,11/01/2021_PF/BT_MOL_140201_Casa Dei Nonni (Talita' Kum)_40-49,1 - Operatori Sanitari e Sociosanitari,14,2021-01-11,PF/BT,140201_Casa Dei Nonni (Talita' Kum),40-49,MOL,ITF2
1,Molise,TML_CAT_OSS,"11/01/2021_PF/BT_MOL_140201_Casa Di Riposo ""Arnaldo De Lisio""_40-49",1 - Operatori Sanitari e Sociosanitari,14,2021-01-11,PF/BT,"140201_Casa Di Riposo ""Arnaldo De Lisio""",40-49,MOL,ITF2
1,Molise,TML_CAT_OSS,11/01/2021_PF/BT_MOL_140201_Casa San Bernardino - Agnone_40-49,1 - Operatori Sanitari e Sociosanitari,14,2021-01-11,PF/BT,140201_Casa San Bernardino - Agnone,40-49,MOL,ITF2
10,Molise,TML_CAT_OSS,11/01/2021_PF/BT_MOL_14000100_P.O. A.CARDARELLI-CAMPOBASSO_50-59,1 - Operatori Sanitari e Sociosanitari,14,2021-01-11,PF/BT,14000100_P.O. A.CARDARELLI-CAMPOBASSO,50-59,MOL,ITF2
5,Molise,TML_CAT_OSS,11/01/2021_PF/BT_MOL_14000200_P.O TIMOTEO- TERMOLI_50-59,1 - Operatori Sanitari e Sociosanitari,14,2021-01-11,PF/BT,14000200_P.O TIMOTEO- TERMOLI,50-59,MOL,ITF2
21,Molise,TML_CAT_OSS,11/01/2021_PF/BT_MOL_14000301_P.O. ISERNIA_50-59,1 - Operatori Sanitari e Sociosanitari,14,2021-01-11,PF/BT,14000301_P.O. ISERNIA,50-59,MOL,ITF2
9,Molise,TML_CAT_OSS,"11/01/2021_PF/BT_MOL_14000500_Casa Di Cura ""Villa Esther""_50-59",1 - Operatori Sanitari e Sociosanitari,14,2021-01-11,PF/BT,"14000500_Casa Di Cura ""Villa Esther""",50-59,MOL,ITF2
2,Molise,TML_CAT_OSS,11/01/2021_PF/BT_MOL_140201_Casa Dei Nonni (Talita' Kum)_50-59,1 - Operatori Sanitari e Sociosanitari,14,2021-01-11,PF/BT,140201_Casa Dei Nonni (Talita' Kum),50-59,MOL,ITF2
1,Molise,TML_CAT_OSS,"11/01/2021_PF/BT_MOL_140201_Casa Di Riposo ""Arnaldo De Lisio""_50-59",1 - Operatori Sanitari e Sociosanitari,14,2021-01-11,PF/BT,"140201_Casa Di Riposo ""Arnaldo De Lisio""",50-59,MOL,ITF2
1,Molise,TML_CAT_OSS,11/01/2021_PF/BT_MOL_140201_Casa San Bernardino - Agnone_50-59,1 - Operatori Sanitari e Sociosanitari,14,2021-01-11,PF/BT,140201_Casa San Bernardino - Agnone,50-59,MOL,ITF2
1,Molise,TML_CAT_OSS,11/01/2021_PF/BT_MOL_140201_Comunita Alloggio Nicolino De Rubertis_50-59,1 - Operatori Sanitari e Sociosanitari,14,2021-01-11,PF/BT,140201_Comunita Alloggio Nicolino De Rubertis,50-59,MOL,ITF2
12,Molise,TML_CAT_OSS,11/01/2021_PF/BT_MOL_14000100_P.O. A.CARDARELLI-CAMPOBASSO_60-69,1 - Operatori Sanitari e Sociosanitari,14,2021-01-11,PF/BT,14000100_P.O. A.CARDARELLI-CAMPOBASSO,60-69,MOL,ITF2
8,Molise,TML_CAT_OSS,11/01/2021_PF/BT_MOL_14000200_P.O TIMOTEO- TERMOLI_60-69,1 - Operatori Sanitari e Sociosanitari,14,2021-01-11,PF/BT,14000200_P.O TIMOTEO- TERMOLI,60-69,MOL,ITF2
19,Molise,TML_CAT_OSS,11/01/2021_PF/BT_MOL_14000301_P.O. ISERNIA_60-69,1 - Operatori Sanitari e Sociosanitari,14,2021-01-11,PF/BT,14000301_P.O. ISERNIA,60-69,MOL,ITF2
1,Molise,TML_CAT_OSS,11/01/2021_PF/BT_MOL_14000400_Casa Di Cura Villa Maria_60-69,1 - Operatori Sanitari e Sociosanitari,14,2021-01-11,PF/BT,14000400_Casa Di Cura Villa Maria,60-69,MOL,ITF2
9,Molise,TML_CAT_OSS,"11/01/2021_PF/BT_MOL_14000500_Casa Di Cura ""Villa Esther""_60-69",1 - Operatori Sanitari e Sociosanitari,14,2021-01-11,PF/BT,"14000500_Casa Di Cura ""Villa Esther""",60-69,MOL,ITF2
2,Molise,TML_CAT_OSS,11/01/2021_PF/BT_MOL_140201_Casa Dei Nonni (Talita' Kum)_60-69,1 - Operatori Sanitari e Sociosanitari,14,2021-01-11,PF/BT,140201_Casa Dei Nonni (Talita' Kum),60-69,MOL,ITF2
10,Molise,TML_CAT_OSS,11/01/2021_PF/BT_MOL_14000301_P.O. ISERNIA_90+,1 - Operatori Sanitari e Sociosanitari,14,2021-01-11,PF/BT,14000301_P.O. ISERNIA,90+,MOL,ITF2
18,Molise,TML_CAT_OSS,11/01/2021_PF/BT_MOL_14000400_Casa Di Cura Villa Maria_90+,1 - Operatori Sanitari e Sociosanitari,14,2021-01-11,PF/BT,14000400_Casa Di Cura Villa Maria,90+,MOL,ITF2
1,Molise,TML_CAT_ALTRO,11/01/2021_PF/BT_MOL_14000100_P.O. A.CARDARELLI-CAMPOBASSO_20-29,2 - Personale non Sanitario,14,2021-01-11,PF/BT,14000100_P.O. A.CARDARELLI-CAMPOBASSO,20-29,MOL,ITF2
8,Molise,TML_CAT_PERSONALE,11/01/2021_PF/BT_MOL_14000100_P.O. A.CARDARELLI-CAMPOBASSO_20-29,2 - Personale non Sanitario,14,2021-01-11,PF/BT,14000100_P.O. A.CARDARELLI-CAMPOBASSO,20-29,MOL,ITF2
2,Molise,TML_CAT_PERSONALE,11/01/2021_PF/BT_MOL_14000200_P.O TIMOTEO- TERMOLI_20-29,2 - Personale non Sanitario,14,2021-01-11,PF/BT,14000200_P.O TIMOTEO- TERMOLI,20-29,MOL,ITF2
1,Molise,TML_CAT_PERSONALE,11/01/2021_PF/BT_MOL_14000301_P.O. ISERNIA_20-29,2 - Personale non Sanitario,14,2021-01-11,PF/BT,14000301_P.O. ISERNIA,20-29,MOL,ITF2
1,Molise,TML_CAT_PERSONALE,"11/01/2021_PF/BT_MOL_14000500_Casa Di Cura ""Villa Esther""_20-29",2 - Personale non Sanitario,14,2021-01-11,PF/BT,"14000500_Casa Di Cura ""Villa Esther""",20-29,MOL,ITF2
1,Molise,TML_CAT_PERSONALE,"11/01/2021_PF/BT_MOL_140201_Casa Di Riposo ""Arnaldo De Lisio""_20-29",2 - Personale non Sanitario,14,2021-01-11,PF/BT,"140201_Casa Di Riposo ""Arnaldo De Lisio""",20-29,MOL,ITF2
27,Molise,TML_CAT_PERSONALE,11/01/2021_PF/BT_MOL_14000100_P.O. A.CARDARELLI-CAMPOBASSO_30-39,2 - Personale non Sanitario,14,2021-01-11,PF/BT,14000100_P.O. A.CARDARELLI-CAMPOBASSO,30-39,MOL,ITF2
10,Molise,TML_CAT_PERSONALE,11/01/2021_PF/BT_MOL_14000200_P.O TIMOTEO- TERMOLI_30-39,2 - Personale non Sanitario,14,2021-01-11,PF/BT,14000200_P.O TIMOTEO- TERMOLI,30-39,MOL,ITF2
4,Molise,TML_CAT_PERSONALE,11/01/2021_PF/BT_MOL_14000301_P.O. ISERNIA_30-39,2 - Personale non Sanitario,14,2021-01-11,PF/BT,14000301_P.O. ISERNIA,30-39,MOL,ITF2
1,Molise,TML_CAT_PERSONALE,"11/01/2021_PF/BT_MOL_14000500_Casa Di Cura ""Villa Esther""_30-39",2 - Personale non Sanitario,14,2021-01-11,PF/BT,"14000500_Casa Di Cura ""Villa Esther""",30-39,MOL,ITF2
32,Molise,TML_CAT_PERSONALE,11/01/2021_PF/BT_MOL_14000100_P.O. A.CARDARELLI-CAMPOBASSO_40-49,2 - Personale non Sanitario,14,2021-01-11,PF/BT,14000100_P.O. A.CARDARELLI-CAMPOBASSO,40-49,MOL,ITF2
1,Molise,TML_CAT_ALTRO,11/01/2021_PF/BT_MOL_14000200_P.O TIMOTEO- TERMOLI_40-49,2 - Personale non Sanitario,14,2021-01-11,PF/BT,14000200_P.O TIMOTEO- TERMOLI,40-49,MOL,ITF2
12,Molise,TML_CAT_PERSONALE,11/01/2021_PF/BT_MOL_14000200_P.O TIMOTEO- TERMOLI_40-49,2 - Personale non Sanitario,14,2021-01-11,PF/BT,14000200_P.O TIMOTEO- TERMOLI,40-49,MOL,ITF2
12,Molise,TML_CAT_PERSONALE,11/01/2021_PF/BT_MOL_14000301_P.O. ISERNIA_40-49,2 - Personale non Sanitario,14,2021-01-11,PF/BT,14000301_P.O. ISERNIA,40-49,MOL,ITF2
1,Molise,TML_CAT_PERSONALE,"11/01/2021_PF/BT_MOL_14000500_Casa Di Cura ""Villa Esther""_40-49",2 - Personale non Sanitario,14,2021-01-11,PF/BT,"14000500_Casa Di Cura ""Villa Esther""",40-49,MOL,ITF2
3,Molise,TML_CAT_PERSONALE,11/01/2021_PF/BT_MOL_140201_Casa San Bernardino - Agnone_40-49,2 - Personale non Sanitario,14,2021-01-11,PF/BT,140201_Casa San Bernardino - Agnone,40-49,MOL,ITF2
3,Molise,TML_CAT_ALTRO,11/01/2021_PF/BT_MOL_14000100_P.O. A.CARDARELLI-CAMPOBASSO_50-59,2 - Personale non Sanitario,14,2021-01-11,PF/BT,14000100_P.O. A.CARDARELLI-CAMPOBASSO,50-59,MOL,ITF2
32,Molise,TML_CAT_PERSONALE,11/01/2021_PF/BT_MOL_14000100_P.O. A.CARDARELLI-CAMPOBASSO_50-59,2 - Personale non Sanitario,14,2021-01-11,PF/BT,14000100_P.O. A.CARDARELLI-CAMPOBASSO,50-59,MOL,ITF2
30,Molise,TML_CAT_PERSONALE,11/01/2021_PF/BT_MOL_14000200_P.O TIMOTEO- TERMOLI_50-59,2 - Personale non Sanitario,14,2021-01-11,PF/BT,14000200_P.O TIMOTEO- TERMOLI,50-59,MOL,ITF2
12,Molise,TML_CAT_PERSONALE,11/01/2021_PF/BT_MOL_14000301_P.O. ISERNIA_50-59,2 - Personale non Sanitario,14,2021-01-11,PF/BT,14000301_P.O. ISERNIA,50-59,MOL,ITF2
5,Molise,TML_CAT_PERSONALE,"11/01/2021_PF/BT_MOL_14000500_Casa Di Cura ""Villa Esther""_50-59",2 - Personale non Sanitario,14,2021-01-11,PF/BT,"14000500_Casa Di Cura ""Villa Esther""",50-59,MOL,ITF2
2,Molise,TML_CAT_PERSONALE,11/01/2021_PF/BT_MOL_140201_COMUNITA' ALLOGGIO - DON CRESCENZO SELVAGGIO_50-59,2 - Personale non Sanitario,14,2021-01-11,PF/BT,140201_COMUNITA' ALLOGGIO - DON CRESCENZO SELVAGGIO,50-59,MOL,ITF2
2,Molise,TML_CAT_PERSONALE,11/01/2021_PF/BT_MOL_140201_Casa Di Riposo Giovanni Paolo II_50-59,2 - Personale non Sanitario,14,2021-01-11,PF/BT,140201_Casa Di Riposo Giovanni Paolo II,50-59,MOL,ITF2
1,Molise,TML_CAT_ALTRO,11/01/2021_PF/BT_MOL_14000100_P.O. A.CARDARELLI-CAMPOBASSO_60-69,2 - Personale non Sanitario,14,2021-01-11,PF/BT,14000100_P.O. A.CARDARELLI-CAMPOBASSO,60-69,MOL,ITF2
21,Molise,TML_CAT_PERSONALE,11/01/2021_PF/BT_MOL_14000100_P.O. A.CARDARELLI-CAMPOBASSO_60-69,2 - Personale non Sanitario,14,2021-01-11,PF/BT,14000100_P.O. A.CARDARELLI-CAMPOBASSO,60-69,MOL,ITF2
4,Molise,TML_CAT_PERSONALE,11/01/2021_PF/BT_MOL_14000200_P.O TIMOTEO- TERMOLI_60-69,2 - Personale non Sanitario,14,2021-01-11,PF/BT,14000200_P.O TIMOTEO- TERMOLI,60-69,MOL,ITF2
2,Molise,TML_CAT_PERSONALE,11/01/2021_PF/BT_MOL_14000301_P.O. ISERNIA_60-69,2 - Personale non Sanitario,14,2021-01-11,PF/BT,14000301_P.O. ISERNIA,60-69,MOL,ITF2
2,Molise,TML_CAT_PERSONALE,11/01/2021_PF/BT_MOL_14000400_Casa Di Cura Villa Maria_60-69,2 - Personale non Sanitario,14,2021-01-11,PF/BT,14000400_Casa Di Cura Villa Maria,60-69,MOL,ITF2
1,Molise,TML_CAT_PERSONALE,11/01/2021_PF/BT_MOL_140201_COMUNITA' ALLOGGIO - DON CRESCENZO SELVAGGIO_60-69,2 - Personale non Sanitario,14,2021-01-11,PF/BT,140201_COMUNITA' ALLOGGIO - DON CRESCENZO SELVAGGIO,60-69,MOL,ITF2
2,Molise,TML_CAT_PERSONALE,11/01/2021_PF/BT_MOL_14000301_P.O. ISERNIA_90+,2 - Personale non Sanitario,14,2021-01-11,PF/BT,14000301_P.O. ISERNIA,90+,MOL,ITF2
19,Molise,TML_CAT_PERSONALE,11/01/2021_PF/BT_MOL_14000400_Casa Di Cura Villa Maria_90+,2 - Personale non Sanitario,14,2021-01-11,PF/BT,14000400_Casa Di Cura Villa Maria,90+,MOL,ITF2
1,Molise,TML_CAT_PERSONALE,11/01/2021_PF/BT_MOL_140201_Comunita Alloggio Nicolino De Rubertis_90+,2 - Personale non Sanitario,14,2021-01-11,PF/BT,140201_Comunita Alloggio Nicolino De Rubertis,90+,MOL,ITF2
1,Molise,TML_CAT_RSA_OSPITI,11/01/2021_PF/BT_MOL_140201_Casa San Bernardino - Agnone_40-49,3 - Ospiti Strutture Residenziali,14,2021-01-11,PF/BT,140201_Casa San Bernardino - Agnone,40-49,MOL,ITF2
2,Molise,TML_CAT_RSA_OSPITI,11/01/2021_PF/BT_MOL_14000100_P.O. A.CARDARELLI-CAMPOBASSO_50-59,3 - Ospiti Strutture Residenziali,14,2021-01-11,PF/BT,14000100_P.O. A.CARDARELLI-CAMPOBASSO,50-59,MOL,ITF2
1,Molise,TML_CAT_RSA_OSPITI,11/01/2021_PF/BT_MOL_140201_COMUNITA' ALLOGGIO - DON CRESCENZO SELVAGGIO_50-59,3 - Ospiti Strutture Residenziali,14,2021-01-11,PF/BT,140201_COMUNITA' ALLOGGIO - DON CRESCENZO SELVAGGIO,50-59,MOL,ITF2
1,Molise,TML_CAT_RSA_OSPITI,11/01/2021_PF/BT_MOL_140201_Casa Di Riposo Giovanni Paolo II_50-59,3 - Ospiti Strutture Residenziali,14,2021-01-11,PF/BT,140201_Casa Di Riposo Giovanni Paolo II,50-59,MOL,ITF2
1,Molise,TML_CAT_RSA_OSPITI,11/01/2021_PF/BT_MOL_140201_Casa San Bernardino - Agnone_50-59,3 - Ospiti Strutture Residenziali,14,2021-01-11,PF/BT,140201_Casa San Bernardino - Agnone,50-59,MOL,ITF2
1,Molise,TML_CAT_RSA_OSPITI,11/01/2021_PF/BT_MOL_140201_Comunita Alloggio Nicolino De Rubertis_50-59,3 - Ospiti Strutture Residenziali,14,2021-01-11,PF/BT,140201_Comunita Alloggio Nicolino De Rubertis,50-59,MOL,ITF2
3,Molise,TML_CAT_RSA_OSPITI,11/01/2021_PF/BT_MOL_140201_COMUNITA' ALLOGGIO - DON CRESCENZO SELVAGGIO_60-69,3 - Ospiti Strutture Residenziali,14,2021-01-11,PF/BT,140201_COMUNITA' ALLOGGIO - DON CRESCENZO SELVAGGIO,60-69,MOL,ITF2
1,Molise,TML_CAT_RSA_OSPITI,11/01/2021_PF/BT_MOL_140201_Casa Dei Nonni (Talita' Kum)_60-69,3 - Ospiti Strutture Residenziali,14,2021-01-11,PF/BT,140201_Casa Dei Nonni (Talita' Kum),60-69,MOL,ITF2
2,Molise,TML_CAT_RSA_OSPITI,"11/01/2021_PF/BT_MOL_140201_Casa Di Riposo ""Arnaldo De Lisio""_60-69",3 - Ospiti Strutture Residenziali,14,2021-01-11,PF/BT,"140201_Casa Di Riposo ""Arnaldo De Lisio""",60-69,MOL,ITF2
1,Molise,TML_CAT_RSA_OSPITI,11/01/2021_PF/BT_MOL_140201_Casa Di Riposo Giovanni Paolo II_60-69,3 - Ospiti Strutture Residenziali,14,2021-01-11,PF/BT,140201_Casa Di Riposo Giovanni Paolo II,60-69,MOL,ITF2
1,Molise,TML_CAT_RSA_OSPITI,11/01/2021_PF/BT_MOL_140201_Casa San Bernardino - Agnone_60-69,3 - Ospiti Strutture Residenziali,14,2021-01-11,PF/BT,140201_Casa San Bernardino - Agnone,60-69,MOL,ITF2
1,Molise,TML_CAT_RSA_OSPITI,11/01/2021_PF/BT_MOL_140201_Comunita Alloggio Nicolino De Rubertis_60-69,3 - Ospiti Strutture Residenziali,14,2021-01-11,PF/BT,140201_Comunita Alloggio Nicolino De Rubertis,60-69,MOL,ITF2
2,Molise,TML_CAT_RSA_OSPITI,11/01/2021_PF/BT_MOL_140201_COMUNITA' ALLOGGIO - DON CRESCENZO SELVAGGIO_70-79,3 - Ospiti Strutture Residenziali,14,2021-01-11,PF/BT,140201_COMUNITA' ALLOGGIO - DON CRESCENZO SELVAGGIO,70-79,MOL,ITF2
3,Molise,TML_CAT_RSA_OSPITI,11/01/2021_PF/BT_MOL_140201_Casa Dei Nonni (Talita' Kum)_70-79,3 - Ospiti Strutture Residenziali,14,2021-01-11,PF/BT,140201_Casa Dei Nonni (Talita' Kum),70-79,MOL,ITF2
1,Molise,TML_CAT_RSA_OSPITI,"11/01/2021_PF/BT_MOL_140201_Casa Di Riposo ""Arnaldo De Lisio""_70-79",3 - Ospiti Strutture Residenziali,14,2021-01-11,PF/BT,"140201_Casa Di Riposo ""Arnaldo De Lisio""",70-79,MOL,ITF2
4,Molise,TML_CAT_RSA_OSPITI,11/01/2021_PF/BT_MOL_140201_Casa Di Riposo Giovanni Paolo II_70-79,3 - Ospiti Strutture Residenziali,14,2021-01-11,PF/BT,140201_Casa Di Riposo Giovanni Paolo II,70-79,MOL,ITF2
4,Molise,TML_CAT_RSA_OSPITI,11/01/2021_PF/BT_MOL_140201_Casa San Bernardino - Agnone_70-79,3 - Ospiti Strutture Residenziali,14,2021-01-11,PF/BT,140201_Casa San Bernardino - Agnone,70-79,MOL,ITF2
3,Molise,TML_CAT_RSA_OSPITI,11/01/2021_PF/BT_MOL_140201_Comunita Alloggio Nicolino De Rubertis_70-79,3 - Ospiti Strutture Residenziali,14,2021-01-11,PF/BT,140201_Comunita Alloggio Nicolino De Rubertis,70-79,MOL,ITF2
6,Molise,TML_CAT_RSA_OSPITI,11/01/2021_PF/BT_MOL_140201_COMUNITA' ALLOGGIO - DON CRESCENZO SELVAGGIO_80-89,3 - Ospiti Strutture Residenziali,14,2021-01-11,PF/BT,140201_COMUNITA' ALLOGGIO - DON CRESCENZO SELVAGGIO,80-89,MOL,ITF2
7,Molise,TML_CAT_RSA_OSPITI,11/01/2021_PF/BT_MOL_140201_Casa Dei Nonni (Talita' Kum)_80-89,3 - Ospiti Strutture Residenziali,14,2021-01-11,PF/BT,140201_Casa Dei Nonni (Talita' Kum),80-89,MOL,ITF2
13,Molise,TML_CAT_RSA_OSPITI,"11/01/2021_PF/BT_MOL_140201_Casa Di Riposo ""Arnaldo De Lisio""_80-89",3 - Ospiti Strutture Residenziali,14,2021-01-11,PF/BT,"140201_Casa Di Riposo ""Arnaldo De Lisio""",80-89,MOL,ITF2
2,Molise,TML_CAT_RSA_OSPITI,11/01/2021_PF/BT_MOL_140201_Casa Di Riposo Giovanni Paolo II_80-89,3 - Ospiti Strutture Residenziali,14,2021-01-11,PF/BT,140201_Casa Di Riposo Giovanni Paolo II,80-89,MOL,ITF2
12,Molise,TML_CAT_RSA_OSPITI,11/01/2021_PF/BT_MOL_140201_Casa San Bernardino - Agnone_80-89,3 - Ospiti Strutture Residenziali,14,2021-01-11,PF/BT,140201_Casa San Bernardino - Agnone,80-89,MOL,ITF2
4,Molise,TML_CAT_RSA_OSPITI,11/01/2021_PF/BT_MOL_140201_Comunita Alloggio Nicolino De Rubertis_80-89,3 - Ospiti Strutture Residenziali,14,2021-01-11,PF/BT,140201_Comunita Alloggio Nicolino De Rubertis,80-89,MOL,ITF2
1,Molise,TML_CAT_RSA_OSPITI,11/01/2021_PF/BT_MOL_14000400_Casa Di Cura Villa Maria_90+,3 - Ospiti Strutture Residenziali,14,2021-01-11,PF/BT,14000400_Casa Di Cura Villa Maria,90+,MOL,ITF2
3,Molise,TML_CAT_RSA_OSPITI,11/01/2021_PF/BT_MOL_140201_COMUNITA' ALLOGGIO - DON CRESCENZO SELVAGGIO_90+,3 - Ospiti Strutture Residenziali,14,2021-01-11,PF/BT,140201_COMUNITA' ALLOGGIO - DON CRESCENZO SELVAGGIO,90+,MOL,ITF2
2,Molise,TML_CAT_RSA_OSPITI,11/01/2021_PF/BT_MOL_140201_Casa Dei Nonni (Talita' Kum)_90+,3 - Ospiti Strutture Residenziali,14,2021-01-11,PF/BT,140201_Casa Dei Nonni (Talita' Kum),90+,MOL,ITF2
3,Molise,TML_CAT_RSA_OSPITI,"11/01/2021_PF/BT_MOL_140201_Casa Di Riposo ""Arnaldo De Lisio""_90+",3 - Ospiti Strutture Residenziali,14,2021-01-11,PF/BT,"140201_Casa Di Riposo ""Arnaldo De Lisio""",90+,MOL,ITF2
8,Molise,TML_CAT_RSA_OSPITI,11/01/2021_PF/BT_MOL_140201_Casa Di Riposo Giovanni Paolo II_90+,3 - Ospiti Strutture Residenziali,14,2021-01-11,PF/BT,140201_Casa Di Riposo Giovanni Paolo II,90+,MOL,ITF2
11,Molise,TML_CAT_RSA_OSPITI,11/01/2021_PF/BT_MOL_140201_Casa San Bernardino - Agnone_90+,3 - Ospiti Strutture Residenziali,14,2021-01-11,PF/BT,140201_Casa San Bernardino - Agnone,90+,MOL,ITF2
6,Molise,TML_CAT_RSA_OSPITI,11/01/2021_PF/BT_MOL_140201_Comunita Alloggio Nicolino De Rubertis_90+,3 - Ospiti Strutture Residenziali,14,2021-01-11,PF/BT,140201_Comunita Alloggio Nicolino De Rubertis,90+,MOL,ITF2
3,Molise,TML_CAT_OSS,12/01/2021_PF/BT_MOL_14000301_P.O. ISERNIA_20-29,1 - Operatori Sanitari e Sociosanitari,14,2021-01-12,PF/BT,14000301_P.O. ISERNIA,20-29,MOL,ITF2
12,Molise,TML_CAT_OSS,12/01/2021_PF/BT_MOL_14091100_NEUROMED I.R.C.C.S._20-29,1 - Operatori Sanitari e Sociosanitari,14,2021-01-12,PF/BT,14091100_NEUROMED I.R.C.C.S.,20-29,MOL,ITF2
7,Molise,TML_CAT_OSS,12/01/2021_PF/BT_MOL_14000100_P.O. A.CARDARELLI-CAMPOBASSO_30-39,1 - Operatori Sanitari e Sociosanitari,14,2021-01-12,PF/BT,14000100_P.O. A.CARDARELLI-CAMPOBASSO,30-39,MOL,ITF2
5,Molise,TML_CAT_OSS,12/01/2021_PF/BT_MOL_14000301_P.O. ISERNIA_30-39,1 - Operatori Sanitari e Sociosanitari,14,2021-01-12,PF/BT,14000301_P.O. ISERNIA,30-39,MOL,ITF2
1,Molise,TML_CAT_OSS,12/01/2021_PF/BT_MOL_140201_Comunita' Alloggio La Sfinge_30-39,1 - Operatori Sanitari e Sociosanitari,14,2021-01-12,PF/BT,140201_Comunita' Alloggio La Sfinge,30-39,MOL,ITF2
28,Molise,TML_CAT_OSS,12/01/2021_PF/BT_MOL_14091100_NEUROMED I.R.C.C.S._30-39,1 - Operatori Sanitari e Sociosanitari,14,2021-01-12,PF/BT,14091100_NEUROMED I.R.C.C.S.,30-39,MOL,ITF2
2,Molise,TML_CAT_OSS,12/01/2021_PF/BT_MOL_14000100_P.O. A.CARDARELLI-CAMPOBASSO_40-49,1 - Operatori Sanitari e Sociosanitari,14,2021-01-12,PF/BT,14000100_P.O. A.CARDARELLI-CAMPOBASSO,40-49,MOL,ITF2
5,Molise,TML_CAT_OSS,12/01/2021_PF/BT_MOL_14000301_P.O. ISERNIA_40-49,1 - Operatori Sanitari e Sociosanitari,14,2021-01-12,PF/BT,14000301_P.O. ISERNIA,40-49,MOL,ITF2
1,Molise,TML_CAT_OSS,12/01/2021_PF/BT_MOL_140201_Casa Di Riposo Cardinal Seper_40-49,1 - Operatori Sanitari e Sociosanitari,14,2021-01-12,PF/BT,140201_Casa Di Riposo Cardinal Seper,40-49,MOL,ITF2
2,Molise,TML_CAT_OSS,12/01/2021_PF/BT_MOL_140201_Casa Di Riposo Villa Santa Maria_40-49,1 - Operatori Sanitari e Sociosanitari,14,2021-01-12,PF/BT,140201_Casa Di Riposo Villa Santa Maria,40-49,MOL,ITF2
18,Molise,TML_CAT_OSS,12/01/2021_PF/BT_MOL_14091100_NEUROMED I.R.C.C.S._40-49,1 - Operatori Sanitari e Sociosanitari,14,2021-01-12,PF/BT,14091100_NEUROMED I.R.C.C.S.,40-49,MOL,ITF2
7,Molise,TML_CAT_OSS,12/01/2021_PF/BT_MOL_14000100_P.O. A.CARDARELLI-CAMPOBASSO_50-59,1 - Operatori Sanitari e Sociosanitari,14,2021-01-12,PF/BT,14000100_P.O. A.CARDARELLI-CAMPOBASSO,50-59,MOL,ITF2
12,Molise,TML_CAT_OSS,12/01/2021_PF/BT_MOL_14000301_P.O. ISERNIA_50-59,1 - Operatori Sanitari e Sociosanitari,14,2021-01-12,PF/BT,14000301_P.O. ISERNIA,50-59,MOL,ITF2
1,Molise,TML_CAT_OSS,12/01/2021_PF/BT_MOL_140201_Casa Di Riposo Cardinal Seper_50-59,1 - Operatori Sanitari e Sociosanitari,14,2021-01-12,PF/BT,140201_Casa Di Riposo Cardinal Seper,50-59,MOL,ITF2
1,Molise,TML_CAT_OSS,12/01/2021_PF/BT_MOL_140201_Comunita' Alloggio La Sfinge_50-59,1 - Operatori Sanitari e Sociosanitari,14,2021-01-12,PF/BT,140201_Comunita' Alloggio La Sfinge,50-59,MOL,ITF2
10,Molise,TML_CAT_OSS,12/01/2021_PF/BT_MOL_14091100_NEUROMED I.R.C.C.S._50-59,1 - Operatori Sanitari e Sociosanitari,14,2021-01-12,PF/BT,14091100_NEUROMED I.R.C.C.S.,50-59,MOL,ITF2
3,Molise,TML_CAT_OSS,12/01/2021_PF/BT_MOL_14000100_P.O. A.CARDARELLI-CAMPOBASSO_60-69,1 - Operatori Sanitari e Sociosanitari,14,2021-01-12,PF/BT,14000100_P.O. A.CARDARELLI-CAMPOBASSO,60-69,MOL,ITF2
6,Molise,TML_CAT_OSS,12/01/2021_PF/BT_MOL_14000301_P.O. ISERNIA_60-69,1 - Operatori Sanitari e Sociosanitari,14,2021-01-12,PF/BT,14000301_P.O. ISERNIA,60-69,MOL,ITF2
1,Molise,TML_CAT_OSS,12/01/2021_PF/BT_MOL_140201_Casa Di Riposo Cardinal Seper_60-69,1 - Operatori Sanitari e Sociosanitari,14,2021-01-12,PF/BT,140201_Casa Di Riposo Cardinal Seper,60-69,MOL,ITF2
2,Molise,TML_CAT_OSS,12/01/2021_PF/BT_MOL_14091100_NEUROMED I.R.C.C.S._60-69,1 - Operatori Sanitari e Sociosanitari,14,2021-01-12,PF/BT,14091100_NEUROMED I.R.C.C.S.,60-69,MOL,ITF2
1,Molise,TML_CAT_OSS,12/01/2021_PF/BT_MOL_14000301_P.O. ISERNIA_70-79,1 - Operatori Sanitari e Sociosanitari,14,2021-01-12,PF/BT,14000301_P.O. ISERNIA,70-79,MOL,ITF2
2,Molise,TML_CAT_OSS,12/01/2021_PF/BT_MOL_14091100_NEUROMED I.R.C.C.S._70-79,1 - Operatori Sanitari e Sociosanitari,14,2021-01-12,PF/BT,14091100_NEUROMED I.R.C.C.S.,70-79,MOL,ITF2
1,Molise,TML_CAT_OSS,12/01/2021_PF/BT_MOL_14000301_P.O. ISERNIA_90+,1 - Operatori Sanitari e Sociosanitari,14,2021-01-12,PF/BT,14000301_P.O. ISERNIA,90+,MOL,ITF2
4,Molise,TML_CAT_PERSONALE,12/01/2021_PF/BT_MOL_14000100_P.O. A.CARDARELLI-CAMPOBASSO_20-29,2 - Personale non Sanitario,14,2021-01-12,PF/BT,14000100_P.O. A.CARDARELLI-CAMPOBASSO,20-29,MOL,ITF2
2,Molise,TML_CAT_PERSONALE,12/01/2021_PF/BT_MOL_14000301_P.O. ISERNIA_20-29,2 - Personale non Sanitario,14,2021-01-12,PF/BT,14000301_P.O. ISERNIA,20-29,MOL,ITF2
1,Molise,TML_CAT_PERSONALE,12/01/2021_PF/BT_MOL_140201_Comunita' Alloggio La Sfinge_20-29,2 - Personale non Sanitario,14,2021-01-12,PF/BT,140201_Comunita' Alloggio La Sfinge,20-29,MOL,ITF2
7,Molise,TML_CAT_PERSONALE,12/01/2021_PF/BT_MOL_14000100_P.O. A.CARDARELLI-CAMPOBASSO_30-39,2 - Personale non Sanitario,14,2021-01-12,PF/BT,14000100_P.O. A.CARDARELLI-CAMPOBASSO,30-39,MOL,ITF2
3,Molise,TML_CAT_PERSONALE,12/01/2021_PF/BT_MOL_14000301_P.O. ISERNIA_30-39,2 - Personale non Sanitario,14,2021-01-12,PF/BT,14000301_P.O. ISERNIA,30-39,MOL,ITF2
1,Molise,TML_CAT_ALTRO,12/01/2021_PF/BT_MOL_14000100_P.O. A.CARDARELLI-CAMPOBASSO_40-49,2 - Personale non Sanitario,14,2021-01-12,PF/BT,14000100_P.O. A.CARDARELLI-CAMPOBASSO,40-49,MOL,ITF2
10,Molise,TML_CAT_PERSONALE,12/01/2021_PF/BT_MOL_14000100_P.O. A.CARDARELLI-CAMPOBASSO_40-49,2 - Personale non Sanitario,14,2021-01-12,PF/BT,14000100_P.O. A.CARDARELLI-CAMPOBASSO,40-49,MOL,ITF2
8,Molise,TML_CAT_PERSONALE,12/01/2021_PF/BT_MOL_14000301_P.O. ISERNIA_40-49,2 - Personale non Sanitario,14,2021-01-12,PF/BT,14000301_P.O. ISERNIA,40-49,MOL,ITF2
1,Molise,TML_CAT_PERSONALE,12/01/2021_PF/BT_MOL_140201_Casa Di Riposo Cardinal Seper_40-49,2 - Personale non Sanitario,14,2021-01-12,PF/BT,140201_Casa Di Riposo Cardinal Seper,40-49,MOL,ITF2
14,Molise,TML_CAT_PERSONALE,12/01/2021_PF/BT_MOL_14000100_P.O. A.CARDARELLI-CAMPOBASSO_50-59,2 - Personale non Sanitario,14,2021-01-12,PF/BT,14000100_P.O. A.CARDARELLI-CAMPOBASSO,50-59,MOL,ITF2
10,Molise,TML_CAT_PERSONALE,12/01/2021_PF/BT_MOL_14000301_P.O. ISERNIA_50-59,2 - Personale non Sanitario,14,2021-01-12,PF/BT,14000301_P.O. ISERNIA,50-59,MOL,ITF2
1,Molise,TML_CAT_PERSONALE,12/01/2021_PF/BT_MOL_140201_Casa Di Riposo Cardinal Seper_50-59,2 - Personale non Sanitario,14,2021-01-12,PF/BT,140201_Casa Di Riposo Cardinal Seper,50-59,MOL,ITF2
5,Molise,TML_CAT_PERSONALE,12/01/2021_PF/BT_MOL_14000100_P.O. A.CARDARELLI-CAMPOBASSO_60-69,2 - Personale non Sanitario,14,2021-01-12,PF/BT,14000100_P.O. A.CARDARELLI-CAMPOBASSO,60-69,MOL,ITF2
2,Molise,TML_CAT_PERSONALE,12/01/2021_PF/BT_MOL_14000301_P.O. ISERNIA_60-69,2 - Personale non Sanitario,14,2021-01-12,PF/BT,14000301_P.O. ISERNIA,60-69,MOL,ITF2
1,Molise,TML_CAT_PERSONALE,12/01/2021_PF/BT_MOL_140201_CASA DELLA CARITA'_60-69,2 - Personale non Sanitario,14,2021-01-12,PF/BT,140201_CASA DELLA CARITA',60-69,MOL,ITF2
1,Molise,TML_CAT_PERSONALE,12/01/2021_PF/BT_MOL_140201_Casa Di Riposo Villa Santa Maria_60-69,2 - Personale non Sanitario,14,2021-01-12,PF/BT,140201_Casa Di Riposo Villa Santa Maria,60-69,MOL,ITF2
1,Molise,TML_CAT_PERSONALE,12/01/2021_PF/BT_MOL_14000301_P.O. ISERNIA_70-79,2 - Personale non Sanitario,14,2021-01-12,PF/BT,14000301_P.O. ISERNIA,70-79,MOL,ITF2
1,Molise,TML_CAT_PERSONALE,12/01/2021_PF/BT_MOL_140201_CASA DELLA CARITA'_80-89,2 - Personale non Sanitario,14,2021-01-12,PF/BT,140201_CASA DELLA CARITA',80-89,MOL,ITF2
1,Molise,TML_CAT_PERSONALE,12/01/2021_PF/BT_MOL_14000301_P.O. ISERNIA_90+,2 - Personale non Sanitario,14,2021-01-12,PF/BT,14000301_P.O. ISERNIA,90+,MOL,ITF2
1,Molise,TML_CAT_PERSONALE,12/01/2021_PF/BT_MOL_140201_CASA DELLA CARITA'_90+,2 - Personale non Sanitario,14,2021-01-12,PF/BT,140201_CASA DELLA CARITA',90+,MOL,ITF2
1,Molise,TML_CAT_RSA_OSPITI,12/01/2021_PF/BT_MOL_140201_Casa Di Riposo Villa Santa Maria_40-49,3 - Ospiti Strutture Residenziali,14,2021-01-12,PF/BT,140201_Casa Di Riposo Villa Santa Maria,40-49,MOL,ITF2
1,Molise,TML_CAT_RSA_OSPITI,12/01/2021_PF/BT_MOL_140201_Comunita' Alloggio La Sfinge_50-59,3 - Ospiti Strutture Residenziali,14,2021-01-12,PF/BT,140201_Comunita' Alloggio La Sfinge,50-59,MOL,ITF2
1,Molise,TML_CAT_RSA_OSPITI,12/01/2021_PF/BT_MOL_140201_CASA DELLA CARITA'_60-69,3 - Ospiti Strutture Residenziali,14,2021-01-12,PF/BT,140201_CASA DELLA CARITA',60-69,MOL,ITF2
2,Molise,TML_CAT_RSA_OSPITI,12/01/2021_PF/BT_MOL_140201_Casa Di Riposo Cardinal Seper_60-69,3 - Ospiti Strutture Residenziali,14,2021-01-12,PF/BT,140201_Casa Di Riposo Cardinal Seper,60-69,MOL,ITF2
1,Molise,TML_CAT_RSA_OSPITI,12/01/2021_PF/BT_MOL_140201_Casa Di Riposo Villa Santa Maria_60-69,3 - Ospiti Strutture Residenziali,14,2021-01-12,PF/BT,140201_Casa Di Riposo Villa Santa Maria,60-69,MOL,ITF2
2,Molise,TML_CAT_RSA_OSPITI,12/01/2021_PF/BT_MOL_140201_Comunita' Alloggio La Sfinge_60-69,3 - Ospiti Strutture Residenziali,14,2021-01-12,PF/BT,140201_Comunita' Alloggio La Sfinge,60-69,MOL,ITF2
1,Molise,TML_CAT_RSA_OSPITI,12/01/2021_PF/BT_MOL_140201_Comunita' Alloggio Madonna Delle Grazie_60-69,3 - Ospiti Strutture Residenziali,14,2021-01-12,PF/BT,140201_Comunita' Alloggio Madonna Delle Grazie,60-69,MOL,ITF2
7,Molise,TML_CAT_RSA_OSPITI,12/01/2021_PF/BT_MOL_140201_CASA DELLA CARITA'_70-79,3 - Ospiti Strutture Residenziali,14,2021-01-12,PF/BT,140201_CASA DELLA CARITA',70-79,MOL,ITF2
5,Molise,TML_CAT_RSA_OSPITI,12/01/2021_PF/BT_MOL_140201_Casa Di Riposo Cardinal Seper_70-79,3 - Ospiti Strutture Residenziali,14,2021-01-12,PF/BT,140201_Casa Di Riposo Cardinal Seper,70-79,MOL,ITF2
5,Molise,TML_CAT_RSA_OSPITI,12/01/2021_PF/BT_MOL_140201_Casa Di Riposo Villa Santa Maria_70-79,3 - Ospiti Strutture Residenziali,14,2021-01-12,PF/BT,140201_Casa Di Riposo Villa Santa Maria,70-79,MOL,ITF2
2,Molise,TML_CAT_RSA_OSPITI,12/01/2021_PF/BT_MOL_140201_Comunita' Alloggio Madonna Delle Grazie_70-79,3 - Ospiti Strutture Residenziali,14,2021-01-12,PF/BT,140201_Comunita' Alloggio Madonna Delle Grazie,70-79,MOL,ITF2
7,Molise,TML_CAT_RSA_OSPITI,12/01/2021_PF/BT_MOL_140201_CASA DELLA CARITA'_80-89,3 - Ospiti Strutture Residenziali,14,2021-01-12,PF/BT,140201_CASA DELLA CARITA',80-89,MOL,ITF2
15,Molise,TML_CAT_RSA_OSPITI,12/01/2021_PF/BT_MOL_140201_Casa Di Riposo Cardinal Seper_80-89,3 - Ospiti Strutture Residenziali,14,2021-01-12,PF/BT,140201_Casa Di Riposo Cardinal Seper,80-89,MOL,ITF2
17,Molise,TML_CAT_RSA_OSPITI,12/01/2021_PF/BT_MOL_140201_Casa Di Riposo Villa Santa Maria_80-89,3 - Ospiti Strutture Residenziali,14,2021-01-12,PF/BT,140201_Casa Di Riposo Villa Santa Maria,80-89,MOL,ITF2
5,Molise,TML_CAT_RSA_OSPITI,12/01/2021_PF/BT_MOL_140201_Comunita' Alloggio La Sfinge_80-89,3 - Ospiti Strutture Residenziali,14,2021-01-12,PF/BT,140201_Comunita' Alloggio La Sfinge,80-89,MOL,ITF2
8,Molise,TML_CAT_RSA_OSPITI,12/01/2021_PF/BT_MOL_140201_Comunita' Alloggio Madonna Delle Grazie_80-89,3 - Ospiti Strutture Residenziali,14,2021-01-12,PF/BT,140201_Comunita' Alloggio Madonna Delle Grazie,80-89,MOL,ITF2
6,Molise,TML_CAT_RSA_OSPITI,12/01/2021_PF/BT_MOL_140201_CASA DELLA CARITA'_90+,3 - Ospiti Strutture Residenziali,14,2021-01-12,PF/BT,140201_CASA DELLA CARITA',90+,MOL,ITF2
9,Molise,TML_CAT_RSA_OSPITI,12/01/2021_PF/BT_MOL_140201_Casa Di Riposo Cardinal Seper_90+,3 - Ospiti Strutture Residenziali,14,2021-01-12,PF/BT,140201_Casa Di Riposo Cardinal Seper,90+,MOL,ITF2
1,Molise,TML_CAT_RSA_OSPITI,12/01/2021_PF/BT_MOL_140201_Casa Di Riposo Villa Anna_90+,3 - Ospiti Strutture Residenziali,14,2021-01-12,PF/BT,140201_Casa Di Riposo Villa Anna,90+,MOL,ITF2
14,Molise,TML_CAT_RSA_OSPITI,12/01/2021_PF/BT_MOL_140201_Casa Di Riposo Villa Santa Maria_90+,3 - Ospiti Strutture Residenziali,14,2021-01-12,PF/BT,140201_Casa Di Riposo Villa Santa Maria,90+,MOL,ITF2
13,Molise,TML_CAT_RSA_OSPITI,12/01/2021_PF/BT_MOL_140201_Comunita' Alloggio La Sfinge_90+,3 - Ospiti Strutture Residenziali,14,2021-01-12,PF/BT,140201_Comunita' Alloggio La Sfinge,90+,MOL,ITF2
7,Molise,TML_CAT_RSA_OSPITI,12/01/2021_PF/BT_MOL_140201_Comunita' Alloggio Madonna Delle Grazie_90+,3 - Ospiti Strutture Residenziali,14,2021-01-12,PF/BT,140201_Comunita' Alloggio Madonna Delle Grazie,90+,MOL,ITF2
7,Molise,TML_CAT_OSS,13/01/2021_PF/BT_MOL_14000200_P.O TIMOTEO- TERMOLI_20-29,1 - Operatori Sanitari e Sociosanitari,14,2021-01-13,PF/BT,14000200_P.O TIMOTEO- TERMOLI,20-29,MOL,ITF2
3,Molise,TML_CAT_OSS,13/01/2021_PF/BT_MOL_14000301_P.O. ISERNIA_20-29,1 - Operatori Sanitari e Sociosanitari,14,2021-01-13,PF/BT,14000301_P.O. ISERNIA,20-29,MOL,ITF2
1,Molise,TML_CAT_OSS,13/01/2021_PF/BT_MOL_140201_Casa Di Riposo Maria De Horatiis_20-29,1 - Operatori Sanitari e Sociosanitari,14,2021-01-13,PF/BT,140201_Casa Di Riposo Maria De Horatiis,20-29,MOL,ITF2
13,Molise,TML_CAT_OSS,13/01/2021_PF/BT_MOL_14091100_NEUROMED I.R.C.C.S._20-29,1 - Operatori Sanitari e Sociosanitari,14,2021-01-13,PF/BT,14091100_NEUROMED I.R.C.C.S.,20-29,MOL,ITF2
17,Molise,TML_CAT_OSS,13/01/2021_PF/BT_MOL_14000200_P.O TIMOTEO- TERMOLI_30-39,1 - Operatori Sanitari e Sociosanitari,14,2021-01-13,PF/BT,14000200_P.O TIMOTEO- TERMOLI,30-39,MOL,ITF2
7,Molise,TML_CAT_OSS,13/01/2021_PF/BT_MOL_14000301_P.O. ISERNIA_30-39,1 - Operatori Sanitari e Sociosanitari,14,2021-01-13,PF/BT,14000301_P.O. ISERNIA,30-39,MOL,ITF2
1,Molise,TML_CAT_OSS,13/01/2021_PF/BT_MOL_140201_Casa Di Riposo Famiglia Leccesse_30-39,1 - Operatori Sanitari e Sociosanitari,14,2021-01-13,PF/BT,140201_Casa Di Riposo Famiglia Leccesse,30-39,MOL,ITF2
3,Molise,TML_CAT_OSS,13/01/2021_PF/BT_MOL_140201_Casa Di Riposo Maria De Horatiis_30-39,1 - Operatori Sanitari e Sociosanitari,14,2021-01-13,PF/BT,140201_Casa Di Riposo Maria De Horatiis,30-39,MOL,ITF2
1,Molise,TML_CAT_OSS,13/01/2021_PF/BT_MOL_140201_Villa S. Clemente_30-39,1 - Operatori Sanitari e Sociosanitari,14,2021-01-13,PF/BT,140201_Villa S. Clemente,30-39,MOL,ITF2
15,Molise,TML_CAT_OSS,13/01/2021_PF/BT_MOL_14091100_NEUROMED I.R.C.C.S._30-39,1 - Operatori Sanitari e Sociosanitari,14,2021-01-13,PF/BT,14091100_NEUROMED I.R.C.C.S.,30-39,MOL,ITF2
12,Molise,TML_CAT_OSS,13/01/2021_PF/BT_MOL_14000200_P.O TIMOTEO- TERMOLI_40-49,1 - Operatori Sanitari e Sociosanitari,14,2021-01-13,PF/BT,14000200_P.O TIMOTEO- TERMOLI,40-49,MOL,ITF2
2,Molise,TML_CAT_OSS,13/01/2021_PF/BT_MOL_14000301_P.O. ISERNIA_40-49,1 - Operatori Sanitari e Sociosanitari,14,2021-01-13,PF/BT,14000301_P.O. ISERNIA,40-49,MOL,ITF2
7,Molise,TML_CAT_OSS,13/01/2021_PF/BT_MOL_14000700_GEMELLI MOLISE S.P.A._40-49,1 - Operatori Sanitari e Sociosanitari,14,2021-01-13,PF/BT,14000700_GEMELLI MOLISE S.P.A.,40-49,MOL,ITF2
2,Molise,TML_CAT_OSS,13/01/2021_PF/BT_MOL_140201_Casa Di Riposo Maria De Horatiis_40-49,1 - Operatori Sanitari e Sociosanitari,14,2021-01-13,PF/BT,140201_Casa Di Riposo Maria De Horatiis,40-49,MOL,ITF2
1,Molise,TML_CAT_OSS,13/01/2021_PF/BT_MOL_140201_Comunit Alloggio Sant'Amico_40-49,1 - Operatori Sanitari e Sociosanitari,14,2021-01-13,PF/BT,140201_Comunit Alloggio Sant'Amico,40-49,MOL,ITF2
2,Molise,TML_CAT_OSS,13/01/2021_PF/BT_MOL_140201_Villa S. Clemente_40-49,1 - Operatori Sanitari e Sociosanitari,14,2021-01-13,PF/BT,140201_Villa S. Clemente,40-49,MOL,ITF2
16,Molise,TML_CAT_OSS,13/01/2021_PF/BT_MOL_14091100_NEUROMED I.R.C.C.S._40-49,1 - Operatori Sanitari e Sociosanitari,14,2021-01-13,PF/BT,14091100_NEUROMED I.R.C.C.S.,40-49,MOL,ITF2
16,Molise,TML_CAT_OSS,13/01/2021_PF/BT_MOL_14000200_P.O TIMOTEO- TERMOLI_50-59,1 - Operatori Sanitari e Sociosanitari,14,2021-01-13,PF/BT,14000200_P.O TIMOTEO- TERMOLI,50-59,MOL,ITF2
5,Molise,TML_CAT_OSS,13/01/2021_PF/BT_MOL_14000301_P.O. ISERNIA_50-59,1 - Operatori Sanitari e Sociosanitari,14,2021-01-13,PF/BT,14000301_P.O. ISERNIA,50-59,MOL,ITF2
50,Molise,TML_CAT_OSS,13/01/2021_PF/BT_MOL_14000700_GEMELLI MOLISE S.P.A._50-59,1 - Operatori Sanitari e Sociosanitari,14,2021-01-13,PF/BT,14000700_GEMELLI MOLISE S.P.A.,50-59,MOL,ITF2
2,Molise,TML_CAT_OSS,13/01/2021_PF/BT_MOL_140201_Casa Di Riposo Famiglia Leccesse_50-59,1 - Operatori Sanitari e Sociosanitari,14,2021-01-13,PF/BT,140201_Casa Di Riposo Famiglia Leccesse,50-59,MOL,ITF2
