somministrazioni,regione,siglaCategoria,identificativo,categoria,codice_regione,data,vaccino,punto,classeEta,siglaRegione,NUTS2
1,Sardegna,TML_CAT_OSS,27/12/2020_PF/BT_SAR_200036_P.O. A. BUSINCO - AOB_20-29,1 - Operatori Sanitari e Sociosanitari,20,2020-12-27,PF/BT,200036_P.O. A. BUSINCO - AOB,20-29,SAR,ITG2
1,Sardegna,TML_CAT_OSS,27/12/2020_PF/BT_SAR_200904_P.O. SAN MICHELE - AOB_20-29,1 - Operatori Sanitari e Sociosanitari,20,2020-12-27,PF/BT,200904_P.O. SAN MICHELE - AOB,20-29,SAR,ITG2
1,Sardegna,TML_CAT_OSS,27/12/2020_PF/BT_SAR_200036_P.O. A. BUSINCO - AOB_30-39,1 - Operatori Sanitari e Sociosanitari,20,2020-12-27,PF/BT,200036_P.O. A. BUSINCO - AOB,30-39,SAR,ITG2
1,Sardegna,TML_CAT_OSS,27/12/2020_PF/BT_SAR_200036_P.O. A. BUSINCO - AOB_40-49,1 - Operatori Sanitari e Sociosanitari,20,2020-12-27,PF/BT,200036_P.O. A. BUSINCO - AOB,40-49,SAR,ITG2
1,Sardegna,TML_CAT_OSS,27/12/2020_PF/BT_SAR_200904_P.O. SAN MICHELE - AOB_40-49,1 - Operatori Sanitari e Sociosanitari,20,2020-12-27,PF/BT,200904_P.O. SAN MICHELE - AOB,40-49,SAR,ITG2
1,Sardegna,TML_CAT_OSS,27/12/2020_PF/BT_SAR_200036_P.O. A. BUSINCO - AOB_50-59,1 - Operatori Sanitari e Sociosanitari,20,2020-12-27,PF/BT,200036_P.O. A. BUSINCO - AOB,50-59,SAR,ITG2
1,Sardegna,TML_CAT_OSS,27/12/2020_PF/BT_SAR_200904_P.O. SAN MICHELE - AOB_50-59,1 - Operatori Sanitari e Sociosanitari,20,2020-12-27,PF/BT,200904_P.O. SAN MICHELE - AOB,50-59,SAR,ITG2
1,Sardegna,TML_CAT_OSS,27/12/2020_PF/BT_SAR_200036_P.O. A. BUSINCO - AOB_60-69,1 - Operatori Sanitari e Sociosanitari,20,2020-12-27,PF/BT,200036_P.O. A. BUSINCO - AOB,60-69,SAR,ITG2
15,Sardegna,TML_CAT_OSS,27/12/2020_PF/BT_SAR_200904_P.O. SAN MICHELE - AOB_60-69,1 - Operatori Sanitari e Sociosanitari,20,2020-12-27,PF/BT,200904_P.O. SAN MICHELE - AOB,60-69,SAR,ITG2
1,Sardegna,TML_CAT_OSS,27/12/2020_PF/BT_SAR_200904_P.O. SAN MICHELE - AOB_70-79,1 - Operatori Sanitari e Sociosanitari,20,2020-12-27,PF/BT,200904_P.O. SAN MICHELE - AOB,70-79,SAR,ITG2
1,Sardegna,TML_CAT_OSS,28/12/2020_PF/BT_SAR_200036_P.O. A. BUSINCO - AOB_20-29,1 - Operatori Sanitari e Sociosanitari,20,2020-12-28,PF/BT,200036_P.O. A. BUSINCO - AOB,20-29,SAR,ITG2
1,Sardegna,TML_CAT_OSS,28/12/2020_PF/BT_SAR_200036_P.O. A. BUSINCO - AOB_30-39,1 - Operatori Sanitari e Sociosanitari,20,2020-12-28,PF/BT,200036_P.O. A. BUSINCO - AOB,30-39,SAR,ITG2
1,Sardegna,TML_CAT_OSS,28/12/2020_PF/BT_SAR_200904_P.O. SAN MICHELE - AOB_30-39,1 - Operatori Sanitari e Sociosanitari,20,2020-12-28,PF/BT,200904_P.O. SAN MICHELE - AOB,30-39,SAR,ITG2
1,Sardegna,TML_CAT_OSS,28/12/2020_PF/BT_SAR_200036_P.O. A. BUSINCO - AOB_40-49,1 - Operatori Sanitari e Sociosanitari,20,2020-12-28,PF/BT,200036_P.O. A. BUSINCO - AOB,40-49,SAR,ITG2
1,Sardegna,TML_CAT_OSS,28/12/2020_PF/BT_SAR_200904_P.O. SAN MICHELE - AOB_40-49,1 - Operatori Sanitari e Sociosanitari,20,2020-12-28,PF/BT,200904_P.O. SAN MICHELE - AOB,40-49,SAR,ITG2
1,Sardegna,TML_CAT_OSS,28/12/2020_PF/BT_SAR_200036_P.O. A. BUSINCO - AOB_50-59,1 - Operatori Sanitari e Sociosanitari,20,2020-12-28,PF/BT,200036_P.O. A. BUSINCO - AOB,50-59,SAR,ITG2
15,Sardegna,TML_CAT_OSS,28/12/2020_PF/BT_SAR_200904_P.O. SAN MICHELE - AOB_50-59,1 - Operatori Sanitari e Sociosanitari,20,2020-12-28,PF/BT,200904_P.O. SAN MICHELE - AOB,50-59,SAR,ITG2
1,Sardegna,TML_CAT_OSS,28/12/2020_PF/BT_SAR_200036_P.O. A. BUSINCO - AOB_60-69,1 - Operatori Sanitari e Sociosanitari,20,2020-12-28,PF/BT,200036_P.O. A. BUSINCO - AOB,60-69,SAR,ITG2
1,Sardegna,TML_CAT_OSS,28/12/2020_PF/BT_SAR_200904_P.O. SAN MICHELE - AOB_60-69,1 - Operatori Sanitari e Sociosanitari,20,2020-12-28,PF/BT,200904_P.O. SAN MICHELE - AOB,60-69,SAR,ITG2
1,Sardegna,TML_CAT_OSS,29/12/2020_PF/BT_SAR_200904_P.O. SAN MICHELE - AOB_20-29,1 - Operatori Sanitari e Sociosanitari,20,2020-12-29,PF/BT,200904_P.O. SAN MICHELE - AOB,20-29,SAR,ITG2
1,Sardegna,TML_CAT_OSS,29/12/2020_PF/BT_SAR_200904_P.O. SAN MICHELE - AOB_30-39,1 - Operatori Sanitari e Sociosanitari,20,2020-12-29,PF/BT,200904_P.O. SAN MICHELE - AOB,30-39,SAR,ITG2
1,Sardegna,TML_CAT_OSS,29/12/2020_PF/BT_SAR_200904_P.O. SAN MICHELE - AOB_40-49,1 - Operatori Sanitari e Sociosanitari,20,2020-12-29,PF/BT,200904_P.O. SAN MICHELE - AOB,40-49,SAR,ITG2
17,Sardegna,TML_CAT_OSS,29/12/2020_PF/BT_SAR_200904_P.O. SAN MICHELE - AOB_50-59,1 - Operatori Sanitari e Sociosanitari,20,2020-12-29,PF/BT,200904_P.O. SAN MICHELE - AOB,50-59,SAR,ITG2
15,Sardegna,TML_CAT_OSS,29/12/2020_PF/BT_SAR_200904_P.O. SAN MICHELE - AOB_60-69,1 - Operatori Sanitari e Sociosanitari,20,2020-12-29,PF/BT,200904_P.O. SAN MICHELE - AOB,60-69,SAR,ITG2
1,Sardegna,TML_CAT_PERSONALE,29/12/2020_PF/BT_SAR_200904_P.O. SAN MICHELE - AOB_50-59,2 - Personale non Sanitario,20,2020-12-29,PF/BT,200904_P.O. SAN MICHELE - AOB,50-59,SAR,ITG2
1,Sardegna,TML_CAT_OSS,31/12/2020_PF/BT_SAR_200905_AZIENDA OSPEDALIERO UNIVERSITARIA SS_30-39,1 - Operatori Sanitari e Sociosanitari,20,2020-12-31,PF/BT,200905_AZIENDA OSPEDALIERO UNIVERSITARIA SS,30-39,SAR,ITG2
1,Sardegna,TML_CAT_OSS,31/12/2020_PF/BT_SAR_200906_A.O.U. Cagliari_30-39,1 - Operatori Sanitari e Sociosanitari,20,2020-12-31,PF/BT,200906_A.O.U. Cagliari,30-39,SAR,ITG2
1,Sardegna,TML_CAT_OSS,31/12/2020_PF/BT_SAR_200905_AZIENDA OSPEDALIERO UNIVERSITARIA SS_40-49,1 - Operatori Sanitari e Sociosanitari,20,2020-12-31,PF/BT,200905_AZIENDA OSPEDALIERO UNIVERSITARIA SS,40-49,SAR,ITG2
1,Sardegna,TML_CAT_OSS,31/12/2020_PF/BT_SAR_200906_A.O.U. Cagliari_40-49,1 - Operatori Sanitari e Sociosanitari,20,2020-12-31,PF/BT,200906_A.O.U. Cagliari,40-49,SAR,ITG2
1,Sardegna,TML_CAT_OSS,31/12/2020_PF/BT_SAR_200905_AZIENDA OSPEDALIERO UNIVERSITARIA SS_50-59,1 - Operatori Sanitari e Sociosanitari,20,2020-12-31,PF/BT,200905_AZIENDA OSPEDALIERO UNIVERSITARIA SS,50-59,SAR,ITG2
1,Sardegna,TML_CAT_OSS,31/12/2020_PF/BT_SAR_200906_A.O.U. Cagliari_50-59,1 - Operatori Sanitari e Sociosanitari,20,2020-12-31,PF/BT,200906_A.O.U. Cagliari,50-59,SAR,ITG2
1,Sardegna,TML_CAT_OSS,31/12/2020_PF/BT_SAR_200905_AZIENDA OSPEDALIERO UNIVERSITARIA SS_60-69,1 - Operatori Sanitari e Sociosanitari,20,2020-12-31,PF/BT,200905_AZIENDA OSPEDALIERO UNIVERSITARIA SS,60-69,SAR,ITG2
1,Sardegna,TML_CAT_OSS,31/12/2020_PF/BT_SAR_200906_A.O.U. Cagliari_60-69,1 - Operatori Sanitari e Sociosanitari,20,2020-12-31,PF/BT,200906_A.O.U. Cagliari,60-69,SAR,ITG2
1,Sardegna,TML_CAT_OSS,31/12/2020_PF/BT_SAR_200906_A.O.U. Cagliari_70-79,1 - Operatori Sanitari e Sociosanitari,20,2020-12-31,PF/BT,200906_A.O.U. Cagliari,70-79,SAR,ITG2
1,Sardegna,TML_CAT_PERSONALE,31/12/2020_PF/BT_SAR_200905_AZIENDA OSPEDALIERO UNIVERSITARIA SS_40-49,2 - Personale non Sanitario,20,2020-12-31,PF/BT,200905_AZIENDA OSPEDALIERO UNIVERSITARIA SS,40-49,SAR,ITG2
1,Sardegna,TML_CAT_PERSONALE,31/12/2020_PF/BT_SAR_200905_AZIENDA OSPEDALIERO UNIVERSITARIA SS_40-49,2 - Personale non Sanitario,20,2020-12-31,PF/BT,200905_AZIENDA OSPEDALIERO UNIVERSITARIA SS,40-49,SAR,ITG2
1,Sardegna,TML_CAT_ALTRO,31/12/2020_PF/BT_SAR_200905_AZIENDA OSPEDALIERO UNIVERSITARIA SS_50-59,2 - Personale non Sanitario,20,2020-12-31,PF/BT,200905_AZIENDA OSPEDALIERO UNIVERSITARIA SS,50-59,SAR,ITG2
1,Sardegna,TML_CAT_PERSONALE,31/12/2020_PF/BT_SAR_200905_AZIENDA OSPEDALIERO UNIVERSITARIA SS_50-59,2 - Personale non Sanitario,20,2020-12-31,PF/BT,200905_AZIENDA OSPEDALIERO UNIVERSITARIA SS,50-59,SAR,ITG2
1,Sardegna,TML_CAT_PERSONALE,31/12/2020_PF/BT_SAR_200905_AZIENDA OSPEDALIERO UNIVERSITARIA SS_50-59,2 - Personale non Sanitario,20,2020-12-31,PF/BT,200905_AZIENDA OSPEDALIERO UNIVERSITARIA SS,50-59,SAR,ITG2
1,Sardegna,TML_CAT_OSS,01/01/2021_PF/BT_SAR_200025_P.O. R.BINAGHI CAGLIARI_20-29,1 - Operatori Sanitari e Sociosanitari,20,2021-01-01,PF/BT,200025_P.O. R.BINAGHI CAGLIARI,20-29,SAR,ITG2
1,Sardegna,TML_CAT_OSS,01/01/2021_PF/BT_SAR_200025_P.O. R.BINAGHI CAGLIARI_30-39,1 - Operatori Sanitari e Sociosanitari,20,2021-01-01,PF/BT,200025_P.O. R.BINAGHI CAGLIARI,30-39,SAR,ITG2
1,Sardegna,TML_CAT_OSS,01/01/2021_PF/BT_SAR_200025_P.O. R.BINAGHI CAGLIARI_40-49,1 - Operatori Sanitari e Sociosanitari,20,2021-01-01,PF/BT,200025_P.O. R.BINAGHI CAGLIARI,40-49,SAR,ITG2
1,Sardegna,TML_CAT_OSS,01/01/2021_PF/BT_SAR_200025_P.O. R.BINAGHI CAGLIARI_50-59,1 - Operatori Sanitari e Sociosanitari,20,2021-01-01,PF/BT,200025_P.O. R.BINAGHI CAGLIARI,50-59,SAR,ITG2
1,Sardegna,TML_CAT_OSS,01/01/2021_PF/BT_SAR_200025_P.O. R.BINAGHI CAGLIARI_60-69,1 - Operatori Sanitari e Sociosanitari,20,2021-01-01,PF/BT,200025_P.O. R.BINAGHI CAGLIARI,60-69,SAR,ITG2
1,Sardegna,TML_CAT_OSS,02/01/2021_PF/BT_SAR_200025_P.O. R.BINAGHI CAGLIARI_20-29,1 - Operatori Sanitari e Sociosanitari,20,2021-01-02,PF/BT,200025_P.O. R.BINAGHI CAGLIARI,20-29,SAR,ITG2
1,Sardegna,TML_CAT_OSS,02/01/2021_PF/BT_SAR_200025_P.O. R.BINAGHI CAGLIARI_30-39,1 - Operatori Sanitari e Sociosanitari,20,2021-01-02,PF/BT,200025_P.O. R.BINAGHI CAGLIARI,30-39,SAR,ITG2
14,Sardegna,TML_CAT_OSS,02/01/2021_PF/BT_SAR_200025_P.O. R.BINAGHI CAGLIARI_40-49,1 - Operatori Sanitari e Sociosanitari,20,2021-01-02,PF/BT,200025_P.O. R.BINAGHI CAGLIARI,40-49,SAR,ITG2
25,Sardegna,TML_CAT_OSS,02/01/2021_PF/BT_SAR_200025_P.O. R.BINAGHI CAGLIARI_50-59,1 - Operatori Sanitari e Sociosanitari,20,2021-01-02,PF/BT,200025_P.O. R.BINAGHI CAGLIARI,50-59,SAR,ITG2
1,Sardegna,TML_CAT_OSS,02/01/2021_PF/BT_SAR_200025_P.O. R.BINAGHI CAGLIARI_60-69,1 - Operatori Sanitari e Sociosanitari,20,2021-01-02,PF/BT,200025_P.O. R.BINAGHI CAGLIARI,60-69,SAR,ITG2
1,Sardegna,TML_CAT_OSS,03/01/2021_PF/BT_SAR_200025_P.O. R.BINAGHI CAGLIARI_20-29,1 - Operatori Sanitari e Sociosanitari,20,2021-01-03,PF/BT,200025_P.O. R.BINAGHI CAGLIARI,20-29,SAR,ITG2
1,Sardegna,TML_CAT_OSS,03/01/2021_PF/BT_SAR_200025_P.O. R.BINAGHI CAGLIARI_30-39,1 - Operatori Sanitari e Sociosanitari,20,2021-01-03,PF/BT,200025_P.O. R.BINAGHI CAGLIARI,30-39,SAR,ITG2
17,Sardegna,TML_CAT_OSS,03/01/2021_PF/BT_SAR_200025_P.O. R.BINAGHI CAGLIARI_40-49,1 - Operatori Sanitari e Sociosanitari,20,2021-01-03,PF/BT,200025_P.O. R.BINAGHI CAGLIARI,40-49,SAR,ITG2
26,Sardegna,TML_CAT_OSS,03/01/2021_PF/BT_SAR_200025_P.O. R.BINAGHI CAGLIARI_50-59,1 - Operatori Sanitari e Sociosanitari,20,2021-01-03,PF/BT,200025_P.O. R.BINAGHI CAGLIARI,50-59,SAR,ITG2
20,Sardegna,TML_CAT_OSS,03/01/2021_PF/BT_SAR_200025_P.O. R.BINAGHI CAGLIARI_60-69,1 - Operatori Sanitari e Sociosanitari,20,2021-01-03,PF/BT,200025_P.O. R.BINAGHI CAGLIARI,60-69,SAR,ITG2
1,Sardegna,TML_CAT_OSS,03/01/2021_PF/BT_SAR_200025_P.O. R.BINAGHI CAGLIARI_70-79,1 - Operatori Sanitari e Sociosanitari,20,2021-01-03,PF/BT,200025_P.O. R.BINAGHI CAGLIARI,70-79,SAR,ITG2
1,Sardegna,TML_CAT_PERSONALE,03/01/2021_PF/BT_SAR_200025_P.O. R.BINAGHI CAGLIARI_60-69,2 - Personale non Sanitario,20,2021-01-03,PF/BT,200025_P.O. R.BINAGHI CAGLIARI,60-69,SAR,ITG2
20,Sardegna,TML_CAT_OSS,04/01/2021_PF/BT_SAR_200002_OSPEDALE CIVILE ALGHERO_20-29,1 - Operatori Sanitari e Sociosanitari,20,2021-01-04,PF/BT,200002_OSPEDALE CIVILE ALGHERO,20-29,SAR,ITG2
1,Sardegna,TML_CAT_OSS,04/01/2021_PF/BT_SAR_200025_P.O. R.BINAGHI CAGLIARI_20-29,1 - Operatori Sanitari e Sociosanitari,20,2021-01-04,PF/BT,200025_P.O. R.BINAGHI CAGLIARI,20-29,SAR,ITG2
1,Sardegna,TML_CAT_OSS,04/01/2021_PF/BT_SAR_200904_P.O. SAN MICHELE - AOB_20-29,1 - Operatori Sanitari e Sociosanitari,20,2021-01-04,PF/BT,200904_P.O. SAN MICHELE - AOB,20-29,SAR,ITG2
1,Sardegna,TML_CAT_OSS,04/01/2021_PF/BT_SAR_200905_AZIENDA OSPEDALIERO UNIVERSITARIA SS_20-29,1 - Operatori Sanitari e Sociosanitari,20,2021-01-04,PF/BT,200905_AZIENDA OSPEDALIERO UNIVERSITARIA SS,20-29,SAR,ITG2
1,Sardegna,TML_CAT_OSS,04/01/2021_PF/BT_SAR_200906_A.O.U. Cagliari_20-29,1 - Operatori Sanitari e Sociosanitari,20,2021-01-04,PF/BT,200906_A.O.U. Cagliari,20-29,SAR,ITG2
42,Sardegna,TML_CAT_OSS,04/01/2021_PF/BT_SAR_200002_OSPEDALE CIVILE ALGHERO_30-39,1 - Operatori Sanitari e Sociosanitari,20,2021-01-04,PF/BT,200002_OSPEDALE CIVILE ALGHERO,30-39,SAR,ITG2
17,Sardegna,TML_CAT_OSS,04/01/2021_PF/BT_SAR_200025_P.O. R.BINAGHI CAGLIARI_30-39,1 - Operatori Sanitari e Sociosanitari,20,2021-01-04,PF/BT,200025_P.O. R.BINAGHI CAGLIARI,30-39,SAR,ITG2
1,Sardegna,TML_CAT_OSS,04/01/2021_PF/BT_SAR_200031_P.O. SS. TRINITA` CAGLIARI_30-39,1 - Operatori Sanitari e Sociosanitari,20,2021-01-04,PF/BT,200031_P.O. SS. TRINITA` CAGLIARI,30-39,SAR,ITG2
1,Sardegna,TML_CAT_OSS,04/01/2021_PF/BT_SAR_200904_P.O. SAN MICHELE - AOB_30-39,1 - Operatori Sanitari e Sociosanitari,20,2021-01-04,PF/BT,200904_P.O. SAN MICHELE - AOB,30-39,SAR,ITG2
39,Sardegna,TML_CAT_OSS,04/01/2021_PF/BT_SAR_200905_AZIENDA OSPEDALIERO UNIVERSITARIA SS_30-39,1 - Operatori Sanitari e Sociosanitari,20,2021-01-04,PF/BT,200905_AZIENDA OSPEDALIERO UNIVERSITARIA SS,30-39,SAR,ITG2
20,Sardegna,TML_CAT_OSS,04/01/2021_PF/BT_SAR_200906_A.O.U. Cagliari_30-39,1 - Operatori Sanitari e Sociosanitari,20,2021-01-04,PF/BT,200906_A.O.U. Cagliari,30-39,SAR,ITG2
48,Sardegna,TML_CAT_OSS,04/01/2021_PF/BT_SAR_200002_OSPEDALE CIVILE ALGHERO_40-49,1 - Operatori Sanitari e Sociosanitari,20,2021-01-04,PF/BT,200002_OSPEDALE CIVILE ALGHERO,40-49,SAR,ITG2
1,Sardegna,TML_CAT_OSS,04/01/2021_PF/BT_SAR_200025_P.O. R.BINAGHI CAGLIARI_40-49,1 - Operatori Sanitari e Sociosanitari,20,2021-01-04,PF/BT,200025_P.O. R.BINAGHI CAGLIARI,40-49,SAR,ITG2
1,Sardegna,TML_CAT_OSS,04/01/2021_PF/BT_SAR_200026_P.O. MARINO CAGLIARI_40-49,1 - Operatori Sanitari e Sociosanitari,20,2021-01-04,PF/BT,200026_P.O. MARINO CAGLIARI,40-49,SAR,ITG2
1,Sardegna,TML_CAT_OSS,04/01/2021_PF/BT_SAR_200031_P.O. SS. TRINITA` CAGLIARI_40-49,1 - Operatori Sanitari e Sociosanitari,20,2021-01-04,PF/BT,200031_P.O. SS. TRINITA` CAGLIARI,40-49,SAR,ITG2
1,Sardegna,TML_CAT_OSS,04/01/2021_PF/BT_SAR_200904_P.O. SAN MICHELE - AOB_40-49,1 - Operatori Sanitari e Sociosanitari,20,2021-01-04,PF/BT,200904_P.O. SAN MICHELE - AOB,40-49,SAR,ITG2
31,Sardegna,TML_CAT_OSS,04/01/2021_PF/BT_SAR_200905_AZIENDA OSPEDALIERO UNIVERSITARIA SS_40-49,1 - Operatori Sanitari e Sociosanitari,20,2021-01-04,PF/BT,200905_AZIENDA OSPEDALIERO UNIVERSITARIA SS,40-49,SAR,ITG2
27,Sardegna,TML_CAT_OSS,04/01/2021_PF/BT_SAR_200906_A.O.U. Cagliari_40-49,1 - Operatori Sanitari e Sociosanitari,20,2021-01-04,PF/BT,200906_A.O.U. Cagliari,40-49,SAR,ITG2
43,Sardegna,TML_CAT_OSS,04/01/2021_PF/BT_SAR_200002_OSPEDALE CIVILE ALGHERO_50-59,1 - Operatori Sanitari e Sociosanitari,20,2021-01-04,PF/BT,200002_OSPEDALE CIVILE ALGHERO,50-59,SAR,ITG2
15,Sardegna,TML_CAT_OSS,04/01/2021_PF/BT_SAR_200025_P.O. R.BINAGHI CAGLIARI_50-59,1 - Operatori Sanitari e Sociosanitari,20,2021-01-04,PF/BT,200025_P.O. R.BINAGHI CAGLIARI,50-59,SAR,ITG2
1,Sardegna,TML_CAT_OSS,04/01/2021_PF/BT_SAR_200026_P.O. MARINO CAGLIARI_50-59,1 - Operatori Sanitari e Sociosanitari,20,2021-01-04,PF/BT,200026_P.O. MARINO CAGLIARI,50-59,SAR,ITG2
1,Sardegna,TML_CAT_OSS,04/01/2021_PF/BT_SAR_200031_P.O. SS. TRINITA` CAGLIARI_50-59,1 - Operatori Sanitari e Sociosanitari,20,2021-01-04,PF/BT,200031_P.O. SS. TRINITA` CAGLIARI,50-59,SAR,ITG2
1,Sardegna,TML_CAT_OSS,04/01/2021_PF/BT_SAR_200904_P.O. SAN MICHELE - AOB_50-59,1 - Operatori Sanitari e Sociosanitari,20,2021-01-04,PF/BT,200904_P.O. SAN MICHELE - AOB,50-59,SAR,ITG2
35,Sardegna,TML_CAT_OSS,04/01/2021_PF/BT_SAR_200905_AZIENDA OSPEDALIERO UNIVERSITARIA SS_50-59,1 - Operatori Sanitari e Sociosanitari,20,2021-01-04,PF/BT,200905_AZIENDA OSPEDALIERO UNIVERSITARIA SS,50-59,SAR,ITG2
43,Sardegna,TML_CAT_OSS,04/01/2021_PF/BT_SAR_200906_A.O.U. Cagliari_50-59,1 - Operatori Sanitari e Sociosanitari,20,2021-01-04,PF/BT,200906_A.O.U. Cagliari,50-59,SAR,ITG2
20,Sardegna,TML_CAT_OSS,04/01/2021_PF/BT_SAR_200002_OSPEDALE CIVILE ALGHERO_60-69,1 - Operatori Sanitari e Sociosanitari,20,2021-01-04,PF/BT,200002_OSPEDALE CIVILE ALGHERO,60-69,SAR,ITG2
1,Sardegna,TML_CAT_OSS,04/01/2021_PF/BT_SAR_200025_P.O. R.BINAGHI CAGLIARI_60-69,1 - Operatori Sanitari e Sociosanitari,20,2021-01-04,PF/BT,200025_P.O. R.BINAGHI CAGLIARI,60-69,SAR,ITG2
1,Sardegna,TML_CAT_OSS,04/01/2021_PF/BT_SAR_200026_P.O. MARINO CAGLIARI_60-69,1 - Operatori Sanitari e Sociosanitari,20,2021-01-04,PF/BT,200026_P.O. MARINO CAGLIARI,60-69,SAR,ITG2
1,Sardegna,TML_CAT_OSS,04/01/2021_PF/BT_SAR_200031_P.O. SS. TRINITA` CAGLIARI_60-69,1 - Operatori Sanitari e Sociosanitari,20,2021-01-04,PF/BT,200031_P.O. SS. TRINITA` CAGLIARI,60-69,SAR,ITG2
1,Sardegna,TML_CAT_OSS,04/01/2021_PF/BT_SAR_200904_P.O. SAN MICHELE - AOB_60-69,1 - Operatori Sanitari e Sociosanitari,20,2021-01-04,PF/BT,200904_P.O. SAN MICHELE - AOB,60-69,SAR,ITG2
15,Sardegna,TML_CAT_OSS,04/01/2021_PF/BT_SAR_200905_AZIENDA OSPEDALIERO UNIVERSITARIA SS_60-69,1 - Operatori Sanitari e Sociosanitari,20,2021-01-04,PF/BT,200905_AZIENDA OSPEDALIERO UNIVERSITARIA SS,60-69,SAR,ITG2
30,Sardegna,TML_CAT_OSS,04/01/2021_PF/BT_SAR_200906_A.O.U. Cagliari_60-69,1 - Operatori Sanitari e Sociosanitari,20,2021-01-04,PF/BT,200906_A.O.U. Cagliari,60-69,SAR,ITG2
1,Sardegna,TML_CAT_OSS,04/01/2021_PF/BT_SAR_200905_AZIENDA OSPEDALIERO UNIVERSITARIA SS_90+,1 - Operatori Sanitari e Sociosanitari,20,2021-01-04,PF/BT,200905_AZIENDA OSPEDALIERO UNIVERSITARIA SS,90+,SAR,ITG2
1,Sardegna,TML_CAT_PERSONALE,04/01/2021_PF/BT_SAR_200025_P.O. R.BINAGHI CAGLIARI_20-29,2 - Personale non Sanitario,20,2021-01-04,PF/BT,200025_P.O. R.BINAGHI CAGLIARI,20-29,SAR,ITG2
1,Sardegna,TML_CAT_PERSONALE,04/01/2021_PF/BT_SAR_200031_P.O. SS. TRINITA` CAGLIARI_30-39,2 - Personale non Sanitario,20,2021-01-04,PF/BT,200031_P.O. SS. TRINITA` CAGLIARI,30-39,SAR,ITG2
1,Sardegna,TML_CAT_PERSONALE,04/01/2021_PF/BT_SAR_200905_AZIENDA OSPEDALIERO UNIVERSITARIA SS_30-39,2 - Personale non Sanitario,20,2021-01-04,PF/BT,200905_AZIENDA OSPEDALIERO UNIVERSITARIA SS,30-39,SAR,ITG2
1,Sardegna,TML_CAT_PERSONALE,04/01/2021_PF/BT_SAR_200906_A.O.U. Cagliari_30-39,2 - Personale non Sanitario,20,2021-01-04,PF/BT,200906_A.O.U. Cagliari,30-39,SAR,ITG2
1,Sardegna,TML_CAT_PERSONALE,04/01/2021_PF/BT_SAR_200025_P.O. R.BINAGHI CAGLIARI_40-49,2 - Personale non Sanitario,20,2021-01-04,PF/BT,200025_P.O. R.BINAGHI CAGLIARI,40-49,SAR,ITG2
1,Sardegna,TML_CAT_PERSONALE,04/01/2021_PF/BT_SAR_200026_P.O. MARINO CAGLIARI_40-49,2 - Personale non Sanitario,20,2021-01-04,PF/BT,200026_P.O. MARINO CAGLIARI,40-49,SAR,ITG2
1,Sardegna,TML_CAT_ALTRO,04/01/2021_PF/BT_SAR_200905_AZIENDA OSPEDALIERO UNIVERSITARIA SS_40-49,2 - Personale non Sanitario,20,2021-01-04,PF/BT,200905_AZIENDA OSPEDALIERO UNIVERSITARIA SS,40-49,SAR,ITG2
1,Sardegna,TML_CAT_PERSONALE,04/01/2021_PF/BT_SAR_200905_AZIENDA OSPEDALIERO UNIVERSITARIA SS_40-49,2 - Personale non Sanitario,20,2021-01-04,PF/BT,200905_AZIENDA OSPEDALIERO UNIVERSITARIA SS,40-49,SAR,ITG2
1,Sardegna,TML_CAT_PERSONALE,04/01/2021_PF/BT_SAR_200002_OSPEDALE CIVILE ALGHERO_50-59,2 - Personale non Sanitario,20,2021-01-04,PF/BT,200002_OSPEDALE CIVILE ALGHERO,50-59,SAR,ITG2
1,Sardegna,TML_CAT_PERSONALE,04/01/2021_PF/BT_SAR_200025_P.O. R.BINAGHI CAGLIARI_50-59,2 - Personale non Sanitario,20,2021-01-04,PF/BT,200025_P.O. R.BINAGHI CAGLIARI,50-59,SAR,ITG2
1,Sardegna,TML_CAT_PERSONALE,04/01/2021_PF/BT_SAR_200026_P.O. MARINO CAGLIARI_50-59,2 - Personale non Sanitario,20,2021-01-04,PF/BT,200026_P.O. MARINO CAGLIARI,50-59,SAR,ITG2
1,Sardegna,TML_CAT_PERSONALE,04/01/2021_PF/BT_SAR_200031_P.O. SS. TRINITA` CAGLIARI_50-59,2 - Personale non Sanitario,20,2021-01-04,PF/BT,200031_P.O. SS. TRINITA` CAGLIARI,50-59,SAR,ITG2
1,Sardegna,TML_CAT_PERSONALE,04/01/2021_PF/BT_SAR_200905_AZIENDA OSPEDALIERO UNIVERSITARIA SS_50-59,2 - Personale non Sanitario,20,2021-01-04,PF/BT,200905_AZIENDA OSPEDALIERO UNIVERSITARIA SS,50-59,SAR,ITG2
1,Sardegna,TML_CAT_PERSONALE,04/01/2021_PF/BT_SAR_200031_P.O. SS. TRINITA` CAGLIARI_60-69,2 - Personale non Sanitario,20,2021-01-04,PF/BT,200031_P.O. SS. TRINITA` CAGLIARI,60-69,SAR,ITG2
14,Sardegna,TML_CAT_OSS,05/01/2021_PF/BT_SAR_200002_OSPEDALE CIVILE ALGHERO_20-29,1 - Operatori Sanitari e Sociosanitari,20,2021-01-05,PF/BT,200002_OSPEDALE CIVILE ALGHERO,20-29,SAR,ITG2
1,Sardegna,TML_CAT_OSS,05/01/2021_PF/BT_SAR_200012_P.O. GIOVANNI PAOLO II OLBIA_20-29,1 - Operatori Sanitari e Sociosanitari,20,2021-01-05,PF/BT,200012_P.O. GIOVANNI PAOLO II OLBIA,20-29,SAR,ITG2
1,Sardegna,TML_CAT_OSS,05/01/2021_PF/BT_SAR_200025_P.O. R.BINAGHI CAGLIARI_20-29,1 - Operatori Sanitari e Sociosanitari,20,2021-01-05,PF/BT,200025_P.O. R.BINAGHI CAGLIARI,20-29,SAR,ITG2
1,Sardegna,TML_CAT_OSS,05/01/2021_PF/BT_SAR_200026_P.O. MARINO CAGLIARI_20-29,1 - Operatori Sanitari e Sociosanitari,20,2021-01-05,PF/BT,200026_P.O. MARINO CAGLIARI,20-29,SAR,ITG2
1,Sardegna,TML_CAT_OSS,05/01/2021_PF/BT_SAR_200031_P.O. SS. TRINITA` CAGLIARI_20-29,1 - Operatori Sanitari e Sociosanitari,20,2021-01-05,PF/BT,200031_P.O. SS. TRINITA` CAGLIARI,20-29,SAR,ITG2
1,Sardegna,TML_CAT_OSS,05/01/2021_PF/BT_SAR_200052_P.O. SAN MARTINO ORISTANO_20-29,1 - Operatori Sanitari e Sociosanitari,20,2021-01-05,PF/BT,200052_P.O. SAN MARTINO ORISTANO,20-29,SAR,ITG2
1,Sardegna,TML_CAT_OSS,05/01/2021_PF/BT_SAR_200904_P.O. SAN MICHELE - AOB_20-29,1 - Operatori Sanitari e Sociosanitari,20,2021-01-05,PF/BT,200904_P.O. SAN MICHELE - AOB,20-29,SAR,ITG2
24,Sardegna,TML_CAT_OSS,05/01/2021_PF/BT_SAR_200905_AZIENDA OSPEDALIERO UNIVERSITARIA SS_20-29,1 - Operatori Sanitari e Sociosanitari,20,2021-01-05,PF/BT,200905_AZIENDA OSPEDALIERO UNIVERSITARIA SS,20-29,SAR,ITG2
1,Sardegna,TML_CAT_OSS,05/01/2021_PF/BT_SAR_200906_A.O.U. Cagliari_20-29,1 - Operatori Sanitari e Sociosanitari,20,2021-01-05,PF/BT,200906_A.O.U. Cagliari,20-29,SAR,ITG2
32,Sardegna,TML_CAT_OSS,05/01/2021_PF/BT_SAR_200002_OSPEDALE CIVILE ALGHERO_30-39,1 - Operatori Sanitari e Sociosanitari,20,2021-01-05,PF/BT,200002_OSPEDALE CIVILE ALGHERO,30-39,SAR,ITG2
1,Sardegna,TML_CAT_OSS,05/01/2021_PF/BT_SAR_200006_P.O. PAOLO DETTORI - TEMPIO P._30-39,1 - Operatori Sanitari e Sociosanitari,20,2021-01-05,PF/BT,200006_P.O. PAOLO DETTORI - TEMPIO P.,30-39,SAR,ITG2
20,Sardegna,TML_CAT_OSS,05/01/2021_PF/BT_SAR_200012_P.O. GIOVANNI PAOLO II OLBIA_30-39,1 - Operatori Sanitari e Sociosanitari,20,2021-01-05,PF/BT,200012_P.O. GIOVANNI PAOLO II OLBIA,30-39,SAR,ITG2
1,Sardegna,TML_CAT_OSS,05/01/2021_PF/BT_SAR_200025_P.O. R.BINAGHI CAGLIARI_30-39,1 - Operatori Sanitari e Sociosanitari,20,2021-01-05,PF/BT,200025_P.O. R.BINAGHI CAGLIARI,30-39,SAR,ITG2
1,Sardegna,TML_CAT_OSS,05/01/2021_PF/BT_SAR_200026_P.O. MARINO CAGLIARI_30-39,1 - Operatori Sanitari e Sociosanitari,20,2021-01-05,PF/BT,200026_P.O. MARINO CAGLIARI,30-39,SAR,ITG2
1,Sardegna,TML_CAT_OSS,05/01/2021_PF/BT_SAR_200031_P.O. SS. TRINITA` CAGLIARI_30-39,1 - Operatori Sanitari e Sociosanitari,20,2021-01-05,PF/BT,200031_P.O. SS. TRINITA` CAGLIARI,30-39,SAR,ITG2
1,Sardegna,TML_CAT_OSS,05/01/2021_PF/BT_SAR_200052_P.O. SAN MARTINO ORISTANO_30-39,1 - Operatori Sanitari e Sociosanitari,20,2021-01-05,PF/BT,200052_P.O. SAN MARTINO ORISTANO,30-39,SAR,ITG2
1,Sardegna,TML_CAT_OSS,05/01/2021_PF/BT_SAR_200904_P.O. SAN MICHELE - AOB_30-39,1 - Operatori Sanitari e Sociosanitari,20,2021-01-05,PF/BT,200904_P.O. SAN MICHELE - AOB,30-39,SAR,ITG2
67,Sardegna,TML_CAT_OSS,05/01/2021_PF/BT_SAR_200905_AZIENDA OSPEDALIERO UNIVERSITARIA SS_30-39,1 - Operatori Sanitari e Sociosanitari,20,2021-01-05,PF/BT,200905_AZIENDA OSPEDALIERO UNIVERSITARIA SS,30-39,SAR,ITG2
27,Sardegna,TML_CAT_OSS,05/01/2021_PF/BT_SAR_200906_A.O.U. Cagliari_30-39,1 - Operatori Sanitari e Sociosanitari,20,2021-01-05,PF/BT,200906_A.O.U. Cagliari,30-39,SAR,ITG2
74,Sardegna,TML_CAT_OSS,05/01/2021_PF/BT_SAR_200002_OSPEDALE CIVILE ALGHERO_40-49,1 - Operatori Sanitari e Sociosanitari,20,2021-01-05,PF/BT,200002_OSPEDALE CIVILE ALGHERO,40-49,SAR,ITG2
1,Sardegna,TML_CAT_OSS,05/01/2021_PF/BT_SAR_200006_P.O. PAOLO DETTORI - TEMPIO P._40-49,1 - Operatori Sanitari e Sociosanitari,20,2021-01-05,PF/BT,200006_P.O. PAOLO DETTORI - TEMPIO P.,40-49,SAR,ITG2
37,Sardegna,TML_CAT_OSS,05/01/2021_PF/BT_SAR_200012_P.O. GIOVANNI PAOLO II OLBIA_40-49,1 - Operatori Sanitari e Sociosanitari,20,2021-01-05,PF/BT,200012_P.O. GIOVANNI PAOLO II OLBIA,40-49,SAR,ITG2
15,Sardegna,TML_CAT_OSS,05/01/2021_PF/BT_SAR_200025_P.O. R.BINAGHI CAGLIARI_40-49,1 - Operatori Sanitari e Sociosanitari,20,2021-01-05,PF/BT,200025_P.O. R.BINAGHI CAGLIARI,40-49,SAR,ITG2
1,Sardegna,TML_CAT_OSS,05/01/2021_PF/BT_SAR_200026_P.O. MARINO CAGLIARI_40-49,1 - Operatori Sanitari e Sociosanitari,20,2021-01-05,PF/BT,200026_P.O. MARINO CAGLIARI,40-49,SAR,ITG2
14,Sardegna,TML_CAT_OSS,05/01/2021_PF/BT_SAR_200031_P.O. SS. TRINITA` CAGLIARI_40-49,1 - Operatori Sanitari e Sociosanitari,20,2021-01-05,PF/BT,200031_P.O. SS. TRINITA` CAGLIARI,40-49,SAR,ITG2
20,Sardegna,TML_CAT_OSS,05/01/2021_PF/BT_SAR_200052_P.O. SAN MARTINO ORISTANO_40-49,1 - Operatori Sanitari e Sociosanitari,20,2021-01-05,PF/BT,200052_P.O. SAN MARTINO ORISTANO,40-49,SAR,ITG2
1,Sardegna,TML_CAT_OSS,05/01/2021_PF/BT_SAR_200904_P.O. SAN MICHELE - AOB_40-49,1 - Operatori Sanitari e Sociosanitari,20,2021-01-05,PF/BT,200904_P.O. SAN MICHELE - AOB,40-49,SAR,ITG2
81,Sardegna,TML_CAT_OSS,05/01/2021_PF/BT_SAR_200905_AZIENDA OSPEDALIERO UNIVERSITARIA SS_40-49,1 - Operatori Sanitari e Sociosanitari,20,2021-01-05,PF/BT,200905_AZIENDA OSPEDALIERO UNIVERSITARIA SS,40-49,SAR,ITG2
40,Sardegna,TML_CAT_OSS,05/01/2021_PF/BT_SAR_200906_A.O.U. Cagliari_40-49,1 - Operatori Sanitari e Sociosanitari,20,2021-01-05,PF/BT,200906_A.O.U. Cagliari,40-49,SAR,ITG2
139,Sardegna,TML_CAT_OSS,05/01/2021_PF/BT_SAR_200002_OSPEDALE CIVILE ALGHERO_50-59,1 - Operatori Sanitari e Sociosanitari,20,2021-01-05,PF/BT,200002_OSPEDALE CIVILE ALGHERO,50-59,SAR,ITG2
1,Sardegna,TML_CAT_OSS,05/01/2021_PF/BT_SAR_200006_P.O. PAOLO DETTORI - TEMPIO P._50-59,1 - Operatori Sanitari e Sociosanitari,20,2021-01-05,PF/BT,200006_P.O. PAOLO DETTORI - TEMPIO P.,50-59,SAR,ITG2
38,Sardegna,TML_CAT_OSS,05/01/2021_PF/BT_SAR_200012_P.O. GIOVANNI PAOLO II OLBIA_50-59,1 - Operatori Sanitari e Sociosanitari,20,2021-01-05,PF/BT,200012_P.O. GIOVANNI PAOLO II OLBIA,50-59,SAR,ITG2
27,Sardegna,TML_CAT_OSS,05/01/2021_PF/BT_SAR_200025_P.O. R.BINAGHI CAGLIARI_50-59,1 - Operatori Sanitari e Sociosanitari,20,2021-01-05,PF/BT,200025_P.O. R.BINAGHI CAGLIARI,50-59,SAR,ITG2
25,Sardegna,TML_CAT_OSS,05/01/2021_PF/BT_SAR_200026_P.O. MARINO CAGLIARI_50-59,1 - Operatori Sanitari e Sociosanitari,20,2021-01-05,PF/BT,200026_P.O. MARINO CAGLIARI,50-59,SAR,ITG2
20,Sardegna,TML_CAT_OSS,05/01/2021_PF/BT_SAR_200031_P.O. SS. TRINITA` CAGLIARI_50-59,1 - Operatori Sanitari e Sociosanitari,20,2021-01-05,PF/BT,200031_P.O. SS. TRINITA` CAGLIARI,50-59,SAR,ITG2
27,Sardegna,TML_CAT_OSS,05/01/2021_PF/BT_SAR_200052_P.O. SAN MARTINO ORISTANO_50-59,1 - Operatori Sanitari e Sociosanitari,20,2021-01-05,PF/BT,200052_P.O. SAN MARTINO ORISTANO,50-59,SAR,ITG2
1,Sardegna,TML_CAT_OSS,05/01/2021_PF/BT_SAR_200904_P.O. SAN MICHELE - AOB_50-59,1 - Operatori Sanitari e Sociosanitari,20,2021-01-05,PF/BT,200904_P.O. SAN MICHELE - AOB,50-59,SAR,ITG2
59,Sardegna,TML_CAT_OSS,05/01/2021_PF/BT_SAR_200905_AZIENDA OSPEDALIERO UNIVERSITARIA SS_50-59,1 - Operatori Sanitari e Sociosanitari,20,2021-01-05,PF/BT,200905_AZIENDA OSPEDALIERO UNIVERSITARIA SS,50-59,SAR,ITG2
76,Sardegna,TML_CAT_OSS,05/01/2021_PF/BT_SAR_200906_A.O.U. Cagliari_50-59,1 - Operatori Sanitari e Sociosanitari,20,2021-01-05,PF/BT,200906_A.O.U. Cagliari,50-59,SAR,ITG2
64,Sardegna,TML_CAT_OSS,05/01/2021_PF/BT_SAR_200002_OSPEDALE CIVILE ALGHERO_60-69,1 - Operatori Sanitari e Sociosanitari,20,2021-01-05,PF/BT,200002_OSPEDALE CIVILE ALGHERO,60-69,SAR,ITG2
1,Sardegna,TML_CAT_OSS,05/01/2021_PF/BT_SAR_200006_P.O. PAOLO DETTORI - TEMPIO P._60-69,1 - Operatori Sanitari e Sociosanitari,20,2021-01-05,PF/BT,200006_P.O. PAOLO DETTORI - TEMPIO P.,60-69,SAR,ITG2
17,Sardegna,TML_CAT_OSS,05/01/2021_PF/BT_SAR_200012_P.O. GIOVANNI PAOLO II OLBIA_60-69,1 - Operatori Sanitari e Sociosanitari,20,2021-01-05,PF/BT,200012_P.O. GIOVANNI PAOLO II OLBIA,60-69,SAR,ITG2
15,Sardegna,TML_CAT_OSS,05/01/2021_PF/BT_SAR_200025_P.O. R.BINAGHI CAGLIARI_60-69,1 - Operatori Sanitari e Sociosanitari,20,2021-01-05,PF/BT,200025_P.O. R.BINAGHI CAGLIARI,60-69,SAR,ITG2
1,Sardegna,TML_CAT_OSS,05/01/2021_PF/BT_SAR_200026_P.O. MARINO CAGLIARI_60-69,1 - Operatori Sanitari e Sociosanitari,20,2021-01-05,PF/BT,200026_P.O. MARINO CAGLIARI,60-69,SAR,ITG2
1,Sardegna,TML_CAT_OSS,05/01/2021_PF/BT_SAR_200031_P.O. SS. TRINITA` CAGLIARI_60-69,1 - Operatori Sanitari e Sociosanitari,20,2021-01-05,PF/BT,200031_P.O. SS. TRINITA` CAGLIARI,60-69,SAR,ITG2
1,Sardegna,TML_CAT_OSS,05/01/2021_PF/BT_SAR_200052_P.O. SAN MARTINO ORISTANO_60-69,1 - Operatori Sanitari e Sociosanitari,20,2021-01-05,PF/BT,200052_P.O. SAN MARTINO ORISTANO,60-69,SAR,ITG2
1,Sardegna,TML_CAT_OSS,05/01/2021_PF/BT_SAR_200904_P.O. SAN MICHELE - AOB_60-69,1 - Operatori Sanitari e Sociosanitari,20,2021-01-05,PF/BT,200904_P.O. SAN MICHELE - AOB,60-69,SAR,ITG2
20,Sardegna,TML_CAT_OSS,05/01/2021_PF/BT_SAR_200905_AZIENDA OSPEDALIERO UNIVERSITARIA SS_60-69,1 - Operatori Sanitari e Sociosanitari,20,2021-01-05,PF/BT,200905_AZIENDA OSPEDALIERO UNIVERSITARIA SS,60-69,SAR,ITG2
47,Sardegna,TML_CAT_OSS,05/01/2021_PF/BT_SAR_200906_A.O.U. Cagliari_60-69,1 - Operatori Sanitari e Sociosanitari,20,2021-01-05,PF/BT,200906_A.O.U. Cagliari,60-69,SAR,ITG2
1,Sardegna,TML_CAT_PERSONALE,05/01/2021_PF/BT_SAR_200025_P.O. R.BINAGHI CAGLIARI_20-29,2 - Personale non Sanitario,20,2021-01-05,PF/BT,200025_P.O. R.BINAGHI CAGLIARI,20-29,SAR,ITG2
1,Sardegna,TML_CAT_PERSONALE,05/01/2021_PF/BT_SAR_200026_P.O. MARINO CAGLIARI_20-29,2 - Personale non Sanitario,20,2021-01-05,PF/BT,200026_P.O. MARINO CAGLIARI,20-29,SAR,ITG2
1,Sardegna,TML_CAT_PERSONALE,05/01/2021_PF/BT_SAR_200025_P.O. R.BINAGHI CAGLIARI_30-39,2 - Personale non Sanitario,20,2021-01-05,PF/BT,200025_P.O. R.BINAGHI CAGLIARI,30-39,SAR,ITG2
1,Sardegna,TML_CAT_PERSONALE,05/01/2021_PF/BT_SAR_200006_P.O. PAOLO DETTORI - TEMPIO P._40-49,2 - Personale non Sanitario,20,2021-01-05,PF/BT,200006_P.O. PAOLO DETTORI - TEMPIO P.,40-49,SAR,ITG2
1,Sardegna,TML_CAT_PERSONALE,05/01/2021_PF/BT_SAR_200025_P.O. R.BINAGHI CAGLIARI_40-49,2 - Personale non Sanitario,20,2021-01-05,PF/BT,200025_P.O. R.BINAGHI CAGLIARI,40-49,SAR,ITG2
1,Sardegna,TML_CAT_PERSONALE,05/01/2021_PF/BT_SAR_200006_P.O. PAOLO DETTORI - TEMPIO P._50-59,2 - Personale non Sanitario,20,2021-01-05,PF/BT,200006_P.O. PAOLO DETTORI - TEMPIO P.,50-59,SAR,ITG2
1,Sardegna,TML_CAT_PERSONALE,05/01/2021_PF/BT_SAR_200025_P.O. R.BINAGHI CAGLIARI_50-59,2 - Personale non Sanitario,20,2021-01-05,PF/BT,200025_P.O. R.BINAGHI CAGLIARI,50-59,SAR,ITG2
1,Sardegna,TML_CAT_ALTRO,05/01/2021_PF/BT_SAR_200905_AZIENDA OSPEDALIERO UNIVERSITARIA SS_50-59,2 - Personale non Sanitario,20,2021-01-05,PF/BT,200905_AZIENDA OSPEDALIERO UNIVERSITARIA SS,50-59,SAR,ITG2
1,Sardegna,TML_CAT_PERSONALE,05/01/2021_PF/BT_SAR_200002_OSPEDALE CIVILE ALGHERO_60-69,2 - Personale non Sanitario,20,2021-01-05,PF/BT,200002_OSPEDALE CIVILE ALGHERO,60-69,SAR,ITG2
1,Sardegna,TML_CAT_PERSONALE,05/01/2021_PF/BT_SAR_200025_P.O. R.BINAGHI CAGLIARI_60-69,2 - Personale non Sanitario,20,2021-01-05,PF/BT,200025_P.O. R.BINAGHI CAGLIARI,60-69,SAR,ITG2
1,Sardegna,TML_CAT_PERSONALE,05/01/2021_PF/BT_SAR_200026_P.O. MARINO CAGLIARI_60-69,2 - Personale non Sanitario,20,2021-01-05,PF/BT,200026_P.O. MARINO CAGLIARI,60-69,SAR,ITG2
15,Sardegna,TML_CAT_OSS,06/01/2021_PF/BT_SAR_10036_SISP-SASSARI_20-29,1 - Operatori Sanitari e Sociosanitari,20,2021-01-06,PF/BT,10036_SISP-SASSARI,20-29,SAR,ITG2
1,Sardegna,TML_CAT_OSS,06/01/2021_PF/BT_SAR_200006_P.O. PAOLO DETTORI - TEMPIO P._20-29,1 - Operatori Sanitari e Sociosanitari,20,2021-01-06,PF/BT,200006_P.O. PAOLO DETTORI - TEMPIO P.,20-29,SAR,ITG2
1,Sardegna,TML_CAT_OSS,06/01/2021_PF/BT_SAR_200011_P.O. PAOLO MERLO LA MADDALENA_20-29,1 - Operatori Sanitari e Sociosanitari,20,2021-01-06,PF/BT,200011_P.O. PAOLO MERLO LA MADDALENA,20-29,SAR,ITG2
1,Sardegna,TML_CAT_OSS,06/01/2021_PF/BT_SAR_200012_P.O. GIOVANNI PAOLO II OLBIA_20-29,1 - Operatori Sanitari e Sociosanitari,20,2021-01-06,PF/BT,200012_P.O. GIOVANNI PAOLO II OLBIA,20-29,SAR,ITG2
1,Sardegna,TML_CAT_OSS,06/01/2021_PF/BT_SAR_200017_P.O. SAN FRANCESCO_20-29,1 - Operatori Sanitari e Sociosanitari,20,2021-01-06,PF/BT,200017_P.O. SAN FRANCESCO,20-29,SAR,ITG2
20,Sardegna,TML_CAT_OSS,06/01/2021_PF/BT_SAR_200025_P.O. R.BINAGHI CAGLIARI_20-29,1 - Operatori Sanitari e Sociosanitari,20,2021-01-06,PF/BT,200025_P.O. R.BINAGHI CAGLIARI,20-29,SAR,ITG2
1,Sardegna,TML_CAT_OSS,06/01/2021_PF/BT_SAR_200026_P.O. MARINO CAGLIARI_20-29,1 - Operatori Sanitari e Sociosanitari,20,2021-01-06,PF/BT,200026_P.O. MARINO CAGLIARI,20-29,SAR,ITG2
1,Sardegna,TML_CAT_OSS,06/01/2021_PF/BT_SAR_200030_P.O.CTO_20-29,1 - Operatori Sanitari e Sociosanitari,20,2021-01-06,PF/BT,200030_P.O.CTO,20-29,SAR,ITG2
1,Sardegna,TML_CAT_OSS,06/01/2021_PF/BT_SAR_200031_P.O. SS. TRINITA` CAGLIARI_20-29,1 - Operatori Sanitari e Sociosanitari,20,2021-01-06,PF/BT,200031_P.O. SS. TRINITA` CAGLIARI,20-29,SAR,ITG2
1,Sardegna,TML_CAT_OSS,06/01/2021_PF/BT_SAR_200034_PRESIDIO OSPEDALIERO N.S. DI BONARIA_20-29,1 - Operatori Sanitari e Sociosanitari,20,2021-01-06,PF/BT,200034_PRESIDIO OSPEDALIERO N.S. DI BONARIA,20-29,SAR,ITG2
1,Sardegna,TML_CAT_OSS,06/01/2021_PF/BT_SAR_200052_P.O. SAN MARTINO ORISTANO_20-29,1 - Operatori Sanitari e Sociosanitari,20,2021-01-06,PF/BT,200052_P.O. SAN MARTINO ORISTANO,20-29,SAR,ITG2
1,Sardegna,TML_CAT_OSS,06/01/2021_PF/BT_SAR_200904_P.O. SAN MICHELE - AOB_20-29,1 - Operatori Sanitari e Sociosanitari,20,2021-01-06,PF/BT,200904_P.O. SAN MICHELE - AOB,20-29,SAR,ITG2
46,Sardegna,TML_CAT_OSS,06/01/2021_PF/BT_SAR_200905_AZIENDA OSPEDALIERO UNIVERSITARIA SS_20-29,1 - Operatori Sanitari e Sociosanitari,20,2021-01-06,PF/BT,200905_AZIENDA OSPEDALIERO UNIVERSITARIA SS,20-29,SAR,ITG2
1,Sardegna,TML_CAT_OSS,06/01/2021_PF/BT_SAR_200906_A.O.U. Cagliari_20-29,1 - Operatori Sanitari e Sociosanitari,20,2021-01-06,PF/BT,200906_A.O.U. Cagliari,20-29,SAR,ITG2
27,Sardegna,TML_CAT_OSS,06/01/2021_PF/BT_SAR_10036_SISP-SASSARI_30-39,1 - Operatori Sanitari e Sociosanitari,20,2021-01-06,PF/BT,10036_SISP-SASSARI,30-39,SAR,ITG2
1,Sardegna,TML_CAT_OSS,06/01/2021_PF/BT_SAR_200006_P.O. PAOLO DETTORI - TEMPIO P._30-39,1 - Operatori Sanitari e Sociosanitari,20,2021-01-06,PF/BT,200006_P.O. PAOLO DETTORI - TEMPIO P.,30-39,SAR,ITG2
1,Sardegna,TML_CAT_OSS,06/01/2021_PF/BT_SAR_200011_P.O. PAOLO MERLO LA MADDALENA_30-39,1 - Operatori Sanitari e Sociosanitari,20,2021-01-06,PF/BT,200011_P.O. PAOLO MERLO LA MADDALENA,30-39,SAR,ITG2
43,Sardegna,TML_CAT_OSS,06/01/2021_PF/BT_SAR_200012_P.O. GIOVANNI PAOLO II OLBIA_30-39,1 - Operatori Sanitari e Sociosanitari,20,2021-01-06,PF/BT,200012_P.O. GIOVANNI PAOLO II OLBIA,30-39,SAR,ITG2
24,Sardegna,TML_CAT_OSS,06/01/2021_PF/BT_SAR_200017_P.O. SAN FRANCESCO_30-39,1 - Operatori Sanitari e Sociosanitari,20,2021-01-06,PF/BT,200017_P.O. SAN FRANCESCO,30-39,SAR,ITG2
25,Sardegna,TML_CAT_OSS,06/01/2021_PF/BT_SAR_200025_P.O. R.BINAGHI CAGLIARI_30-39,1 - Operatori Sanitari e Sociosanitari,20,2021-01-06,PF/BT,200025_P.O. R.BINAGHI CAGLIARI,30-39,SAR,ITG2
1,Sardegna,TML_CAT_OSS,06/01/2021_PF/BT_SAR_200026_P.O. MARINO CAGLIARI_30-39,1 - Operatori Sanitari e Sociosanitari,20,2021-01-06,PF/BT,200026_P.O. MARINO CAGLIARI,30-39,SAR,ITG2
1,Sardegna,TML_CAT_OSS,06/01/2021_PF/BT_SAR_200030_P.O.CTO_30-39,1 - Operatori Sanitari e Sociosanitari,20,2021-01-06,PF/BT,200030_P.O.CTO,30-39,SAR,ITG2
1,Sardegna,TML_CAT_OSS,06/01/2021_PF/BT_SAR_200031_P.O. SS. TRINITA` CAGLIARI_30-39,1 - Operatori Sanitari e Sociosanitari,20,2021-01-06,PF/BT,200031_P.O. SS. TRINITA` CAGLIARI,30-39,SAR,ITG2
1,Sardegna,TML_CAT_OSS,06/01/2021_PF/BT_SAR_200034_PRESIDIO OSPEDALIERO N.S. DI BONARIA_30-39,1 - Operatori Sanitari e Sociosanitari,20,2021-01-06,PF/BT,200034_PRESIDIO OSPEDALIERO N.S. DI BONARIA,30-39,SAR,ITG2
25,Sardegna,TML_CAT_OSS,06/01/2021_PF/BT_SAR_200052_P.O. SAN MARTINO ORISTANO_30-39,1 - Operatori Sanitari e Sociosanitari,20,2021-01-06,PF/BT,200052_P.O. SAN MARTINO ORISTANO,30-39,SAR,ITG2
43,Sardegna,TML_CAT_OSS,06/01/2021_PF/BT_SAR_200904_P.O. SAN MICHELE - AOB_30-39,1 - Operatori Sanitari e Sociosanitari,20,2021-01-06,PF/BT,200904_P.O. SAN MICHELE - AOB,30-39,SAR,ITG2
67,Sardegna,TML_CAT_OSS,06/01/2021_PF/BT_SAR_200905_AZIENDA OSPEDALIERO UNIVERSITARIA SS_30-39,1 - Operatori Sanitari e Sociosanitari,20,2021-01-06,PF/BT,200905_AZIENDA OSPEDALIERO UNIVERSITARIA SS,30-39,SAR,ITG2
1,Sardegna,TML_CAT_OSS,06/01/2021_PF/BT_SAR_200906_A.O.U. Cagliari_30-39,1 - Operatori Sanitari e Sociosanitari,20,2021-01-06,PF/BT,200906_A.O.U. Cagliari,30-39,SAR,ITG2
14,Sardegna,TML_CAT_OSS,06/01/2021_PF/BT_SAR_10036_SISP-SASSARI_40-49,1 - Operatori Sanitari e Sociosanitari,20,2021-01-06,PF/BT,10036_SISP-SASSARI,40-49,SAR,ITG2
1,Sardegna,TML_CAT_OSS,06/01/2021_PF/BT_SAR_200006_P.O. PAOLO DETTORI - TEMPIO P._40-49,1 - Operatori Sanitari e Sociosanitari,20,2021-01-06,PF/BT,200006_P.O. PAOLO DETTORI - TEMPIO P.,40-49,SAR,ITG2
1,Sardegna,TML_CAT_OSS,06/01/2021_PF/BT_SAR_200011_P.O. PAOLO MERLO LA MADDALENA_40-49,1 - Operatori Sanitari e Sociosanitari,20,2021-01-06,PF/BT,200011_P.O. PAOLO MERLO LA MADDALENA,40-49,SAR,ITG2
38,Sardegna,TML_CAT_OSS,06/01/2021_PF/BT_SAR_200012_P.O. GIOVANNI PAOLO II OLBIA_40-49,1 - Operatori Sanitari e Sociosanitari,20,2021-01-06,PF/BT,200012_P.O. GIOVANNI PAOLO II OLBIA,40-49,SAR,ITG2
27,Sardegna,TML_CAT_OSS,06/01/2021_PF/BT_SAR_200017_P.O. SAN FRANCESCO_40-49,1 - Operatori Sanitari e Sociosanitari,20,2021-01-06,PF/BT,200017_P.O. SAN FRANCESCO,40-49,SAR,ITG2
32,Sardegna,TML_CAT_OSS,06/01/2021_PF/BT_SAR_200025_P.O. R.BINAGHI CAGLIARI_40-49,1 - Operatori Sanitari e Sociosanitari,20,2021-01-06,PF/BT,200025_P.O. R.BINAGHI CAGLIARI,40-49,SAR,ITG2
1,Sardegna,TML_CAT_OSS,06/01/2021_PF/BT_SAR_200026_P.O. MARINO CAGLIARI_40-49,1 - Operatori Sanitari e Sociosanitari,20,2021-01-06,PF/BT,200026_P.O. MARINO CAGLIARI,40-49,SAR,ITG2
26,Sardegna,TML_CAT_OSS,06/01/2021_PF/BT_SAR_200030_P.O.CTO_40-49,1 - Operatori Sanitari e Sociosanitari,20,2021-01-06,PF/BT,200030_P.O.CTO,40-49,SAR,ITG2
17,Sardegna,TML_CAT_OSS,06/01/2021_PF/BT_SAR_200031_P.O. SS. TRINITA` CAGLIARI_40-49,1 - Operatori Sanitari e Sociosanitari,20,2021-01-06,PF/BT,200031_P.O. SS. TRINITA` CAGLIARI,40-49,SAR,ITG2
1,Sardegna,TML_CAT_OSS,06/01/2021_PF/BT_SAR_200034_PRESIDIO OSPEDALIERO N.S. DI BONARIA_40-49,1 - Operatori Sanitari e Sociosanitari,20,2021-01-06,PF/BT,200034_PRESIDIO OSPEDALIERO N.S. DI BONARIA,40-49,SAR,ITG2
20,Sardegna,TML_CAT_OSS,06/01/2021_PF/BT_SAR_200052_P.O. SAN MARTINO ORISTANO_40-49,1 - Operatori Sanitari e Sociosanitari,20,2021-01-06,PF/BT,200052_P.O. SAN MARTINO ORISTANO,40-49,SAR,ITG2
49,Sardegna,TML_CAT_OSS,06/01/2021_PF/BT_SAR_200904_P.O. SAN MICHELE - AOB_40-49,1 - Operatori Sanitari e Sociosanitari,20,2021-01-06,PF/BT,200904_P.O. SAN MICHELE - AOB,40-49,SAR,ITG2
84,Sardegna,TML_CAT_OSS,06/01/2021_PF/BT_SAR_200905_AZIENDA OSPEDALIERO UNIVERSITARIA SS_40-49,1 - Operatori Sanitari e Sociosanitari,20,2021-01-06,PF/BT,200905_AZIENDA OSPEDALIERO UNIVERSITARIA SS,40-49,SAR,ITG2
1,Sardegna,TML_CAT_OSS,06/01/2021_PF/BT_SAR_200906_A.O.U. Cagliari_40-49,1 - Operatori Sanitari e Sociosanitari,20,2021-01-06,PF/BT,200906_A.O.U. Cagliari,40-49,SAR,ITG2
1,Sardegna,TML_CAT_OSS,06/01/2021_PF/BT_SAR_10036_SISP-SASSARI_50-59,1 - Operatori Sanitari e Sociosanitari,20,2021-01-06,PF/BT,10036_SISP-SASSARI,50-59,SAR,ITG2
17,Sardegna,TML_CAT_OSS,06/01/2021_PF/BT_SAR_200006_P.O. PAOLO DETTORI - TEMPIO P._50-59,1 - Operatori Sanitari e Sociosanitari,20,2021-01-06,PF/BT,200006_P.O. PAOLO DETTORI - TEMPIO P.,50-59,SAR,ITG2
1,Sardegna,TML_CAT_OSS,06/01/2021_PF/BT_SAR_200011_P.O. PAOLO MERLO LA MADDALENA_50-59,1 - Operatori Sanitari e Sociosanitari,20,2021-01-06,PF/BT,200011_P.O. PAOLO MERLO LA MADDALENA,50-59,SAR,ITG2
47,Sardegna,TML_CAT_OSS,06/01/2021_PF/BT_SAR_200012_P.O. GIOVANNI PAOLO II OLBIA_50-59,1 - Operatori Sanitari e Sociosanitari,20,2021-01-06,PF/BT,200012_P.O. GIOVANNI PAOLO II OLBIA,50-59,SAR,ITG2
40,Sardegna,TML_CAT_OSS,06/01/2021_PF/BT_SAR_200017_P.O. SAN FRANCESCO_50-59,1 - Operatori Sanitari e Sociosanitari,20,2021-01-06,PF/BT,200017_P.O. SAN FRANCESCO,50-59,SAR,ITG2
54,Sardegna,TML_CAT_OSS,06/01/2021_PF/BT_SAR_200025_P.O. R.BINAGHI CAGLIARI_50-59,1 - Operatori Sanitari e Sociosanitari,20,2021-01-06,PF/BT,200025_P.O. R.BINAGHI CAGLIARI,50-59,SAR,ITG2
17,Sardegna,TML_CAT_OSS,06/01/2021_PF/BT_SAR_200026_P.O. MARINO CAGLIARI_50-59,1 - Operatori Sanitari e Sociosanitari,20,2021-01-06,PF/BT,200026_P.O. MARINO CAGLIARI,50-59,SAR,ITG2
46,Sardegna,TML_CAT_OSS,06/01/2021_PF/BT_SAR_200030_P.O.CTO_50-59,1 - Operatori Sanitari e Sociosanitari,20,2021-01-06,PF/BT,200030_P.O.CTO,50-59,SAR,ITG2
20,Sardegna,TML_CAT_OSS,06/01/2021_PF/BT_SAR_200031_P.O. SS. TRINITA` CAGLIARI_50-59,1 - Operatori Sanitari e Sociosanitari,20,2021-01-06,PF/BT,200031_P.O. SS. TRINITA` CAGLIARI,50-59,SAR,ITG2
14,Sardegna,TML_CAT_OSS,06/01/2021_PF/BT_SAR_200034_PRESIDIO OSPEDALIERO N.S. DI BONARIA_50-59,1 - Operatori Sanitari e Sociosanitari,20,2021-01-06,PF/BT,200034_PRESIDIO OSPEDALIERO N.S. DI BONARIA,50-59,SAR,ITG2
26,Sardegna,TML_CAT_OSS,06/01/2021_PF/BT_SAR_200052_P.O. SAN MARTINO ORISTANO_50-59,1 - Operatori Sanitari e Sociosanitari,20,2021-01-06,PF/BT,200052_P.O. SAN MARTINO ORISTANO,50-59,SAR,ITG2
43,Sardegna,TML_CAT_OSS,06/01/2021_PF/BT_SAR_200904_P.O. SAN MICHELE - AOB_50-59,1 - Operatori Sanitari e Sociosanitari,20,2021-01-06,PF/BT,200904_P.O. SAN MICHELE - AOB,50-59,SAR,ITG2
86,Sardegna,TML_CAT_OSS,06/01/2021_PF/BT_SAR_200905_AZIENDA OSPEDALIERO UNIVERSITARIA SS_50-59,1 - Operatori Sanitari e Sociosanitari,20,2021-01-06,PF/BT,200905_AZIENDA OSPEDALIERO UNIVERSITARIA SS,50-59,SAR,ITG2
1,Sardegna,TML_CAT_OSS,06/01/2021_PF/BT_SAR_200906_A.O.U. Cagliari_50-59,1 - Operatori Sanitari e Sociosanitari,20,2021-01-06,PF/BT,200906_A.O.U. Cagliari,50-59,SAR,ITG2
20,Sardegna,TML_CAT_OSS,06/01/2021_PF/BT_SAR_10036_SISP-SASSARI_60-69,1 - Operatori Sanitari e Sociosanitari,20,2021-01-06,PF/BT,10036_SISP-SASSARI,60-69,SAR,ITG2
1,Sardegna,TML_CAT_OSS,06/01/2021_PF/BT_SAR_200006_P.O. PAOLO DETTORI - TEMPIO P._60-69,1 - Operatori Sanitari e Sociosanitari,20,2021-01-06,PF/BT,200006_P.O. PAOLO DETTORI - TEMPIO P.,60-69,SAR,ITG2
1,Sardegna,TML_CAT_OSS,06/01/2021_PF/BT_SAR_200011_P.O. PAOLO MERLO LA MADDALENA_60-69,1 - Operatori Sanitari e Sociosanitari,20,2021-01-06,PF/BT,200011_P.O. PAOLO MERLO LA MADDALENA,60-69,SAR,ITG2
17,Sardegna,TML_CAT_OSS,06/01/2021_PF/BT_SAR_200012_P.O. GIOVANNI PAOLO II OLBIA_60-69,1 - Operatori Sanitari e Sociosanitari,20,2021-01-06,PF/BT,200012_P.O. GIOVANNI PAOLO II OLBIA,60-69,SAR,ITG2
1,Sardegna,TML_CAT_OSS,06/01/2021_PF/BT_SAR_200017_P.O. SAN FRANCESCO_60-69,1 - Operatori Sanitari e Sociosanitari,20,2021-01-06,PF/BT,200017_P.O. SAN FRANCESCO,60-69,SAR,ITG2
32,Sardegna,TML_CAT_OSS,06/01/2021_PF/BT_SAR_200025_P.O. R.BINAGHI CAGLIARI_60-69,1 - Operatori Sanitari e Sociosanitari,20,2021-01-06,PF/BT,200025_P.O. R.BINAGHI CAGLIARI,60-69,SAR,ITG2
1,Sardegna,TML_CAT_OSS,06/01/2021_PF/BT_SAR_200026_P.O. MARINO CAGLIARI_60-69,1 - Operatori Sanitari e Sociosanitari,20,2021-01-06,PF/BT,200026_P.O. MARINO CAGLIARI,60-69,SAR,ITG2
34,Sardegna,TML_CAT_OSS,06/01/2021_PF/BT_SAR_200030_P.O.CTO_60-69,1 - Operatori Sanitari e Sociosanitari,20,2021-01-06,PF/BT,200030_P.O.CTO,60-69,SAR,ITG2
24,Sardegna,TML_CAT_OSS,06/01/2021_PF/BT_SAR_200031_P.O. SS. TRINITA` CAGLIARI_60-69,1 - Operatori Sanitari e Sociosanitari,20,2021-01-06,PF/BT,200031_P.O. SS. TRINITA` CAGLIARI,60-69,SAR,ITG2
1,Sardegna,TML_CAT_OSS,06/01/2021_PF/BT_SAR_200034_PRESIDIO OSPEDALIERO N.S. DI BONARIA_60-69,1 - Operatori Sanitari e Sociosanitari,20,2021-01-06,PF/BT,200034_PRESIDIO OSPEDALIERO N.S. DI BONARIA,60-69,SAR,ITG2
1,Sardegna,TML_CAT_OSS,06/01/2021_PF/BT_SAR_200052_P.O. SAN MARTINO ORISTANO_60-69,1 - Operatori Sanitari e Sociosanitari,20,2021-01-06,PF/BT,200052_P.O. SAN MARTINO ORISTANO,60-69,SAR,ITG2
1,Sardegna,TML_CAT_OSS,06/01/2021_PF/BT_SAR_200904_P.O. SAN MICHELE - AOB_60-69,1 - Operatori Sanitari e Sociosanitari,20,2021-01-06,PF/BT,200904_P.O. SAN MICHELE - AOB,60-69,SAR,ITG2
20,Sardegna,TML_CAT_OSS,06/01/2021_PF/BT_SAR_200905_AZIENDA OSPEDALIERO UNIVERSITARIA SS_60-69,1 - Operatori Sanitari e Sociosanitari,20,2021-01-06,PF/BT,200905_AZIENDA OSPEDALIERO UNIVERSITARIA SS,60-69,SAR,ITG2
1,Sardegna,TML_CAT_OSS,06/01/2021_PF/BT_SAR_200906_A.O.U. Cagliari_60-69,1 - Operatori Sanitari e Sociosanitari,20,2021-01-06,PF/BT,200906_A.O.U. Cagliari,60-69,SAR,ITG2
1,Sardegna,TML_CAT_OSS,06/01/2021_PF/BT_SAR_200025_P.O. R.BINAGHI CAGLIARI_70-79,1 - Operatori Sanitari e Sociosanitari,20,2021-01-06,PF/BT,200025_P.O. R.BINAGHI CAGLIARI,70-79,SAR,ITG2
1,Sardegna,TML_CAT_OSS,06/01/2021_PF/BT_SAR_200905_AZIENDA OSPEDALIERO UNIVERSITARIA SS_80-89,1 - Operatori Sanitari e Sociosanitari,20,2021-01-06,PF/BT,200905_AZIENDA OSPEDALIERO UNIVERSITARIA SS,80-89,SAR,ITG2
1,Sardegna,TML_CAT_PERSONALE,06/01/2021_PF/BT_SAR_10036_SISP-SASSARI_20-29,2 - Personale non Sanitario,20,2021-01-06,PF/BT,10036_SISP-SASSARI,20-29,SAR,ITG2
1,Sardegna,TML_CAT_PERSONALE,06/01/2021_PF/BT_SAR_200025_P.O. R.BINAGHI CAGLIARI_20-29,2 - Personale non Sanitario,20,2021-01-06,PF/BT,200025_P.O. R.BINAGHI CAGLIARI,20-29,SAR,ITG2
1,Sardegna,TML_CAT_ALTRO,06/01/2021_PF/BT_SAR_200905_AZIENDA OSPEDALIERO UNIVERSITARIA SS_20-29,2 - Personale non Sanitario,20,2021-01-06,PF/BT,200905_AZIENDA OSPEDALIERO UNIVERSITARIA SS,20-29,SAR,ITG2
1,Sardegna,TML_CAT_PERSONALE,06/01/2021_PF/BT_SAR_10036_SISP-SASSARI_30-39,2 - Personale non Sanitario,20,2021-01-06,PF/BT,10036_SISP-SASSARI,30-39,SAR,ITG2
1,Sardegna,TML_CAT_PERSONALE,06/01/2021_PF/BT_SAR_200025_P.O. R.BINAGHI CAGLIARI_30-39,2 - Personale non Sanitario,20,2021-01-06,PF/BT,200025_P.O. R.BINAGHI CAGLIARI,30-39,SAR,ITG2
1,Sardegna,TML_CAT_PERSONALE,06/01/2021_PF/BT_SAR_200030_P.O.CTO_30-39,2 - Personale non Sanitario,20,2021-01-06,PF/BT,200030_P.O.CTO,30-39,SAR,ITG2
1,Sardegna,TML_CAT_PERSONALE,06/01/2021_PF/BT_SAR_200031_P.O. SS. TRINITA` CAGLIARI_30-39,2 - Personale non Sanitario,20,2021-01-06,PF/BT,200031_P.O. SS. TRINITA` CAGLIARI,30-39,SAR,ITG2
1,Sardegna,TML_CAT_PERSONALE,06/01/2021_PF/BT_SAR_200905_AZIENDA OSPEDALIERO UNIVERSITARIA SS_30-39,2 - Personale non Sanitario,20,2021-01-06,PF/BT,200905_AZIENDA OSPEDALIERO UNIVERSITARIA SS,30-39,SAR,ITG2
1,Sardegna,TML_CAT_PERSONALE,06/01/2021_PF/BT_SAR_10036_SISP-SASSARI_40-49,2 - Personale non Sanitario,20,2021-01-06,PF/BT,10036_SISP-SASSARI,40-49,SAR,ITG2
1,Sardegna,TML_CAT_PERSONALE,06/01/2021_PF/BT_SAR_200006_P.O. PAOLO DETTORI - TEMPIO P._40-49,2 - Personale non Sanitario,20,2021-01-06,PF/BT,200006_P.O. PAOLO DETTORI - TEMPIO P.,40-49,SAR,ITG2
1,Sardegna,TML_CAT_PERSONALE,06/01/2021_PF/BT_SAR_200006_P.O. PAOLO DETTORI - TEMPIO P._40-49,2 - Personale non Sanitario,20,2021-01-06,PF/BT,200006_P.O. PAOLO DETTORI - TEMPIO P.,40-49,SAR,ITG2
1,Sardegna,TML_CAT_PERSONALE,06/01/2021_PF/BT_SAR_200011_P.O. PAOLO MERLO LA MADDALENA_40-49,2 - Personale non Sanitario,20,2021-01-06,PF/BT,200011_P.O. PAOLO MERLO LA MADDALENA,40-49,SAR,ITG2
1,Sardegna,TML_CAT_PERSONALE,06/01/2021_PF/BT_SAR_200012_P.O. GIOVANNI PAOLO II OLBIA_40-49,2 - Personale non Sanitario,20,2021-01-06,PF/BT,200012_P.O. GIOVANNI PAOLO II OLBIA,40-49,SAR,ITG2
1,Sardegna,TML_CAT_PERSONALE,06/01/2021_PF/BT_SAR_200025_P.O. R.BINAGHI CAGLIARI_40-49,2 - Personale non Sanitario,20,2021-01-06,PF/BT,200025_P.O. R.BINAGHI CAGLIARI,40-49,SAR,ITG2
1,Sardegna,TML_CAT_PERSONALE,06/01/2021_PF/BT_SAR_200030_P.O.CTO_40-49,2 - Personale non Sanitario,20,2021-01-06,PF/BT,200030_P.O.CTO,40-49,SAR,ITG2
1,Sardegna,TML_CAT_PERSONALE,06/01/2021_PF/BT_SAR_200031_P.O. SS. TRINITA` CAGLIARI_40-49,2 - Personale non Sanitario,20,2021-01-06,PF/BT,200031_P.O. SS. TRINITA` CAGLIARI,40-49,SAR,ITG2
1,Sardegna,TML_CAT_PERSONALE,06/01/2021_PF/BT_SAR_200905_AZIENDA OSPEDALIERO UNIVERSITARIA SS_40-49,2 - Personale non Sanitario,20,2021-01-06,PF/BT,200905_AZIENDA OSPEDALIERO UNIVERSITARIA SS,40-49,SAR,ITG2
1,Sardegna,TML_CAT_PERSONALE,06/01/2021_PF/BT_SAR_10036_SISP-SASSARI_50-59,2 - Personale non Sanitario,20,2021-01-06,PF/BT,10036_SISP-SASSARI,50-59,SAR,ITG2
1,Sardegna,TML_CAT_PERSONALE,06/01/2021_PF/BT_SAR_200006_P.O. PAOLO DETTORI - TEMPIO P._50-59,2 - Personale non Sanitario,20,2021-01-06,PF/BT,200006_P.O. PAOLO DETTORI - TEMPIO P.,50-59,SAR,ITG2
1,Sardegna,TML_CAT_PERSONALE,06/01/2021_PF/BT_SAR_200006_P.O. PAOLO DETTORI - TEMPIO P._50-59,2 - Personale non Sanitario,20,2021-01-06,PF/BT,200006_P.O. PAOLO DETTORI - TEMPIO P.,50-59,SAR,ITG2
1,Sardegna,TML_CAT_PERSONALE,06/01/2021_PF/BT_SAR_200011_P.O. PAOLO MERLO LA MADDALENA_50-59,2 - Personale non Sanitario,20,2021-01-06,PF/BT,200011_P.O. PAOLO MERLO LA MADDALENA,50-59,SAR,ITG2
20,Sardegna,TML_CAT_PERSONALE,06/01/2021_PF/BT_SAR_200025_P.O. R.BINAGHI CAGLIARI_50-59,2 - Personale non Sanitario,20,2021-01-06,PF/BT,200025_P.O. R.BINAGHI CAGLIARI,50-59,SAR,ITG2
1,Sardegna,TML_CAT_PERSONALE,06/01/2021_PF/BT_SAR_200030_P.O.CTO_50-59,2 - Personale non Sanitario,20,2021-01-06,PF/BT,200030_P.O.CTO,50-59,SAR,ITG2
1,Sardegna,TML_CAT_PERSONALE,06/01/2021_PF/BT_SAR_200031_P.O. SS. TRINITA` CAGLIARI_50-59,2 - Personale non Sanitario,20,2021-01-06,PF/BT,200031_P.O. SS. TRINITA` CAGLIARI,50-59,SAR,ITG2
1,Sardegna,TML_CAT_ALTRO,06/01/2021_PF/BT_SAR_200905_AZIENDA OSPEDALIERO UNIVERSITARIA SS_50-59,2 - Personale non Sanitario,20,2021-01-06,PF/BT,200905_AZIENDA OSPEDALIERO UNIVERSITARIA SS,50-59,SAR,ITG2
1,Sardegna,TML_CAT_PERSONALE,06/01/2021_PF/BT_SAR_10036_SISP-SASSARI_60-69,2 - Personale non Sanitario,20,2021-01-06,PF/BT,10036_SISP-SASSARI,60-69,SAR,ITG2
1,Sardegna,TML_CAT_ALTRO,06/01/2021_PF/BT_SAR_200006_P.O. PAOLO DETTORI - TEMPIO P._60-69,2 - Personale non Sanitario,20,2021-01-06,PF/BT,200006_P.O. PAOLO DETTORI - TEMPIO P.,60-69,SAR,ITG2
1,Sardegna,TML_CAT_PERSONALE,06/01/2021_PF/BT_SAR_200006_P.O. PAOLO DETTORI - TEMPIO P._60-69,2 - Personale non Sanitario,20,2021-01-06,PF/BT,200006_P.O. PAOLO DETTORI - TEMPIO P.,60-69,SAR,ITG2
1,Sardegna,TML_CAT_PERSONALE,06/01/2021_PF/BT_SAR_200017_P.O. SAN FRANCESCO_60-69,2 - Personale non Sanitario,20,2021-01-06,PF/BT,200017_P.O. SAN FRANCESCO,60-69,SAR,ITG2
1,Sardegna,TML_CAT_PERSONALE,06/01/2021_PF/BT_SAR_200025_P.O. R.BINAGHI CAGLIARI_60-69,2 - Personale non Sanitario,20,2021-01-06,PF/BT,200025_P.O. R.BINAGHI CAGLIARI,60-69,SAR,ITG2
1,Sardegna,TML_CAT_PERSONALE,06/01/2021_PF/BT_SAR_200030_P.O.CTO_60-69,2 - Personale non Sanitario,20,2021-01-06,PF/BT,200030_P.O.CTO,60-69,SAR,ITG2
1,Sardegna,TML_CAT_PERSONALE,06/01/2021_PF/BT_SAR_200905_AZIENDA OSPEDALIERO UNIVERSITARIA SS_60-69,2 - Personale non Sanitario,20,2021-01-06,PF/BT,200905_AZIENDA OSPEDALIERO UNIVERSITARIA SS,60-69,SAR,ITG2
1,Sardegna,TML_CAT_OSS,07/01/2021_PF/BT_SAR_200002_OSPEDALE CIVILE ALGHERO_16-19,1 - Operatori Sanitari e Sociosanitari,20,2021-01-07,PF/BT,200002_OSPEDALE CIVILE ALGHERO,16-19,SAR,ITG2
1,Sardegna,TML_CAT_OSS,07/01/2021_PF/BT_SAR_10036_SISP-SASSARI COVID_20-29,1 - Operatori Sanitari e Sociosanitari,20,2021-01-07,PF/BT,10036_SISP-SASSARI COVID,20-29,SAR,ITG2
14,Sardegna,TML_CAT_OSS,07/01/2021_PF/BT_SAR_200002_OSPEDALE CIVILE ALGHERO_20-29,1 - Operatori Sanitari e Sociosanitari,20,2021-01-07,PF/BT,200002_OSPEDALE CIVILE ALGHERO,20-29,SAR,ITG2
1,Sardegna,TML_CAT_OSS,07/01/2021_PF/BT_SAR_200003_OSPEDALE CIVILE OZIERI_20-29,1 - Operatori Sanitari e Sociosanitari,20,2021-01-07,PF/BT,200003_OSPEDALE CIVILE OZIERI,20-29,SAR,ITG2
1,Sardegna,TML_CAT_OSS,07/01/2021_PF/BT_SAR_200011_P.O. PAOLO MERLO LA MADDALENA_20-29,1 - Operatori Sanitari e Sociosanitari,20,2021-01-07,PF/BT,200011_P.O. PAOLO MERLO LA MADDALENA,20-29,SAR,ITG2
1,Sardegna,TML_CAT_OSS,07/01/2021_PF/BT_SAR_200012_P.O. GIOVANNI PAOLO II OLBIA_20-29,1 - Operatori Sanitari e Sociosanitari,20,2021-01-07,PF/BT,200012_P.O. GIOVANNI PAOLO II OLBIA,20-29,SAR,ITG2
1,Sardegna,TML_CAT_OSS,07/01/2021_PF/BT_SAR_200017_P.O. SAN FRANCESCO_20-29,1 - Operatori Sanitari e Sociosanitari,20,2021-01-07,PF/BT,200017_P.O. SAN FRANCESCO,20-29,SAR,ITG2
15,Sardegna,TML_CAT_OSS,07/01/2021_PF/BT_SAR_200019_P.O. NOSTRA SIGNORA DELLA MERCEDE_20-29,1 - Operatori Sanitari e Sociosanitari,20,2021-01-07,PF/BT,200019_P.O. NOSTRA SIGNORA DELLA MERCEDE,20-29,SAR,ITG2
47,Sardegna,TML_CAT_OSS,07/01/2021_PF/BT_SAR_200025_P.O. R.BINAGHI CAGLIARI_20-29,1 - Operatori Sanitari e Sociosanitari,20,2021-01-07,PF/BT,200025_P.O. R.BINAGHI CAGLIARI,20-29,SAR,ITG2
1,Sardegna,TML_CAT_OSS,07/01/2021_PF/BT_SAR_200026_P.O. MARINO CAGLIARI_20-29,1 - Operatori Sanitari e Sociosanitari,20,2021-01-07,PF/BT,200026_P.O. MARINO CAGLIARI,20-29,SAR,ITG2
1,Sardegna,TML_CAT_OSS,07/01/2021_PF/BT_SAR_200030_P.O.CTO_20-29,1 - Operatori Sanitari e Sociosanitari,20,2021-01-07,PF/BT,200030_P.O.CTO,20-29,SAR,ITG2
1,Sardegna,TML_CAT_OSS,07/01/2021_PF/BT_SAR_200031_P.O. SS. TRINITA` CAGLIARI_20-29,1 - Operatori Sanitari e Sociosanitari,20,2021-01-07,PF/BT,200031_P.O. SS. TRINITA` CAGLIARI,20-29,SAR,ITG2
1,Sardegna,TML_CAT_OSS,07/01/2021_PF/BT_SAR_200034_PRESIDIO OSPEDALIERO N.S. DI BONARIA_20-29,1 - Operatori Sanitari e Sociosanitari,20,2021-01-07,PF/BT,200034_PRESIDIO OSPEDALIERO N.S. DI BONARIA,20-29,SAR,ITG2
1,Sardegna,TML_CAT_OSS,07/01/2021_PF/BT_SAR_200035_P.O. SAN MARCELLINO MURAVERA_20-29,1 - Operatori Sanitari e Sociosanitari,20,2021-01-07,PF/BT,200035_P.O. SAN MARCELLINO MURAVERA,20-29,SAR,ITG2
1,Sardegna,TML_CAT_OSS,07/01/2021_PF/BT_SAR_200036_OSPEDALE BUSINCO_20-29,1 - Operatori Sanitari e Sociosanitari,20,2021-01-07,PF/BT,200036_OSPEDALE BUSINCO,20-29,SAR,ITG2
1,Sardegna,TML_CAT_OSS,07/01/2021_PF/BT_SAR_200052_P.O. SAN MARTINO ORISTANO_20-29,1 - Operatori Sanitari e Sociosanitari,20,2021-01-07,PF/BT,200052_P.O. SAN MARTINO ORISTANO,20-29,SAR,ITG2
24,Sardegna,TML_CAT_OSS,07/01/2021_PF/BT_SAR_200904_P.O. SAN MICHELE - AOB_20-29,1 - Operatori Sanitari e Sociosanitari,20,2021-01-07,PF/BT,200904_P.O. SAN MICHELE - AOB,20-29,SAR,ITG2
59,Sardegna,TML_CAT_OSS,07/01/2021_PF/BT_SAR_200905_AOU DI SASSARI_20-29,1 - Operatori Sanitari e Sociosanitari,20,2021-01-07,PF/BT,200905_AOU DI SASSARI,20-29,SAR,ITG2
1,Sardegna,TML_CAT_OSS,"07/01/2021_PF/BT_SAR_200906_AOU CAGLIARI P.O. D. CASULA""_20-29",1 - Operatori Sanitari e Sociosanitari,20,2021-01-07,PF/BT,"200906_AOU CAGLIARI P.O. D. CASULA""",20-29,SAR,ITG2
15,Sardegna,TML_CAT_OSS,07/01/2021_PF/BT_SAR_10036_SISP-SASSARI COVID_30-39,1 - Operatori Sanitari e Sociosanitari,20,2021-01-07,PF/BT,10036_SISP-SASSARI COVID,30-39,SAR,ITG2
20,Sardegna,TML_CAT_OSS,07/01/2021_PF/BT_SAR_200002_OSPEDALE CIVILE ALGHERO_30-39,1 - Operatori Sanitari e Sociosanitari,20,2021-01-07,PF/BT,200002_OSPEDALE CIVILE ALGHERO,30-39,SAR,ITG2
20,Sardegna,TML_CAT_OSS,07/01/2021_PF/BT_SAR_200003_OSPEDALE CIVILE OZIERI_30-39,1 - Operatori Sanitari e Sociosanitari,20,2021-01-07,PF/BT,200003_OSPEDALE CIVILE OZIERI,30-39,SAR,ITG2
60,Sardegna,TML_CAT_OSS,07/01/2021_PF/BT_SAR_200012_P.O. GIOVANNI PAOLO II OLBIA_30-39,1 - Operatori Sanitari e Sociosanitari,20,2021-01-07,PF/BT,200012_P.O. GIOVANNI PAOLO II OLBIA,30-39,SAR,ITG2
20,Sardegna,TML_CAT_OSS,07/01/2021_PF/BT_SAR_200017_P.O. SAN FRANCESCO_30-39,1 - Operatori Sanitari e Sociosanitari,20,2021-01-07,PF/BT,200017_P.O. SAN FRANCESCO,30-39,SAR,ITG2
32,Sardegna,TML_CAT_OSS,07/01/2021_PF/BT_SAR_200019_P.O. NOSTRA SIGNORA DELLA MERCEDE_30-39,1 - Operatori Sanitari e Sociosanitari,20,2021-01-07,PF/BT,200019_P.O. NOSTRA SIGNORA DELLA MERCEDE,30-39,SAR,ITG2
49,Sardegna,TML_CAT_OSS,07/01/2021_PF/BT_SAR_200025_P.O. R.BINAGHI CAGLIARI_30-39,1 - Operatori Sanitari e Sociosanitari,20,2021-01-07,PF/BT,200025_P.O. R.BINAGHI CAGLIARI,30-39,SAR,ITG2
1,Sardegna,TML_CAT_OSS,07/01/2021_PF/BT_SAR_200026_P.O. MARINO CAGLIARI_30-39,1 - Operatori Sanitari e Sociosanitari,20,2021-01-07,PF/BT,200026_P.O. MARINO CAGLIARI,30-39,SAR,ITG2
1,Sardegna,TML_CAT_OSS,07/01/2021_PF/BT_SAR_200030_P.O.CTO_30-39,1 - Operatori Sanitari e Sociosanitari,20,2021-01-07,PF/BT,200030_P.O.CTO,30-39,SAR,ITG2
17,Sardegna,TML_CAT_OSS,07/01/2021_PF/BT_SAR_200031_P.O. SS. TRINITA` CAGLIARI_30-39,1 - Operatori Sanitari e Sociosanitari,20,2021-01-07,PF/BT,200031_P.O. SS. TRINITA` CAGLIARI,30-39,SAR,ITG2
15,Sardegna,TML_CAT_OSS,07/01/2021_PF/BT_SAR_200034_PRESIDIO OSPEDALIERO N.S. DI BONARIA_30-39,1 - Operatori Sanitari e Sociosanitari,20,2021-01-07,PF/BT,200034_PRESIDIO OSPEDALIERO N.S. DI BONARIA,30-39,SAR,ITG2
1,Sardegna,TML_CAT_OSS,07/01/2021_PF/BT_SAR_200035_P.O. SAN MARCELLINO MURAVERA_30-39,1 - Operatori Sanitari e Sociosanitari,20,2021-01-07,PF/BT,200035_P.O. SAN MARCELLINO MURAVERA,30-39,SAR,ITG2
1,Sardegna,TML_CAT_OSS,07/01/2021_PF/BT_SAR_200036_OSPEDALE BUSINCO_30-39,1 - Operatori Sanitari e Sociosanitari,20,2021-01-07,PF/BT,200036_OSPEDALE BUSINCO,30-39,SAR,ITG2
1,Sardegna,TML_CAT_OSS,07/01/2021_PF/BT_SAR_200052_P.O. SAN MARTINO ORISTANO_30-39,1 - Operatori Sanitari e Sociosanitari,20,2021-01-07,PF/BT,200052_P.O. SAN MARTINO ORISTANO,30-39,SAR,ITG2
79,Sardegna,TML_CAT_OSS,07/01/2021_PF/BT_SAR_200904_P.O. SAN MICHELE - AOB_30-39,1 - Operatori Sanitari e Sociosanitari,20,2021-01-07,PF/BT,200904_P.O. SAN MICHELE - AOB,30-39,SAR,ITG2
110,Sardegna,TML_CAT_OSS,07/01/2021_PF/BT_SAR_200905_AOU DI SASSARI_30-39,1 - Operatori Sanitari e Sociosanitari,20,2021-01-07,PF/BT,200905_AOU DI SASSARI,30-39,SAR,ITG2
43,Sardegna,TML_CAT_OSS,"07/01/2021_PF/BT_SAR_200906_AOU CAGLIARI P.O. D. CASULA""_30-39",1 - Operatori Sanitari e Sociosanitari,20,2021-01-07,PF/BT,"200906_AOU CAGLIARI P.O. D. CASULA""",30-39,SAR,ITG2
20,Sardegna,TML_CAT_OSS,07/01/2021_PF/BT_SAR_10036_SISP-SASSARI COVID_40-49,1 - Operatori Sanitari e Sociosanitari,20,2021-01-07,PF/BT,10036_SISP-SASSARI COVID,40-49,SAR,ITG2
34,Sardegna,TML_CAT_OSS,07/01/2021_PF/BT_SAR_200002_OSPEDALE CIVILE ALGHERO_40-49,1 - Operatori Sanitari e Sociosanitari,20,2021-01-07,PF/BT,200002_OSPEDALE CIVILE ALGHERO,40-49,SAR,ITG2
17,Sardegna,TML_CAT_OSS,07/01/2021_PF/BT_SAR_200003_OSPEDALE CIVILE OZIERI_40-49,1 - Operatori Sanitari e Sociosanitari,20,2021-01-07,PF/BT,200003_OSPEDALE CIVILE OZIERI,40-49,SAR,ITG2
1,Sardegna,TML_CAT_OSS,07/01/2021_PF/BT_SAR_200011_P.O. PAOLO MERLO LA MADDALENA_40-49,1 - Operatori Sanitari e Sociosanitari,20,2021-01-07,PF/BT,200011_P.O. PAOLO MERLO LA MADDALENA,40-49,SAR,ITG2
66,Sardegna,TML_CAT_OSS,07/01/2021_PF/BT_SAR_200012_P.O. GIOVANNI PAOLO II OLBIA_40-49,1 - Operatori Sanitari e Sociosanitari,20,2021-01-07,PF/BT,200012_P.O. GIOVANNI PAOLO II OLBIA,40-49,SAR,ITG2
17,Sardegna,TML_CAT_OSS,07/01/2021_PF/BT_SAR_200017_P.O. SAN FRANCESCO_40-49,1 - Operatori Sanitari e Sociosanitari,20,2021-01-07,PF/BT,200017_P.O. SAN FRANCESCO,40-49,SAR,ITG2
27,Sardegna,TML_CAT_OSS,07/01/2021_PF/BT_SAR_200019_P.O. NOSTRA SIGNORA DELLA MERCEDE_40-49,1 - Operatori Sanitari e Sociosanitari,20,2021-01-07,PF/BT,200019_P.O. NOSTRA SIGNORA DELLA MERCEDE,40-49,SAR,ITG2
48,Sardegna,TML_CAT_OSS,07/01/2021_PF/BT_SAR_200025_P.O. R.BINAGHI CAGLIARI_40-49,1 - Operatori Sanitari e Sociosanitari,20,2021-01-07,PF/BT,200025_P.O. R.BINAGHI CAGLIARI,40-49,SAR,ITG2
17,Sardegna,TML_CAT_OSS,07/01/2021_PF/BT_SAR_200026_P.O. MARINO CAGLIARI_40-49,1 - Operatori Sanitari e Sociosanitari,20,2021-01-07,PF/BT,200026_P.O. MARINO CAGLIARI,40-49,SAR,ITG2
1,Sardegna,TML_CAT_OSS,07/01/2021_PF/BT_SAR_200030_P.O.CTO_40-49,1 - Operatori Sanitari e Sociosanitari,20,2021-01-07,PF/BT,200030_P.O.CTO,40-49,SAR,ITG2
20,Sardegna,TML_CAT_OSS,07/01/2021_PF/BT_SAR_200031_P.O. SS. TRINITA` CAGLIARI_40-49,1 - Operatori Sanitari e Sociosanitari,20,2021-01-07,PF/BT,200031_P.O. SS. TRINITA` CAGLIARI,40-49,SAR,ITG2
20,Sardegna,TML_CAT_OSS,07/01/2021_PF/BT_SAR_200034_PRESIDIO OSPEDALIERO N.S. DI BONARIA_40-49,1 - Operatori Sanitari e Sociosanitari,20,2021-01-07,PF/BT,200034_PRESIDIO OSPEDALIERO N.S. DI BONARIA,40-49,SAR,ITG2
1,Sardegna,TML_CAT_OSS,07/01/2021_PF/BT_SAR_200035_P.O. SAN MARCELLINO MURAVERA_40-49,1 - Operatori Sanitari e Sociosanitari,20,2021-01-07,PF/BT,200035_P.O. SAN MARCELLINO MURAVERA,40-49,SAR,ITG2
24,Sardegna,TML_CAT_OSS,07/01/2021_PF/BT_SAR_200036_OSPEDALE BUSINCO_40-49,1 - Operatori Sanitari e Sociosanitari,20,2021-01-07,PF/BT,200036_OSPEDALE BUSINCO,40-49,SAR,ITG2
1,Sardegna,TML_CAT_OSS,07/01/2021_PF/BT_SAR_200052_P.O. SAN MARTINO ORISTANO_40-49,1 - Operatori Sanitari e Sociosanitari,20,2021-01-07,PF/BT,200052_P.O. SAN MARTINO ORISTANO,40-49,SAR,ITG2
62,Sardegna,TML_CAT_OSS,07/01/2021_PF/BT_SAR_200904_P.O. SAN MICHELE - AOB_40-49,1 - Operatori Sanitari e Sociosanitari,20,2021-01-07,PF/BT,200904_P.O. SAN MICHELE - AOB,40-49,SAR,ITG2
149,Sardegna,TML_CAT_OSS,07/01/2021_PF/BT_SAR_200905_AOU DI SASSARI_40-49,1 - Operatori Sanitari e Sociosanitari,20,2021-01-07,PF/BT,200905_AOU DI SASSARI,40-49,SAR,ITG2
65,Sardegna,TML_CAT_OSS,"07/01/2021_PF/BT_SAR_200906_AOU CAGLIARI P.O. D. CASULA""_40-49",1 - Operatori Sanitari e Sociosanitari,20,2021-01-07,PF/BT,"200906_AOU CAGLIARI P.O. D. CASULA""",40-49,SAR,ITG2
41,Sardegna,TML_CAT_OSS,07/01/2021_PF/BT_SAR_10036_SISP-SASSARI COVID_50-59,1 - Operatori Sanitari e Sociosanitari,20,2021-01-07,PF/BT,10036_SISP-SASSARI COVID,50-59,SAR,ITG2
59,Sardegna,TML_CAT_OSS,07/01/2021_PF/BT_SAR_200002_OSPEDALE CIVILE ALGHERO_50-59,1 - Operatori Sanitari e Sociosanitari,20,2021-01-07,PF/BT,200002_OSPEDALE CIVILE ALGHERO,50-59,SAR,ITG2
26,Sardegna,TML_CAT_OSS,07/01/2021_PF/BT_SAR_200003_OSPEDALE CIVILE OZIERI_50-59,1 - Operatori Sanitari e Sociosanitari,20,2021-01-07,PF/BT,200003_OSPEDALE CIVILE OZIERI,50-59,SAR,ITG2
1,Sardegna,TML_CAT_OSS,07/01/2021_PF/BT_SAR_200011_P.O. PAOLO MERLO LA MADDALENA_50-59,1 - Operatori Sanitari e Sociosanitari,20,2021-01-07,PF/BT,200011_P.O. PAOLO MERLO LA MADDALENA,50-59,SAR,ITG2
82,Sardegna,TML_CAT_OSS,07/01/2021_PF/BT_SAR_200012_P.O. GIOVANNI PAOLO II OLBIA_50-59,1 - Operatori Sanitari e Sociosanitari,20,2021-01-07,PF/BT,200012_P.O. GIOVANNI PAOLO II OLBIA,50-59,SAR,ITG2
1,Sardegna,TML_CAT_OSS,07/01/2021_PF/BT_SAR_200017_P.O. SAN FRANCESCO_50-59,1 - Operatori Sanitari e Sociosanitari,20,2021-01-07,PF/BT,200017_P.O. SAN FRANCESCO,50-59,SAR,ITG2
52,Sardegna,TML_CAT_OSS,07/01/2021_PF/BT_SAR_200019_P.O. NOSTRA SIGNORA DELLA MERCEDE_50-59,1 - Operatori Sanitari e Sociosanitari,20,2021-01-07,PF/BT,200019_P.O. NOSTRA SIGNORA DELLA MERCEDE,50-59,SAR,ITG2
61,Sardegna,TML_CAT_OSS,07/01/2021_PF/BT_SAR_200025_P.O. R.BINAGHI CAGLIARI_50-59,1 - Operatori Sanitari e Sociosanitari,20,2021-01-07,PF/BT,200025_P.O. R.BINAGHI CAGLIARI,50-59,SAR,ITG2
20,Sardegna,TML_CAT_OSS,07/01/2021_PF/BT_SAR_200026_P.O. MARINO CAGLIARI_50-59,1 - Operatori Sanitari e Sociosanitari,20,2021-01-07,PF/BT,200026_P.O. MARINO CAGLIARI,50-59,SAR,ITG2
20,Sardegna,TML_CAT_OSS,07/01/2021_PF/BT_SAR_200030_P.O.CTO_50-59,1 - Operatori Sanitari e Sociosanitari,20,2021-01-07,PF/BT,200030_P.O.CTO,50-59,SAR,ITG2
38,Sardegna,TML_CAT_OSS,07/01/2021_PF/BT_SAR_200031_P.O. SS. TRINITA` CAGLIARI_50-59,1 - Operatori Sanitari e Sociosanitari,20,2021-01-07,PF/BT,200031_P.O. SS. TRINITA` CAGLIARI,50-59,SAR,ITG2
42,Sardegna,TML_CAT_OSS,07/01/2021_PF/BT_SAR_200034_PRESIDIO OSPEDALIERO N.S. DI BONARIA_50-59,1 - Operatori Sanitari e Sociosanitari,20,2021-01-07,PF/BT,200034_PRESIDIO OSPEDALIERO N.S. DI BONARIA,50-59,SAR,ITG2
1,Sardegna,TML_CAT_OSS,07/01/2021_PF/BT_SAR_200035_P.O. SAN MARCELLINO MURAVERA_50-59,1 - Operatori Sanitari e Sociosanitari,20,2021-01-07,PF/BT,200035_P.O. SAN MARCELLINO MURAVERA,50-59,SAR,ITG2
49,Sardegna,TML_CAT_OSS,07/01/2021_PF/BT_SAR_200036_OSPEDALE BUSINCO_50-59,1 - Operatori Sanitari e Sociosanitari,20,2021-01-07,PF/BT,200036_OSPEDALE BUSINCO,50-59,SAR,ITG2
1,Sardegna,TML_CAT_OSS,07/01/2021_PF/BT_SAR_200052_P.O. SAN MARTINO ORISTANO_50-59,1 - Operatori Sanitari e Sociosanitari,20,2021-01-07,PF/BT,200052_P.O. SAN MARTINO ORISTANO,50-59,SAR,ITG2
101,Sardegna,TML_CAT_OSS,07/01/2021_PF/BT_SAR_200904_P.O. SAN MICHELE - AOB_50-59,1 - Operatori Sanitari e Sociosanitari,20,2021-01-07,PF/BT,200904_P.O. SAN MICHELE - AOB,50-59,SAR,ITG2
142,Sardegna,TML_CAT_OSS,07/01/2021_PF/BT_SAR_200905_AOU DI SASSARI_50-59,1 - Operatori Sanitari e Sociosanitari,20,2021-01-07,PF/BT,200905_AOU DI SASSARI,50-59,SAR,ITG2
118,Sardegna,TML_CAT_OSS,"07/01/2021_PF/BT_SAR_200906_AOU CAGLIARI P.O. D. CASULA""_50-59",1 - Operatori Sanitari e Sociosanitari,20,2021-01-07,PF/BT,"200906_AOU CAGLIARI P.O. D. CASULA""",50-59,SAR,ITG2
36,Sardegna,TML_CAT_OSS,07/01/2021_PF/BT_SAR_10036_SISP-SASSARI COVID_60-69,1 - Operatori Sanitari e Sociosanitari,20,2021-01-07,PF/BT,10036_SISP-SASSARI COVID,60-69,SAR,ITG2
37,Sardegna,TML_CAT_OSS,07/01/2021_PF/BT_SAR_200002_OSPEDALE CIVILE ALGHERO_60-69,1 - Operatori Sanitari e Sociosanitari,20,2021-01-07,PF/BT,200002_OSPEDALE CIVILE ALGHERO,60-69,SAR,ITG2
1,Sardegna,TML_CAT_OSS,07/01/2021_PF/BT_SAR_200003_OSPEDALE CIVILE OZIERI_60-69,1 - Operatori Sanitari e Sociosanitari,20,2021-01-07,PF/BT,200003_OSPEDALE CIVILE OZIERI,60-69,SAR,ITG2
1,Sardegna,TML_CAT_OSS,07/01/2021_PF/BT_SAR_200011_P.O. PAOLO MERLO LA MADDALENA_60-69,1 - Operatori Sanitari e Sociosanitari,20,2021-01-07,PF/BT,200011_P.O. PAOLO MERLO LA MADDALENA,60-69,SAR,ITG2
31,Sardegna,TML_CAT_OSS,07/01/2021_PF/BT_SAR_200012_P.O. GIOVANNI PAOLO II OLBIA_60-69,1 - Operatori Sanitari e Sociosanitari,20,2021-01-07,PF/BT,200012_P.O. GIOVANNI PAOLO II OLBIA,60-69,SAR,ITG2
1,Sardegna,TML_CAT_OSS,07/01/2021_PF/BT_SAR_200017_P.O. SAN FRANCESCO_60-69,1 - Operatori Sanitari e Sociosanitari,20,2021-01-07,PF/BT,200017_P.O. SAN FRANCESCO,60-69,SAR,ITG2
31,Sardegna,TML_CAT_OSS,07/01/2021_PF/BT_SAR_200019_P.O. NOSTRA SIGNORA DELLA MERCEDE_60-69,1 - Operatori Sanitari e Sociosanitari,20,2021-01-07,PF/BT,200019_P.O. NOSTRA SIGNORA DELLA MERCEDE,60-69,SAR,ITG2
20,Sardegna,TML_CAT_OSS,07/01/2021_PF/BT_SAR_200025_P.O. R.BINAGHI CAGLIARI_60-69,1 - Operatori Sanitari e Sociosanitari,20,2021-01-07,PF/BT,200025_P.O. R.BINAGHI CAGLIARI,60-69,SAR,ITG2
1,Sardegna,TML_CAT_OSS,07/01/2021_PF/BT_SAR_200026_P.O. MARINO CAGLIARI_60-69,1 - Operatori Sanitari e Sociosanitari,20,2021-01-07,PF/BT,200026_P.O. MARINO CAGLIARI,60-69,SAR,ITG2
1,Sardegna,TML_CAT_OSS,07/01/2021_PF/BT_SAR_200030_P.O.CTO_60-69,1 - Operatori Sanitari e Sociosanitari,20,2021-01-07,PF/BT,200030_P.O.CTO,60-69,SAR,ITG2
17,Sardegna,TML_CAT_OSS,07/01/2021_PF/BT_SAR_200031_P.O. SS. TRINITA` CAGLIARI_60-69,1 - Operatori Sanitari e Sociosanitari,20,2021-01-07,PF/BT,200031_P.O. SS. TRINITA` CAGLIARI,60-69,SAR,ITG2
15,Sardegna,TML_CAT_OSS,07/01/2021_PF/BT_SAR_200034_PRESIDIO OSPEDALIERO N.S. DI BONARIA_60-69,1 - Operatori Sanitari e Sociosanitari,20,2021-01-07,PF/BT,200034_PRESIDIO OSPEDALIERO N.S. DI BONARIA,60-69,SAR,ITG2
1,Sardegna,TML_CAT_OSS,07/01/2021_PF/BT_SAR_200035_P.O. SAN MARCELLINO MURAVERA_60-69,1 - Operatori Sanitari e Sociosanitari,20,2021-01-07,PF/BT,200035_P.O. SAN MARCELLINO MURAVERA,60-69,SAR,ITG2
25,Sardegna,TML_CAT_OSS,07/01/2021_PF/BT_SAR_200036_OSPEDALE BUSINCO_60-69,1 - Operatori Sanitari e Sociosanitari,20,2021-01-07,PF/BT,200036_OSPEDALE BUSINCO,60-69,SAR,ITG2
1,Sardegna,TML_CAT_OSS,07/01/2021_PF/BT_SAR_200052_P.O. SAN MARTINO ORISTANO_60-69,1 - Operatori Sanitari e Sociosanitari,20,2021-01-07,PF/BT,200052_P.O. SAN MARTINO ORISTANO,60-69,SAR,ITG2
47,Sardegna,TML_CAT_OSS,07/01/2021_PF/BT_SAR_200904_P.O. SAN MICHELE - AOB_60-69,1 - Operatori Sanitari e Sociosanitari,20,2021-01-07,PF/BT,200904_P.O. SAN MICHELE - AOB,60-69,SAR,ITG2
63,Sardegna,TML_CAT_OSS,07/01/2021_PF/BT_SAR_200905_AOU DI SASSARI_60-69,1 - Operatori Sanitari e Sociosanitari,20,2021-01-07,PF/BT,200905_AOU DI SASSARI,60-69,SAR,ITG2
49,Sardegna,TML_CAT_OSS,"07/01/2021_PF/BT_SAR_200906_AOU CAGLIARI P.O. D. CASULA""_60-69",1 - Operatori Sanitari e Sociosanitari,20,2021-01-07,PF/BT,"200906_AOU CAGLIARI P.O. D. CASULA""",60-69,SAR,ITG2
1,Sardegna,TML_CAT_OSS,07/01/2021_PF/BT_SAR_200002_OSPEDALE CIVILE ALGHERO_70-79,1 - Operatori Sanitari e Sociosanitari,20,2021-01-07,PF/BT,200002_OSPEDALE CIVILE ALGHERO,70-79,SAR,ITG2
1,Sardegna,TML_CAT_OSS,07/01/2021_PF/BT_SAR_200019_P.O. NOSTRA SIGNORA DELLA MERCEDE_70-79,1 - Operatori Sanitari e Sociosanitari,20,2021-01-07,PF/BT,200019_P.O. NOSTRA SIGNORA DELLA MERCEDE,70-79,SAR,ITG2
1,Sardegna,TML_CAT_OSS,07/01/2021_PF/BT_SAR_200025_P.O. R.BINAGHI CAGLIARI_70-79,1 - Operatori Sanitari e Sociosanitari,20,2021-01-07,PF/BT,200025_P.O. R.BINAGHI CAGLIARI,70-79,SAR,ITG2
1,Sardegna,TML_CAT_PERSONALE,07/01/2021_PF/BT_SAR_10036_SISP-SASSARI COVID_20-29,2 - Personale non Sanitario,20,2021-01-07,PF/BT,10036_SISP-SASSARI COVID,20-29,SAR,ITG2
1,Sardegna,TML_CAT_PERSONALE,07/01/2021_PF/BT_SAR_200002_OSPEDALE CIVILE ALGHERO_20-29,2 - Personale non Sanitario,20,2021-01-07,PF/BT,200002_OSPEDALE CIVILE ALGHERO,20-29,SAR,ITG2
1,Sardegna,TML_CAT_PERSONALE,07/01/2021_PF/BT_SAR_200025_P.O. R.BINAGHI CAGLIARI_20-29,2 - Personale non Sanitario,20,2021-01-07,PF/BT,200025_P.O. R.BINAGHI CAGLIARI,20-29,SAR,ITG2
1,Sardegna,TML_CAT_PERSONALE,07/01/2021_PF/BT_SAR_200026_P.O. MARINO CAGLIARI_20-29,2 - Personale non Sanitario,20,2021-01-07,PF/BT,200026_P.O. MARINO CAGLIARI,20-29,SAR,ITG2
1,Sardegna,TML_CAT_PERSONALE,07/01/2021_PF/BT_SAR_200030_P.O.CTO_20-29,2 - Personale non Sanitario,20,2021-01-07,PF/BT,200030_P.O.CTO,20-29,SAR,ITG2
1,Sardegna,TML_CAT_PERSONALE,07/01/2021_PF/BT_SAR_10036_SISP-SASSARI COVID_30-39,2 - Personale non Sanitario,20,2021-01-07,PF/BT,10036_SISP-SASSARI COVID,30-39,SAR,ITG2
37,Sardegna,TML_CAT_PERSONALE,07/01/2021_PF/BT_SAR_200002_OSPEDALE CIVILE ALGHERO_30-39,2 - Personale non Sanitario,20,2021-01-07,PF/BT,200002_OSPEDALE CIVILE ALGHERO,30-39,SAR,ITG2
1,Sardegna,TML_CAT_PERSONALE,07/01/2021_PF/BT_SAR_200025_P.O. R.BINAGHI CAGLIARI_30-39,2 - Personale non Sanitario,20,2021-01-07,PF/BT,200025_P.O. R.BINAGHI CAGLIARI,30-39,SAR,ITG2
1,Sardegna,TML_CAT_PERSONALE,07/01/2021_PF/BT_SAR_200026_P.O. MARINO CAGLIARI_30-39,2 - Personale non Sanitario,20,2021-01-07,PF/BT,200026_P.O. MARINO CAGLIARI,30-39,SAR,ITG2
1,Sardegna,TML_CAT_PERSONALE,07/01/2021_PF/BT_SAR_200030_P.O.CTO_30-39,2 - Personale non Sanitario,20,2021-01-07,PF/BT,200030_P.O.CTO,30-39,SAR,ITG2
1,Sardegna,TML_CAT_PERSONALE,07/01/2021_PF/BT_SAR_200031_P.O. SS. TRINITA` CAGLIARI_30-39,2 - Personale non Sanitario,20,2021-01-07,PF/BT,200031_P.O. SS. TRINITA` CAGLIARI,30-39,SAR,ITG2
1,Sardegna,TML_CAT_PERSONALE,07/01/2021_PF/BT_SAR_200036_OSPEDALE BUSINCO_30-39,2 - Personale non Sanitario,20,2021-01-07,PF/BT,200036_OSPEDALE BUSINCO,30-39,SAR,ITG2
1,Sardegna,TML_CAT_ALTRO,07/01/2021_PF/BT_SAR_10036_SISP-SASSARI COVID_40-49,2 - Personale non Sanitario,20,2021-01-07,PF/BT,10036_SISP-SASSARI COVID,40-49,SAR,ITG2
1,Sardegna,TML_CAT_PERSONALE,07/01/2021_PF/BT_SAR_10036_SISP-SASSARI COVID_40-49,2 - Personale non Sanitario,20,2021-01-07,PF/BT,10036_SISP-SASSARI COVID,40-49,SAR,ITG2
1,Sardegna,TML_CAT_ALTRO,07/01/2021_PF/BT_SAR_200002_OSPEDALE CIVILE ALGHERO_40-49,2 - Personale non Sanitario,20,2021-01-07,PF/BT,200002_OSPEDALE CIVILE ALGHERO,40-49,SAR,ITG2
55,Sardegna,TML_CAT_PERSONALE,07/01/2021_PF/BT_SAR_200002_OSPEDALE CIVILE ALGHERO_40-49,2 - Personale non Sanitario,20,2021-01-07,PF/BT,200002_OSPEDALE CIVILE ALGHERO,40-49,SAR,ITG2
1,Sardegna,TML_CAT_PERSONALE,07/01/2021_PF/BT_SAR_200003_OSPEDALE CIVILE OZIERI_40-49,2 - Personale non Sanitario,20,2021-01-07,PF/BT,200003_OSPEDALE CIVILE OZIERI,40-49,SAR,ITG2
1,Sardegna,TML_CAT_PERSONALE,07/01/2021_PF/BT_SAR_200025_P.O. R.BINAGHI CAGLIARI_40-49,2 - Personale non Sanitario,20,2021-01-07,PF/BT,200025_P.O. R.BINAGHI CAGLIARI,40-49,SAR,ITG2
1,Sardegna,TML_CAT_PERSONALE,07/01/2021_PF/BT_SAR_200026_P.O. MARINO CAGLIARI_40-49,2 - Personale non Sanitario,20,2021-01-07,PF/BT,200026_P.O. MARINO CAGLIARI,40-49,SAR,ITG2
1,Sardegna,TML_CAT_PERSONALE,07/01/2021_PF/BT_SAR_200031_P.O. SS. TRINITA` CAGLIARI_40-49,2 - Personale non Sanitario,20,2021-01-07,PF/BT,200031_P.O. SS. TRINITA` CAGLIARI,40-49,SAR,ITG2
1,Sardegna,TML_CAT_PERSONALE,07/01/2021_PF/BT_SAR_200035_P.O. SAN MARCELLINO MURAVERA_40-49,2 - Personale non Sanitario,20,2021-01-07,PF/BT,200035_P.O. SAN MARCELLINO MURAVERA,40-49,SAR,ITG2
1,Sardegna,TML_CAT_PERSONALE,07/01/2021_PF/BT_SAR_10036_SISP-SASSARI COVID_50-59,2 - Personale non Sanitario,20,2021-01-07,PF/BT,10036_SISP-SASSARI COVID,50-59,SAR,ITG2
1,Sardegna,TML_CAT_PERSONALE,07/01/2021_PF/BT_SAR_10036_SISP-SASSARI COVID_50-59,2 - Personale non Sanitario,20,2021-01-07,PF/BT,10036_SISP-SASSARI COVID,50-59,SAR,ITG2
54,Sardegna,TML_CAT_PERSONALE,07/01/2021_PF/BT_SAR_200002_OSPEDALE CIVILE ALGHERO_50-59,2 - Personale non Sanitario,20,2021-01-07,PF/BT,200002_OSPEDALE CIVILE ALGHERO,50-59,SAR,ITG2
1,Sardegna,TML_CAT_PERSONALE,07/01/2021_PF/BT_SAR_200003_OSPEDALE CIVILE OZIERI_50-59,2 - Personale non Sanitario,20,2021-01-07,PF/BT,200003_OSPEDALE CIVILE OZIERI,50-59,SAR,ITG2
1,Sardegna,TML_CAT_PERSONALE,07/01/2021_PF/BT_SAR_200011_P.O. PAOLO MERLO LA MADDALENA_50-59,2 - Personale non Sanitario,20,2021-01-07,PF/BT,200011_P.O. PAOLO MERLO LA MADDALENA,50-59,SAR,ITG2
20,Sardegna,TML_CAT_PERSONALE,07/01/2021_PF/BT_SAR_200025_P.O. R.BINAGHI CAGLIARI_50-59,2 - Personale non Sanitario,20,2021-01-07,PF/BT,200025_P.O. R.BINAGHI CAGLIARI,50-59,SAR,ITG2
1,Sardegna,TML_CAT_PERSONALE,07/01/2021_PF/BT_SAR_200026_P.O. MARINO CAGLIARI_50-59,2 - Personale non Sanitario,20,2021-01-07,PF/BT,200026_P.O. MARINO CAGLIARI,50-59,SAR,ITG2
1,Sardegna,TML_CAT_PERSONALE,07/01/2021_PF/BT_SAR_200030_P.O.CTO_50-59,2 - Personale non Sanitario,20,2021-01-07,PF/BT,200030_P.O.CTO,50-59,SAR,ITG2
1,Sardegna,TML_CAT_PERSONALE,07/01/2021_PF/BT_SAR_200031_P.O. SS. TRINITA` CAGLIARI_50-59,2 - Personale non Sanitario,20,2021-01-07,PF/BT,200031_P.O. SS. TRINITA` CAGLIARI,50-59,SAR,ITG2
1,Sardegna,TML_CAT_PERSONALE,07/01/2021_PF/BT_SAR_200035_P.O. SAN MARCELLINO MURAVERA_50-59,2 - Personale non Sanitario,20,2021-01-07,PF/BT,200035_P.O. SAN MARCELLINO MURAVERA,50-59,SAR,ITG2
1,Sardegna,TML_CAT_ALTRO,07/01/2021_PF/BT_SAR_10036_SISP-SASSARI COVID_60-69,2 - Personale non Sanitario,20,2021-01-07,PF/BT,10036_SISP-SASSARI COVID,60-69,SAR,ITG2
1,Sardegna,TML_CAT_PERSONALE,07/01/2021_PF/BT_SAR_10036_SISP-SASSARI COVID_60-69,2 - Personale non Sanitario,20,2021-01-07,PF/BT,10036_SISP-SASSARI COVID,60-69,SAR,ITG2
1,Sardegna,TML_CAT_PERSONALE,07/01/2021_PF/BT_SAR_200002_OSPEDALE CIVILE ALGHERO_60-69,2 - Personale non Sanitario,20,2021-01-07,PF/BT,200002_OSPEDALE CIVILE ALGHERO,60-69,SAR,ITG2
17,Sardegna,TML_CAT_PERSONALE,07/01/2021_PF/BT_SAR_200002_OSPEDALE CIVILE ALGHERO_60-69,2 - Personale non Sanitario,20,2021-01-07,PF/BT,200002_OSPEDALE CIVILE ALGHERO,60-69,SAR,ITG2
1,Sardegna,TML_CAT_PERSONALE,07/01/2021_PF/BT_SAR_200003_OSPEDALE CIVILE OZIERI_60-69,2 - Personale non Sanitario,20,2021-01-07,PF/BT,200003_OSPEDALE CIVILE OZIERI,60-69,SAR,ITG2
1,Sardegna,TML_CAT_PERSONALE,07/01/2021_PF/BT_SAR_200025_P.O. R.BINAGHI CAGLIARI_60-69,2 - Personale non Sanitario,20,2021-01-07,PF/BT,200025_P.O. R.BINAGHI CAGLIARI,60-69,SAR,ITG2
1,Sardegna,TML_CAT_PERSONALE,07/01/2021_PF/BT_SAR_200026_P.O. MARINO CAGLIARI_60-69,2 - Personale non Sanitario,20,2021-01-07,PF/BT,200026_P.O. MARINO CAGLIARI,60-69,SAR,ITG2
1,Sardegna,TML_CAT_PERSONALE,07/01/2021_PF/BT_SAR_200031_P.O. SS. TRINITA` CAGLIARI_60-69,2 - Personale non Sanitario,20,2021-01-07,PF/BT,200031_P.O. SS. TRINITA` CAGLIARI,60-69,SAR,ITG2
1,Sardegna,TML_CAT_PERSONALE,07/01/2021_PF/BT_SAR_200035_P.O. SAN MARCELLINO MURAVERA_60-69,2 - Personale non Sanitario,20,2021-01-07,PF/BT,200035_P.O. SAN MARCELLINO MURAVERA,60-69,SAR,ITG2
1,Sardegna,TML_CAT_ALTRO,07/01/2021_PF/BT_SAR_200052_P.O. SAN MARTINO ORISTANO_60-69,2 - Personale non Sanitario,20,2021-01-07,PF/BT,200052_P.O. SAN MARTINO ORISTANO,60-69,SAR,ITG2
1,Sardegna,TML_CAT_ALTRO,07/01/2021_PF/BT_SAR_200905_AOU DI SASSARI_60-69,2 - Personale non Sanitario,20,2021-01-07,PF/BT,200905_AOU DI SASSARI,60-69,SAR,ITG2
1,Sardegna,TML_CAT_ALTRO,07/01/2021_PF/BT_SAR_200905_AOU DI SASSARI_70-79,2 - Personale non Sanitario,20,2021-01-07,PF/BT,200905_AOU DI SASSARI,70-79,SAR,ITG2
1,Sardegna,TML_CAT_OSS,08/01/2021_PF/BT_SAR_20090602_POLICLINICO MONSERRATO-AOU CAGLIARI_16-19,1 - Operatori Sanitari e Sociosanitari,20,2021-01-08,PF/BT,20090602_POLICLINICO MONSERRATO-AOU CAGLIARI,16-19,SAR,ITG2
17,Sardegna,TML_CAT_OSS,08/01/2021_PF/BT_SAR_10036_SISP-SASSARI COVID_20-29,1 - Operatori Sanitari e Sociosanitari,20,2021-01-08,PF/BT,10036_SISP-SASSARI COVID,20-29,SAR,ITG2
24,Sardegna,TML_CAT_OSS,08/01/2021_PF/BT_SAR_101_P.O. SAN FRANCESCO - AMBULATORIO NUORO_20-29,1 - Operatori Sanitari e Sociosanitari,20,2021-01-08,PF/BT,101_P.O. SAN FRANCESCO - AMBULATORIO NUORO,20-29,SAR,ITG2
1,Sardegna,TML_CAT_OSS,08/01/2021_PF/BT_SAR_120010_ P.O. GIOVANNI PAOLO II - OLBIA_20-29,1 - Operatori Sanitari e Sociosanitari,20,2021-01-08,PF/BT,120010_ P.O. GIOVANNI PAOLO II - OLBIA,20-29,SAR,ITG2
14,Sardegna,TML_CAT_OSS,08/01/2021_PF/BT_SAR_200003_OSPEDALE CIVILE OZIERI_20-29,1 - Operatori Sanitari e Sociosanitari,20,2021-01-08,PF/BT,200003_OSPEDALE CIVILE OZIERI,20-29,SAR,ITG2
14,Sardegna,TML_CAT_OSS,08/01/2021_PF/BT_SAR_200019_P.O. NOSTRA SIGNORA DELLA MERCEDE_20-29,1 - Operatori Sanitari e Sociosanitari,20,2021-01-08,PF/BT,200019_P.O. NOSTRA SIGNORA DELLA MERCEDE,20-29,SAR,ITG2
40,Sardegna,TML_CAT_OSS,08/01/2021_PF/BT_SAR_200025_P.O. R.BINAGHI CAGLIARI_20-29,1 - Operatori Sanitari e Sociosanitari,20,2021-01-08,PF/BT,200025_P.O. R.BINAGHI CAGLIARI,20-29,SAR,ITG2
17,Sardegna,TML_CAT_OSS,08/01/2021_PF/BT_SAR_200026_P.O. MARINO CAGLIARI_20-29,1 - Operatori Sanitari e Sociosanitari,20,2021-01-08,PF/BT,200026_P.O. MARINO CAGLIARI,20-29,SAR,ITG2
25,Sardegna,TML_CAT_OSS,08/01/2021_PF/BT_SAR_200031_P.O. SS. TRINITA` CAGLIARI_20-29,1 - Operatori Sanitari e Sociosanitari,20,2021-01-08,PF/BT,200031_P.O. SS. TRINITA` CAGLIARI,20-29,SAR,ITG2
1,Sardegna,TML_CAT_OSS,08/01/2021_PF/BT_SAR_200034_PRESIDIO OSPEDALIERO N.S. DI BONARIA_20-29,1 - Operatori Sanitari e Sociosanitari,20,2021-01-08,PF/BT,200034_PRESIDIO OSPEDALIERO N.S. DI BONARIA,20-29,SAR,ITG2
1,Sardegna,TML_CAT_OSS,08/01/2021_PF/BT_SAR_200036_OSPEDALE BUSINCO_20-29,1 - Operatori Sanitari e Sociosanitari,20,2021-01-08,PF/BT,200036_OSPEDALE BUSINCO,20-29,SAR,ITG2
15,Sardegna,TML_CAT_OSS,08/01/2021_PF/BT_SAR_200052_P.O. SAN MARTINO ORISTANO_20-29,1 - Operatori Sanitari e Sociosanitari,20,2021-01-08,PF/BT,200052_P.O. SAN MARTINO ORISTANO,20-29,SAR,ITG2
39,Sardegna,TML_CAT_OSS,08/01/2021_PF/BT_SAR_200904_P.O. SAN MICHELE - AOB_20-29,1 - Operatori Sanitari e Sociosanitari,20,2021-01-08,PF/BT,200904_P.O. SAN MICHELE - AOB,20-29,SAR,ITG2
43,Sardegna,TML_CAT_OSS,08/01/2021_PF/BT_SAR_200905_AOU DI SASSARI_20-29,1 - Operatori Sanitari e Sociosanitari,20,2021-01-08,PF/BT,200905_AOU DI SASSARI,20-29,SAR,ITG2
15,Sardegna,TML_CAT_OSS,08/01/2021_PF/BT_SAR_20090602_POLICLINICO MONSERRATO-AOU CAGLIARI_20-29,1 - Operatori Sanitari e Sociosanitari,20,2021-01-08,PF/BT,20090602_POLICLINICO MONSERRATO-AOU CAGLIARI,20-29,SAR,ITG2
20,Sardegna,TML_CAT_OSS,08/01/2021_PF/BT_SAR_10036_SISP-SASSARI COVID_30-39,1 - Operatori Sanitari e Sociosanitari,20,2021-01-08,PF/BT,10036_SISP-SASSARI COVID,30-39,SAR,ITG2
41,Sardegna,TML_CAT_OSS,08/01/2021_PF/BT_SAR_101_P.O. SAN FRANCESCO - AMBULATORIO NUORO_30-39,1 - Operatori Sanitari e Sociosanitari,20,2021-01-08,PF/BT,101_P.O. SAN FRANCESCO - AMBULATORIO NUORO,30-39,SAR,ITG2
1,Sardegna,TML_CAT_OSS,08/01/2021_PF/BT_SAR_120010_ P.O. GIOVANNI PAOLO II - OLBIA_30-39,1 - Operatori Sanitari e Sociosanitari,20,2021-01-08,PF/BT,120010_ P.O. GIOVANNI PAOLO II - OLBIA,30-39,SAR,ITG2
15,Sardegna,TML_CAT_OSS,08/01/2021_PF/BT_SAR_200003_OSPEDALE CIVILE OZIERI_30-39,1 - Operatori Sanitari e Sociosanitari,20,2021-01-08,PF/BT,200003_OSPEDALE CIVILE OZIERI,30-39,SAR,ITG2
36,Sardegna,TML_CAT_OSS,08/01/2021_PF/BT_SAR_200019_P.O. NOSTRA SIGNORA DELLA MERCEDE_30-39,1 - Operatori Sanitari e Sociosanitari,20,2021-01-08,PF/BT,200019_P.O. NOSTRA SIGNORA DELLA MERCEDE,30-39,SAR,ITG2
71,Sardegna,TML_CAT_OSS,08/01/2021_PF/BT_SAR_200025_P.O. R.BINAGHI CAGLIARI_30-39,1 - Operatori Sanitari e Sociosanitari,20,2021-01-08,PF/BT,200025_P.O. R.BINAGHI CAGLIARI,30-39,SAR,ITG2
20,Sardegna,TML_CAT_OSS,08/01/2021_PF/BT_SAR_200026_P.O. MARINO CAGLIARI_30-39,1 - Operatori Sanitari e Sociosanitari,20,2021-01-08,PF/BT,200026_P.O. MARINO CAGLIARI,30-39,SAR,ITG2
33,Sardegna,TML_CAT_OSS,08/01/2021_PF/BT_SAR_200031_P.O. SS. TRINITA` CAGLIARI_30-39,1 - Operatori Sanitari e Sociosanitari,20,2021-01-08,PF/BT,200031_P.O. SS. TRINITA` CAGLIARI,30-39,SAR,ITG2
1,Sardegna,TML_CAT_OSS,08/01/2021_PF/BT_SAR_200034_PRESIDIO OSPEDALIERO N.S. DI BONARIA_30-39,1 - Operatori Sanitari e Sociosanitari,20,2021-01-08,PF/BT,200034_PRESIDIO OSPEDALIERO N.S. DI BONARIA,30-39,SAR,ITG2
1,Sardegna,TML_CAT_OSS,08/01/2021_PF/BT_SAR_200035_P.O. SAN MARCELLINO MURAVERA_30-39,1 - Operatori Sanitari e Sociosanitari,20,2021-01-08,PF/BT,200035_P.O. SAN MARCELLINO MURAVERA,30-39,SAR,ITG2
14,Sardegna,TML_CAT_OSS,08/01/2021_PF/BT_SAR_200036_OSPEDALE BUSINCO_30-39,1 - Operatori Sanitari e Sociosanitari,20,2021-01-08,PF/BT,200036_OSPEDALE BUSINCO,30-39,SAR,ITG2
20,Sardegna,TML_CAT_OSS,08/01/2021_PF/BT_SAR_200052_P.O. SAN MARTINO ORISTANO_30-39,1 - Operatori Sanitari e Sociosanitari,20,2021-01-08,PF/BT,200052_P.O. SAN MARTINO ORISTANO,30-39,SAR,ITG2
54,Sardegna,TML_CAT_OSS,08/01/2021_PF/BT_SAR_200904_P.O. SAN MICHELE - AOB_30-39,1 - Operatori Sanitari e Sociosanitari,20,2021-01-08,PF/BT,200904_P.O. SAN MICHELE - AOB,30-39,SAR,ITG2
138,Sardegna,TML_CAT_OSS,08/01/2021_PF/BT_SAR_200905_AOU DI SASSARI_30-39,1 - Operatori Sanitari e Sociosanitari,20,2021-01-08,PF/BT,200905_AOU DI SASSARI,30-39,SAR,ITG2
56,Sardegna,TML_CAT_OSS,08/01/2021_PF/BT_SAR_20090602_POLICLINICO MONSERRATO-AOU CAGLIARI_30-39,1 - Operatori Sanitari e Sociosanitari,20,2021-01-08,PF/BT,20090602_POLICLINICO MONSERRATO-AOU CAGLIARI,30-39,SAR,ITG2
25,Sardegna,TML_CAT_OSS,08/01/2021_PF/BT_SAR_10036_SISP-SASSARI COVID_40-49,1 - Operatori Sanitari e Sociosanitari,20,2021-01-08,PF/BT,10036_SISP-SASSARI COVID,40-49,SAR,ITG2
42,Sardegna,TML_CAT_OSS,08/01/2021_PF/BT_SAR_101_P.O. SAN FRANCESCO - AMBULATORIO NUORO_40-49,1 - Operatori Sanitari e Sociosanitari,20,2021-01-08,PF/BT,101_P.O. SAN FRANCESCO - AMBULATORIO NUORO,40-49,SAR,ITG2
1,Sardegna,TML_CAT_OSS,08/01/2021_PF/BT_SAR_120010_ P.O. GIOVANNI PAOLO II - OLBIA_40-49,1 - Operatori Sanitari e Sociosanitari,20,2021-01-08,PF/BT,120010_ P.O. GIOVANNI PAOLO II - OLBIA,40-49,SAR,ITG2
30,Sardegna,TML_CAT_OSS,08/01/2021_PF/BT_SAR_200003_OSPEDALE CIVILE OZIERI_40-49,1 - Operatori Sanitari e Sociosanitari,20,2021-01-08,PF/BT,200003_OSPEDALE CIVILE OZIERI,40-49,SAR,ITG2
38,Sardegna,TML_CAT_OSS,08/01/2021_PF/BT_SAR_200019_P.O. NOSTRA SIGNORA DELLA MERCEDE_40-49,1 - Operatori Sanitari e Sociosanitari,20,2021-01-08,PF/BT,200019_P.O. NOSTRA SIGNORA DELLA MERCEDE,40-49,SAR,ITG2
95,Sardegna,TML_CAT_OSS,08/01/2021_PF/BT_SAR_200025_P.O. R.BINAGHI CAGLIARI_40-49,1 - Operatori Sanitari e Sociosanitari,20,2021-01-08,PF/BT,200025_P.O. R.BINAGHI CAGLIARI,40-49,SAR,ITG2
20,Sardegna,TML_CAT_OSS,08/01/2021_PF/BT_SAR_200026_P.O. MARINO CAGLIARI_40-49,1 - Operatori Sanitari e Sociosanitari,20,2021-01-08,PF/BT,200026_P.O. MARINO CAGLIARI,40-49,SAR,ITG2
41,Sardegna,TML_CAT_OSS,08/01/2021_PF/BT_SAR_200031_P.O. SS. TRINITA` CAGLIARI_40-49,1 - Operatori Sanitari e Sociosanitari,20,2021-01-08,PF/BT,200031_P.O. SS. TRINITA` CAGLIARI,40-49,SAR,ITG2
1,Sardegna,TML_CAT_OSS,08/01/2021_PF/BT_SAR_200034_PRESIDIO OSPEDALIERO N.S. DI BONARIA_40-49,1 - Operatori Sanitari e Sociosanitari,20,2021-01-08,PF/BT,200034_PRESIDIO OSPEDALIERO N.S. DI BONARIA,40-49,SAR,ITG2
1,Sardegna,TML_CAT_OSS,08/01/2021_PF/BT_SAR_200035_P.O. SAN MARCELLINO MURAVERA_40-49,1 - Operatori Sanitari e Sociosanitari,20,2021-01-08,PF/BT,200035_P.O. SAN MARCELLINO MURAVERA,40-49,SAR,ITG2
30,Sardegna,TML_CAT_OSS,08/01/2021_PF/BT_SAR_200036_OSPEDALE BUSINCO_40-49,1 - Operatori Sanitari e Sociosanitari,20,2021-01-08,PF/BT,200036_OSPEDALE BUSINCO,40-49,SAR,ITG2
27,Sardegna,TML_CAT_OSS,08/01/2021_PF/BT_SAR_200052_P.O. SAN MARTINO ORISTANO_40-49,1 - Operatori Sanitari e Sociosanitari,20,2021-01-08,PF/BT,200052_P.O. SAN MARTINO ORISTANO,40-49,SAR,ITG2
63,Sardegna,TML_CAT_OSS,08/01/2021_PF/BT_SAR_200904_P.O. SAN MICHELE - AOB_40-49,1 - Operatori Sanitari e Sociosanitari,20,2021-01-08,PF/BT,200904_P.O. SAN MICHELE - AOB,40-49,SAR,ITG2
112,Sardegna,TML_CAT_OSS,08/01/2021_PF/BT_SAR_200905_AOU DI SASSARI_40-49,1 - Operatori Sanitari e Sociosanitari,20,2021-01-08,PF/BT,200905_AOU DI SASSARI,40-49,SAR,ITG2
82,Sardegna,TML_CAT_OSS,08/01/2021_PF/BT_SAR_20090602_POLICLINICO MONSERRATO-AOU CAGLIARI_40-49,1 - Operatori Sanitari e Sociosanitari,20,2021-01-08,PF/BT,20090602_POLICLINICO MONSERRATO-AOU CAGLIARI,40-49,SAR,ITG2
53,Sardegna,TML_CAT_OSS,08/01/2021_PF/BT_SAR_10036_SISP-SASSARI COVID_50-59,1 - Operatori Sanitari e Sociosanitari,20,2021-01-08,PF/BT,10036_SISP-SASSARI COVID,50-59,SAR,ITG2
84,Sardegna,TML_CAT_OSS,08/01/2021_PF/BT_SAR_101_P.O. SAN FRANCESCO - AMBULATORIO NUORO_50-59,1 - Operatori Sanitari e Sociosanitari,20,2021-01-08,PF/BT,101_P.O. SAN FRANCESCO - AMBULATORIO NUORO,50-59,SAR,ITG2
1,Sardegna,TML_CAT_OSS,08/01/2021_PF/BT_SAR_120010_ P.O. GIOVANNI PAOLO II - OLBIA_50-59,1 - Operatori Sanitari e Sociosanitari,20,2021-01-08,PF/BT,120010_ P.O. GIOVANNI PAOLO II - OLBIA,50-59,SAR,ITG2
43,Sardegna,TML_CAT_OSS,08/01/2021_PF/BT_SAR_200003_OSPEDALE CIVILE OZIERI_50-59,1 - Operatori Sanitari e Sociosanitari,20,2021-01-08,PF/BT,200003_OSPEDALE CIVILE OZIERI,50-59,SAR,ITG2
60,Sardegna,TML_CAT_OSS,08/01/2021_PF/BT_SAR_200019_P.O. NOSTRA SIGNORA DELLA MERCEDE_50-59,1 - Operatori Sanitari e Sociosanitari,20,2021-01-08,PF/BT,200019_P.O. NOSTRA SIGNORA DELLA MERCEDE,50-59,SAR,ITG2
143,Sardegna,TML_CAT_OSS,08/01/2021_PF/BT_SAR_200025_P.O. R.BINAGHI CAGLIARI_50-59,1 - Operatori Sanitari e Sociosanitari,20,2021-01-08,PF/BT,200025_P.O. R.BINAGHI CAGLIARI,50-59,SAR,ITG2
25,Sardegna,TML_CAT_OSS,08/01/2021_PF/BT_SAR_200026_P.O. MARINO CAGLIARI_50-59,1 - Operatori Sanitari e Sociosanitari,20,2021-01-08,PF/BT,200026_P.O. MARINO CAGLIARI,50-59,SAR,ITG2
69,Sardegna,TML_CAT_OSS,08/01/2021_PF/BT_SAR_200031_P.O. SS. TRINITA` CAGLIARI_50-59,1 - Operatori Sanitari e Sociosanitari,20,2021-01-08,PF/BT,200031_P.O. SS. TRINITA` CAGLIARI,50-59,SAR,ITG2
1,Sardegna,TML_CAT_OSS,08/01/2021_PF/BT_SAR_200034_PRESIDIO OSPEDALIERO N.S. DI BONARIA_50-59,1 - Operatori Sanitari e Sociosanitari,20,2021-01-08,PF/BT,200034_PRESIDIO OSPEDALIERO N.S. DI BONARIA,50-59,SAR,ITG2
20,Sardegna,TML_CAT_OSS,08/01/2021_PF/BT_SAR_200035_P.O. SAN MARCELLINO MURAVERA_50-59,1 - Operatori Sanitari e Sociosanitari,20,2021-01-08,PF/BT,200035_P.O. SAN MARCELLINO MURAVERA,50-59,SAR,ITG2
53,Sardegna,TML_CAT_OSS,08/01/2021_PF/BT_SAR_200036_OSPEDALE BUSINCO_50-59,1 - Operatori Sanitari e Sociosanitari,20,2021-01-08,PF/BT,200036_OSPEDALE BUSINCO,50-59,SAR,ITG2
40,Sardegna,TML_CAT_OSS,08/01/2021_PF/BT_SAR_200052_P.O. SAN MARTINO ORISTANO_50-59,1 - Operatori Sanitari e Sociosanitari,20,2021-01-08,PF/BT,200052_P.O. SAN MARTINO ORISTANO,50-59,SAR,ITG2
86,Sardegna,TML_CAT_OSS,08/01/2021_PF/BT_SAR_200904_P.O. SAN MICHELE - AOB_50-59,1 - Operatori Sanitari e Sociosanitari,20,2021-01-08,PF/BT,200904_P.O. SAN MICHELE - AOB,50-59,SAR,ITG2
151,Sardegna,TML_CAT_OSS,08/01/2021_PF/BT_SAR_200905_AOU DI SASSARI_50-59,1 - Operatori Sanitari e Sociosanitari,20,2021-01-08,PF/BT,200905_AOU DI SASSARI,50-59,SAR,ITG2
131,Sardegna,TML_CAT_OSS,08/01/2021_PF/BT_SAR_20090602_POLICLINICO MONSERRATO-AOU CAGLIARI_50-59,1 - Operatori Sanitari e Sociosanitari,20,2021-01-08,PF/BT,20090602_POLICLINICO MONSERRATO-AOU CAGLIARI,50-59,SAR,ITG2
49,Sardegna,TML_CAT_OSS,08/01/2021_PF/BT_SAR_10036_SISP-SASSARI COVID_60-69,1 - Operatori Sanitari e Sociosanitari,20,2021-01-08,PF/BT,10036_SISP-SASSARI COVID,60-69,SAR,ITG2
20,Sardegna,TML_CAT_OSS,08/01/2021_PF/BT_SAR_101_P.O. SAN FRANCESCO - AMBULATORIO NUORO_60-69,1 - Operatori Sanitari e Sociosanitari,20,2021-01-08,PF/BT,101_P.O. SAN FRANCESCO - AMBULATORIO NUORO,60-69,SAR,ITG2
1,Sardegna,TML_CAT_OSS,08/01/2021_PF/BT_SAR_120010_ P.O. GIOVANNI PAOLO II - OLBIA_60-69,1 - Operatori Sanitari e Sociosanitari,20,2021-01-08,PF/BT,120010_ P.O. GIOVANNI PAOLO II - OLBIA,60-69,SAR,ITG2
1,Sardegna,TML_CAT_OSS,08/01/2021_PF/BT_SAR_200003_OSPEDALE CIVILE OZIERI_60-69,1 - Operatori Sanitari e Sociosanitari,20,2021-01-08,PF/BT,200003_OSPEDALE CIVILE OZIERI,60-69,SAR,ITG2
43,Sardegna,TML_CAT_OSS,08/01/2021_PF/BT_SAR_200019_P.O. NOSTRA SIGNORA DELLA MERCEDE_60-69,1 - Operatori Sanitari e Sociosanitari,20,2021-01-08,PF/BT,200019_P.O. NOSTRA SIGNORA DELLA MERCEDE,60-69,SAR,ITG2
49,Sardegna,TML_CAT_OSS,08/01/2021_PF/BT_SAR_200025_P.O. R.BINAGHI CAGLIARI_60-69,1 - Operatori Sanitari e Sociosanitari,20,2021-01-08,PF/BT,200025_P.O. R.BINAGHI CAGLIARI,60-69,SAR,ITG2
15,Sardegna,TML_CAT_OSS,08/01/2021_PF/BT_SAR_200026_P.O. MARINO CAGLIARI_60-69,1 - Operatori Sanitari e Sociosanitari,20,2021-01-08,PF/BT,200026_P.O. MARINO CAGLIARI,60-69,SAR,ITG2
42,Sardegna,TML_CAT_OSS,08/01/2021_PF/BT_SAR_200031_P.O. SS. TRINITA` CAGLIARI_60-69,1 - Operatori Sanitari e Sociosanitari,20,2021-01-08,PF/BT,200031_P.O. SS. TRINITA` CAGLIARI,60-69,SAR,ITG2
1,Sardegna,TML_CAT_OSS,08/01/2021_PF/BT_SAR_200034_PRESIDIO OSPEDALIERO N.S. DI BONARIA_60-69,1 - Operatori Sanitari e Sociosanitari,20,2021-01-08,PF/BT,200034_PRESIDIO OSPEDALIERO N.S. DI BONARIA,60-69,SAR,ITG2
1,Sardegna,TML_CAT_OSS,08/01/2021_PF/BT_SAR_200035_P.O. SAN MARCELLINO MURAVERA_60-69,1 - Operatori Sanitari e Sociosanitari,20,2021-01-08,PF/BT,200035_P.O. SAN MARCELLINO MURAVERA,60-69,SAR,ITG2
25,Sardegna,TML_CAT_OSS,08/01/2021_PF/BT_SAR_200036_OSPEDALE BUSINCO_60-69,1 - Operatori Sanitari e Sociosanitari,20,2021-01-08,PF/BT,200036_OSPEDALE BUSINCO,60-69,SAR,ITG2
1,Sardegna,TML_CAT_OSS,08/01/2021_PF/BT_SAR_200052_P.O. SAN MARTINO ORISTANO_60-69,1 - Operatori Sanitari e Sociosanitari,20,2021-01-08,PF/BT,200052_P.O. SAN MARTINO ORISTANO,60-69,SAR,ITG2
48,Sardegna,TML_CAT_OSS,08/01/2021_PF/BT_SAR_200904_P.O. SAN MICHELE - AOB_60-69,1 - Operatori Sanitari e Sociosanitari,20,2021-01-08,PF/BT,200904_P.O. SAN MICHELE - AOB,60-69,SAR,ITG2
72,Sardegna,TML_CAT_OSS,08/01/2021_PF/BT_SAR_200905_AOU DI SASSARI_60-69,1 - Operatori Sanitari e Sociosanitari,20,2021-01-08,PF/BT,200905_AOU DI SASSARI,60-69,SAR,ITG2
61,Sardegna,TML_CAT_OSS,08/01/2021_PF/BT_SAR_20090602_POLICLINICO MONSERRATO-AOU CAGLIARI_60-69,1 - Operatori Sanitari e Sociosanitari,20,2021-01-08,PF/BT,20090602_POLICLINICO MONSERRATO-AOU CAGLIARI,60-69,SAR,ITG2
1,Sardegna,TML_CAT_OSS,08/01/2021_PF/BT_SAR_10036_SISP-SASSARI COVID_70-79,1 - Operatori Sanitari e Sociosanitari,20,2021-01-08,PF/BT,10036_SISP-SASSARI COVID,70-79,SAR,ITG2
1,Sardegna,TML_CAT_OSS,08/01/2021_PF/BT_SAR_200025_P.O. R.BINAGHI CAGLIARI_70-79,1 - Operatori Sanitari e Sociosanitari,20,2021-01-08,PF/BT,200025_P.O. R.BINAGHI CAGLIARI,70-79,SAR,ITG2
1,Sardegna,TML_CAT_OSS,08/01/2021_PF/BT_SAR_200026_P.O. MARINO CAGLIARI_70-79,1 - Operatori Sanitari e Sociosanitari,20,2021-01-08,PF/BT,200026_P.O. MARINO CAGLIARI,70-79,SAR,ITG2
1,Sardegna,TML_CAT_OSS,08/01/2021_PF/BT_SAR_20090602_POLICLINICO MONSERRATO-AOU CAGLIARI_70-79,1 - Operatori Sanitari e Sociosanitari,20,2021-01-08,PF/BT,20090602_POLICLINICO MONSERRATO-AOU CAGLIARI,70-79,SAR,ITG2
1,Sardegna,TML_CAT_OSS,08/01/2021_PF/BT_SAR_200905_AOU DI SASSARI_90+,1 - Operatori Sanitari e Sociosanitari,20,2021-01-08,PF/BT,200905_AOU DI SASSARI,90+,SAR,ITG2
1,Sardegna,TML_CAT_PERSONALE,08/01/2021_PF/BT_SAR_10036_SISP-SASSARI COVID_20-29,2 - Personale non Sanitario,20,2021-01-08,PF/BT,10036_SISP-SASSARI COVID,20-29,SAR,ITG2
1,Sardegna,TML_CAT_PERSONALE,08/01/2021_PF/BT_SAR_200019_P.O. NOSTRA SIGNORA DELLA MERCEDE_20-29,2 - Personale non Sanitario,20,2021-01-08,PF/BT,200019_P.O. NOSTRA SIGNORA DELLA MERCEDE,20-29,SAR,ITG2
1,Sardegna,TML_CAT_PERSONALE,08/01/2021_PF/BT_SAR_200025_P.O. R.BINAGHI CAGLIARI_20-29,2 - Personale non Sanitario,20,2021-01-08,PF/BT,200025_P.O. R.BINAGHI CAGLIARI,20-29,SAR,ITG2
1,Sardegna,TML_CAT_PERSONALE,08/01/2021_PF/BT_SAR_200026_P.O. MARINO CAGLIARI_20-29,2 - Personale non Sanitario,20,2021-01-08,PF/BT,200026_P.O. MARINO CAGLIARI,20-29,SAR,ITG2
1,Sardegna,TML_CAT_PERSONALE,08/01/2021_PF/BT_SAR_200904_P.O. SAN MICHELE - AOB_20-29,2 - Personale non Sanitario,20,2021-01-08,PF/BT,200904_P.O. SAN MICHELE - AOB,20-29,SAR,ITG2
1,Sardegna,TML_CAT_PERSONALE,08/01/2021_PF/BT_SAR_200905_AOU DI SASSARI_20-29,2 - Personale non Sanitario,20,2021-01-08,PF/BT,200905_AOU DI SASSARI,20-29,SAR,ITG2
1,Sardegna,TML_CAT_PERSONALE,08/01/2021_PF/BT_SAR_10036_SISP-SASSARI COVID_30-39,2 - Personale non Sanitario,20,2021-01-08,PF/BT,10036_SISP-SASSARI COVID,30-39,SAR,ITG2
1,Sardegna,TML_CAT_PERSONALE,08/01/2021_PF/BT_SAR_101_P.O. SAN FRANCESCO - AMBULATORIO NUORO_30-39,2 - Personale non Sanitario,20,2021-01-08,PF/BT,101_P.O. SAN FRANCESCO - AMBULATORIO NUORO,30-39,SAR,ITG2
1,Sardegna,TML_CAT_PERSONALE,08/01/2021_PF/BT_SAR_200019_P.O. NOSTRA SIGNORA DELLA MERCEDE_30-39,2 - Personale non Sanitario,20,2021-01-08,PF/BT,200019_P.O. NOSTRA SIGNORA DELLA MERCEDE,30-39,SAR,ITG2
14,Sardegna,TML_CAT_PERSONALE,08/01/2021_PF/BT_SAR_200025_P.O. R.BINAGHI CAGLIARI_30-39,2 - Personale non Sanitario,20,2021-01-08,PF/BT,200025_P.O. R.BINAGHI CAGLIARI,30-39,SAR,ITG2
1,Sardegna,TML_CAT_PERSONALE,08/01/2021_PF/BT_SAR_200026_P.O. MARINO CAGLIARI_30-39,2 - Personale non Sanitario,20,2021-01-08,PF/BT,200026_P.O. MARINO CAGLIARI,30-39,SAR,ITG2
1,Sardegna,TML_CAT_PERSONALE,08/01/2021_PF/BT_SAR_200026_P.O. MARINO CAGLIARI_30-39,2 - Personale non Sanitario,20,2021-01-08,PF/BT,200026_P.O. MARINO CAGLIARI,30-39,SAR,ITG2
1,Sardegna,TML_CAT_PERSONALE,08/01/2021_PF/BT_SAR_200031_P.O. SS. TRINITA` CAGLIARI_30-39,2 - Personale non Sanitario,20,2021-01-08,PF/BT,200031_P.O. SS. TRINITA` CAGLIARI,30-39,SAR,ITG2
1,Sardegna,TML_CAT_PERSONALE,08/01/2021_PF/BT_SAR_200904_P.O. SAN MICHELE - AOB_30-39,2 - Personale non Sanitario,20,2021-01-08,PF/BT,200904_P.O. SAN MICHELE - AOB,30-39,SAR,ITG2
1,Sardegna,TML_CAT_PERSONALE,08/01/2021_PF/BT_SAR_10036_SISP-SASSARI COVID_40-49,2 - Personale non Sanitario,20,2021-01-08,PF/BT,10036_SISP-SASSARI COVID,40-49,SAR,ITG2
1,Sardegna,TML_CAT_PERSONALE,08/01/2021_PF/BT_SAR_101_P.O. SAN FRANCESCO - AMBULATORIO NUORO_40-49,2 - Personale non Sanitario,20,2021-01-08,PF/BT,101_P.O. SAN FRANCESCO - AMBULATORIO NUORO,40-49,SAR,ITG2
1,Sardegna,TML_CAT_PERSONALE,08/01/2021_PF/BT_SAR_200019_P.O. NOSTRA SIGNORA DELLA MERCEDE_40-49,2 - Personale non Sanitario,20,2021-01-08,PF/BT,200019_P.O. NOSTRA SIGNORA DELLA MERCEDE,40-49,SAR,ITG2
30,Sardegna,TML_CAT_PERSONALE,08/01/2021_PF/BT_SAR_200025_P.O. R.BINAGHI CAGLIARI_40-49,2 - Personale non Sanitario,20,2021-01-08,PF/BT,200025_P.O. R.BINAGHI CAGLIARI,40-49,SAR,ITG2
1,Sardegna,TML_CAT_PERSONALE,08/01/2021_PF/BT_SAR_200026_P.O. MARINO CAGLIARI_40-49,2 - Personale non Sanitario,20,2021-01-08,PF/BT,200026_P.O. MARINO CAGLIARI,40-49,SAR,ITG2
1,Sardegna,TML_CAT_PERSONALE,08/01/2021_PF/BT_SAR_200031_P.O. SS. TRINITA` CAGLIARI_40-49,2 - Personale non Sanitario,20,2021-01-08,PF/BT,200031_P.O. SS. TRINITA` CAGLIARI,40-49,SAR,ITG2
1,Sardegna,TML_CAT_PERSONALE,08/01/2021_PF/BT_SAR_200035_P.O. SAN MARCELLINO MURAVERA_40-49,2 - Personale non Sanitario,20,2021-01-08,PF/BT,200035_P.O. SAN MARCELLINO MURAVERA,40-49,SAR,ITG2
1,Sardegna,TML_CAT_PERSONALE,08/01/2021_PF/BT_SAR_200904_P.O. SAN MICHELE - AOB_40-49,2 - Personale non Sanitario,20,2021-01-08,PF/BT,200904_P.O. SAN MICHELE - AOB,40-49,SAR,ITG2
15,Sardegna,TML_CAT_PERSONALE,08/01/2021_PF/BT_SAR_200905_AOU DI SASSARI_40-49,2 - Personale non Sanitario,20,2021-01-08,PF/BT,200905_AOU DI SASSARI,40-49,SAR,ITG2
1,Sardegna,TML_CAT_PERSONALE,08/01/2021_PF/BT_SAR_10036_SISP-SASSARI COVID_50-59,2 - Personale non Sanitario,20,2021-01-08,PF/BT,10036_SISP-SASSARI COVID,50-59,SAR,ITG2
1,Sardegna,TML_CAT_PERSONALE,08/01/2021_PF/BT_SAR_10036_SISP-SASSARI COVID_50-59,2 - Personale non Sanitario,20,2021-01-08,PF/BT,10036_SISP-SASSARI COVID,50-59,SAR,ITG2
1,Sardegna,TML_CAT_PERSONALE,08/01/2021_PF/BT_SAR_101_P.O. SAN FRANCESCO - AMBULATORIO NUORO_50-59,2 - Personale non Sanitario,20,2021-01-08,PF/BT,101_P.O. SAN FRANCESCO - AMBULATORIO NUORO,50-59,SAR,ITG2
1,Sardegna,TML_CAT_PERSONALE,08/01/2021_PF/BT_SAR_200003_OSPEDALE CIVILE OZIERI_50-59,2 - Personale non Sanitario,20,2021-01-08,PF/BT,200003_OSPEDALE CIVILE OZIERI,50-59,SAR,ITG2
1,Sardegna,TML_CAT_PERSONALE,08/01/2021_PF/BT_SAR_200019_P.O. NOSTRA SIGNORA DELLA MERCEDE_50-59,2 - Personale non Sanitario,20,2021-01-08,PF/BT,200019_P.O. NOSTRA SIGNORA DELLA MERCEDE,50-59,SAR,ITG2
1,Sardegna,TML_CAT_PERSONALE,08/01/2021_PF/BT_SAR_200019_P.O. NOSTRA SIGNORA DELLA MERCEDE_50-59,2 - Personale non Sanitario,20,2021-01-08,PF/BT,200019_P.O. NOSTRA SIGNORA DELLA MERCEDE,50-59,SAR,ITG2
1,Sardegna,TML_CAT_ALTRO,08/01/2021_PF/BT_SAR_200025_P.O. R.BINAGHI CAGLIARI_50-59,2 - Personale non Sanitario,20,2021-01-08,PF/BT,200025_P.O. R.BINAGHI CAGLIARI,50-59,SAR,ITG2
32,Sardegna,TML_CAT_PERSONALE,08/01/2021_PF/BT_SAR_200025_P.O. R.BINAGHI CAGLIARI_50-59,2 - Personale non Sanitario,20,2021-01-08,PF/BT,200025_P.O. R.BINAGHI CAGLIARI,50-59,SAR,ITG2
1,Sardegna,TML_CAT_PERSONALE,08/01/2021_PF/BT_SAR_200026_P.O. MARINO CAGLIARI_50-59,2 - Personale non Sanitario,20,2021-01-08,PF/BT,200026_P.O. MARINO CAGLIARI,50-59,SAR,ITG2
1,Sardegna,TML_CAT_PERSONALE,08/01/2021_PF/BT_SAR_200026_P.O. MARINO CAGLIARI_50-59,2 - Personale non Sanitario,20,2021-01-08,PF/BT,200026_P.O. MARINO CAGLIARI,50-59,SAR,ITG2
1,Sardegna,TML_CAT_PERSONALE,08/01/2021_PF/BT_SAR_200031_P.O. SS. TRINITA` CAGLIARI_50-59,2 - Personale non Sanitario,20,2021-01-08,PF/BT,200031_P.O. SS. TRINITA` CAGLIARI,50-59,SAR,ITG2
1,Sardegna,TML_CAT_PERSONALE,08/01/2021_PF/BT_SAR_200035_P.O. SAN MARCELLINO MURAVERA_50-59,2 - Personale non Sanitario,20,2021-01-08,PF/BT,200035_P.O. SAN MARCELLINO MURAVERA,50-59,SAR,ITG2
1,Sardegna,TML_CAT_PERSONALE,08/01/2021_PF/BT_SAR_200904_P.O. SAN MICHELE - AOB_50-59,2 - Personale non Sanitario,20,2021-01-08,PF/BT,200904_P.O. SAN MICHELE - AOB,50-59,SAR,ITG2
1,Sardegna,TML_CAT_ALTRO,08/01/2021_PF/BT_SAR_10036_SISP-SASSARI COVID_60-69,2 - Personale non Sanitario,20,2021-01-08,PF/BT,10036_SISP-SASSARI COVID,60-69,SAR,ITG2
1,Sardegna,TML_CAT_PERSONALE,08/01/2021_PF/BT_SAR_10036_SISP-SASSARI COVID_60-69,2 - Personale non Sanitario,20,2021-01-08,PF/BT,10036_SISP-SASSARI COVID,60-69,SAR,ITG2
1,Sardegna,TML_CAT_PERSONALE,08/01/2021_PF/BT_SAR_101_P.O. SAN FRANCESCO - AMBULATORIO NUORO_60-69,2 - Personale non Sanitario,20,2021-01-08,PF/BT,101_P.O. SAN FRANCESCO - AMBULATORIO NUORO,60-69,SAR,ITG2
1,Sardegna,TML_CAT_PERSONALE,08/01/2021_PF/BT_SAR_200003_OSPEDALE CIVILE OZIERI_60-69,2 - Personale non Sanitario,20,2021-01-08,PF/BT,200003_OSPEDALE CIVILE OZIERI,60-69,SAR,ITG2
1,Sardegna,TML_CAT_PERSONALE,08/01/2021_PF/BT_SAR_200019_P.O. NOSTRA SIGNORA DELLA MERCEDE_60-69,2 - Personale non Sanitario,20,2021-01-08,PF/BT,200019_P.O. NOSTRA SIGNORA DELLA MERCEDE,60-69,SAR,ITG2
1,Sardegna,TML_CAT_PERSONALE,08/01/2021_PF/BT_SAR_200025_P.O. R.BINAGHI CAGLIARI_60-69,2 - Personale non Sanitario,20,2021-01-08,PF/BT,200025_P.O. R.BINAGHI CAGLIARI,60-69,SAR,ITG2
1,Sardegna,TML_CAT_ALTRO,08/01/2021_PF/BT_SAR_200026_P.O. MARINO CAGLIARI_60-69,2 - Personale non Sanitario,20,2021-01-08,PF/BT,200026_P.O. MARINO CAGLIARI,60-69,SAR,ITG2
1,Sardegna,TML_CAT_PERSONALE,08/01/2021_PF/BT_SAR_200026_P.O. MARINO CAGLIARI_60-69,2 - Personale non Sanitario,20,2021-01-08,PF/BT,200026_P.O. MARINO CAGLIARI,60-69,SAR,ITG2
1,Sardegna,TML_CAT_PERSONALE,08/01/2021_PF/BT_SAR_200031_P.O. SS. TRINITA` CAGLIARI_60-69,2 - Personale non Sanitario,20,2021-01-08,PF/BT,200031_P.O. SS. TRINITA` CAGLIARI,60-69,SAR,ITG2
1,Sardegna,TML_CAT_PERSONALE,08/01/2021_PF/BT_SAR_200035_P.O. SAN MARCELLINO MURAVERA_60-69,2 - Personale non Sanitario,20,2021-01-08,PF/BT,200035_P.O. SAN MARCELLINO MURAVERA,60-69,SAR,ITG2
1,Sardegna,TML_CAT_PERSONALE,08/01/2021_PF/BT_SAR_200904_P.O. SAN MICHELE - AOB_60-69,2 - Personale non Sanitario,20,2021-01-08,PF/BT,200904_P.O. SAN MICHELE - AOB,60-69,SAR,ITG2
1,Sardegna,TML_CAT_PERSONALE,08/01/2021_PF/BT_SAR_200905_AOU DI SASSARI_60-69,2 - Personale non Sanitario,20,2021-01-08,PF/BT,200905_AOU DI SASSARI,60-69,SAR,ITG2
1,Sardegna,TML_CAT_PERSONALE,08/01/2021_PF/BT_SAR_200025_P.O. R.BINAGHI CAGLIARI_70-79,2 - Personale non Sanitario,20,2021-01-08,PF/BT,200025_P.O. R.BINAGHI CAGLIARI,70-79,SAR,ITG2
1,Sardegna,TML_CAT_PERSONALE,08/01/2021_PF/BT_SAR_200026_P.O. MARINO CAGLIARI_70-79,2 - Personale non Sanitario,20,2021-01-08,PF/BT,200026_P.O. MARINO CAGLIARI,70-79,SAR,ITG2
1,Sardegna,TML_CAT_ALTRO,08/01/2021_PF/BT_SAR_200905_AOU DI SASSARI_80-89,2 - Personale non Sanitario,20,2021-01-08,PF/BT,200905_AOU DI SASSARI,80-89,SAR,ITG2
1,Sardegna,TML_CAT_OSS,09/01/2021_PF/BT_SAR_200026_P.O. MARINO CAGLIARI_16-19,1 - Operatori Sanitari e Sociosanitari,20,2021-01-09,PF/BT,200026_P.O. MARINO CAGLIARI,16-19,SAR,ITG2
20,Sardegna,TML_CAT_OSS,09/01/2021_PF/BT_SAR_10036_SISP-SASSARI COVID_20-29,1 - Operatori Sanitari e Sociosanitari,20,2021-01-09,PF/BT,10036_SISP-SASSARI COVID,20-29,SAR,ITG2
