DATA_INIZIO_SINTOMI,CASI_TOTALI,NESSUNO_STATO_CLINICO,SOLO_ST_GUARITO,SOLO_ST_DECEDUTO,SOLO_ST_ASINTOMATICO,SOLO_ST_LIEVE_PAU_SEVERO_GRAVE,CON_ST_LIEVE_PAU_SEVERO_GRAVE_GUARITO,CON_ST_LIEVE_PAU_SEVERO_GRAVE_DECEDUTO,CON_ST_ASINTOMATICO_GUARITO,CON_ST_ASINTOMATICO_DECEDUTO,date
,4283696,261,235051,972,13,1,88919,7271,3938344,12864,
21/02/2020,319,,27,1,,,229,62,,,2020-02-21
22/02/2020,417,,48,2,,,320,47,,,2020-02-22
23/02/2020,505,,21,4,,,390,90,,,2020-02-23
24/02/2020,645,,47,2,,,461,134,1,,2020-02-24
25/02/2020,756,1,31,2,,,565,156,1,,2020-02-25
26/02/2020,779,,49,,,,544,184,2,,2020-02-26
27/02/2020,850,,48,12,,,627,163,,,2020-02-27
28/02/2020,1145,,45,6,,,854,220,20,,2020-02-28
29/02/2020,1066,,81,6,,,726,253,,,2020-02-29
01/03/2020,2477,,158,20,,,1665,634,,,2020-03-01
02/03/2020,1720,,132,8,,,1182,398,,,2020-03-02
03/03/2020,2059,,250,18,,,1286,504,1,,2020-03-03
04/03/2020,1617,,114,13,,,1148,342,,,2020-03-04
05/03/2020,2430,,192,20,,,1699,519,,,2020-03-05
06/03/2020,2877,,217,30,,,2026,594,10,,2020-03-06
07/03/2020,2671,,174,24,,,1891,582,,,2020-03-07
08/03/2020,3181,,200,11,,,2313,657,,,2020-03-08
09/03/2020,4105,,291,43,,,3025,746,,,2020-03-09
10/03/2020,5564,,443,56,,,3950,1115,,,2020-03-10
11/03/2020,3426,,227,56,,,2447,695,1,,2020-03-11
12/03/2020,3526,,282,57,,,2486,700,1,,2020-03-12
13/03/2020,4247,,327,79,,,2998,841,2,,2020-03-13
14/03/2020,3906,,321,66,,,2725,794,,,2020-03-14
15/03/2020,4992,,328,98,,,3708,858,,,2020-03-15
16/03/2020,4191,,305,100,,,3078,707,1,,2020-03-16
17/03/2020,3507,,256,62,,,2532,657,,,2020-03-17
18/03/2020,3405,,335,70,,,2377,623,,,2020-03-18
19/03/2020,3201,,330,143,,,2077,651,,,2020-03-19
20/03/2020,5363,,438,135,,,3544,1246,,,2020-03-20
21/03/2020,2868,,193,98,,,2025,552,,,2020-03-21
22/03/2020,2921,,282,96,,,2000,543,,,2020-03-22
23/03/2020,3724,,424,57,,,2522,721,,,2020-03-23
24/03/2020,2918,,336,52,,,1903,627,,,2020-03-24
25/03/2020,3596,,374,49,,,2399,774,,,2020-03-25
26/03/2020,2755,,390,95,,,1897,372,1,,2020-03-26
27/03/2020,3050,,333,66,,,2010,641,,,2020-03-27
28/03/2020,2581,,265,99,,,1661,555,1,,2020-03-28
29/03/2020,1915,,169,46,,,1268,432,,,2020-03-29
30/03/2020,3268,,427,52,,,2192,597,,,2020-03-30
31/03/2020,2117,,236,41,,,1466,374,,,2020-03-31
01/04/2020,3780,,567,105,,,2429,677,2,,2020-04-01
02/04/2020,2438,,432,91,,,1557,358,,,2020-04-02
03/04/2020,2664,,344,148,,,1734,428,10,,2020-04-03
04/04/2020,1966,,388,35,,,1224,319,,,2020-04-04
05/04/2020,1827,,234,59,,,1210,324,,,2020-04-05
06/04/2020,2100,,362,56,,,1322,360,,,2020-04-06
07/04/2020,2358,,400,79,,,1353,526,,,2020-04-07
08/04/2020,1951,,361,83,,,1199,308,,,2020-04-08
09/04/2020,2275,,484,139,,,1231,421,,,2020-04-09
10/04/2020,3158,,775,128,,,1759,495,1,,2020-04-10
11/04/2020,1406,,281,58,,,808,259,,,2020-04-11
12/04/2020,1194,,172,30,,,758,234,,,2020-04-12
13/04/2020,1252,,200,58,,,783,211,,,2020-04-13
14/04/2020,1692,,357,55,,,1008,272,,,2020-04-14
15/04/2020,2224,,533,88,,,1329,271,3,,2020-04-15
16/04/2020,1482,,388,44,,,887,162,1,,2020-04-16
17/04/2020,1893,,479,90,,,1113,211,,,2020-04-17
18/04/2020,1015,,319,72,,,490,134,,,2020-04-18
19/04/2020,1334,,508,119,,,569,138,,,2020-04-19
20/04/2020,2170,,660,90,,,1198,222,,,2020-04-20
21/04/2020,1118,,371,92,,,572,83,,,2020-04-21
22/04/2020,1547,,469,64,,,827,185,2,,2020-04-22
23/04/2020,1444,,557,65,,,687,134,1,,2020-04-23
24/04/2020,1088,,398,33,,,536,121,,,2020-04-24
25/04/2020,790,,214,61,,,386,129,,,2020-04-25
26/04/2020,752,,204,41,,,393,104,10,,2020-04-26
27/04/2020,1106,,381,19,,,585,118,3,,2020-04-27
28/04/2020,1056,,426,25,,,508,95,2,,2020-04-28
29/04/2020,903,,498,15,,,351,38,1,,2020-04-29
30/04/2020,1106,,448,38,,,535,85,,,2020-04-30
01/05/2020,553,,195,3,,,283,72,,,2020-05-01
02/05/2020,548,,185,32,,,259,71,1,,2020-05-02
03/05/2020,396,,103,1,,,258,34,,,2020-05-03
04/05/2020,753,,327,25,,,380,21,,,2020-05-04
05/05/2020,695,,301,7,,,346,40,1,,2020-05-05
06/05/2020,599,,233,28,,,305,31,2,,2020-05-06
07/05/2020,548,,170,19,,,337,21,1,,2020-05-07
08/05/2020,574,,211,11,,,331,19,2,,2020-05-08
09/05/2020,252,,97,3,,,118,34,,,2020-05-09
10/05/2020,347,,147,,,,159,41,,,2020-05-10
11/05/2020,600,,205,2,,,349,44,,,2020-05-11
12/05/2020,538,,254,5,,,237,42,,,2020-05-12
13/05/2020,505,,161,13,,,292,38,1,,2020-05-13
14/05/2020,422,,188,1,,,218,14,1,,2020-05-14
15/05/2020,408,,108,2,,,294,4,,,2020-05-15
16/05/2020,199,,82,2,,,110,5,,,2020-05-16
17/05/2020,236,,73,1,,,147,15,,,2020-05-17
18/05/2020,447,,126,10,,,267,24,20,,2020-05-18
19/05/2020,279,,71,1,,,192,14,1,,2020-05-19
20/05/2020,329,,140,10,,,164,14,1,,2020-05-20
21/05/2020,399,,128,1,,,266,3,1,,2020-05-21
22/05/2020,295,,89,1,,,184,19,2,,2020-05-22
23/05/2020,145,,35,,,,105,5,,,2020-05-23
24/05/2020,128,,23,,,,100,5,,,2020-05-24
25/05/2020,441,,72,1,,,321,47,,,2020-05-25
26/05/2020,319,,49,11,,,256,3,,,2020-05-26
27/05/2020,318,,84,10,,,209,14,1,,2020-05-27
28/05/2020,245,,82,,,,148,15,,,2020-05-28
29/05/2020,195,,51,11,,,129,3,1,,2020-05-29
30/05/2020,188,,33,,,,152,3,,,2020-05-30
31/05/2020,56,,5,,,,49,2,,,2020-05-31
01/06/2020,233,,79,,,,146,6,2,,2020-06-01
02/06/2020,83,,25,,,,56,2,,,2020-06-02
03/06/2020,213,,58,,,,142,13,,,2020-06-03
04/06/2020,205,,59,,,,131,14,1,,2020-06-04
05/06/2020,318,,109,,,,206,2,1,,2020-06-05
06/06/2020,147,,37,,,,108,2,,,2020-06-06
07/06/2020,70,,8,,,,51,11,,,2020-06-07
08/06/2020,225,,35,,,,175,5,10,,2020-06-08
09/06/2020,243,,95,,,,147,1,,,2020-06-09
10/06/2020,246,,41,,,,191,4,10,,2020-06-10
11/06/2020,198,,48,1,,,144,5,,,2020-06-11
12/06/2020,187,,64,,,,121,1,1,,2020-06-12
13/06/2020,137,,7,,,,126,3,1,,2020-06-13
14/06/2020,103,,8,1,,,92,2,,,2020-06-14
15/06/2020,167,,26,,,,135,6,,,2020-06-15
16/06/2020,167,,50,,,,114,3,,,2020-06-16
17/06/2020,157,,52,1,,,100,4,,,2020-06-17
18/06/2020,133,,34,,,,96,3,,,2020-06-18
19/06/2020,144,,61,,,,72,11,,,2020-06-19
20/06/2020,88,,13,1,,,72,2,,,2020-06-20
21/06/2020,65,,15,,,,49,1,,,2020-06-21
22/06/2020,110,,29,,,,69,12,,,2020-06-22
23/06/2020,73,,8,,,,63,2,,,2020-06-23
24/06/2020,125,,26,,,,98,1,,,2020-06-24
25/06/2020,89,,15,,,,71,3,,,2020-06-25
26/06/2020,100,,37,,,,60,3,,,2020-06-26
27/06/2020,75,,24,,,,51,,,,2020-06-27
28/06/2020,79,,5,,,,72,1,1,,2020-06-28
29/06/2020,120,,48,2,,,68,2,,,2020-06-29
30/06/2020,82,,5,,,,73,4,,,2020-06-30
01/07/2020,197,,10,10,,,153,24,,,2020-07-01
02/07/2020,91,,20,,,,69,,2,,2020-07-02
03/07/2020,130,,17,,,,102,11,,,2020-07-03
04/07/2020,97,,14,,,,83,,,,2020-07-04
05/07/2020,89,,16,,,,72,1,,,2020-07-05
06/07/2020,146,,7,,,,138,1,,,2020-07-06
07/07/2020,158,,27,1,,,128,1,1,,2020-07-07
08/07/2020,118,,4,,,,103,11,,,2020-07-08
09/07/2020,105,,22,,,,79,4,,,2020-07-09
10/07/2020,121,,28,,,,80,13,,,2020-07-10
11/07/2020,70,,2,,,,66,2,,,2020-07-11
12/07/2020,114,,24,,,,90,,,,2020-07-12
13/07/2020,121,,16,,,,103,1,1,,2020-07-13
14/07/2020,109,,26,,,,83,,,,2020-07-14
15/07/2020,81,,3,,,,74,4,,,2020-07-15
16/07/2020,105,,17,,,,75,13,,,2020-07-16
17/07/2020,59,,3,,,,56,,,,2020-07-17
18/07/2020,91,,14,,,,66,11,,,2020-07-18
19/07/2020,39,,4,,,,30,5,,,2020-07-19
20/07/2020,111,,45,,,,65,1,,,2020-07-20
21/07/2020,110,,18,,,,92,,,,2020-07-21
22/07/2020,92,,15,,,,65,12,,,2020-07-22
23/07/2020,129,,29,,,,100,,,,2020-07-23
24/07/2020,47,,6,,,,40,1,,,2020-07-24
25/07/2020,95,,13,,,,82,,,,2020-07-25
26/07/2020,62,,3,,,,56,3,,,2020-07-26
27/07/2020,137,,17,,,,120,,,,2020-07-27
28/07/2020,148,,25,1,,,119,3,,,2020-07-28
29/07/2020,166,,35,,,,127,3,1,,2020-07-29
30/07/2020,132,,43,10,,,78,1,,,2020-07-30
31/07/2020,62,,16,,,,46,,,,2020-07-31
01/08/2020,110,,3,,,,84,23,,,2020-08-01
02/08/2020,93,,15,,,,78,,,,2020-08-02
03/08/2020,141,,32,,,,107,,2,,2020-08-03
04/08/2020,187,,38,,,,148,1,,,2020-08-04
05/08/2020,106,,9,,,,93,4,,,2020-08-05
06/08/2020,154,,3,,,,150,1,,,2020-08-06
07/08/2020,194,,28,,,,166,,,,2020-08-07
08/08/2020,143,,9,1,,,130,2,1,,2020-08-08
09/08/2020,101,,4,,,,87,10,,,2020-08-09
10/08/2020,214,,38,,,,174,2,,,2020-08-10
11/08/2020,173,,18,,,,143,12,,,2020-08-11
12/08/2020,186,,36,,,,150,,,,2020-08-12
13/08/2020,256,,41,,,,205,10,,,2020-08-13
14/08/2020,218,,5,,,,211,1,1,,2020-08-14
15/08/2020,303,,29,,,,274,,,,2020-08-15
16/08/2020,312,,69,1,,,240,2,,,2020-08-16
17/08/2020,419,,38,,,,379,2,,,2020-08-17
18/08/2020,434,,60,1,,,371,2,,,2020-08-18
19/08/2020,442,,46,1,,,394,1,,,2020-08-19
20/08/2020,455,,100,,,,355,,,,2020-08-20
21/08/2020,583,,81,,,,479,21,2,,2020-08-21
22/08/2020,454,,68,,,,384,2,,,2020-08-22
23/08/2020,447,,73,,,,361,13,,,2020-08-23
24/08/2020,798,,132,,,,647,19,,,2020-08-24
25/08/2020,681,,85,,,,554,42,,,2020-08-25
26/08/2020,585,,155,,,,430,,,,2020-08-26
27/08/2020,447,,76,,,,360,11,,,2020-08-27
28/08/2020,435,,161,,,,271,3,,,2020-08-28
29/08/2020,303,,31,,,,271,1,,,2020-08-29
30/08/2020,420,,74,1,,,345,,,,2020-08-30
31/08/2020,459,,125,1,,,321,11,1,,2020-08-31
01/09/2020,533,,127,10,,,390,6,,,2020-09-01
02/09/2020,480,,126,,,,354,,,,2020-09-02
03/09/2020,523,,66,,,,446,11,,,2020-09-03
04/09/2020,488,,62,,,,415,11,,,2020-09-04
05/09/2020,435,,98,,,,326,11,,,2020-09-05
06/09/2020,302,,56,,,,246,,,,2020-09-06
07/09/2020,429,,85,,,,321,23,,,2020-09-07
08/09/2020,485,,135,,,,330,10,10,,2020-09-08
09/09/2020,372,,49,,,,321,2,,,2020-09-09
10/09/2020,465,,91,1,,,362,11,,,2020-09-10
11/09/2020,497,,79,,,,415,2,1,,2020-09-11
12/09/2020,339,,64,,,,264,11,,,2020-09-12
13/09/2020,382,,62,,,,308,12,,,2020-09-13
14/09/2020,575,,96,,,,476,3,,,2020-09-14
15/09/2020,700,,161,,,,535,3,1,,2020-09-15
16/09/2020,539,,106,,,,431,2,,,2020-09-16
17/09/2020,583,,97,,,,485,1,,,2020-09-17
18/09/2020,478,,118,10,,,349,,1,,2020-09-18
19/09/2020,506,,84,,,,416,5,1,,2020-09-19
20/09/2020,453,,65,10,,,368,10,,,2020-09-20
21/09/2020,798,,235,,,,562,1,,,2020-09-21
22/09/2020,694,,189,,,,505,,,,2020-09-22
23/09/2020,739,,175,,,,563,,1,,2020-09-23
24/09/2020,608,,165,1,,,421,21,,,2020-09-24
25/09/2020,653,,105,,,,543,4,1,,2020-09-25
26/09/2020,573,,158,1,,,411,3,,,2020-09-26
27/09/2020,558,,167,,,,378,3,10,,2020-09-27
28/09/2020,980,,180,,,,767,23,10,,2020-09-28
29/09/2020,791,,224,,,,561,5,1,,2020-09-29
30/09/2020,1245,,375,10,,,835,25,,,2020-09-30
01/10/2020,2033,,742,,,,1279,11,1,,2020-10-01
02/10/2020,1871,,605,,,,1234,32,,,2020-10-02
03/10/2020,1725,,463,1,,,1208,43,10,,2020-10-03
04/10/2020,1703,,349,1,,,1306,47,,,2020-10-04
05/10/2020,3162,,1042,,,,1999,120,1,,2020-10-05
06/10/2020,2759,,940,13,,,1786,19,1,,2020-10-06
07/10/2020,3473,,1207,,,,2190,75,1,,2020-10-07
08/10/2020,4097,,1415,1,,,2581,98,2,,2020-10-08
09/10/2020,4656,,1874,6,,,2633,143,,,2020-10-09
10/10/2020,4560,,1878,3,,,2582,97,,,2020-10-10
11/10/2020,4052,,1853,23,,,2065,90,21,,2020-10-11
12/10/2020,8110,,4097,9,,,3848,146,10,,2020-10-12
13/10/2020,7582,,3895,1,,,3554,131,1,,2020-10-13
14/10/2020,8367,,5054,28,,,3134,130,21,,2020-10-14
15/10/2020,9165,,5535,28,,,3452,148,2,,2020-10-15
16/10/2020,11030,,6902,38,,,3776,309,5,,2020-10-16
17/10/2020,9570,,6321,34,,,3036,178,1,,2020-10-17
18/10/2020,9043,,5813,24,,,2994,211,1,,2020-10-18
19/10/2020,14910,,10592,52,,,4012,240,14,,2020-10-19
20/10/2020,14885,,10543,48,,,3971,319,4,,2020-10-20
21/10/2020,14297,,10068,122,,,3877,207,23,,2020-10-21
22/10/2020,13939,,9789,31,,,3836,271,12,,2020-10-22
23/10/2020,16150,,11873,32,,,3977,262,6,,2020-10-23
24/10/2020,13277,,9566,17,,,3428,265,1,,2020-10-24
25/10/2020,12107,,8169,81,,,3500,347,10,,2020-10-25
26/10/2020,19376,,14441,105,,,4508,315,7,,2020-10-26
27/10/2020,16109,,11709,139,,,3997,249,15,,2020-10-27
28/10/2020,15322,,10758,132,,,4156,260,16,,2020-10-28
29/10/2020,23787,,17990,109,,,5267,409,12,,2020-10-29
30/10/2020,16728,,11659,102,,,4591,346,30,,2020-10-30
31/10/2020,12820,,8945,92,,,3534,244,5,,2020-10-31
01/11/2020,15089,,9317,70,,,5242,386,74,,2020-11-01
02/11/2020,16379,,10648,87,,,5230,387,27,,2020-11-02
03/11/2020,12132,,7498,107,,,4242,257,28,,2020-11-03
04/11/2020,17944,,12282,180,,,4971,422,89,,2020-11-04
05/11/2020,11866,,7031,98,,,4328,338,71,,2020-11-05
06/11/2020,13064,,7500,87,,,5004,427,46,,2020-11-06
07/11/2020,15570,,10277,68,,,4883,302,40,,2020-11-07
08/11/2020,8571,,4315,18,,,3854,328,56,,2020-11-08
09/11/2020,11308,,5111,88,,,5711,319,79,,2020-11-09
10/11/2020,10137,,4668,43,,,4957,409,60,,2020-11-10
11/11/2020,9901,,5180,32,,,4354,262,73,,2020-11-11
12/11/2020,8759,,4592,54,,,3850,244,19,,2020-11-12
13/11/2020,11544,,5921,34,,,5275,266,48,,2020-11-13
14/11/2020,10853,,6781,64,,,3690,261,57,,2020-11-14
15/11/2020,9635,,4785,42,,,4411,342,55,,2020-11-15
16/11/2020,8646,,4363,42,,,3972,215,54,,2020-11-16
17/11/2020,6257,,2941,11,,,3136,138,31,,2020-11-17
18/11/2020,8508,,4405,32,,,3810,228,33,,2020-11-18
19/11/2020,6663,,3971,17,,,2526,145,4,,2020-11-19
20/11/2020,7453,,3825,60,,,3325,205,38,,2020-11-20
21/11/2020,6242,,3561,10,,,2417,210,44,,2020-11-21
22/11/2020,4182,,2121,30,,,1951,77,3,,2020-11-22
23/11/2020,6372,,2676,24,,,3477,146,49,,2020-11-23
24/11/2020,5640,,2813,11,,,2658,126,32,,2020-11-24
25/11/2020,5144,,2213,13,,,2783,107,28,,2020-11-25
26/11/2020,5572,,2734,12,,,2638,180,8,,2020-11-26
27/11/2020,5384,,2332,4,,,2822,199,27,,2020-11-27
28/11/2020,6721,,3454,12,,,3113,139,3,,2020-11-28
29/11/2020,2867,,1291,3,,,1466,105,2,,2020-11-29
30/11/2020,3964,,1703,6,,,2071,141,43,,2020-11-30
01/12/2020,4318,,1695,19,,,2423,168,13,,2020-12-01
02/12/2020,3970,,1693,31,,,2099,120,27,,2020-12-02
03/12/2020,3513,,1391,12,,,2009,98,3,,2020-12-03
04/12/2020,5386,,2114,155,,,2415,700,2,,2020-12-04
05/12/2020,3217,,1262,5,,,1842,104,4,,2020-12-05
06/12/2020,2651,,900,11,,,1663,77,,,2020-12-06
07/12/2020,4076,,1580,34,,,2326,133,3,,2020-12-07
08/12/2020,2127,,124,,,,1913,88,2,,2020-12-08
09/12/2020,3010,,332,2,,,2528,143,5,,2020-12-09
10/12/2020,2754,,422,31,,,2215,82,4,,2020-12-10
11/12/2020,3032,,360,2,,,2527,126,17,,2020-12-11
12/12/2020,2433,,135,2,,,2203,83,10,,2020-12-12
13/12/2020,2012,,124,1,,,1747,139,1,,2020-12-13
14/12/2020,3248,,493,3,,,2661,88,3,,2020-12-14
15/12/2020,2905,,389,31,,,2381,102,2,,2020-12-15
16/12/2020,2468,,343,1,,,2014,97,13,,2020-12-16
17/12/2020,2449,,352,1,,,1930,132,34,,2020-12-17
18/12/2020,2466,,442,2,,,1955,63,4,,2020-12-18
19/12/2020,2101,,209,2,,,1739,151,,,2020-12-19
20/12/2020,1953,,173,,,,1693,85,2,,2020-12-20
21/12/2020,2831,,356,2,,,2348,109,16,,2020-12-21
22/12/2020,2207,,299,2,,,1821,72,13,,2020-12-22
23/12/2020,2659,,477,6,,,2058,112,6,,2020-12-23
24/12/2020,2057,,372,2,,,1600,72,11,,2020-12-24
25/12/2020,1684,,192,,,,1444,48,,,2020-12-25
26/12/2020,1981,,235,1,,,1684,59,2,,2020-12-26
27/12/2020,2206,,392,1,,,1771,42,,,2020-12-27
28/12/2020,3234,,759,30,,,2332,99,14,,2020-12-28
29/12/2020,4335,,2091,3,,,2020,216,5,,2020-12-29
30/12/2020,3869,,1663,3,,,2033,159,11,,2020-12-30
31/12/2020,3798,,1586,15,,,2122,74,1,,2020-12-31
01/01/2021,2441,,299,,,,2042,88,12,,2021-01-01
02/01/2021,2882,,748,,,,1999,134,1,,2021-01-02
03/01/2021,2462,,409,1,,,1942,109,1,,2021-01-03
04/01/2021,4694,,1473,22,,,3017,158,24,,2021-01-04
05/01/2021,4562,,2033,,,,2407,108,14,,2021-01-05
06/01/2021,1977,,224,,,,1672,70,11,,2021-01-06
07/01/2021,2636,,423,1,,,2063,138,11,,2021-01-07
08/01/2021,2369,,340,2,,,1921,93,13,,2021-01-08
09/01/2021,2124,,303,1,,,1722,97,1,,2021-01-09
10/01/2021,1742,,151,12,,,1479,100,,,2021-01-10
11/01/2021,2680,,413,1,,,2176,74,16,,2021-01-11
12/01/2021,3196,,484,1,,,2579,130,2,,2021-01-12
13/01/2021,2138,,355,,,,1702,81,,,2021-01-13
14/01/2021,2030,,287,4,,,1626,112,1,,2021-01-14
15/01/2021,2143,,247,2,,,1801,92,1,,2021-01-15
16/01/2021,1834,,121,,,,1587,125,1,,2021-01-16
17/01/2021,1574,,102,1,,,1425,46,,,2021-01-17
18/01/2021,2603,,304,4,,,2127,137,31,,2021-01-18
19/01/2021,2950,,261,,,,2600,86,3,,2021-01-19
20/01/2021,2229,,190,4,,,1932,81,22,,2021-01-20
21/01/2021,1968,,81,1,,,1834,51,1,,2021-01-21
22/01/2021,2226,,52,,,,2052,109,13,,2021-01-22
23/01/2021,2010,,43,,,,1893,74,,,2021-01-23
24/01/2021,1843,,36,,,,1731,73,3,,2021-01-24
25/01/2021,2533,,108,,,,2332,90,3,,2021-01-25
26/01/2021,2366,,105,,,,2168,93,,,2021-01-26
27/01/2021,2225,,100,,,,2021,102,2,,2021-01-27
28/01/2021,2225,,112,,,,2033,79,1,,2021-01-28
29/01/2021,2026,,78,,,,1873,75,,,2021-01-29
30/01/2021,1787,,60,,,,1660,56,11,,2021-01-30
31/01/2021,1745,,45,,,,1624,75,1,,2021-01-31
01/02/2021,3123,,122,1,,,2874,113,13,,2021-02-01
02/02/2021,2572,,126,,,,2369,72,5,,2021-02-02
03/02/2021,2611,,153,1,,,2353,102,2,,2021-02-03
04/02/2021,2564,,100,11,,,2370,82,1,,2021-02-04
05/02/2021,2853,,142,,,,2554,137,20,,2021-02-05
06/02/2021,2492,,86,2,,,2315,88,1,,2021-02-06
07/02/2021,2192,,79,,,,2056,55,2,,2021-02-07
08/02/2021,2937,,153,2,,,2704,64,14,,2021-02-08
09/02/2021,2854,,155,,,,2620,78,1,,2021-02-09
10/02/2021,2830,,120,,,,2640,68,2,,2021-02-10
11/02/2021,2568,,89,,,,2398,67,14,,2021-02-11
12/02/2021,2664,,133,2,,,2488,40,1,,2021-02-12
13/02/2021,2742,,169,,,,2525,36,12,,2021-02-13
14/02/2021,2795,,70,,,,2592,133,,,2021-02-14
15/02/2021,3952,,138,3,,,3727,83,1,,2021-02-15
16/02/2021,3693,,220,,,,3361,110,2,,2021-02-16
17/02/2021,3820,,224,,,,3493,101,2,,2021-02-17
18/02/2021,3763,,209,,,,3436,116,2,,2021-02-18
19/02/2021,4053,,237,,,,3720,91,5,,2021-02-19
20/02/2021,4376,,256,,,,4005,95,20,,2021-02-20
21/02/2021,3781,,128,,,,3534,115,4,,2021-02-21
22/02/2021,5629,,285,,,,5162,180,2,,2021-02-22
23/02/2021,5255,,331,1,,,4770,142,11,,2021-02-23
24/02/2021,5082,,310,1,,,4628,140,3,,2021-02-24
25/02/2021,5210,,366,,,,4649,194,1,,2021-02-25
26/02/2021,5228,,406,2,,,4625,183,12,,2021-02-26
27/02/2021,4919,,347,,,,4450,101,21,,2021-02-27
28/02/2021,4625,,191,2,,,4311,121,,,2021-02-28
01/03/2021,7785,,511,2,,,7118,148,6,,2021-03-01
02/03/2021,6541,,564,1,,,5846,129,1,,2021-03-02
03/03/2021,6856,,493,1,,,6192,149,21,,2021-03-03
04/03/2021,6930,,460,2,,,6185,240,43,,2021-03-04
05/03/2021,7717,,603,,,,6854,229,31,,2021-03-05
06/03/2021,6597,,430,2,,,6019,145,1,,2021-03-06
07/03/2021,6195,,255,,,,5785,155,,,2021-03-07
08/03/2021,8660,,645,1,,,7784,205,25,,2021-03-08
09/03/2021,7021,,551,1,,,6310,145,14,,2021-03-09
10/03/2021,8387,,716,,,,7443,213,15,,2021-03-10
11/03/2021,6496,,526,1,,,5838,128,3,,2021-03-11
12/03/2021,7378,,565,,,,6569,231,13,,2021-03-12
13/03/2021,6365,,422,1,,,5791,150,1,,2021-03-13
14/03/2021,6055,,339,1,,,5556,158,1,,2021-03-14
15/03/2021,8067,,584,1,,,7230,251,1,,2021-03-15
16/03/2021,6448,,542,1,,,5730,164,11,,2021-03-16
17/03/2021,6474,,516,,,,5781,172,5,,2021-03-17
18/03/2021,6020,,474,,,,5367,177,2,,2021-03-18
19/03/2021,6074,,373,10,,,5556,133,2,,2021-03-19
20/03/2021,5940,,357,1,,,5395,186,1,,2021-03-20
21/03/2021,5357,,212,1,,,5005,138,1,,2021-03-21
22/03/2021,6857,,523,,,,6166,164,4,,2021-03-22
23/03/2021,6002,,402,,,,5379,221,,,2021-03-23
24/03/2021,6214,,485,,,,5587,136,6,,2021-03-24
25/03/2021,5379,,505,,,,4722,150,2,,2021-03-25
26/03/2021,5527,,356,1,,,5057,111,2,,2021-03-26
27/03/2021,4756,,348,,,,4287,119,2,,2021-03-27
28/03/2021,4423,,212,,,,4075,136,,,2021-03-28
29/03/2021,5459,,343,1,,,4984,128,3,,2021-03-29
30/03/2021,4357,,257,1,,,4013,83,3,,2021-03-30
31/03/2021,3845,,314,1,,,3386,132,12,,2021-03-31
01/04/2021,4253,,223,2,,,3926,101,1,,2021-04-01
02/04/2021,3813,,180,1,,,3521,108,3,,2021-04-02
03/04/2021,2969,,180,,,,2736,51,2,,2021-04-03
04/04/2021,2668,,70,,,,2551,47,,,2021-04-04
05/04/2021,2960,,194,1,,,2690,74,1,,2021-04-05
06/04/2021,3372,,218,,,,3042,109,3,,2021-04-06
07/04/2021,3443,,247,,,,3136,58,2,,2021-04-07
08/04/2021,3291,,242,1,,,2958,87,3,,2021-04-08
09/04/2021,2930,,173,,,,2672,81,4,,2021-04-09
10/04/2021,3126,,168,,,,2891,55,12,,2021-04-10
11/04/2021,2507,,101,1,,,2341,64,,,2021-04-11
12/04/2021,3556,,205,,,,3267,84,,,2021-04-12
13/04/2021,3191,,223,,,,2894,73,1,,2021-04-13
14/04/2021,3125,,204,,,,2855,65,1,,2021-04-14
15/04/2021,3076,,174,,,,2829,73,,,2021-04-15
16/04/2021,2682,,132,,,,2479,71,,,2021-04-16
17/04/2021,2792,,116,1,,,2657,17,1,,2021-04-17
18/04/2021,2638,,90,,,,2504,44,,,2021-04-18
19/04/2021,3263,,207,2,,,2999,55,,,2021-04-19
20/04/2021,3435,,193,,,,3171,70,1,,2021-04-20
21/04/2021,3250,,170,,,,3047,33,,,2021-04-21
22/04/2021,2776,,202,,,,2528,44,2,,2021-04-22
23/04/2021,2951,,160,,,,2749,41,1,,2021-04-23
24/04/2021,2599,,65,,,,2498,36,,,2021-04-24
25/04/2021,2664,,127,1,,,2498,38,,,2021-04-25
26/04/2021,2874,,170,,,,2623,79,2,,2021-04-26
27/04/2021,2871,,157,10,,,2628,75,1,,2021-04-27
28/04/2021,2390,,164,,,,2191,34,1,,2021-04-28
29/04/2021,2144,,133,10,,,1958,42,1,,2021-04-29
30/04/2021,1965,,82,,,,1841,42,,,2021-04-30
01/05/2021,2011,,75,,,,1899,37,,,2021-05-01
02/05/2021,1810,,94,,,,1694,22,,,2021-05-02
03/05/2021,2301,,171,10,,,2072,47,1,,2021-05-03
04/05/2021,2188,,100,,,,2082,6,,,2021-05-04
05/05/2021,1863,,106,,,,1744,11,2,,2021-05-05
06/05/2021,1678,,139,,,,1533,6,,,2021-05-06
07/05/2021,1508,,86,,,,1418,4,,,2021-05-07
08/05/2021,1264,,37,,,,1210,17,,,2021-05-08
09/05/2021,1236,,54,,,,1165,17,,,2021-05-09
10/05/2021,1713,,70,10,,,1602,29,2,,2021-05-10
11/05/2021,1250,,50,,,,1190,10,,,2021-05-11
12/05/2021,1361,,68,,,,1258,35,,,2021-05-12
13/05/2021,1165,,45,1,,,1107,12,,,2021-05-13
14/05/2021,1119,,48,,,,1055,16,,,2021-05-14
15/05/2021,910,,17,,,,876,16,1,,2021-05-15
16/05/2021,945,,25,,,,916,4,,,2021-05-16
17/05/2021,1054,,42,,,,1002,8,2,,2021-05-17
18/05/2021,1192,,45,,,,1139,7,1,,2021-05-18
19/05/2021,1081,,65,,,,1013,3,,,2021-05-19
20/05/2021,811,,43,,,,761,6,1,,2021-05-20
21/05/2021,837,,40,,,,795,2,,,2021-05-21
22/05/2021,738,,22,,,,705,11,,,2021-05-22
23/05/2021,584,,16,,,,567,1,,,2021-05-23
24/05/2021,716,,27,,,,686,3,,,2021-05-24
25/05/2021,630,,46,,,,580,4,,,2021-05-25
26/05/2021,715,,24,,,,688,3,,,2021-05-26
27/05/2021,580,,26,,,,548,6,,,2021-05-27
28/05/2021,527,,25,,,,488,4,10,,2021-05-28
29/05/2021,572,,15,,,,556,1,,,2021-05-29
30/05/2021,477,,8,,,,458,11,,,2021-05-30
31/05/2021,433,,26,,,,395,11,1,,2021-05-31
01/06/2021,700,,21,,,,678,1,,,2021-06-01
02/06/2021,529,,23,,,,505,1,,,2021-06-02
03/06/2021,525,,43,,,,471,11,,,2021-06-03
04/06/2021,491,,6,,,,472,13,,,2021-06-04
05/06/2021,484,,29,,,,454,1,,,2021-06-05
06/06/2021,393,,45,,,,346,2,,,2021-06-06
07/06/2021,411,,21,,,,380,10,,,2021-06-07
08/06/2021,385,,18,,,,366,1,,,2021-06-08
09/06/2021,400,,14,,,,376,10,,,2021-06-09
10/06/2021,334,,9,,,,325,,,,2021-06-10
11/06/2021,274,,15,,,,255,4,,,2021-06-11
12/06/2021,278,,5,,,,272,1,,,2021-06-12
13/06/2021,269,,13,,,,246,10,,,2021-06-13
14/06/2021,251,,9,,,,242,,,,2021-06-14
15/06/2021,238,,4,,,,233,,1,,2021-06-15
16/06/2021,307,,3,,,,304,,,,2021-06-16
17/06/2021,178,,3,,,,175,,,,2021-06-17
18/06/2021,125,,1,,,,124,,,,2021-06-18
19/06/2021,195,,2,,,,193,,,,2021-06-19
20/06/2021,159,,2,,,,157,,,,2021-06-20
21/06/2021,142,,21,,,,121,,,,2021-06-21
22/06/2021,213,,3,,,,199,11,,,2021-06-22
23/06/2021,306,,3,,,,293,10,,,2021-06-23
24/06/2021,227,,4,,,,222,1,,,2021-06-24
25/06/2021,196,,2,,,,193,1,,,2021-06-25
26/06/2021,129,,3,,,,126,,,,2021-06-26
27/06/2021,161,,5,,,,155,1,,,2021-06-27
28/06/2021,280,,5,,,,274,1,,,2021-06-28
29/06/2021,329,,4,,,,325,,,,2021-06-29
30/06/2021,183,,14,,,,169,,,,2021-06-30
01/07/2021,232,,7,,,,225,,,,2021-07-01
02/07/2021,264,,1,,,,262,1,,,2021-07-02
03/07/2021,355,,25,,,,320,10,,,2021-07-03
04/07/2021,350,,11,,,,339,,,,2021-07-04
05/07/2021,336,,3,,,,332,1,,,2021-07-05
06/07/2021,407,,3,,,,404,,,,2021-07-06
07/07/2021,406,,12,,,,394,,,,2021-07-07
08/07/2021,477,,4,,,,462,11,,,2021-07-08
09/07/2021,483,,15,,,,468,,,,2021-07-09
10/07/2021,482,,3,,,,479,,,,2021-07-10
11/07/2021,681,,21,,,,660,,,,2021-07-11
12/07/2021,851,,7,,,,833,11,,,2021-07-12
13/07/2021,799,,7,,,,780,12,,,2021-07-13
14/07/2021,935,,30,,,,905,,,,2021-07-14
15/07/2021,933,,10,,,,912,11,,,2021-07-15
16/07/2021,852,,17,,,,834,,1,,2021-07-16
17/07/2021,760,,17,,,,733,10,,,2021-07-17
18/07/2021,919,,18,,,,899,2,,,2021-07-18
19/07/2021,1168,,54,,,,1114,,,,2021-07-19
20/07/2021,1020,,30,,,,989,1,,,2021-07-20
21/07/2021,1113,,21,,,,1090,2,,,2021-07-21
22/07/2021,944,,26,,,,915,3,,,2021-07-22
23/07/2021,1071,,11,,,,1057,3,,,2021-07-23
24/07/2021,820,,12,,,,798,10,,,2021-07-24
25/07/2021,1086,,26,,,,1038,22,,,2021-07-25
26/07/2021,1084,,26,,,,1058,,,,2021-07-26
27/07/2021,1193,,13,,,,1165,15,,,2021-07-27
28/07/2021,1124,,31,,,,1071,12,10,,2021-07-28
29/07/2021,864,,26,,,,815,22,1,,2021-07-29
30/07/2021,745,,21,,,,703,21,,,2021-07-30
31/07/2021,762,,13,,,,747,2,,,2021-07-31
01/08/2021,917,,36,,,,880,1,,,2021-08-01
02/08/2021,818,,54,,,,759,4,1,,2021-08-02
03/08/2021,979,,9,,,,952,17,1,,2021-08-03
04/08/2021,919,,33,,,,884,2,,,2021-08-04
05/08/2021,723,,25,,,,696,1,1,,2021-08-05
06/08/2021,857,,14,,,,839,4,,,2021-08-06
07/08/2021,816,,13,,,,803,,,,2021-08-07
08/08/2021,745,,22,,,,722,1,,,2021-08-08
09/08/2021,780,,22,,,,746,12,,,2021-08-09
10/08/2021,715,,10,,,,693,12,,,2021-08-10
11/08/2021,712,,15,,,,694,2,1,,2021-08-11
12/08/2021,687,,31,,,,651,5,,,2021-08-12
13/08/2021,580,,8,,,,559,13,,,2021-08-13
14/08/2021,546,,11,,,,532,3,,,2021-08-14
15/08/2021,631,,17,,,,611,3,,,2021-08-15
16/08/2021,600,,37,,,,550,12,1,,2021-08-16
17/08/2021,660,,27,,,,633,,,,2021-08-17
18/08/2021,782,,35,,,,735,12,,,2021-08-18
19/08/2021,571,,25,,,,545,1,,,2021-08-19
20/08/2021,662,,21,,,,635,6,,,2021-08-20
21/08/2021,680,,19,,,,660,1,,,2021-08-21
22/08/2021,649,,26,,,,620,3,,,2021-08-22
23/08/2021,819,,28,,,,781,10,,,2021-08-23
24/08/2021,790,,19,1,,,767,3,,,2021-08-24
25/08/2021,844,,15,,,,828,1,,,2021-08-25
26/08/2021,609,,23,,,,583,1,2,,2021-08-26
27/08/2021,635,,49,,,,586,,,,2021-08-27
28/08/2021,704,,4,,,,690,10,,,2021-08-28
29/08/2021,601,,5,,,,590,6,,,2021-08-29
30/08/2021,834,,24,,,,810,,,,2021-08-30
31/08/2021,684,,12,,,,671,1,,,2021-08-31
01/09/2021,942,,24,,,,915,3,,,2021-09-01
02/09/2021,770,,19,,,,747,4,,,2021-09-02
03/09/2021,729,,25,,,,703,1,,,2021-09-03
04/09/2021,614,,25,,,,584,5,,,2021-09-04
05/09/2021,577,,29,,,,547,1,,,2021-09-05
06/09/2021,700,,15,,,,685,,,,2021-09-06
07/09/2021,691,,31,,,,643,17,,,2021-09-07
08/09/2021,694,,20,,,,660,14,,,2021-09-08
09/09/2021,804,,9,,,1,790,4,,,2021-09-09
10/09/2021,751,,15,,,,732,4,,,2021-09-10
11/09/2021,532,,12,,,,497,12,11,,2021-09-11
12/09/2021,677,,5,,,,659,13,,,2021-09-12
13/09/2021,699,,27,,,,667,5,,,2021-09-13
14/09/2021,703,,11,,,,665,26,1,,2021-09-14
15/09/2021,687,,31,,,,651,4,1,,2021-09-15
16/09/2021,627,,22,,,,576,28,1,,2021-09-16
17/09/2021,598,,18,,,,576,4,,,2021-09-17
18/09/2021,610,,10,,,,599,1,,,2021-09-18
19/09/2021,581,,19,,,,560,2,,,2021-09-19
20/09/2021,575,,18,,,,556,1,,,2021-09-20
21/09/2021,672,,32,,,,636,4,,,2021-09-21
22/09/2021,678,,27,,,,639,12,,,2021-09-22
23/09/2021,581,,6,,,,560,15,,,2021-09-23
24/09/2021,612,,19,,,,590,2,1,,2021-09-24
25/09/2021,483,,2,,,,476,5,,,2021-09-25
26/09/2021,445,,12,,,,418,15,,,2021-09-26
27/09/2021,525,,29,,,,494,2,,,2021-09-27
28/09/2021,452,,16,,,,432,4,,,2021-09-28
29/09/2021,510,,11,,,,475,23,1,,2021-09-29
30/09/2021,444,,9,,,,433,2,,,2021-09-30
01/10/2021,567,,4,,,,561,2,,,2021-10-01
02/10/2021,508,,18,,,,489,1,,,2021-10-02
03/10/2021,504,,34,,,,468,2,,,2021-10-03
04/10/2021,479,,8,,,,468,3,,,2021-10-04
05/10/2021,488,,13,,,,443,32,,,2021-10-05
06/10/2021,546,,5,,,,533,8,,,2021-10-06
07/10/2021,373,,11,,,,352,10,,,2021-10-07
08/10/2021,438,,14,,,,422,2,,,2021-10-08
09/10/2021,384,,4,,,,379,1,,,2021-10-09
10/10/2021,501,,14,,,,481,6,,,2021-10-10
11/10/2021,502,,15,,,,484,3,,,2021-10-11
12/10/2021,438,,30,,,,393,15,,,2021-10-12
13/10/2021,550,,27,,,,509,14,,,2021-10-13
14/10/2021,534,,3,,,,519,12,,,2021-10-14
15/10/2021,552,,10,,,,541,1,,,2021-10-15
16/10/2021,616,,18,,,,588,10,,,2021-10-16
17/10/2021,535,,3,,,,532,,,,2021-10-17
18/10/2021,922,,11,,,,908,3,,,2021-10-18
19/10/2021,726,,6,,,,717,2,1,,2021-10-19
20/10/2021,697,,25,,,,648,24,,,2021-10-20
21/10/2021,680,,36,,,,632,12,,,2021-10-21
22/10/2021,797,,19,,,,753,25,,,2021-10-22
23/10/2021,772,,26,,,,745,1,,,2021-10-23
24/10/2021,626,,15,,,,603,8,,,2021-10-24
25/10/2021,657,,12,,,,633,12,,,2021-10-25
26/10/2021,732,,20,,,,699,13,,,2021-10-26
27/10/2021,727,,28,,,,693,6,,,2021-10-27
28/10/2021,745,,16,,,,686,33,10,,2021-10-28
29/10/2021,952,,14,,,,936,1,1,,2021-10-29
30/10/2021,804,,12,,,,788,4,,,2021-10-30
31/10/2021,640,,18,,,,608,14,,,2021-10-31
01/11/2021,1250,,38,,,,1184,27,1,,2021-11-01
02/11/2021,1274,,21,,,,1226,27,,,2021-11-02
03/11/2021,1245,,48,,,,1192,4,1,,2021-11-03
04/11/2021,1414,,30,,,,1359,25,,,2021-11-04
05/11/2021,1387,,37,,,,1336,14,,,2021-11-05
06/11/2021,1174,,28,,,,1134,12,,,2021-11-06
07/11/2021,1190,,26,,,,1160,4,,,2021-11-07
08/11/2021,1519,,53,,,,1458,7,1,,2021-11-08
09/11/2021,1651,,64,,,,1571,16,,,2021-11-09
10/11/2021,1984,,106,,,,1866,11,1,,2021-11-10
11/11/2021,1837,,44,,,,1752,40,1,,2021-11-11
12/11/2021,1996,,76,,,,1891,29,,,2021-11-12
13/11/2021,1704,,31,,,,1644,28,1,,2021-11-13
14/11/2021,2141,,46,,,,2038,57,,,2021-11-14
15/11/2021,2484,,73,,,,2347,50,14,,2021-11-15
16/11/2021,2610,,70,,,,2531,8,1,,2021-11-16
17/11/2021,2570,,83,1,,,2475,10,1,,2021-11-17
18/11/2021,2587,,48,,,,2519,19,1,,2021-11-18
19/11/2021,2197,,49,,,,2108,40,,,2021-11-19
20/11/2021,2414,,94,,,,2290,30,,,2021-11-20
21/11/2021,2379,,68,,,,2269,41,1,,2021-11-21
22/11/2021,2969,,52,,,,2863,42,12,,2021-11-22
23/11/2021,2946,,33,,,,2884,29,,,2021-11-23
24/11/2021,2874,,50,,,,2783,41,,,2021-11-24
25/11/2021,2983,,44,,,,2914,24,1,,2021-11-25
26/11/2021,2840,,41,,,,2765,33,1,,2021-11-26
27/11/2021,2675,,15,,,,2634,25,1,,2021-11-27
28/11/2021,2494,,76,,,,2376,42,,,2021-11-28
29/11/2021,3254,,51,,,,3185,18,,,2021-11-29
30/11/2021,3385,,45,,,,3285,54,1,,2021-11-30
01/12/2021,3930,,81,,,,3815,33,1,,2021-12-01
02/12/2021,3211,,42,,,,3138,31,,,2021-12-02
03/12/2021,3245,,96,,,,3116,33,,,2021-12-03
04/12/2021,2969,,80,,,,2855,34,,,2021-12-04
05/12/2021,3064,,110,,,,2875,69,10,,2021-12-05
06/12/2021,3410,,107,,,,3251,49,3,,2021-12-06
07/12/2021,3525,,103,,,,3352,69,1,,2021-12-07
08/12/2021,3712,,56,1,,,3605,48,2,,2021-12-08
09/12/2021,3720,,83,,,,3605,30,2,,2021-12-09
10/12/2021,4055,,97,,,,3888,69,1,,2021-12-10
11/12/2021,4531,,125,,,,4312,93,1,,2021-12-11
12/12/2021,4709,,149,,,,4519,41,,,2021-12-12
13/12/2021,5510,,115,,,1,5361,27,6,,2021-12-13
14/12/2021,6537,,148,,,,6309,68,12,,2021-12-14
15/12/2021,6638,,164,1,,,6409,52,12,,2021-12-15
16/12/2021,6785,,163,,,1,6543,77,1,,2021-12-16
17/12/2021,8337,,224,,,,8072,39,2,,2021-12-17
18/12/2021,9412,,226,,,,9144,26,16,,2021-12-18
19/12/2021,12038,,345,,,,11629,62,2,,2021-12-19
20/12/2021,17323,,632,,,,16578,100,13,,2021-12-20
21/12/2021,19326,,458,,,,18766,99,3,,2021-12-21
22/12/2021,19920,,587,1,,,19239,79,14,,2021-12-22
23/12/2021,21730,,636,,,,20930,124,40,,2021-12-23
24/12/2021,24248,,446,,,,23698,101,3,,2021-12-24
25/12/2021,23224,,678,,,,22487,57,2,,2021-12-25
26/12/2021,30999,,755,,,,30112,121,11,,2021-12-26
27/12/2021,41492,,1017,,,,40327,109,39,,2021-12-27
28/12/2021,39182,,843,,,,38146,160,33,,2021-12-28
29/12/2021,32587,,752,,,,31656,142,37,,2021-12-29
30/12/2021,27127,,492,,,,26406,151,78,,2021-12-30
31/12/2021,21670,,241,,,,21295,84,50,,2021-12-31
01/01/2022,39357,,203,,,,39002,139,13,,2022-01-01
02/01/2022,32308,,153,,,,31934,204,17,,2022-01-02
03/01/2022,43209,,190,,,,42799,143,77,,2022-01-03
04/01/2022,37365,,132,,,,37055,118,60,,2022-01-04
05/01/2022,32798,,71,,,,32496,185,46,,2022-01-05
06/01/2022,27566,,52,1,,,27335,153,25,,2022-01-06
07/01/2022,28894,,75,,,,28575,180,64,,2022-01-07
08/01/2022,26532,,35,,,,26214,204,79,,2022-01-08
09/01/2022,27067,,56,,,,26888,120,3,,2022-01-09
10/01/2022,31544,,65,,,,31254,160,65,,2022-01-10
11/01/2022,28182,,35,,,,27940,171,36,,2022-01-11
12/01/2022,24860,,57,,,,24577,177,49,,2022-01-12
13/01/2022,25894,,34,,,,25631,176,53,,2022-01-13
14/01/2022,25935,,7,,,,25720,165,43,,2022-01-14
15/01/2022,24836,,23,1,,,24673,125,14,,2022-01-15
16/01/2022,25619,,40,,,,25518,58,3,,2022-01-16
17/01/2022,28664,,66,,,,28505,76,17,,2022-01-17
18/01/2022,24952,,28,,,,24823,94,7,,2022-01-18
19/01/2022,20926,,16,,,,20857,45,8,,2022-01-19
20/01/2022,21533,,27,1,,,21429,62,14,,2022-01-20
21/01/2022,20311,,10,,,,20240,58,3,,2022-01-21
22/01/2022,18527,,20,,,,18469,35,3,,2022-01-22
23/01/2022,18329,,21,,,,18244,63,1,,2022-01-23
24/01/2022,20073,,12,,,,19951,107,3,,2022-01-24
25/01/2022,17748,,27,,,,17652,66,3,,2022-01-25
26/01/2022,16286,,24,,,,16183,78,1,,2022-01-26
27/01/2022,13954,,30,1,,,13865,44,14,,2022-01-27
28/01/2022,12565,,28,,,,12506,28,3,,2022-01-28
29/01/2022,10500,,14,,,,10447,35,4,,2022-01-29
30/01/2022,10243,,41,,,,10174,28,,,2022-01-30
31/01/2022,11882,,50,,,,11794,35,3,,2022-01-31
01/02/2022,12587,,22,,,,12519,45,1,,2022-02-01
02/02/2022,10178,,34,,,,10093,49,2,,2022-02-02
03/02/2022,8861,,44,,,,8767,50,,,2022-02-03
04/02/2022,7764,,46,,,,7685,20,13,,2022-02-04
05/02/2022,7531,,40,,,,7469,22,,,2022-02-05
06/02/2022,7501,,39,,,,7419,33,10,,2022-02-06
07/02/2022,7635,,23,,,,7598,11,3,,2022-02-07
08/02/2022,7099,,31,,,,7047,20,1,,2022-02-08
09/02/2022,6235,,43,,,,6168,23,1,,2022-02-09
10/02/2022,5947,,25,1,,,5874,37,10,,2022-02-10
11/02/2022,5396,,35,,,,5354,6,1,,2022-02-11
12/02/2022,4965,,54,,,,4901,10,,,2022-02-12
13/02/2022,5343,,28,,,,5298,17,,,2022-02-13
14/02/2022,6156,,46,,,,6089,20,1,,2022-02-14
15/02/2022,5735,,50,,,,5671,14,,,2022-02-15
16/02/2022,5938,,32,,,,5896,9,1,,2022-02-16
17/02/2022,5191,,30,,,,5145,16,,,2022-02-17
18/02/2022,4869,,14,,,,4835,18,2,,2022-02-18
19/02/2022,4444,,45,,,,4383,16,,,2022-02-19
20/02/2022,5496,,39,,,,5441,16,,,2022-02-20
21/02/2022,5895,,58,,,,5809,28,,,2022-02-21
22/02/2022,5550,,36,,,,5489,25,,,2022-02-22
23/02/2022,4922,,60,,,,4848,13,1,,2022-02-23
24/02/2022,4584,,61,,,,4497,26,,,2022-02-24
25/02/2022,4664,,44,,,,4606,14,,,2022-02-25
26/02/2022,4055,,42,,,,4004,7,2,,2022-02-26
27/02/2022,4380,,48,,,,4326,6,,,2022-02-27
28/02/2022,5032,,33,,,,4995,3,1,,2022-02-28
01/03/2022,5936,,34,,,,5890,11,1,,2022-03-01
02/03/2022,5863,,50,,,,5806,6,1,,2022-03-02
03/03/2022,5468,,21,,,,5431,15,1,,2022-03-03
04/03/2022,5407,,8,,,,5374,25,,,2022-03-04
05/03/2022,5632,,8,,,,5623,1,,,2022-03-05
06/03/2022,6009,,8,,,,5975,25,1,,2022-03-06
07/03/2022,7129,,8,,,,7088,23,10,,2022-03-07
08/03/2022,7974,,20,,,,7925,27,2,,2022-03-08
09/03/2022,7573,,20,,,,7536,17,,,2022-03-09
10/03/2022,7373,,23,,,,7315,25,10,,2022-03-10
11/03/2022,8198,,26,,,,8136,35,1,,2022-03-11
12/03/2022,8055,,25,,,,8006,24,,,2022-03-12
13/03/2022,9197,,22,,,,9150,24,1,,2022-03-13
14/03/2022,10919,,18,,,,10884,16,1,,2022-03-14
15/03/2022,11209,,17,,,,11183,8,1,,2022-03-15
16/03/2022,10931,,26,,,,10894,10,1,,2022-03-16
17/03/2022,10064,,13,,,,10027,22,2,,2022-03-17
18/03/2022,10390,,17,,,,10331,41,1,,2022-03-18
19/03/2022,9301,,16,,,,9281,4,,,2022-03-19
20/03/2022,10442,,22,,,,10394,26,,,2022-03-20
21/03/2022,11476,,21,,,,11432,20,3,,2022-03-21
22/03/2022,12065,,50,,,,11956,58,1,,2022-03-22
23/03/2022,11331,,59,,,,11253,17,2,,2022-03-23
24/03/2022,9589,,41,,,,9528,20,,,2022-03-24
25/03/2022,9936,,35,,,,9879,21,1,,2022-03-25
26/03/2022,9835,,21,,,,9778,34,2,,2022-03-26
27/03/2022,10833,,43,,,,10769,21,,,2022-03-27
28/03/2022,11576,,44,,,,11500,30,2,,2022-03-28
29/03/2022,11107,,25,,,,11071,11,,,2022-03-29
30/03/2022,10702,,31,,,,10652,19,,,2022-03-30
31/03/2022,8534,,25,,,,8458,40,11,,2022-03-31
01/04/2022,9572,,19,,,,9500,52,1,,2022-04-01
02/04/2022,8579,,50,,,,8517,10,2,,2022-04-02
03/04/2022,8875,,46,,,,8811,18,,,2022-04-03
04/04/2022,9815,,19,,,,9769,27,,,2022-04-04
05/04/2022,10612,,23,,,,10565,24,,,2022-04-05
06/04/2022,9900,,9,,,,9879,10,2,,2022-04-06
07/04/2022,9039,,41,,,,8964,32,2,,2022-04-07
08/04/2022,8863,,32,,,,8819,12,,,2022-04-08
09/04/2022,8680,,32,,,,8630,18,,,2022-04-09
10/04/2022,8913,,31,,,,8851,29,2,,2022-04-10
11/04/2022,8670,,30,,,,8630,10,,,2022-04-11
12/04/2022,9194,,26,,,,9145,23,,,2022-04-12
13/04/2022,9255,,27,,,,9206,21,1,,2022-04-13
14/04/2022,7974,,17,,,,7949,8,,,2022-04-14
15/04/2022,7872,,20,,,,7815,36,1,,2022-04-15
16/04/2022,6416,,37,,,,6350,28,1,,2022-04-16
17/04/2022,6643,,12,,,,6614,16,1,,2022-04-17
18/04/2022,7705,,39,,,,7661,4,1,,2022-04-18
19/04/2022,8887,,19,,,,8857,10,1,,2022-04-19
20/04/2022,9296,,23,,,,9252,20,1,,2022-04-20
21/04/2022,7951,,17,,,,7910,13,11,,2022-04-21
22/04/2022,6961,,36,,,,6898,27,,,2022-04-22
23/04/2022,6262,,24,,,,6227,11,,,2022-04-23
24/04/2022,5708,,18,,,,5666,24,,,2022-04-24
25/04/2022,6904,,5,,,,6876,22,1,,2022-04-25
26/04/2022,7708,,30,,,,7659,19,,,2022-04-26
27/04/2022,6831,,18,,,,6784,29,,,2022-04-27
28/04/2022,6252,,31,,,,6207,13,1,,2022-04-28
29/04/2022,5602,,37,1,,,5545,19,,,2022-04-29
30/04/2022,5159,,129,,,,5022,7,1,,2022-04-30
01/05/2022,5931,,9,,,,5916,6,,,2022-05-01
02/05/2022,6454,,16,1,,,6420,16,1,,2022-05-02
03/05/2022,6182,,19,,,,6123,29,11,,2022-05-03
04/05/2022,5718,,43,,,,5651,24,,,2022-05-04
05/05/2022,5002,,20,,,,4972,10,,,2022-05-05
06/05/2022,4757,,8,,,,4726,21,2,,2022-05-06
07/05/2022,4557,,1,,,,4541,15,,,2022-05-07
08/05/2022,5286,,17,,,,5246,23,,,2022-05-08
09/05/2022,5744,,13,,,,5713,18,,,2022-05-09
10/05/2022,6206,,12,,,,6187,5,2,,2022-05-10
11/05/2022,4971,,5,,,,4948,18,,,2022-05-11
12/05/2022,4702,,24,,,,4648,29,1,,2022-05-12
13/05/2022,4241,,14,,,,4199,28,,,2022-05-13
14/05/2022,3674,,9,,,,3632,33,,,2022-05-14
15/05/2022,4080,,16,,,,4050,3,11,,2022-05-15
16/05/2022,4429,,24,,,,4400,5,,,2022-05-16
17/05/2022,4113,,5,,,,4102,5,1,,2022-05-17
18/05/2022,3702,,15,,,,3685,2,,,2022-05-18
19/05/2022,3076,,24,,,,3040,11,1,,2022-05-19
20/05/2022,2828,,6,,,,2819,3,,,2022-05-20
21/05/2022,2758,,24,,,,2731,3,,,2022-05-21
22/05/2022,2838,,29,,,,2796,13,,,2022-05-22
23/05/2022,2968,,15,,,,2948,5,,,2022-05-23
24/05/2022,2756,,8,,,,2737,11,,,2022-05-24
25/05/2022,2687,,52,,,,2633,1,1,,2022-05-25
26/05/2022,2417,,32,,,,2372,12,1,,2022-05-26
27/05/2022,2247,,31,,,,2216,,,,2022-05-27
28/05/2022,2186,,15,,,,2171,,,,2022-05-28
29/05/2022,2136,,33,,,,2101,2,,,2022-05-29
30/05/2022,2562,,31,,,,2530,1,,,2022-05-30
31/05/2022,2352,,3,,,,2347,1,1,,2022-05-31
01/06/2022,2672,,2,,,,2659,11,,,2022-06-01
02/06/2022,2143,,13,,,,2130,,,,2022-06-02
03/06/2022,2394,,8,,,,2385,1,,,2022-06-03
04/06/2022,2509,,30,,,,2478,1,,,2022-06-04
05/06/2022,3066,,51,,,,3013,2,,,2022-06-05
06/06/2022,3196,,17,,,,3178,1,,,2022-06-06
07/06/2022,3582,,15,,,,3565,2,,,2022-06-07
08/06/2022,3028,,7,,,,2999,22,,,2022-06-08
09/06/2022,3260,,23,,,,3233,4,,,2022-06-09
10/06/2022,3685,,18,,,,3666,1,,,2022-06-10
11/06/2022,3575,,28,,,,3545,2,,,2022-06-11
12/06/2022,4916,,30,,,,4874,12,,,2022-06-12
13/06/2022,5896,,8,,,,5887,1,,,2022-06-13
14/06/2022,6307,,17,,,,6289,1,,,2022-06-14
15/06/2022,5911,,27,,,,5876,7,1,,2022-06-15
16/06/2022,5994,,22,,,,5970,2,,,2022-06-16
17/06/2022,6071,,9,,,,6057,5,,,2022-06-17
18/06/2022,6107,,19,,,,6072,15,1,,2022-06-18
19/06/2022,7085,,12,,,,7072,1,,,2022-06-19
20/06/2022,8490,,7,,,,8480,3,,,2022-06-20
21/06/2022,8630,,27,,,,8594,9,,,2022-06-21
22/06/2022,8323,,26,,,,8292,5,,,2022-06-22
23/06/2022,7686,,28,,,,7654,4,,,2022-06-23
24/06/2022,8810,,16,,,,8791,3,,,2022-06-24
25/06/2022,8396,,18,,,,8353,25,,,2022-06-25
26/06/2022,8660,,20,,,,8636,3,1,,2022-06-26
27/06/2022,10016,,25,,,,9978,13,,,2022-06-27
28/06/2022,10062,,13,,,,10046,3,,,2022-06-28
29/06/2022,8654,,5,,,,8646,2,1,,2022-06-29
30/06/2022,8506,,5,,,,8496,5,,,2022-06-30
01/07/2022,9018,,12,,,,9001,5,,,2022-07-01
02/07/2022,8340,,3,,,,8335,2,,,2022-07-02
03/07/2022,8971,,2,,,,8966,3,,,2022-07-03
04/07/2022,10098,,4,,,,10080,13,1,,2022-07-04
05/07/2022,10489,,16,,,,10457,16,,,2022-07-05
06/07/2022,9818,,47,,,,9770,1,,,2022-07-06
07/07/2022,9160,,6,,,,9151,3,,,2022-07-07
08/07/2022,9109,,3,,,,9102,4,,,2022-07-08
09/07/2022,8151,,1,,,,8149,1,,,2022-07-09
10/07/2022,9648,,2,,,,9643,2,1,,2022-07-10
11/07/2022,9655,,11,,,,9640,3,1,,2022-07-11
12/07/2022,9544,,4,,,,9535,5,,,2022-07-12
13/07/2022,8648,,25,,,,8620,3,,,2022-07-13
14/07/2022,7172,,7,,,,7160,4,1,,2022-07-14
15/07/2022,7091,,16,,,,7064,11,,,2022-07-15
16/07/2022,6565,,41,,,,6512,12,,,2022-07-16
17/07/2022,6899,,2,,,,6875,21,1,,2022-07-17
18/07/2022,7119,,3,,,,7107,9,,,2022-07-18
19/07/2022,6345,,3,,,,6329,13,,,2022-07-19
20/07/2022,5529,,17,,,,5509,2,1,,2022-07-20
21/07/2022,4735,,4,,,,4728,3,,,2022-07-21
22/07/2022,5174,,15,,,,5127,32,,,2022-07-22
23/07/2022,4229,,28,,,,4198,3,,,2022-07-23
24/07/2022,4899,,22,,,,4877,,,,2022-07-24
25/07/2022,4700,,19,,,,4676,4,1,,2022-07-25
26/07/2022,4234,,50,,,,4180,3,1,,2022-07-26
27/07/2022,3957,,37,,,,3919,,1,,2022-07-27
28/07/2022,3382,,63,,,,3297,21,1,,2022-07-28
29/07/2022,3339,,68,,,,3270,1,,,2022-07-29
30/07/2022,2726,,56,,,,2648,21,1,,2022-07-30
31/07/2022,2441,,3,,,,2436,2,,,2022-07-31
01/08/2022,3388,,2,,,,3386,,,,2022-08-01
02/08/2022,2614,,4,,,,2609,1,,,2022-08-02
03/08/2022,2338,,5,,,,2331,2,,,2022-08-03
04/08/2022,2041,,3,,,,2037,1,,,2022-08-04
05/08/2022,1837,,13,,,,1822,2,,,2022-08-05
06/08/2022,1790,,3,,,,1787,,,,2022-08-06
07/08/2022,1927,,47,,,,1867,13,,,2022-08-07
08/08/2022,1798,,5,,,,1791,2,,,2022-08-08
09/08/2022,1765,,14,,,,1751,,,,2022-08-09
10/08/2022,1517,,4,,,,1510,3,,,2022-08-10
11/08/2022,1300,,12,,,,1287,1,,,2022-08-11
12/08/2022,1171,,4,,,,1167,,,,2022-08-12
13/08/2022,1230,,1,,,,1227,2,,,2022-08-13
14/08/2022,1128,,6,,,,1119,3,,,2022-08-14
15/08/2022,1357,,,,,,1357,,,,2022-08-15
16/08/2022,1829,,,,,,1828,1,,,2022-08-16
17/08/2022,1536,,2,,,,1523,11,,,2022-08-17
18/08/2022,1483,,15,,,,1468,,,,2022-08-18
19/08/2022,1548,,1,,,,1547,,,,2022-08-19
20/08/2022,1938,,,,,,1938,,,,2022-08-20
21/08/2022,1758,,3,,,,1754,1,,,2022-08-21
22/08/2022,2046,,2,,,,2043,1,,,2022-08-22
23/08/2022,1965,,18,,,,1947,,,,2022-08-23
24/08/2022,1655,,7,,,,1648,,,,2022-08-24
25/08/2022,1710,,6,,,,1703,1,,,2022-08-25
26/08/2022,1515,,16,,,,1499,,,,2022-08-26
27/08/2022,1743,,9,,,,1730,3,1,,2022-08-27
28/08/2022,1747,,19,,,,1728,,,,2022-08-28
29/08/2022,1642,,23,,,,1619,,,,2022-08-29
30/08/2022,1728,,41,,,,1684,3,,,2022-08-30
31/08/2022,1423,,23,,,,1400,,,,2022-08-31
01/09/2022,1539,,11,,,,1528,,,,2022-09-01
02/09/2022,1539,,3,,,,1534,2,,,2022-09-02
03/09/2022,1482,,2,,,,1479,1,,,2022-09-03
04/09/2022,1583,,11,,,,1572,,,,2022-09-04
05/09/2022,1588,,2,,,,1585,1,,,2022-09-05
06/09/2022,1621,,2,,,,1619,,,,2022-09-06
07/09/2022,1380,,3,,,,1377,,,,2022-09-07
08/09/2022,1392,,28,,,,1363,1,,,2022-09-08
09/09/2022,1405,,2,,,,1402,1,,,2022-09-09
10/09/2022,1667,,3,,,,1662,2,,,2022-09-10
11/09/2022,1538,,10,,,,1528,,,,2022-09-11
12/09/2022,1870,,1,,,,1867,2,,,2022-09-12
13/09/2022,1693,,5,,,,1688,,,,2022-09-13
14/09/2022,1914,,10,,,,1904,,,,2022-09-14
15/09/2022,1648,,2,,,,1644,2,,,2022-09-15
16/09/2022,1839,,1,,,,1837,1,,,2022-09-16
17/09/2022,1797,,6,,,,1791,,,,2022-09-17
18/09/2022,2012,,2,,,,2010,,,,2022-09-18
19/09/2022,2388,,28,,,,2348,12,,,2022-09-19
20/09/2022,2374,,21,,,,2353,,,,2022-09-20
21/09/2022,2497,,2,,,,2495,,,,2022-09-21
22/09/2022,2793,,12,,,,2779,2,,,2022-09-22
23/09/2022,2917,,5,,,,2909,3,,,2022-09-23
24/09/2022,3004,,5,,,,2997,2,,,2022-09-24
25/09/2022,3971,,,,,,3969,2,,,2022-09-25
26/09/2022,3986,,14,,,,3972,,,,2022-09-26
27/09/2022,4099,,27,,,,4070,2,,,2022-09-27
28/09/2022,3391,,34,,,,3355,2,,,2022-09-28
29/09/2022,3169,,7,,,,3162,,,,2022-09-29
30/09/2022,3627,,32,,,,3594,1,,,2022-09-30
01/10/2022,4210,,4,,,,4204,2,,,2022-10-01
02/10/2022,4243,,3,,,,4239,1,,,2022-10-02
03/10/2022,4976,,1,,,,4972,3,,,2022-10-03
04/10/2022,4928,,2,,,,4925,1,,,2022-10-04
05/10/2022,4799,,6,,,,4791,2,,,2022-10-05
06/10/2022,4478,,23,,,,4451,4,,,2022-10-06
07/10/2022,4687,,4,,,,4681,2,,,2022-10-07
08/10/2022,4540,,44,,,,4495,1,,,2022-10-08
09/10/2022,4478,,52,,,,4424,2,,,2022-10-09
10/10/2022,4968,,14,1,,,4939,14,,,2022-10-10
11/10/2022,4203,,10,,,,4191,2,,,2022-10-11
12/10/2022,4100,,20,,,,4077,3,,,2022-10-12
13/10/2022,3877,,3,,,,3872,2,,,2022-10-13
14/10/2022,3984,,3,,,,3978,3,,,2022-10-14
15/10/2022,3769,,3,,,,3765,1,,,2022-10-15
16/10/2022,3601,,13,,,,3585,3,,,2022-10-16
17/10/2022,3182,,11,,,,3170,1,,,2022-10-17
18/10/2022,1994,,10,,,,1980,4,,,2022-10-18
19/10/2022,1092,,4,,,,1086,2,,,2022-10-19
20/10/2022,1052,,,,,,1051,1,,,2022-10-20
21/10/2022,990,,2,,,,985,3,,,2022-10-21
22/10/2022,932,,14,,,,917,1,,,2022-10-22
23/10/2022,928,,12,,,,915,1,,,2022-10-23
24/10/2022,1104,,12,,,,1091,1,,,2022-10-24
25/10/2022,892,,12,,,,880,,,,2022-10-25
26/10/2022,843,,18,,,,825,,,,2022-10-26
27/10/2022,770,,10,,,,759,1,,,2022-10-27
28/10/2022,844,,13,,,,830,,1,,2022-10-28
29/10/2022,755,,33,,,,720,2,,,2022-10-29
30/10/2022,891,,73,,,,817,1,,,2022-10-30
31/10/2022,966,,13,,,,941,12,,,2022-10-31
01/11/2022,1225,,10,,,,1214,1,,,2022-11-01
02/11/2022,1599,,1,,,,1596,2,,,2022-11-02
03/11/2022,2075,,,,,,2075,,,,2022-11-03
04/11/2022,2360,,13,,,,2345,2,,,2022-11-04
05/11/2022,2587,,5,,,,2582,,,,2022-11-05
06/11/2022,2371,,2,,,,2369,,,,2022-11-06
07/11/2022,3029,,4,,,,3025,,,,2022-11-07
08/11/2022,2879,,16,,,,2850,12,1,,2022-11-08
09/11/2022,2683,,22,,,,2660,1,,,2022-11-09
10/11/2022,2959,,88,,,,2867,4,,,2022-11-10
11/11/2022,3220,,36,,,,3182,2,,,2022-11-11
12/11/2022,3323,,12,,,,3311,,,,2022-11-12
13/11/2022,3863,,9,,,,3848,6,,,2022-11-13
14/11/2022,3584,,2,,,,3582,,,,2022-11-14
15/11/2022,3756,,3,,,,3752,1,,,2022-11-15
16/11/2022,3320,,2,,,,3316,2,,,2022-11-16
17/11/2022,3166,,12,,,,3140,14,,,2022-11-17
18/11/2022,3578,,5,,,,3573,,,,2022-11-18
19/11/2022,3607,,3,,,,3604,,,,2022-11-19
20/11/2022,3490,,3,,,,3484,3,,,2022-11-20
21/11/2022,3645,,3,,,,3639,3,,,2022-11-21
22/11/2022,3423,,1,,,,3417,4,1,,2022-11-22
23/11/2022,3100,,13,,,,3086,1,,,2022-11-23
24/11/2022,2946,,7,,,,2935,4,,,2022-11-24
25/11/2022,3028,,1,,,,3023,4,,,2022-11-25
26/11/2022,3044,,17,,,,3026,1,,,2022-11-26
27/11/2022,3281,,7,,,,3270,4,,,2022-11-27
28/11/2022,3031,,9,,,,3022,,,,2022-11-28
29/11/2022,2878,,10,,,,2867,,1,,2022-11-29
30/11/2022,2735,,9,,,,2725,1,,,2022-11-30
01/12/2022,2620,,25,,,,2593,2,,,2022-12-01
02/12/2022,2518,,24,,,,2481,13,,,2022-12-02
03/12/2022,2245,,16,,,,2226,3,,,2022-12-03
04/12/2022,2197,,5,,,,2190,2,,,2022-12-04
05/12/2022,1976,,14,,,,1961,1,,,2022-12-05
06/12/2022,1720,,6,,,,1711,3,,,2022-12-06
07/12/2022,1592,,6,,,,1584,2,,,2022-12-07
08/12/2022,1497,,4,,,,1492,1,,,2022-12-08
09/12/2022,1911,,9,,,,1900,2,,,2022-12-09
10/12/2022,1671,,41,,,,1627,3,,,2022-12-10
11/12/2022,1696,,19,,,,1677,,,,2022-12-11
12/12/2022,1613,,4,,,,1608,1,,,2022-12-12
13/12/2022,1502,,41,,,,1460,1,,,2022-12-13
14/12/2022,1273,,26,,,,1247,,,,2022-12-14
15/12/2022,1101,,15,,,,1084,2,,,2022-12-15
16/12/2022,1222,,12,,,,1209,1,,,2022-12-16
17/12/2022,998,,3,,,,995,,,,2022-12-17
18/12/2022,1026,,1,,,,1015,10,,,2022-12-18
19/12/2022,1181,,5,,,,1174,2,,,2022-12-19
20/12/2022,1144,,35,,,,1108,1,,,2022-12-20
21/12/2022,1099,,1,,,,1095,3,,,2022-12-21
22/12/2022,906,,26,,,,880,,,,2022-12-22
23/12/2022,886,,21,,,,865,,,,2022-12-23
24/12/2022,811,,12,,,,798,1,,,2022-12-24
25/12/2022,834,,14,,,,819,1,,,2022-12-25
26/12/2022,979,,25,,,,942,12,,,2022-12-26
27/12/2022,1284,,80,,,,1203,1,,,2022-12-27
28/12/2022,1039,,49,,,,990,,,,2022-12-28
29/12/2022,824,,47,,,,777,,,,2022-12-29
30/12/2022,551,,44,,,,507,,,,2022-12-30
31/12/2022,631,,55,,,,576,,,,2022-12-31
01/01/2023,793,,4,,,,785,4,,,2023-01-01
02/01/2023,603,,16,,,,584,3,,,2023-01-02
03/01/2023,623,,3,,,,619,1,,,2023-01-03
04/01/2023,412,,13,,,,397,2,,,2023-01-04
05/01/2023,551,,1,,,,549,1,,,2023-01-05
06/01/2023,550,,24,,,,524,2,,,2023-01-06
07/01/2023,405,,12,,,,392,1,,,2023-01-07
08/01/2023,450,,3,,,,445,2,,,2023-01-08
09/01/2023,431,,3,,,,428,,,,2023-01-09
10/01/2023,518,,1,,,,516,1,,,2023-01-10
11/01/2023,290,,5,,,,284,1,,,2023-01-11
12/01/2023,314,,3,,,,311,,,,2023-01-12
13/01/2023,347,,12,,,,335,,,,2023-01-13
14/01/2023,331,,3,,,,328,,,,2023-01-14
15/01/2023,348,,3,,,,344,1,,,2023-01-15
16/01/2023,395,,,,,,393,2,,,2023-01-16
17/01/2023,401,,9,,,,392,,,,2023-01-17
18/01/2023,290,,5,,,,285,,,,2023-01-18
19/01/2023,232,,5,,,,226,1,,,2023-01-19
20/01/2023,363,,16,,,,347,,,,2023-01-20
21/01/2023,335,,4,,,,330,1,,,2023-01-21
22/01/2023,338,,7,,,,331,,,,2023-01-22
23/01/2023,293,,1,,,,292,,,,2023-01-23
24/01/2023,318,,14,,,,303,1,,,2023-01-24
25/01/2023,375,,10,,,,365,,,,2023-01-25
26/01/2023,243,,14,,,,228,1,,,2023-01-26
27/01/2023,238,,24,,,,214,,,,2023-01-27
28/01/2023,254,,24,1,,,229,,,,2023-01-28
29/01/2023,301,,32,,,,269,,,,2023-01-29
30/01/2023,252,,36,,,,215,1,,,2023-01-30
31/01/2023,314,,16,,,,297,1,,,2023-01-31
01/02/2023,346,,23,,,,323,,,,2023-02-01
02/02/2023,291,,1,,,,290,,,,2023-02-02
03/02/2023,278,,3,,,,275,,,,2023-02-03
04/02/2023,324,,,,,,324,,,,2023-02-04
05/02/2023,239,,1,,,,238,,,,2023-02-05
06/02/2023,308,,6,,,,302,,,,2023-02-06
07/02/2023,167,,2,,,,164,1,,,2023-02-07
08/02/2023,223,,23,,,,200,,,,2023-02-08
09/02/2023,193,,4,,,,188,1,,,2023-02-09
10/02/2023,220,,12,,,,208,,,,2023-02-10
11/02/2023,242,,19,,,,222,1,,,2023-02-11
12/02/2023,188,,37,,,,151,,,,2023-02-12
13/02/2023,224,,41,,,,182,1,,,2023-02-13
14/02/2023,221,,30,,,,191,,,,2023-02-14
15/02/2023,219,,43,,,,175,1,,,2023-02-15
16/02/2023,215,,23,,,,192,,,,2023-02-16
17/02/2023,294,,25,,,,269,,,,2023-02-17
18/02/2023,236,,29,,,,207,,,,2023-02-18
19/02/2023,273,,22,,,,251,,,,2023-02-19
20/02/2023,219,,13,,,,206,,,,2023-02-20
21/02/2023,214,,1,,,,213,,,,2023-02-21
22/02/2023,293,,1,,,,292,,,,2023-02-22
23/02/2023,185,,13,,,,171,1,,,2023-02-23
24/02/2023,273,,20,,,,252,1,,,2023-02-24
25/02/2023,230,,1,,,,229,,,,2023-02-25
26/02/2023,231,,11,,,,220,,,,2023-02-26
27/02/2023,266,,4,,,,262,,,,2023-02-27
28/02/2023,151,,1,,,,149,1,,,2023-02-28
01/03/2023,269,,,,,,266,2,1,,2023-03-01
02/03/2023,230,,4,,,,224,1,1,,2023-03-02
03/03/2023,240,,,,,,226,12,2,,2023-03-03
04/03/2023,304,,5,,,,296,3,,,2023-03-04
05/03/2023,283,,,,,,280,3,,,2023-03-05
06/03/2023,324,,1,,,,323,,,,2023-03-06
07/03/2023,260,,2,,,,256,2,,,2023-03-07
08/03/2023,255,,7,,,,248,,,,2023-03-08
09/03/2023,363,,25,,,,334,2,2,,2023-03-09
10/03/2023,337,,5,,,,319,13,,,2023-03-10
11/03/2023,322,,14,,,,295,1,12,,2023-03-11
12/03/2023,326,,12,,,,303,11,,,2023-03-12
13/03/2023,345,,3,,,,337,4,1,,2023-03-13
14/03/2023,359,,11,,,,336,11,1,,2023-03-14
15/03/2023,265,,3,,,,259,3,,,2023-03-15
16/03/2023,251,,25,,,,223,1,2,,2023-03-16
17/03/2023,267,,13,,,,241,11,2,,2023-03-17
18/03/2023,243,,1,,,,236,3,3,,2023-03-18
19/03/2023,253,,15,,,,226,11,1,,2023-03-19
20/03/2023,357,,1,,,,355,1,,,2023-03-20
21/03/2023,311,,4,,,,294,11,2,,2023-03-21
22/03/2023,246,,4,,,,240,1,1,,2023-03-22
23/03/2023,379,,26,,,,340,11,2,,2023-03-23
24/03/2023,242,,14,,,,224,3,1,,2023-03-24
25/03/2023,196,,2,,,,190,4,,,2023-03-25
26/03/2023,267,,22,,,,241,3,1,,2023-03-26
27/03/2023,304,,2,,,,298,1,3,,2023-03-27
28/03/2023,277,,15,,,,261,1,,,2023-03-28
29/03/2023,219,,12,,,,207,,,,2023-03-29
30/03/2023,279,,7,,,,270,,2,,2023-03-30
31/03/2023,253,,,,,,252,1,,,2023-03-31
01/04/2023,206,,15,,,,187,3,1,,2023-04-01
02/04/2023,175,,2,,,,171,1,1,,2023-04-02
03/04/2023,375,,12,,,,357,4,2,,2023-04-03
04/04/2023,300,,14,,,,272,12,2,,2023-04-04
05/04/2023,188,,2,,,,181,3,2,,2023-04-05
06/04/2023,196,,22,,,,172,1,1,,2023-04-06
07/04/2023,151,,1,,,,148,2,,,2023-04-07
08/04/2023,363,,2,,,,354,2,5,,2023-04-08
09/04/2023,239,,3,,,,235,1,,,2023-04-09
10/04/2023,315,,2,,,,302,11,,,2023-04-10
11/04/2023,322,,3,,,,295,2,22,,2023-04-11
12/04/2023,362,,2,,,,355,2,3,,2023-04-12
13/04/2023,322,,11,,,,309,2,,,2023-04-13
14/04/2023,202,,4,,,,194,3,1,,2023-04-14
15/04/2023,311,,4,,,,303,2,2,,2023-04-15
16/04/2023,274,,1,,,,271,2,,,2023-04-16
17/04/2023,299,,12,,,,286,1,,,2023-04-17
18/04/2023,293,,,1,,,287,3,2,,2023-04-18
19/04/2023,254,,,,,,245,3,6,,2023-04-19
20/04/2023,159,,,,,,157,1,1,,2023-04-20
21/04/2023,272,,25,,,,233,2,12,,2023-04-21
22/04/2023,233,,1,,,,228,,4,,2023-04-22
23/04/2023,236,,11,,,,224,1,,,2023-04-23
24/04/2023,264,,2,,,,257,4,1,,2023-04-24
25/04/2023,273,,1,,,,271,,1,,2023-04-25
26/04/2023,283,,1,,,,258,12,12,,2023-04-26
27/04/2023,232,,,,,,230,1,1,,2023-04-27
28/04/2023,144,,2,,,,140,2,,,2023-04-28
29/04/2023,236,,4,,,,230,,2,,2023-04-29
30/04/2023,206,,1,,,,192,11,1,1,2023-04-30
01/05/2023,252,,1,,,,250,1,,,2023-05-01
02/05/2023,176,,2,,,,171,2,1,,2023-05-02
03/05/2023,147,,3,,,,132,11,1,,2023-05-03
04/05/2023,164,,4,,,,158,1,1,,2023-05-04
05/05/2023,196,,,,,,182,12,2,,2023-05-05
06/05/2023,168,,,,,,168,,,,2023-05-06
07/05/2023,230,,2,,,,228,,,,2023-05-07
08/05/2023,161,,1,,,,148,1,11,,2023-05-08
09/05/2023,126,,1,,,,124,1,,,2023-05-09
10/05/2023,82,,12,,,,67,1,2,,2023-05-10
11/05/2023,110,,1,,,,109,,,,2023-05-11
12/05/2023,119,,,,,,117,1,1,,2023-05-12
13/05/2023,116,,1,,,,113,2,,,2023-05-13
14/05/2023,122,,1,,,,121,,,,2023-05-14
15/05/2023,163,,31,,,,131,1,,,2023-05-15
16/05/2023,142,,1,,,,140,,1,,2023-05-16
17/05/2023,147,,,,,,144,2,1,,2023-05-17
18/05/2023,103,,2,,,,90,10,1,,2023-05-18
19/05/2023,98,,,,,,98,,,,2023-05-19
20/05/2023,90,,,,,,89,1,,,2023-05-20
21/05/2023,96,,1,,,,93,1,1,,2023-05-21
22/05/2023,149,,11,,,,136,,2,,2023-05-22
23/05/2023,182,,1,,,,181,,,,2023-05-23
24/05/2023,116,,1,,,,114,1,,,2023-05-24
25/05/2023,98,,1,,,,97,,,,2023-05-25
26/05/2023,112,,,,,,110,,2,,2023-05-26
27/05/2023,113,,,,,,113,,,,2023-05-27
28/05/2023,113,,,,,,111,2,,,2023-05-28
29/05/2023,129,,,,,,128,1,,,2023-05-29
30/05/2023,93,,3,,,,80,,10,,2023-05-30
31/05/2023,123,,,,,,112,11,,,2023-05-31
01/06/2023,83,,1,,,,81,,1,,2023-06-01
02/06/2023,69,,,,,,69,,,,2023-06-02
03/06/2023,111,,1,,,,110,,,,2023-06-03
04/06/2023,93,,2,,,,91,,,,2023-06-04
05/06/2023,101,,3,,,,97,1,,,2023-06-05
06/06/2023,65,,5,,,,58,1,1,,2023-06-06
07/06/2023,35,,1,,,,34,,,,2023-06-07
08/06/2023,61,,2,,,,59,,,,2023-06-08
09/06/2023,72,,1,,,,71,,,,2023-06-09
10/06/2023,25,,1,,,,24,,,,2023-06-10
11/06/2023,59,,11,,,,46,2,,,2023-06-11
12/06/2023,65,,1,,,,61,,3,,2023-06-12
13/06/2023,39,,1,,,,37,1,,,2023-06-13
14/06/2023,56,,3,,,,52,,1,,2023-06-14
15/06/2023,77,,,,,,77,,,,2023-06-15
16/06/2023,61,,,,,,61,,,,2023-06-16
17/06/2023,56,,1,,,,54,1,,,2023-06-17
18/06/2023,20,,,,,,20,,,,2023-06-18
19/06/2023,49,,1,,,,48,,,,2023-06-19
20/06/2023,58,,11,,,,47,,,,2023-06-20
21/06/2023,31,,1,,,,30,,,,2023-06-21
22/06/2023,28,,11,,,,17,,,,2023-06-22
23/06/2023,34,,13,,,,21,,,,2023-06-23
24/06/2023,31,,2,,,,29,,,,2023-06-24
25/06/2023,57,,4,,,,52,1,,,2023-06-25
26/06/2023,35,,4,,,,31,,,,2023-06-26
27/06/2023,32,,3,,,,29,,,,2023-06-27
28/06/2023,48,,2,,,,46,,,,2023-06-28
29/06/2023,19,,3,,,,15,1,,,2023-06-29
30/06/2023,43,,23,,,,20,,,,2023-06-30
01/07/2023,16,,5,,,,11,,,,2023-07-01
02/07/2023,19,,1,,,,18,,,,2023-07-02
03/07/2023,31,,14,,,,17,,,,2023-07-03
04/07/2023,32,,5,,,,27,,,,2023-07-04
05/07/2023,45,,13,,,,31,1,,,2023-07-05
06/07/2023,21,,15,,,,6,,,,2023-07-06
07/07/2023,36,,1,,,,34,1,,,2023-07-07
08/07/2023,55,,6,,,,48,1,,,2023-07-08
09/07/2023,61,,2,,,,59,,,,2023-07-09
10/07/2023,57,,5,,,,42,,10,,2023-07-10
11/07/2023,35,,12,,,,23,,,,2023-07-11
12/07/2023,65,,2,,,,53,10,,,2023-07-12
13/07/2023,64,,4,,,,59,,1,,2023-07-13
14/07/2023,48,,7,,,,41,,,,2023-07-14
15/07/2023,19,,2,,,,17,,,,2023-07-15
16/07/2023,45,,12,,,,33,,,,2023-07-16
17/07/2023,38,,3,,,,34,,1,,2023-07-17
18/07/2023,67,,16,,,,41,10,,,2023-07-18
19/07/2023,39,,1,,,,38,,,,2023-07-19
20/07/2023,12,,2,,,,9,,1,,2023-07-20
21/07/2023,48,,13,,,,35,,,,2023-07-21
22/07/2023,47,,2,,,,45,,,,2023-07-22
23/07/2023,25,,3,,,,22,,,,2023-07-23
24/07/2023,27,,2,,,,23,1,1,,2023-07-24
25/07/2023,86,,11,,,,75,,,,2023-07-25
26/07/2023,90,,15,,,,74,1,,,2023-07-26
27/07/2023,39,,1,,,,38,,,,2023-07-27
28/07/2023,123,,3,,,,120,,,,2023-07-28
29/07/2023,52,,,,,,52,,,,2023-07-29
30/07/2023,48,,2,,,,46,,,,2023-07-30
31/07/2023,53,,1,,,,51,1,,,2023-07-31
01/08/2023,42,,,,,,32,10,,,2023-08-01
02/08/2023,68,,1,,,,67,,,,2023-08-02
03/08/2023,27,,,,,,27,,,,2023-08-03
04/08/2023,47,,2,,,,33,2,10,,2023-08-04
05/08/2023,27,,,,,,27,,,,2023-08-05
06/08/2023,35,,1,,,,34,,,,2023-08-06
07/08/2023,35,,1,,,,32,1,1,,2023-08-07
08/08/2023,25,,,,,,15,10,,,2023-08-08
09/08/2023,39,,,,,,39,,,,2023-08-09
10/08/2023,24,,1,,,,23,,,,2023-08-10
11/08/2023,34,,,,,,24,10,,,2023-08-11
12/08/2023,5,,1,,,,4,,,,2023-08-12
13/08/2023,23,,,,,,21,2,,,2023-08-13
14/08/2023,23,,3,,,,16,3,1,,2023-08-14
15/08/2023,17,,,,,,16,1,,,2023-08-15
16/08/2023,16,,,,,,16,,,,2023-08-16
17/08/2023,22,,11,,,,10,1,,,2023-08-17
18/08/2023,31,,,,,,29,1,1,,2023-08-18
19/08/2023,37,,,,,,27,,10,,2023-08-19
20/08/2023,35,,2,,,,33,,,,2023-08-20
21/08/2023,47,,2,,,,40,3,2,,2023-08-21
22/08/2023,46,,2,,,,44,,,,2023-08-22
23/08/2023,28,,,,,,27,,1,,2023-08-23
24/08/2023,87,,,,,,87,,,,2023-08-24
25/08/2023,58,,,,,,47,10,1,,2023-08-25
26/08/2023,24,,1,,,,23,,,,2023-08-26
27/08/2023,46,,,,,,33,13,,,2023-08-27
28/08/2023,52,,10,,,,42,,,,2023-08-28
29/08/2023,18,,1,,,,15,,2,,2023-08-29
30/08/2023,46,,1,,,,44,,1,,2023-08-30
31/08/2023,54,,1,,,,41,12,,,2023-08-31
01/09/2023,15,,,,,,14,1,,,2023-09-01
02/09/2023,87,,1,,,,85,,1,,2023-09-02
03/09/2023,89,,,,,,78,11,,,2023-09-03
04/09/2023,88,,3,1,,,83,,1,,2023-09-04
05/09/2023,87,,1,,,,61,13,12,,2023-09-05
06/09/2023,37,,,,,,34,1,2,,2023-09-06
07/09/2023,78,,,,,,65,1,12,,2023-09-07
08/09/2023,69,,2,,,,67,,,,2023-09-08
09/09/2023,40,,1,,,,39,,,,2023-09-09
10/09/2023,84,,10,,,,68,4,2,,2023-09-10
11/09/2023,59,,,,,,55,3,1,,2023-09-11
12/09/2023,131,,12,,,,107,11,1,,2023-09-12
13/09/2023,94,,1,,,,91,1,1,,2023-09-13
14/09/2023,97,,10,,,,85,2,,,2023-09-14
15/09/2023,47,,1,,,,42,1,3,,2023-09-15
16/09/2023,66,,10,,,,46,,10,,2023-09-16
17/09/2023,99,,1,,,,73,22,3,,2023-09-17
18/09/2023,137,,1,,,,119,13,4,,2023-09-18
19/09/2023,83,,2,,,,77,3,1,,2023-09-19
20/09/2023,87,,4,,,,82,1,,,2023-09-20
21/09/2023,106,,1,,,,93,10,2,,2023-09-21
22/09/2023,181,,3,,,,163,11,4,,2023-09-22
23/09/2023,103,,4,,,,98,,1,,2023-09-23
24/09/2023,96,,,,,,95,1,,,2023-09-24
25/09/2023,109,,12,,,,91,5,1,,2023-09-25
26/09/2023,94,,4,,,,87,2,1,,2023-09-26
27/09/2023,92,,,,,,79,2,11,,2023-09-27
28/09/2023,137,,2,,,,116,17,2,,2023-09-28
29/09/2023,144,,2,,,,127,13,2,,2023-09-29
30/09/2023,88,,3,,,,74,10,1,,2023-09-30
01/10/2023,129,,1,,,,116,2,10,,2023-10-01
02/10/2023,189,,5,,,,180,3,1,,2023-10-02
03/10/2023,211,,12,,,,193,3,3,,2023-10-03
04/10/2023,119,,3,,,,110,5,1,,2023-10-04
05/10/2023,127,,,,,,120,4,3,,2023-10-05
06/10/2023,161,,,,,,142,16,3,,2023-10-06
07/10/2023,111,,15,,,,91,4,1,,2023-10-07
08/10/2023,126,,,,,,122,2,2,,2023-10-08
09/10/2023,193,,2,,,,172,6,13,,2023-10-09
10/10/2023,139,,15,,,,119,4,1,,2023-10-10
11/10/2023,104,,6,,,,82,13,3,,2023-10-11
12/10/2023,72,,,,,,68,3,1,,2023-10-12
13/10/2023,163,,14,,,,147,1,1,,2023-10-13
14/10/2023,97,,1,,,,92,3,1,,2023-10-14
15/10/2023,69,,1,,,,66,2,,,2023-10-15
16/10/2023,186,,3,,,,153,26,4,,2023-10-16
17/10/2023,93,,3,,,,89,,1,,2023-10-17
18/10/2023,73,,2,,,,60,11,,,2023-10-18
19/10/2023,121,,1,,,,105,12,3,,2023-10-19
20/10/2023,106,,,,,,105,,1,,2023-10-20
21/10/2023,105,,1,,,,99,4,1,,2023-10-21
22/10/2023,81,,1,,,,70,10,,,2023-10-22
23/10/2023,157,,,,,,152,2,3,,2023-10-23
24/10/2023,98,,1,,,,90,7,,,2023-10-24
25/10/2023,101,,1,,,,97,2,1,,2023-10-25
26/10/2023,78,,,,,,73,3,2,,2023-10-26
27/10/2023,153,,2,,,,149,1,1,,2023-10-27
28/10/2023,100,,,,,,96,4,,,2023-10-28
29/10/2023,78,,,,,,75,2,1,,2023-10-29
30/10/2023,140,,1,,,,135,3,1,,2023-10-30
31/10/2023,104,,1,,,,96,5,2,,2023-10-31
01/11/2023,57,,1,,,,55,1,,,2023-11-01
02/11/2023,127,,2,,,,111,8,6,,2023-11-02
03/11/2023,71,,2,,,,63,2,4,,2023-11-03
04/11/2023,78,,,,,,65,13,,,2023-11-04
05/11/2023,93,,2,,,,86,5,,,2023-11-05
06/11/2023,135,,2,,,,118,14,1,,2023-11-06
07/11/2023,118,,1,1,,,113,2,1,,2023-11-07
08/11/2023,102,,2,,,,98,2,,,2023-11-08
09/11/2023,118,,12,,,,92,13,1,,2023-11-09
10/11/2023,148,,,,,,133,14,1,,2023-11-10
11/11/2023,113,,2,,,,106,3,2,,2023-11-11
12/11/2023,79,,4,,,,70,3,2,,2023-11-12
13/11/2023,211,,1,,,,189,9,12,,2023-11-13
14/11/2023,188,,11,,,,129,25,23,,2023-11-14
15/11/2023,138,,10,,,,119,6,3,,2023-11-15
16/11/2023,163,,14,,,,143,6,,,2023-11-16
17/11/2023,161,,2,,,,147,2,10,,2023-11-17
18/11/2023,155,,4,,,,140,6,5,,2023-11-18
19/11/2023,159,,24,,,,124,,11,,2023-11-19
20/11/2023,179,,3,,,,164,8,4,,2023-11-20
21/11/2023,215,,3,,,,183,24,5,,2023-11-21
22/11/2023,182,,2,,,,162,6,12,,2023-11-22
23/11/2023,206,,2,,,,188,13,3,,2023-11-23
24/11/2023,208,,1,,,,195,6,6,,2023-11-24
25/11/2023,167,,,,,,150,5,12,,2023-11-25
26/11/2023,158,,1,,,,151,5,1,,2023-11-26
27/11/2023,200,,2,,,,186,10,2,,2023-11-27
28/11/2023,190,,1,,,,165,20,4,,2023-11-28
29/11/2023,217,,,,,,209,3,5,,2023-11-29
30/11/2023,222,,2,,,,198,21,1,,2023-11-30
01/12/2023,261,,2,,,,206,31,22,,2023-12-01
02/12/2023,178,,12,,,,151,14,1,,2023-12-02
03/12/2023,188,,2,,,,172,14,,,2023-12-03
04/12/2023,297,,,,,,284,9,4,,2023-12-04
05/12/2023,248,,1,,,,223,18,6,,2023-12-05
06/12/2023,256,,,,,,236,17,3,,2023-12-06
07/12/2023,199,,1,,,,191,6,1,,2023-12-07
08/12/2023,225,,2,,,,207,5,11,,2023-12-08
09/12/2023,256,,,,,,232,22,2,,2023-12-09
10/12/2023,218,,,,,,170,48,,,2023-12-10
11/12/2023,304,,1,,,,266,29,8,,2023-12-11
12/12/2023,220,,,,,,214,4,2,,2023-12-12
13/12/2023,244,,3,,,,234,6,1,,2023-12-13
14/12/2023,250,,,,,,206,42,2,,2023-12-14
15/12/2023,243,,1,,,,224,14,4,,2023-12-15
16/12/2023,117,,,,,,112,3,2,,2023-12-16
17/12/2023,147,,1,,,,131,15,,,2023-12-17
18/12/2023,240,,1,,,,217,19,3,,2023-12-18
19/12/2023,185,,1,,,,175,5,4,,2023-12-19
20/12/2023,217,,1,,,,207,6,3,,2023-12-20
21/12/2023,140,,1,,,,132,6,1,,2023-12-21
22/12/2023,135,,2,,,,126,6,1,,2023-12-22
23/12/2023,164,,11,,,,149,3,1,,2023-12-23
24/12/2023,109,,13,,,,89,7,,,2023-12-24
25/12/2023,109,,,,,,101,6,2,,2023-12-25
26/12/2023,220,,2,,,,193,24,1,,2023-12-26
27/12/2023,252,,13,,,,213,25,1,,2023-12-27
28/12/2023,240,,2,,,,217,19,2,,2023-12-28
29/12/2023,135,,1,,,,124,10,,,2023-12-29
30/12/2023,97,,2,,,,89,4,2,,2023-12-30
31/12/2023,139,,24,,,,89,26,,,2023-12-31
01/01/2024,139,,,,,,134,4,1,,2024-01-01
02/01/2024,134,,,,,,128,4,2,,2024-01-02
03/01/2024,115,,,,,,112,3,,,2024-01-03
04/01/2024,98,,,,,,80,18,,,2024-01-04
05/01/2024,138,,1,,,,129,6,2,,2024-01-05
06/01/2024,104,,,,,,92,12,,,2024-01-06
07/01/2024,53,,,,,,50,3,,,2024-01-07
08/01/2024,107,,,,,,102,3,2,,2024-01-08
09/01/2024,60,,1,,,,55,3,1,,2024-01-09
10/01/2024,98,,,,,,84,14,,,2024-01-10
11/01/2024,76,,,,,,75,1,,,2024-01-11
12/01/2024,60,,,,,,47,11,2,,2024-01-12
13/01/2024,87,,,,,,81,5,1,,2024-01-13
14/01/2024,50,,,,,,49,1,,,2024-01-14
15/01/2024,142,,,,,,141,1,,,2024-01-15
16/01/2024,48,,,,,,46,1,1,,2024-01-16
17/01/2024,75,,,,,,75,,,,2024-01-17
18/01/2024,91,,,,,,81,10,,,2024-01-18
19/01/2024,62,,1,,,,58,2,1,,2024-01-19
20/01/2024,18,,,,,,17,1,,,2024-01-20
21/01/2024,57,,,,,,44,12,1,,2024-01-21
22/01/2024,39,,,,,,36,2,1,,2024-01-22
23/01/2024,50,,1,,,,48,1,,,2024-01-23
24/01/2024,53,,1,,,,52,,,,2024-01-24
25/01/2024,61,,,,,,60,,1,,2024-01-25
26/01/2024,37,,,,,,37,,,,2024-01-26
27/01/2024,32,,,,,,30,1,1,,2024-01-27
28/01/2024,46,,,,,,45,,1,,2024-01-28
29/01/2024,59,,,,,,57,2,,,2024-01-29
30/01/2024,27,,,,,,27,,,,2024-01-30
31/01/2024,10,,,,,,9,1,,,2024-01-31
01/02/2024,37,,1,,,,35,1,,,2024-02-01
02/02/2024,22,,,,,,21,1,,,2024-02-02
03/02/2024,34,,,,,,33,1,,,2024-02-03
04/02/2024,24,,,,,,21,2,1,,2024-02-04
05/02/2024,23,,,,,,22,1,,,2024-02-05
06/02/2024,32,,,,,,30,2,,,2024-02-06
07/02/2024,25,,,,,,23,1,1,,2024-02-07
08/02/2024,19,,,,,,19,,,,2024-02-08
09/02/2024,10,,,,,,10,,,,2024-02-09
10/02/2024,13,,,,,,13,,,,2024-02-10
11/02/2024,18,,,,,,17,1,,,2024-02-11
12/02/2024,7,,,,,,6,1,,,2024-02-12
13/02/2024,13,,,,,,13,,,,2024-02-13
14/02/2024,13,,,,,,12,1,,,2024-02-14
15/02/2024,8,,,,,,8,,,,2024-02-15
16/02/2024,15,,,,,,15,,,,2024-02-16
17/02/2024,7,,1,,,,5,1,,,2024-02-17
18/02/2024,16,,,,,,16,,,,2024-02-18
19/02/2024,13,,,,,,13,,,,2024-02-19
20/02/2024,27,,,,,,27,,,,2024-02-20
21/02/2024,7,,,,,,7,,,,2024-02-21
22/02/2024,27,,,,,,27,,,,2024-02-22
23/02/2024,16,,,,,,6,10,,,2024-02-23
24/02/2024,6,,2,,,,4,,,,2024-02-24
25/02/2024,21,,1,,,,20,,,,2024-02-25
26/02/2024,12,,,,,,12,,,,2024-02-26
27/02/2024,18,,,,,,17,,1,,2024-02-27
28/02/2024,29,,,,,,28,,1,,2024-02-28
29/02/2024,47,,,,,,47,,,,2024-02-29
01/03/2024,19,,,,,,8,11,,,2024-03-01
02/03/2024,2,,,,,,2,,,,2024-03-02
03/03/2024,7,,,,,,6,1,,,2024-03-03
04/03/2024,19,,,,,,19,,,,2024-03-04
05/03/2024,16,,,,,,16,,,,2024-03-05
06/03/2024,18,,,,,,18,,,,2024-03-06
07/03/2024,13,,,,,,12,1,,,2024-03-07
08/03/2024,6,,,,,,6,,,,2024-03-08
10/03/2024,6,,,,,,6,,,,2024-03-10
11/03/2024,5,,,,,,4,1,,,2024-03-11
12/03/2024,26,,11,,,,15,,,,2024-03-12
13/03/2024,13,,,,,,11,1,1,,2024-03-13
14/03/2024,1,,,,,,,,1,,2024-03-14
15/03/2024,3,,,,,,3,,,,2024-03-15
16/03/2024,3,,,,,,3,,,,2024-03-16
17/03/2024,15,,,,,,15,,,,2024-03-17
18/03/2024,15,,,,,,15,,,,2024-03-18
19/03/2024,4,,,,,,3,1,,,2024-03-19
20/03/2024,5,,,,,,5,,,,2024-03-20
21/03/2024,6,,,,,,6,,,,2024-03-21
22/03/2024,4,,,,,,4,,,,2024-03-22
23/03/2024,16,,,,,,16,,,,2024-03-23
24/03/2024,2,,,,,,2,,,,2024-03-24
25/03/2024,11,,,,,,11,,,,2024-03-25
26/03/2024,2,,,,,,2,,,,2024-03-26
27/03/2024,32,,,,,,31,1,,,2024-03-27
28/03/2024,1,,,,,,1,,,,2024-03-28
29/03/2024,3,,,,,,3,,,,2024-03-29
30/03/2024,4,,,,,,3,1,,,2024-03-30
31/03/2024,2,,,,,,2,,,,2024-03-31
01/04/2024,4,,,,,,3,1,,,2024-04-01
02/04/2024,5,,1,,,,2,,2,,2024-04-02
03/04/2024,4,,,,,,4,,,,2024-04-03
04/04/2024,7,,,,,,6,1,,,2024-04-04
05/04/2024,11,,,,,,11,,,,2024-04-05
06/04/2024,36,,,,,,36,,,,2024-04-06
07/04/2024,15,,,,,,14,,1,,2024-04-07
08/04/2024,14,,,,,,14,,,,2024-04-08
09/04/2024,14,,,,,,14,,,,2024-04-09
10/04/2024,6,,,,,,5,1,,,2024-04-10
11/04/2024,2,,,,,,2,,,,2024-04-11
12/04/2024,11,,,,,,10,1,,,2024-04-12
13/04/2024,2,,,,,,2,,,,2024-04-13
14/04/2024,2,,,,,,2,,,,2024-04-14
15/04/2024,5,,,,,,3,2,,,2024-04-15
16/04/2024,6,,,,,,6,,,,2024-04-16
17/04/2024,3,,,,,,3,,,,2024-04-17
18/04/2024,2,,,,,,2,,,,2024-04-18
19/04/2024,17,,1,,,,16,,,,2024-04-19
20/04/2024,3,,,,,,3,,,,2024-04-20
21/04/2024,1,,,,,,1,,,,2024-04-21
22/04/2024,10,,,,,,10,,,,2024-04-22
23/04/2024,12,,,,,,12,,,,2024-04-23
24/04/2024,14,,1,,,,13,,,,2024-04-24
25/04/2024,3,,,,,,3,,,,2024-04-25
26/04/2024,4,,,,,,4,,,,2024-04-26
27/04/2024,2,,,,,,2,,,,2024-04-27
28/04/2024,2,,,,,,2,,,,2024-04-28
29/04/2024,25,,,,,,25,,,,2024-04-29
30/04/2024,23,,,,,,23,,,,2024-04-30
01/05/2024,4,,,,,,4,,,,2024-05-01
02/05/2024,14,,10,,,,4,,,,2024-05-02
03/05/2024,48,,,,,,47,1,,,2024-05-03
04/05/2024,13,,,,,,13,,,,2024-05-04
05/05/2024,3,,,,,,2,1,,,2024-05-05
06/05/2024,3,,,,,,3,,,,2024-05-06
07/05/2024,17,,,,,,17,,,,2024-05-07
08/05/2024,16,,,,,,16,,,,2024-05-08
09/05/2024,22,,,,,,22,,,,2024-05-09
10/05/2024,34,,,,,,34,,,,2024-05-10
11/05/2024,11,,,,,,11,,,,2024-05-11
12/05/2024,14,,,,,,14,,,,2024-05-12
13/05/2024,3,,,,,,2,1,,,2024-05-13
14/05/2024,12,,,,,,2,10,,,2024-05-14
15/05/2024,3,,,,,,3,,,,2024-05-15
16/05/2024,12,,,,,,12,,,,2024-05-16
17/05/2024,14,,,,,,14,,,,2024-05-17
18/05/2024,12,,,,,,12,,,,2024-05-18
19/05/2024,16,,,,,,15,,1,,2024-05-19
20/05/2024,23,,,,,,23,,,,2024-05-20
21/05/2024,34,,10,,,,24,,,,2024-05-21
22/05/2024,18,,,,,,17,1,,,2024-05-22
23/05/2024,15,,,,,,15,,,,2024-05-23
24/05/2024,4,,,,,,4,,,,2024-05-24
25/05/2024,6,,,,,,6,,,,2024-05-25
26/05/2024,16,,,,,,16,,,,2024-05-26
27/05/2024,4,,,,,,3,,1,,2024-05-27
28/05/2024,15,,,,,,14,1,,,2024-05-28
29/05/2024,6,,,,,,6,,,,2024-05-29
30/05/2024,14,,,,,,13,1,,,2024-05-30
31/05/2024,7,,,,,,6,1,,,2024-05-31
01/06/2024,17,,,,,,6,10,1,,2024-06-01
02/06/2024,24,,,,,,24,,,,2024-06-02
03/06/2024,17,,10,,,,7,,,,2024-06-03
04/06/2024,6,,,,,,6,,,,2024-06-04
05/06/2024,15,,1,,,,14,,,,2024-06-05
06/06/2024,41,,,,,,37,3,1,,2024-06-06
07/06/2024,24,,,,,,24,,,,2024-06-07
08/06/2024,23,,,,,,13,10,,,2024-06-08
09/06/2024,2,,,,,,2,,,,2024-06-09
10/06/2024,18,,,,,,18,,,,2024-06-10
11/06/2024,20,,,,,,20,,,,2024-06-11
12/06/2024,13,,,,,,13,,,,2024-06-12
13/06/2024,4,,,,,,4,,,,2024-06-13
14/06/2024,26,,,,,,25,1,,,2024-06-14
15/06/2024,27,,,,,,26,1,,,2024-06-15
16/06/2024,15,,,,,,14,1,,,2024-06-16
17/06/2024,3,,,,,,3,,,,2024-06-17
18/06/2024,14,,,,,,13,1,,,2024-06-18
19/06/2024,60,,,,,,59,1,,,2024-06-19
20/06/2024,7,,,,,,6,1,,,2024-06-20
21/06/2024,6,,,,,,5,,1,,2024-06-21
22/06/2024,18,,,,,,18,,,,2024-06-22
23/06/2024,27,,11,,,,14,2,,,2024-06-23
24/06/2024,47,,10,,,,36,1,,,2024-06-24
25/06/2024,21,,,,,,19,2,,,2024-06-25
26/06/2024,17,,,,,,17,,,,2024-06-26
27/06/2024,42,,,,,,32,10,,,2024-06-27
28/06/2024,20,,1,,,,19,,,,2024-06-28
29/06/2024,23,,,,,,23,,,,2024-06-29
30/06/2024,6,,,,,,5,1,,,2024-06-30
01/07/2024,37,,,,,,35,2,,,2024-07-01
02/07/2024,35,,,,,,34,1,,,2024-07-02
03/07/2024,40,,,,,,29,11,,,2024-07-03
04/07/2024,49,,,,,,49,,,,2024-07-04
05/07/2024,28,,,,,,28,,,,2024-07-05
06/07/2024,33,,,,,,32,1,,,2024-07-06
07/07/2024,7,,,,,,6,1,,,2024-07-07
08/07/2024,29,,,,,,28,1,,,2024-07-08
09/07/2024,47,,,,,,45,2,,,2024-07-09
10/07/2024,41,,,,,,39,2,,,2024-07-10
11/07/2024,51,,,,,,51,,,,2024-07-11
12/07/2024,29,,,,,,27,2,,,2024-07-12
13/07/2024,23,,,,,,23,,,,2024-07-13
14/07/2024,20,,,,,,18,1,1,,2024-07-14
15/07/2024,23,,,,,,23,,,,2024-07-15
16/07/2024,17,,,,,,17,,,,2024-07-16
17/07/2024,43,,,,,,40,2,1,,2024-07-17
18/07/2024,49,,,,,,36,13,,,2024-07-18
19/07/2024,51,,,,,,50,1,,,2024-07-19
20/07/2024,37,,,,,,26,1,10,,2024-07-20
21/07/2024,49,,,,,,49,,,,2024-07-21
22/07/2024,92,,,,,,78,14,,,2024-07-22
23/07/2024,35,,,,,,34,1,,,2024-07-23
24/07/2024,85,,,,,,84,1,,,2024-07-24
25/07/2024,30,,,,,,27,2,1,,2024-07-25
26/07/2024,34,,,,,,34,,,,2024-07-26
27/07/2024,63,,,,,,53,10,,,2024-07-27
28/07/2024,41,,,,,,38,3,,,2024-07-28
29/07/2024,56,,,,,,53,3,,,2024-07-29
30/07/2024,63,,,,,,63,,,,2024-07-30
31/07/2024,63,,,,,,63,,,,2024-07-31
01/08/2024,75,,,,,,63,12,,,2024-08-01
02/08/2024,59,,,,,,55,2,2,,2024-08-02
03/08/2024,34,,1,,,,32,1,,,2024-08-03
04/08/2024,30,,,,,,30,,,,2024-08-04
05/08/2024,56,,,,,,41,5,10,,2024-08-05
06/08/2024,45,,,,,,34,11,,,2024-08-06
07/08/2024,51,,,,,,51,,,,2024-08-07
08/08/2024,68,,,,,,68,,,,2024-08-08
09/08/2024,43,,,1,,,42,,,,2024-08-09
10/08/2024,48,,,,,,47,1,,,2024-08-10
11/08/2024,39,,,,,,36,3,,,2024-08-11
12/08/2024,55,,,,,,55,,,,2024-08-12
13/08/2024,74,,,,,,60,12,2,,2024-08-13
14/08/2024,49,,,,,,48,,1,,2024-08-14
15/08/2024,30,,,,,,28,1,1,,2024-08-15
16/08/2024,46,,,,,,33,13,,,2024-08-16
17/08/2024,30,,,,,,29,1,,,2024-08-17
18/08/2024,18,,,,,,16,2,,,2024-08-18
19/08/2024,57,,,,,,56,1,,,2024-08-19
20/08/2024,38,,,,,,35,3,,,2024-08-20
21/08/2024,43,,,,,,41,1,1,,2024-08-21
22/08/2024,41,,,,,,37,1,3,,2024-08-22
23/08/2024,62,,,,,,59,3,,,2024-08-23
24/08/2024,10,,,,,,10,,,,2024-08-24
25/08/2024,25,,,,,,25,,,,2024-08-25
26/08/2024,53,,,,,,42,11,,,2024-08-26
27/08/2024,29,,,,,,25,4,,,2024-08-27
28/08/2024,64,,,,,,61,3,,,2024-08-28
29/08/2024,45,,,,,,44,,1,,2024-08-29
30/08/2024,35,,,,,,34,1,,,2024-08-30
31/08/2024,32,,,,,,30,2,,,2024-08-31
01/09/2024,40,,,,,,39,1,,,2024-09-01
02/09/2024,71,,,,,,59,12,,,2024-09-02
03/09/2024,40,,,,,,30,10,,,2024-09-03
04/09/2024,30,,,,,,29,,1,,2024-09-04
05/09/2024,43,,,,,,41,,2,,2024-09-05
06/09/2024,54,,,,,,52,2,,,2024-09-06
07/09/2024,16,,,,,,15,1,,,2024-09-07
08/09/2024,12,,,,,,9,3,,,2024-09-08
09/09/2024,78,,,,,,48,20,10,,2024-09-09
10/09/2024,42,,,,,,38,1,3,,2024-09-10
11/09/2024,42,,,,,,40,2,,,2024-09-11
12/09/2024,25,,,,,,24,1,,,2024-09-12
13/09/2024,32,,,,,,31,1,,,2024-09-13
14/09/2024,32,,,,,,29,2,1,,2024-09-14
15/09/2024,19,,,,,,8,11,,,2024-09-15
16/09/2024,31,,,,,,31,,,,2024-09-16
17/09/2024,68,,,,,,67,1,,,2024-09-17
18/09/2024,75,,,,,,71,1,3,,2024-09-18
19/09/2024,58,,1,,,,46,10,1,,2024-09-19
20/09/2024,69,,,,,,55,14,,,2024-09-20
21/09/2024,60,,,,,,56,4,,,2024-09-21
22/09/2024,32,,,,,,32,,,,2024-09-22
23/09/2024,70,,,,,,65,5,,,2024-09-23
24/09/2024,77,,1,,,,65,1,10,,2024-09-24
25/09/2024,84,,1,,,,80,3,,,2024-09-25
26/09/2024,72,,,,,,70,2,,,2024-09-26
27/09/2024,59,,,,,,58,,1,,2024-09-27
28/09/2024,66,,,,,,66,,,,2024-09-28
29/09/2024,54,,1,,,,51,1,1,,2024-09-29
30/09/2024,89,,,,,,87,2,,,2024-09-30
01/10/2024,52,,,,,,48,4,,,2024-10-01
02/10/2024,32,,,,,,31,,1,,2024-10-02
03/10/2024,101,,1,,,,98,2,,,2024-10-03
04/10/2024,117,,,,,,109,7,1,,2024-10-04
05/10/2024,64,,,,,,58,5,1,,2024-10-05
06/10/2024,86,,,,,,83,3,,,2024-10-06
07/10/2024,155,,1,,,,148,5,1,,2024-10-07
08/10/2024,72,,10,,,,57,5,,,2024-10-08
09/10/2024,123,,1,,,,115,6,1,,2024-10-09
10/10/2024,114,,,,,,111,3,,,2024-10-10
11/10/2024,87,,,,,,85,2,,,2024-10-11
12/10/2024,30,,,,,,28,2,,,2024-10-12
13/10/2024,73,,,,,,69,4,,,2024-10-13
14/10/2024,126,,,,,,112,14,,,2024-10-14
15/10/2024,133,,,,,,125,8,,,2024-10-15
16/10/2024,91,,,,,,90,1,,,2024-10-16
17/10/2024,88,,,,,,86,2,,,2024-10-17
18/10/2024,59,,,,,,58,1,,,2024-10-18
19/10/2024,54,,,,,,52,2,,,2024-10-19
20/10/2024,98,,,,,,95,3,,,2024-10-20
21/10/2024,152,,10,,,,129,13,,,2024-10-21
22/10/2024,65,,,,,,63,2,,,2024-10-22
23/10/2024,97,,,,,,91,4,2,,2024-10-23
24/10/2024,42,,,,,,29,12,1,,2024-10-24
25/10/2024,114,,,,,,100,3,11,,2024-10-25
26/10/2024,29,,,,,,27,2,,,2024-10-26
27/10/2024,68,,,,,,54,14,,,2024-10-27
28/10/2024,49,,,,,,43,5,1,,2024-10-28
29/10/2024,51,,,,,,49,2,,,2024-10-29
30/10/2024,22,,1,,,,21,,,,2024-10-30
31/10/2024,45,,,,,,44,1,,,2024-10-31
01/11/2024,23,,,,,,22,1,,,2024-11-01
02/11/2024,40,,,,,,30,10,,,2024-11-02
03/11/2024,41,,,,,,40,1,,,2024-11-03
04/11/2024,33,,,,,,32,1,,,2024-11-04
05/11/2024,31,,1,,,,30,,,,2024-11-05
06/11/2024,20,,,,,,20,,,,2024-11-06
07/11/2024,21,,,,,,11,10,,,2024-11-07
08/11/2024,13,,,,,,12,1,,,2024-11-08
09/11/2024,17,,,,,,15,2,,,2024-11-09
10/11/2024,29,,,,,,18,11,,,2024-11-10
11/11/2024,78,,,,,,76,1,1,,2024-11-11
12/11/2024,53,,,,,,41,12,,,2024-11-12
13/11/2024,21,,,,,,20,1,,,2024-11-13
14/11/2024,33,,,,,,32,1,,,2024-11-14
15/11/2024,31,,,,,,31,,,,2024-11-15
16/11/2024,16,,,,,,16,,,,2024-11-16
17/11/2024,50,,,,,,48,2,,,2024-11-17
18/11/2024,22,,,,,,21,1,,,2024-11-18
19/11/2024,39,,,,,,27,1,11,,2024-11-19
20/11/2024,37,,,,,,37,,,,2024-11-20
21/11/2024,36,,,,,,36,,,,2024-11-21
22/11/2024,52,,,,,,42,10,,,2024-11-22
23/11/2024,16,,,,,,16,,,,2024-11-23
24/11/2024,21,,,,,,21,,,,2024-11-24
25/11/2024,29,,2,,,,24,3,,,2024-11-25
26/11/2024,38,,,,,,37,,1,,2024-11-26
27/11/2024,31,,,,,,28,2,1,,2024-11-27
28/11/2024,38,,,,,,27,11,,,2024-11-28
29/11/2024,34,,,,,,33,,1,,2024-11-29
30/11/2024,20,,,,,,19,,1,,2024-11-30
01/12/2024,31,,,,,,30,1,,,2024-12-01
02/12/2024,22,,,,,,21,1,,,2024-12-02
03/12/2024,26,,,,,,26,,,,2024-12-03
04/12/2024,39,,,,,,29,10,,,2024-12-04
05/12/2024,70,,,,,,69,1,,,2024-12-05
06/12/2024,29,,,,,,29,,,,2024-12-06
07/12/2024,35,,,,,,35,,,,2024-12-07
08/12/2024,10,,,,,,7,2,1,,2024-12-08
09/12/2024,23,,,,,,21,2,,,2024-12-09
10/12/2024,31,,,,,,30,1,,,2024-12-10
11/12/2024,24,,,,,,23,1,,,2024-12-11
12/12/2024,22,,,,,,21,1,,,2024-12-12
13/12/2024,18,,,,,,18,,,,2024-12-13
14/12/2024,9,,,,,,9,,,,2024-12-14
15/12/2024,8,,,,,,8,,,,2024-12-15
16/12/2024,41,,,,,,38,3,,,2024-12-16
17/12/2024,19,,,,,,18,1,,,2024-12-17
18/12/2024,31,,,,,,31,,,,2024-12-18
19/12/2024,34,,,,,,31,2,1,,2024-12-19
20/12/2024,57,,,,,,54,3,,,2024-12-20
21/12/2024,15,,,,,,15,,,,2024-12-21
22/12/2024,12,,,,,,12,,,,2024-12-22
23/12/2024,31,,1,,,,30,,,,2024-12-23
24/12/2024,48,,,,,,27,21,,,2024-12-24
25/12/2024,20,,,,,,19,,1,,2024-12-25
26/12/2024,36,,,,,,35,1,,,2024-12-26
27/12/2024,32,,,,,,21,10,1,,2024-12-27
28/12/2024,8,,,,,,7,1,,,2024-12-28
29/12/2024,5,,,,,,3,2,,,2024-12-29
30/12/2024,55,,,,,,53,1,1,,2024-12-30
31/12/2024,50,,,,,,39,11,,,2024-12-31
01/01/2025,41,,,,,,39,2,,,2025-01-01
02/01/2025,82,,,,,,80,2,,,2025-01-02
03/01/2025,33,,,,,,31,2,,,2025-01-03
04/01/2025,62,,,,,,62,,,,2025-01-04
05/01/2025,37,,1,,,,36,,,,2025-01-05
06/01/2025,11,,,,,,10,1,,,2025-01-06
07/01/2025,42,,,,,,42,,,,2025-01-07
08/01/2025,22,,,,,,20,2,,,2025-01-08
09/01/2025,22,,,,,,21,1,,,2025-01-09
10/01/2025,22,,,,,,9,13,,,2025-01-10
11/01/2025,23,,,,,,23,,,,2025-01-11
12/01/2025,17,,,,,,17,,,,2025-01-12
13/01/2025,38,,,,,,38,,,,2025-01-13
14/01/2025,37,,,,,,27,10,,,2025-01-14
15/01/2025,19,,,,,,19,,,,2025-01-15
16/01/2025,7,,,,,,6,1,,,2025-01-16
17/01/2025,10,,,,,,8,2,,,2025-01-17
18/01/2025,9,,,,,,8,1,,,2025-01-18
19/01/2025,26,,,,,,26,,,,2025-01-19
20/01/2025,16,,,,,,13,3,,,2025-01-20
21/01/2025,19,,,,,,17,2,,,2025-01-21
22/01/2025,9,,1,,,,8,,,,2025-01-22
23/01/2025,6,,,,,,6,,,,2025-01-23
24/01/2025,9,,,,,,8,1,,,2025-01-24
25/01/2025,5,,,,,,4,1,,,2025-01-25
26/01/2025,6,,,,,,5,1,,,2025-01-26
27/01/2025,7,,,,,,7,,,,2025-01-27
28/01/2025,8,,,,,,8,,,,2025-01-28
29/01/2025,25,,,,,,25,,,,2025-01-29
30/01/2025,17,,,,,,17,,,,2025-01-30
31/01/2025,5,,,,,,5,,,,2025-01-31
01/02/2025,4,,,,,,4,,,,2025-02-01
02/02/2025,1,,,,,,,1,,,2025-02-02
03/02/2025,21,,,,,,19,2,,,2025-02-03
04/02/2025,9,,,,,,9,,,,2025-02-04
05/02/2025,6,,,,,,6,,,,2025-02-05
06/02/2025,7,,,,,,7,,,,2025-02-06
07/02/2025,36,,,,,,36,,,,2025-02-07
08/02/2025,4,,,,,,4,,,,2025-02-08
09/02/2025,13,,,,,,13,,,,2025-02-09
10/02/2025,2,,,,,,2,,,,2025-02-10
11/02/2025,7,,,,,,5,2,,,2025-02-11
12/02/2025,3,,,,,,2,,1,,2025-02-12
13/02/2025,15,,,,,,3,12,,,2025-02-13
14/02/2025,6,,,,,,5,1,,,2025-02-14
15/02/2025,32,,,,,,32,,,,2025-02-15
16/02/2025,3,,,,,,3,,,,2025-02-16
17/02/2025,4,,,,,,3,,1,,2025-02-17
18/02/2025,4,,,,,,3,1,,,2025-02-18
19/02/2025,15,,,,,,14,1,,,2025-02-19
21/02/2025,3,,,,,,3,,,,2025-02-21
22/02/2025,13,,,,,,2,11,,,2025-02-22
23/02/2025,3,,,,,,2,1,,,2025-02-23
24/02/2025,14,,,,,,14,,,,2025-02-24
25/02/2025,3,,,,,,2,1,,,2025-02-25
26/02/2025,3,,,,,,3,,,,2025-02-26
27/02/2025,14,,,,,,13,1,,,2025-02-27
28/02/2025,15,,,,,,15,,,,2025-02-28
01/03/2025,2,,,,,,1,1,,,2025-03-01
02/03/2025,4,,,,,,3,1,,,2025-03-02
03/03/2025,2,,,,,,1,1,,,2025-03-03
04/03/2025,4,,,,,,3,1,,,2025-03-04
05/03/2025,20,,,,,,20,,,,2025-03-05
06/03/2025,3,,,,,,3,,,,2025-03-06
07/03/2025,27,,,,,,27,,,,2025-03-07
08/03/2025,11,,,,,,11,,,,2025-03-08
09/03/2025,13,,,,,,2,1,10,,2025-03-09
10/03/2025,3,,,,,,3,,,,2025-03-10
11/03/2025,3,,,,,,3,,,,2025-03-11
12/03/2025,16,,,,,,16,,,,2025-03-12
13/03/2025,1,,,,,,1,,,,2025-03-13
14/03/2025,13,,,,,,13,,,,2025-03-14
15/03/2025,3,,,,,,3,,,,2025-03-15
16/03/2025,4,,,,,,4,,,,2025-03-16
17/03/2025,34,,,,,,33,1,,,2025-03-17
18/03/2025,2,,,,,,2,,,,2025-03-18
19/03/2025,2,,,,,,2,,,,2025-03-19
20/03/2025,1,,,,,,1,,,,2025-03-20
21/03/2025,2,,,,,,2,,,,2025-03-21
22/03/2025,11,,,,,,11,,,,2025-03-22
23/03/2025,1,,,,,,1,,,,2025-03-23
24/03/2025,3,,1,,,,2,,,,2025-03-24
25/03/2025,2,,,,,,2,,,,2025-03-25
26/03/2025,3,,,,,,3,,,,2025-03-26
27/03/2025,1,,,,,,,1,,,2025-03-27
28/03/2025,12,,,,,,12,,,,2025-03-28
29/03/2025,10,,,,,,10,,,,2025-03-29
30/03/2025,1,,,,,,1,,,,2025-03-30
31/03/2025,15,,,,,,15,,,,2025-03-31
01/04/2025,4,,,,,,4,,,,2025-04-01
02/04/2025,6,,,,,,6,,,,2025-04-02
03/04/2025,13,,,,,,13,,,,2025-04-03
05/04/2025,1,,,,,,1,,,,2025-04-05
06/04/2025,12,,,,,,12,,,,2025-04-06
07/04/2025,14,,,,,,14,,,,2025-04-07
08/04/2025,3,,,,,,3,,,,2025-04-08
10/04/2025,1,,,,,,1,,,,2025-04-10
11/04/2025,2,,,,,,1,,1,,2025-04-11
12/04/2025,2,,,,,,2,,,,2025-04-12
13/04/2025,1,,,,,,1,,,,2025-04-13
14/04/2025,2,,,,,,2,,,,2025-04-14
15/04/2025,2,,,,,,2,,,,2025-04-15
16/04/2025,3,,,,,,2,1,,,2025-04-16
17/04/2025,1,,,,,,1,,,,2025-04-17
18/04/2025,2,,,,,,2,,,,2025-04-18
19/04/2025,10,,,,,,10,,,,2025-04-19
21/04/2025,1,,,,,,1,,,,2025-04-21
22/04/2025,2,,,,,,1,1,,,2025-04-22
23/04/2025,11,,,,,,11,,,,2025-04-23
24/04/2025,1,,,,,,1,,,,2025-04-24
25/04/2025,2,,,,,,2,,,,2025-04-25
26/04/2025,1,,,,,,1,,,,2025-04-26
27/04/2025,1,,,,,,1,,,,2025-04-27
28/04/2025,5,,,,,,5,,,,2025-04-28
29/04/2025,1,,,,,,1,,,,2025-04-29
02/05/2025,1,,,,,,1,,,,2025-05-02
03/05/2025,3,,,,,,3,,,,2025-05-03
04/05/2025,3,,,,,,2,1,,,2025-05-04
05/05/2025,3,,,,,,3,,,,2025-05-05
07/05/2025,1,,1,,,,,,,,2025-05-07
08/05/2025,4,,,,,,3,1,,,2025-05-08
10/05/2025,1,,,,,,1,,,,2025-05-10
12/05/2025,2,,,,,,2,,,,2025-05-12
13/05/2025,1,,,,,,1,,,,2025-05-13
14/05/2025,4,,,,,,4,,,,2025-05-14
15/05/2025,22,,,,,,22,,,,2025-05-15
16/05/2025,4,,,,,,4,,,,2025-05-16
17/05/2025,1,,,,,,1,,,,2025-05-17
18/05/2025,2,,,,,,2,,,,2025-05-18
19/05/2025,13,,,,,,13,,,,2025-05-19
20/05/2025,11,,,,,,11,,,,2025-05-20
21/05/2025,2,,,,,,2,,,,2025-05-21
22/05/2025,1,,,,,,,1,,,2025-05-22
23/05/2025,3,,,,,,3,,,,2025-05-23
24/05/2025,2,,,,,,1,1,,,2025-05-24
25/05/2025,3,,,,,,3,,,,2025-05-25
26/05/2025,3,,,,,,3,,,,2025-05-26
27/05/2025,13,,,,,,13,,,,2025-05-27
28/05/2025,4,,,,,,4,,,,2025-05-28
29/05/2025,1,,,,,,1,,,,2025-05-29
30/05/2025,1,,,,,,1,,,,2025-05-30
31/05/2025,2,,,,,,2,,,,2025-05-31
01/06/2025,2,,,,,,2,,,,2025-06-01
03/06/2025,4,,,,,,4,,,,2025-06-03
04/06/2025,3,,,1,,,2,,,,2025-06-04
05/06/2025,10,,,,,,10,,,,2025-06-05
06/06/2025,2,,,,,,2,,,,2025-06-06
07/06/2025,12,,,,,,12,,,,2025-06-07
08/06/2025,20,,,,,,10,,10,,2025-06-08
09/06/2025,3,,,,,,3,,,,2025-06-09
10/06/2025,1,,,,,,1,,,,2025-06-10
11/06/2025,2,,,,,,2,,,,2025-06-11
12/06/2025,1,,,,,,1,,,,2025-06-12
13/06/2025,1,,,,,,1,,,,2025-06-13
14/06/2025,12,,,,,,12,,,,2025-06-14
15/06/2025,11,,,,,,11,,,,2025-06-15
16/06/2025,10,,,,,,10,,,,2025-06-16
17/06/2025,3,,,,,,3,,,,2025-06-17
18/06/2025,1,,,,,,1,,,,2025-06-18
19/06/2025,1,,,,,,1,,,,2025-06-19
20/06/2025,1,,,,,,1,,,,2025-06-20
21/06/2025,10,,,,,,10,,,,2025-06-21
22/06/2025,3,,,,,,3,,,,2025-06-22
23/06/2025,21,,,,,,21,,,,2025-06-23
24/06/2025,1,,,,,,1,,,,2025-06-24
25/06/2025,1,,,,,,1,,,,2025-06-25
26/06/2025,10,,,,,,10,,,,2025-06-26
27/06/2025,1,,1,,,,,,,,2025-06-27
30/06/2025,1,,,,,,1,,,,2025-06-30
01/07/2025,2,,,,,,1,,1,,2025-07-01
02/07/2025,12,,,,,,12,,,,2025-07-02
03/07/2025,1,,,,,,1,,,,2025-07-03
04/07/2025,2,,,,,,1,,1,,2025-07-04
05/07/2025,1,,,,,,1,,,,2025-07-05
09/07/2025,1,,,,,,1,,,,2025-07-09
10/07/2025,2,,,,,,2,,,,2025-07-10
11/07/2025,3,,,,,,3,,,,2025-07-11
12/07/2025,1,,,,,,1,,,,2025-07-12
13/07/2025,1,,,,,,1,,,,2025-07-13
14/07/2025,1,,,,,,1,,,,2025-07-14
15/07/2025,12,,,,,,12,,,,2025-07-15
16/07/2025,2,,,,,,2,,,,2025-07-16
18/07/2025,5,,,,,,5,,,,2025-07-18
19/07/2025,1,,1,,,,,,,,2025-07-19
20/07/2025,12,,1,,,,11,,,,2025-07-20
21/07/2025,11,,1,,,,10,,,,2025-07-21
22/07/2025,10,,,,,,10,,,,2025-07-22
23/07/2025,3,,,,,,3,,,,2025-07-23
24/07/2025,22,,,,,,22,,,,2025-07-24
25/07/2025,11,,,,,,11,,,,2025-07-25
26/07/2025,12,,10,,,,2,,,,2025-07-26
27/07/2025,11,,,,,,11,,,,2025-07-27
28/07/2025,24,,1,,,,23,,,,2025-07-28
29/07/2025,1,,,,,,1,,,,2025-07-29
30/07/2025,2,,,,,,2,,,,2025-07-30
31/07/2025,14,,1,,,,13,,,,2025-07-31
01/08/2025,6,,,,,,6,,,,2025-08-01
02/08/2025,2,,,,,,2,,,,2025-08-02
03/08/2025,11,,,,,,11,,,,2025-08-03
04/08/2025,6,,1,,,,5,,,,2025-08-04
05/08/2025,14,,1,,,,13,,,,2025-08-05
06/08/2025,4,,,,,,4,,,,2025-08-06
07/08/2025,2,,2,,,,,,,,2025-08-07
08/08/2025,6,,1,,,,5,,,,2025-08-08
09/08/2025,13,,,,,,13,,,,2025-08-09
10/08/2025,25,,,,,,5,20,,,2025-08-10
11/08/2025,43,,,,,,43,,,,2025-08-11
12/08/2025,16,,,10,,,6,,,,2025-08-12
13/08/2025,8,,1,,,,7,,,,2025-08-13
14/08/2025,23,,,,,,23,,,,2025-08-14
15/08/2025,21,,,,,,21,,,,2025-08-15
16/08/2025,13,,,,,,13,,,,2025-08-16
17/08/2025,13,,,,,,13,,,,2025-08-17
18/08/2025,30,,22,,,,8,,,,2025-08-18
19/08/2025,18,,1,,,,17,,,,2025-08-19
20/08/2025,5,,2,,,,3,,,,2025-08-20
21/08/2025,47,,1,,,,46,,,,2025-08-21
22/08/2025,34,,,,,,34,,,,2025-08-22
23/08/2025,21,,1,,,,20,,,,2025-08-23
24/08/2025,16,,,,,,16,,,,2025-08-24
25/08/2025,47,,,,,,47,,,,2025-08-25
26/08/2025,18,,10,,,,8,,,,2025-08-26
27/08/2025,28,,,,,,28,,,,2025-08-27
28/08/2025,26,,,,,,26,,,,2025-08-28
29/08/2025,27,,1,,,,26,,,,2025-08-29
30/08/2025,12,,,,,,12,,,,2025-08-30
31/08/2025,5,,,,,,5,,,,2025-08-31
01/09/2025,26,,,,,,26,,,,2025-09-01
02/09/2025,8,,2,,,,6,,,,2025-09-02
03/09/2025,33,,1,,,,32,,,,2025-09-03
04/09/2025,8,,1,,,,7,,,,2025-09-04
05/09/2025,18,,1,1,,,15,1,,,2025-09-05
06/09/2025,6,,,,,,6,,,,2025-09-06
07/09/2025,53,,12,,,,41,,,,2025-09-07
08/09/2025,31,,1,,,,29,1,,,2025-09-08
09/09/2025,75,,2,,,,73,,,,2025-09-09
10/09/2025,13,,1,,,,12,,,,2025-09-10
11/09/2025,42,,2,,,,40,,,,2025-09-11
12/09/2025,52,,2,,,,50,,,,2025-09-12
13/09/2025,41,,11,,,,30,,,,2025-09-13
14/09/2025,45,,1,,,,34,10,,,2025-09-14
15/09/2025,38,,1,,,,26,11,,,2025-09-15
16/09/2025,28,,1,,,,26,1,,,2025-09-16
17/09/2025,32,,1,,,,31,,,,2025-09-17
18/09/2025,49,,4,,,,45,,,,2025-09-18
19/09/2025,50,,1,1,,,48,,,,2025-09-19
20/09/2025,27,,4,,,,22,1,,,2025-09-20
21/09/2025,39,,22,,,,17,,,,2025-09-21
22/09/2025,25,,15,,,,10,,,,2025-09-22
23/09/2025,38,,,,,,38,,,,2025-09-23
24/09/2025,46,,2,,,,44,,,,2025-09-24
25/09/2025,48,,,,,,48,,,,2025-09-25
26/09/2025,55,,11,,,,44,,,,2025-09-26
27/09/2025,22,,2,,,,20,,,,2025-09-27
28/09/2025,21,,2,,,,9,10,,,2025-09-28
29/09/2025,63,,26,,,,37,,,,2025-09-29
30/09/2025,51,,14,,,,37,,,,2025-09-30
01/10/2025,44,,3,,,,31,10,,,2025-10-01
02/10/2025,40,,12,,,,28,,,,2025-10-02
03/10/2025,66,,4,,,,62,,,,2025-10-03
04/10/2025,30,,10,,,,20,,,,2025-10-04
05/10/2025,50,,11,,,,39,,,,2025-10-05
06/10/2025,76,,10,,,,66,,,,2025-10-06
07/10/2025,58,,13,,,,45,,,,2025-10-07
08/10/2025,69,,1,,,,68,,,,2025-10-08
09/10/2025,91,,12,,,,79,,,,2025-10-09
10/10/2025,86,,3,,,,82,1,,,2025-10-10
11/10/2025,32,,,,,,22,10,,,2025-10-11
12/10/2025,34,,2,,,,32,,,,2025-10-12
13/10/2025,64,,,,,,64,,,,2025-10-13
14/10/2025,48,,,,,,47,1,,,2025-10-14
15/10/2025,70,,1,,,,68,1,,,2025-10-15
16/10/2025,27,,1,,,,25,1,,,2025-10-16
17/10/2025,37,,1,,,,36,,,,2025-10-17
18/10/2025,34,,3,,,,30,1,,,2025-10-18
19/10/2025,34,,20,,,,14,,,,2025-10-19
20/10/2025,65,,10,,,,54,1,,,2025-10-20
21/10/2025,39,,1,,,,37,1,,,2025-10-21
22/10/2025,39,,10,,,,29,,,,2025-10-22
23/10/2025,25,,,,,,25,,,,2025-10-23
24/10/2025,26,,,,,1,25,,,,2025-10-24
25/10/2025,23,,,,,,23,,,,2025-10-25
26/10/2025,29,,,,,,29,,,,2025-10-26
27/10/2025,34,,1,1,,,32,,,,2025-10-27
28/10/2025,18,,,,,,18,,,,2025-10-28
29/10/2025,12,,3,,,,9,,,,2025-10-29
30/10/2025,41,,1,,,,40,,,,2025-10-30
31/10/2025,21,,2,,,,18,1,,,2025-10-31
01/11/2025,7,,,,,,7,,,,2025-11-01
02/11/2025,9,,1,,,,8,,,,2025-11-02
03/11/2025,10,,,1,,,9,,,,2025-11-03
04/11/2025,18,,,,,,18,,,,2025-11-04
05/11/2025,20,,,,,,20,,,,2025-11-05
06/11/2025,4,,,,,,4,,,,2025-11-06
07/11/2025,3,,,,,,3,,,,2025-11-07
08/11/2025,3,,,,,,3,,,,2025-11-08
09/11/2025,13,,,,,13,,,,,2025-11-09
10/11/2025,10,,,,,10,,,,,2025-11-10
11/11/2025,3,,,,,3,,,,,2025-11-11
